ticker,asset_class,sub_class,region,inception,name,net_assets,nav,nav_as_of,cusip,shares_outstanding,shares_outstanding_as_of,mgmt_fee,expense_ratio,benchmark_index,exchange,type
MTUM,Equity,Large/Mid Cap,North America,2013-04-16,iShares MSCI USA Momentum Factor ETF,14715668135.43,166.466834,2021-01-19,46432F396,88400000,"Jan 19, 2021",0.15,0.15,MSCI USA Momentum SR Variant Index,Cboe BZX formerly known as BATS,etf
MUB,Fixed Income,Municipals,North America,2007-09-07,iShares National Muni Bond ETF,20680727818.45,116.84027,2021-01-19,464288414,177000000,"Jan 19, 2021",0.07,0.07,S&P National AMT-Free Municipal Bond Index,NYSE Arca,etf
MXI,Equity,All Cap,Global,2006-09-12,iShares Global Materials ETF,631463652.1,84.760222,2021-01-19,464288695,7450000,"Jan 19, 2021",0.45,0.45,S&P Global 1200 Materials Sector Index(TM),NYSE Arca,etf
NEAR,Fixed Income,Multi Sectors,North America,2013-09-25,BlackRock Short Maturity Bond ETF,4551240801.21,50.234446,2021-01-19,46431W507,90600000,"Jan 19, 2021",0.25,0.26,,Cboe BZX formerly known as BATS,etf
NYF,Fixed Income,Municipals,North America,2007-10-04,iShares New York Muni Bond ETF,494568671.94,58.18455,2021-01-19,464288323,8500000,"Jan 19, 2021",0.25,0.25,S&P New York AMT-Free Municipal Bond Index,NYSE Arca,etf
OEF,Equity,Large Cap,North America,2000-10-23,iShares S&P 100 ETF,7210429012.74,172.911967,2021-01-19,464287101,41700000,"Jan 19, 2021",0.2,0.2,S&P 100 Index,NYSE Arca,etf
PFF,Equity,All Cap,North America,2007-03-26,iShares Preferred and Income Securities ETF,19337557946.25,38.280823,2021-01-19,464288687,505150000,"Jan 19, 2021",0.46,0.46,ICE Exchange-Listed Preferred & Hybrid Securities Index,NASDAQ,etf
PICK,Equity,All Cap,Global,2012-01-31,iShares MSCI Global Metals & Mining Producers ETF,651813360.95,39.384493,2021-01-19,46434G848,16550000,"Jan 19, 2021",0.39,0.39,MSCI ACWI Select Metals & Mining Producers Ex Gold & Silver Investable Market Index,Cboe BZX formerly known as BATS,etf
QAT,Equity,All Cap,Middle East and Africa,2014-04-29,iShares MSCI Qatar ETF,102291170.15,19.119845,2021-01-19,46434V779,5350000,"Jan 19, 2021",0.59,0.59,MSCI All Qatar Capped Index,NASDAQ,etf
QLTA,Fixed Income,Credit,North America,2012-02-14,iShares Aaa - A Rated Corporate Bond ETF,1437236150.35,57.836465,2021-01-19,46429B291,24850000,"Jan 19, 2021",0.15,0.15,Bloomberg Barclays U.S. Corporate Aaa - A Capped Index,NYSE Arca,etf
QUAL,Equity,Large/Mid Cap,North America,2013-07-16,iShares MSCI USA Quality Factor ETF,21382954064.79,116.117046,2021-01-19,46432F339,184150000,"Jan 19, 2021",0.15,0.15,MSCI USA Sector Neutral Quality Index,Cboe BZX formerly known as BATS,etf
REET,Real Estate,Real Estate Securities,Global,2014-07-08,iShares Global REIT ETF,2446393673.21,23.739871,2021-01-19,46434V647,103050000,"Jan 19, 2021",0.14,0.14,FTSE EPRA Nareit Global REITS Net Total Return Index,NYSE Arca,etf
REM,Real Estate,Real Estate Securities,North America,2007-05-01,iShares Mortgage Real Estate ETF,1321553215.54,31.653969,2021-01-19,46435G342,41750000,"Jan 19, 2021",0.48,0.48,FTSE Nareit All Mortgage Capped Index,Cboe BZX formerly known as BATS,etf
REZ,Real Estate,Real Estate Securities,North America,2007-05-01,iShares Residential and Multisector Real Estate ETF,407958830.7,66.878497,2021-01-19,464288562,6100000,"Jan 19, 2021",0.48,0.48,FTSE Nareit All Residential Capped Index,NYSE Arca,etf
RING,Equity,All Cap,Global,2012-01-31,iShares MSCI Global Gold Miners ETF,470811314.93,29.334038,2021-01-19,46434G855,16050000,"Jan 19, 2021",0.39,0.39,MSCI ACWI Select Gold Miners Investable Market Index,NASDAQ,etf
RXI,Equity,All Cap,Global,2006-09-12,iShares Global Consumer Discretionary ETF,439190514.23,159.705642,2021-01-19,464288745,2750000,"Jan 19, 2021",0.46,0.46,S&P Global 1200 Consumer Discretionary Sector Capped Index,NYSE Arca,etf
SCJ,Equity,Small Cap,Asia Pacific,2007-12-20,iShares MSCI Japan Small-Cap ETF,63166237.75,78.957797,2021-01-19,464286582,800000,"Jan 19, 2021",0.51,0.51,MSCI Japan Small Cap Index,NYSE Arca,etf
SCZ,Equity,Small Cap,Global,2007-12-10,iShares MSCI EAFE Small-Cap ETF,11838205101.46,69.473035,2021-01-19,464288273,170400000,"Jan 19, 2021",0.4,0.4,MSCI EAFE Small Cap Index,NASDAQ,etf
SDG,Equity,Large/Mid Cap,Global,2016-04-20,iShares MSCI Global Impact ETF,347339914.32,97.842229,2021-01-19,46435G532,3550000,"Jan 19, 2021",0.49,0.49,MSCI ACWI Sustainable Impact Index,NASDAQ,etf
SGOV,Fixed Income,Government,North America,2020-05-26,iShares 0-3 Month Treasury Bond ETF,855149535.32,100.01749,2021-01-20,46436E718,8550000,"Jan 20, 2021",0.12,0.12,ICE 0-3 Month US Treasury Securities Index,NYSE Arca,etf
SHV,Fixed Income,Government,North America,2007-01-05,iShares Short Treasury Bond ETF,16702152803.72,110.515138,2021-01-20,464288679,151130000,"Jan 20, 2021",0.15,0.15,ICE Short US Treasury Securities Index,NASDAQ,etf
SHY,Fixed Income,Government,North America,2002-07-22,iShares 1-3 Year Treasury Bond ETF,19068453618.24,86.36075,2021-01-19,464287457,220800000,"Jan 19, 2021",0.15,0.15,ICE U.S. Treasury 1-3 Year Bond Index,NASDAQ,etf
SHYG,Fixed Income,High Yield,North America,2013-10-15,iShares 0-5 Year High Yield Corporate Bond ETF,5265657617.82,45.472,2021-01-19,46434V407,115800000,"Jan 19, 2021",0.3,0.3,Markit iBoxx USD Liquid High Yield 0-5 Index,NYSE Arca,etf
SIZE,Equity,Large/Mid Cap,North America,2013-04-16,iShares MSCI USA Size Factor ETF,1055060879.51,114.68053,2021-01-19,46432F370,9200000,"Jan 19, 2021",0.15,0.15,MSCI USA Low Size Index,NYSE Arca,etf
SLQD,Fixed Income,Credit,North America,2013-10-15,iShares 0-5 Year Investment Grade Corporate Bond ETF,2152020424.78,52.107032,2021-01-19,46434V100,41300000,"Jan 19, 2021",0.06,0.06,Markit iBoxx USD Liquid Investment Grade 0-5 Index,NASDAQ,etf
SLV,Commodity,Precious Metals,Global,2006-04-21,iShares Silver Trust,14522894727.95,23.501731,2021-01-20,46428Q109,617950000,"Jan 20, 2021",,,,NYSE Arca,etf
SLVP,Equity,All Cap,Global,2012-01-31,iShares MSCI Global Silver and Metals Miners ETF,233602134.3,15.47034,2021-01-19,464286327,15100000,"Jan 19, 2021",0.39,0.39,MSCI ACWI Select Silver Miners Investable Market Index,Cboe BZX formerly known as BATS,etf
SMIN,Equity,Small Cap,Asia Pacific,2012-02-08,iShares MSCI India Small-Cap ETF,240668387.3,44.159337,2021-01-19,46429B614,5450000,"Jan 19, 2021",0.74,0.81,MSCI India Small Cap Index,Cboe BZX formerly known as BATS,etf
SMLF,Equity,Small Cap,North America,2015-04-28,iShares MSCI USA Small-Cap Multifactor ETF,788269572.57,49.266848,2021-01-19,46434V290,16000000,"Jan 19, 2021",0.3,0.3,MSCI USA Small Cap Diversified Multiple-Factor Index,NYSE Arca,etf
SMMD,Equity,Mid/Small Cap,North America,2017-07-06,iShares Russell 2500 ETF,212134273.04,60.609792,2021-01-19,46435G268,3500000,"Jan 19, 2021",0.15,0.23,Russell 2500 Index,Cboe BZX formerly known as BATS,etf
SMMV,Equity,Small Cap,North America,2016-09-07,iShares MSCI USA Small-Cap Min Vol Factor ETF,904119480.96,35.386281,2021-01-19,46435G433,25550000,"Jan 19, 2021",0.2,0.2,MSCI USA Small Cap Minimum Volatility (USD) Index,Cboe BZX formerly known as BATS,etf
SOXX,Equity,All Cap,North America,2001-07-10,iShares PHLX Semiconductor ETF,5351188011.29,419.70102,2021-01-19,464287523,12750000,"Jan 19, 2021",0.46,0.46,PHLX SOX Semiconductor Sector Index,NASDAQ,etf
STIP,Fixed Income,Inflation,North America,2010-12-01,iShares 0-5 Year TIPS Bond ETF,3250383795.55,104.85109,2021-01-19,46429B747,31000000,"Jan 19, 2021",0.05,0.05,Bloomberg Barclays U.S. Treasury Inflation-Protected Securities (TIPS) 0-5 Years Index (Series-L),NYSE Arca,etf
STLC,Equity,Large/Mid Cap,North America,2020-04-14,iShares Factors US Blend Style ETF,5479335.49,36.528903,2021-01-19,46436E791,150000,"Jan 19, 2021",0.25,0.25,Russell US Large Cap Factors Blend Style Index,Cboe BZX formerly known as BATS,etf
STLG,Equity,Large/Mid Cap,North America,2020-01-14,iShares Factors US Growth Style ETF,4908304.26,32.722028,2021-01-20,46436E403,150000,"Jan 20, 2021",0.25,0.25,Russell US Large Cap Factors Growth Style Index,Cboe BZX formerly known as BATS,etf
STLV,Equity,Large/Mid Cap,North America,2020-01-14,iShares Factors US Value Style ETF,6425280.35,25.701121,2021-01-20,46436E304,250000,"Jan 20, 2021",0.25,0.25,Russell US Large Cap Factors Value Style Index,Cboe BZX formerly known as BATS,etf
STMB,Equity,Mid Cap,North America,2020-04-14,iShares Factors US Mid Blend Style ETF,5806574.64,38.710498,2021-01-19,46436E783,150000,"Jan 19, 2021",0.3,0.3,Russell US Mid Cap Factors Blend Style Index,Cboe BZX formerly known as BATS,etf
STSB,Equity,Small Cap,North America,2020-04-14,iShares Factors US Small Blend Style ETF,6591797.31,43.945315,2021-01-19,46436E775,150000,"Jan 19, 2021",0.35,0.35,Russell US Small Cap Factors Blend Style Index,Cboe BZX formerly known as BATS,etf
SUB,Fixed Income,Municipals,North America,2008-11-05,iShares Short-Term National Muni Bond ETF,4211552476.42,107.71234,2021-01-19,464288158,39100000,"Jan 19, 2021",0.07,0.07,S&P Short Term National AMT-Free Municipal Bond Index,NYSE Arca,etf
SUSA,Equity,Large/Mid Cap,North America,2005-01-24,iShares MSCI USA ESG Select ETF,2428112885.4,84.017747,2021-01-19,464288802,28900000,"Jan 19, 2021",0.25,0.25,MSCI USA Extended ESG Select Index,NYSE Arca,etf
SUSB,Fixed Income,Credit,North America,2017-07-11,iShares ESG Aware 1-5 Year USD Corporate Bond ETF,565817349.1,26.134751,2021-01-19,46435G243,21650000,"Jan 19, 2021",0.12,0.12,Bloomberg Barclays MSCI US Corporate 1-5 Year ESG Focus Index,NASDAQ,etf
SUSC,Fixed Income,Credit,North America,2017-07-11,iShares ESG Aware USD Corporate Bond ETF,765394072.54,28.036413,2021-01-19,46435G193,27300000,"Jan 19, 2021",0.18,0.18,Bloomberg Barclays MSCI US Corporate ESG Focus Index,NASDAQ,etf
SUSL,Equity,Large/Mid Cap,North America,2019-05-07,iShares ESG MSCI USA Leaders ETF,2987370443.38,65.873659,2021-01-19,46435U218,45350000,"Jan 19, 2021",0.1,0.1,MSCI USA Extended ESG Leaders Index,NASDAQ,etf
SVAL,Equity,Small Cap,North America,2020-10-27,iShares US Small Cap Value Factor ETF,44256413.04,26.822069,2021-01-19,46436E536,1650000,"Jan 19, 2021",0.3,0.3,Russell 2000 Focused Value Select Index,Cboe BZX formerly known as BATS,etf
TECB,Equity,All Cap,North America,2020-01-08,U.S. Tech Breakthrough Multisector ETF,359284807.78,36.291395,2021-01-20,46436E502,9900000,"Jan 20, 2021",0.4,0.4,NYSE FactSet U.S. Tech Breakthrough Index,NYSE Arca,etf
TFLO,Fixed Income,Government,North America,2014-02-03,iShares Treasury Floating Rate Bond ETF,377125627.62,50.283417,2021-01-19,46434V860,7500000,"Jan 19, 2021",0.15,0.15,Bloomberg Barclays US Treasury Floating Rate Bond Index,NYSE Arca,etf
THD,Equity,All Cap,Asia Pacific,2008-03-26,iShares MSCI Thailand ETF,481319670.1,80.219945,2021-01-19,464286624,6000000,"Jan 19, 2021",0.59,0.59,MSCI Thailand IMI 25/50 Index,NYSE Arca,etf
TIP,Fixed Income,Inflation,North America,2003-12-04,iShares TIPS Bond ETF,26994304447.59,127.451862,2021-01-19,464287176,211800000,"Jan 19, 2021",0.19,0.19,Bloomberg Barclays U.S. Treasury Inflation Protected Securities (TIPS) Index (Series-L),NYSE Arca,etf
TLH,Fixed Income,Government,North America,2007-01-05,iShares 10-20 Year Treasury Bond ETF,1438684984.16,154.69731,2021-01-19,464288653,9300000,"Jan 19, 2021",0.15,0.15,ICE U.S. Treasury 10-20 Year Bond Index,NYSE Arca,etf
TLT,Fixed Income,Government,North America,2002-07-22,iShares 20+ Year Treasury Bond ETF,17121342012.47,152.325107,2021-01-19,464287432,112400000,"Jan 19, 2021",0.15,0.15,ICE U.S. Treasury 20+ Year Bond Index,NASDAQ,etf
TOK,Equity,Large/Mid Cap,Global,2007-12-10,iShares MSCI Kokusai ETF,178877960.02,85.179981,2021-01-19,464288265,2100000,"Jan 19, 2021",0.25,0.25,MSCI Kokusai Index,NYSE Arca,etf
TUR,Equity,All Cap,Europe,2008-03-26,iShares MSCI Turkey ETF,326107324.99,28.2344,2021-01-19,464286715,11550000,"Jan 19, 2021",0.59,0.59,MSCI Turkey IMI 25/50 Index,NASDAQ,etf
UAE,Equity,All Cap,Middle East and Africa,2014-04-29,iShares MSCI UAE ETF,15275690.24,13.283209,2021-01-19,46434V761,1150000,"Jan 19, 2021",0.59,0.59,MSCI All UAE Capped Index,NASDAQ,etf
URTH,Equity,Large/Mid Cap,Global,2012-01-10,iShares MSCI World ETF,1121485203.89,114.437266,2021-01-19,464286392,9800000,"Jan 19, 2021",0.24,0.24,MSCI World Index,NYSE Arca,etf
USHY,Fixed Income,High Yield,North America,2017-10-25,iShares Broad USD High Yield Corporate Bond ETF,7558576755.49,41.247349,2021-01-19,46435U853,183250000,"Jan 19, 2021",0.22,0.22,ICE BofA US High Yield Constrained Index,Cboe BZX formerly known as BATS,etf
USIG,Fixed Income,Credit,North America,2007-01-05,iShares Broad USD Investment Grade Corporate Bond ETF,5894895387.82,61.40516,2021-01-19,464288620,96000000,"Jan 19, 2021",0.06,0.06,ICE BofA US Corporate Index,NASDAQ,etf
USMV,Equity,Large/Mid Cap,North America,2011-10-18,iShares MSCI USA Min Vol Factor ETF,31429873786.8,67.663883,2021-01-19,46429B697,464500000,"Jan 19, 2021",0.15,0.15,MSCI USA Minimum Volatility (USD) Index,Cboe BZX formerly known as BATS,etf
USRT,Real Estate,Real Estate Securities,North America,2007-05-01,iShares Core U.S. REIT ETF,1611067221.48,48.091559,2021-01-19,464288521,33500000,"Jan 19, 2021",0.08,0.08,FTSE Nareit Equity REITS Index,NYSE Arca,etf
USXF,Equity,Large Cap,North America,2020-06-16,iShares ESG Advanced MSCI USA ETF,93732703.43,32.321622,2021-01-20,46436E767,2900000,"Jan 20, 2021",0.1,0.1,MSCI USA Choice ESG Screened Index in USD,NASDAQ,etf
VEGI,Equity,All Cap,Global,2012-01-31,iShares MSCI Global Agriculture Producers ETF,38245942.08,36.424707,2021-01-19,464286350,1050000,"Jan 19, 2021",0.39,0.39,MSCI ACWI Select Agriculture Producers Investable Market Index,NYSE Arca,etf
VLUE,Equity,Large/Mid Cap,North America,2013-04-16,iShares MSCI USA Value Factor ETF,10885186111.65,93.595753,2021-01-19,46432F388,116300000,"Jan 19, 2021",0.15,0.15,MSCI USA Enhanced Value Index,Cboe BZX formerly known as BATS,etf
WFBIX,Fixed Income,Multi Sectors,North America,2010-02-02,iShares U.S. Aggregate Bond Index Fund,2188404012.8,10.82,2021-01-19,066922105,,,,,BBG Barc U.S. Aggregate Index,,mf
WFSPX,Equity,Large Cap,North America,1993-07-31,iShares S&P 500 Index Fund,10470723680.25,449.64,2021-01-19,066922204,,,,,S&P 500 Index,,mf
WOOD,Equity,All Cap,Global,2008-06-24,iShares Global Timber & Forestry ETF,310229204.36,80.788855,2021-01-19,464288174,3840000,"Jan 19, 2021",0.46,0.46,S&P Global Timber & Forestry Index,NASDAQ,etf
WPS,Real Estate,Real Estate Securities,Global,2007-07-30,iShares International Developed Property ETF,81717512.3,35.529353,2021-01-19,464288422,2300000,"Jan 19, 2021",0.48,0.48,S&P Developed ex-U.S. Property Index,NYSE Arca,etf
XJH,Equity,Mid Cap,North America,2020-09-22,iShares ESG Screened S&P Mid-Cap ETF,13608311.55,34.020779,2021-01-20,46436E551,400000,"Jan 20, 2021",0.12,0.12,S&P MidCap 400 Sustainability Screened Index,Cboe BZX formerly known as BATS,etf
XJR,Equity,Small Cap,North America,2020-09-22,iShares ESG Screened S&P Small-Cap ETF,7263464.04,36.31732,2021-01-20,46436E544,200000,"Jan 20, 2021",0.12,0.12,S&P SmallCap 600 Sustainability Screened Index,Cboe BZX formerly known as BATS,etf
XT,Equity,Large Cap,Global,2015-03-19,iShares Exponential Technologies ETF,3262795095.03,60.143688,2021-01-19,46434V381,54250000,"Jan 19, 2021",0.47,0.47,Morningstar Exponential Technologies Index,NASDAQ,etf
XVV,Equity,Large Cap,North America,2020-09-22,iShares ESG Screened S&P 500 ETF,7324211.75,29.296847,2021-01-20,46436E569,250000,"Jan 20, 2021",0.08,0.08,S&P 500 Sustainability Screened Index,Cboe BZX formerly known as BATS,etf
