ticker,asset_class,sub_class,region,inception,name,net_assets,nav,nav_as_of,cusip,shares_outstanding,shares_outstanding_as_of,mgmt_fee,expense_ratio,benchmark_index,exchange,type
IEME,Equity,All Cap,North America,2018-03-21,iShares Evolved U.S. Media and Entertainment ETF,13741778.76,34.354447,2021-01-07,46431W630,400000,"Jan 08, 2021",0.18,0.18,,Cboe BZX formerly known as BATS,etf
IEMG,Equity,All Cap,Global,2012-10-18,iShares Core MSCI Emerging Markets ETF,70356088566.26,63.590102,2021-01-07,46434G103,1114200000,"Jan 08, 2021",0.11,0.11,MSCI Emerging Markets Investable Market Index,NYSE Arca,etf
IEO,Equity,All Cap,North America,2006-05-01,iShares U.S. Oil & Gas Exploration & Production ETF,190935820.78,40.197015,2021-01-07,464288851,4750000,"Jan 07, 2021",0.42,0.42,Dow Jones U.S. Select Oil Exploration & Production Index,Cboe BZX formerly known as BATS,etf
IETC,Equity,All Cap,North America,2018-03-21,iShares Evolved U.S. Technology ETF,101839027.04,47.366989,2021-01-07,46431W648,2150000,"Jan 08, 2021",0.18,0.18,,Cboe BZX formerly known as BATS,etf
IEUR,Equity,All Cap,Europe,2014-06-10,iShares Core MSCI Europe ETF,4037855599.05,53.059863,2021-01-07,46434V738,76100000,"Jan 08, 2021",0.09,0.09,MSCI Europe Investable Market Index,NYSE Arca,etf
IEUS,Equity,Small Cap,Europe,2007-11-12,iShares MSCI Europe Small-Cap ETF,169450798.15,63.943697,2021-01-07,464288497,2650000,"Jan 07, 2021",0.4,0.4,MSCI Europe Small Cap Index,NASDAQ,etf
IEV,Equity,Large/Mid Cap,Europe,2000-07-25,iShares Europe ETF,1656413981.85,49.519103,2021-01-07,464287861,33450000,"Jan 08, 2021",0.59,0.59,S&P Europe 350 Index,NYSE Arca,etf
IEZ,Equity,All Cap,North America,2006-05-01,iShares U.S. Oil Equipment & Services ETF,89669821.57,12.809975,2021-01-07,464288844,7000000,"Jan 07, 2021",0.42,0.42,Dow Jones U.S. Select Oil Equipment & Services Index,NYSE Arca,etf
IFGL,Real Estate,Real Estate Securities,Global,2007-11-12,iShares International Developed Real Estate ETF,249217260.91,27.088833,2021-01-07,464288489,9200000,"Jan 07, 2021",0.48,0.48,FTSE EPRA Nareit Developed ex-U.S. Index,NASDAQ,etf
IFRA,Equity,All Cap,North America,2018-04-03,iShares U.S. Infrastructure ETF,126208442.81,31.162578,2021-01-08,46435U713,4050000,"Jan 08, 2021",0.4,0.4,NYSE FactSet U.S. Infrastructure Index,Cboe BZX formerly known as BATS,etf
IGBH,Fixed Income,Credit,North America,2015-07-22,iShares Interest Rate Hedged Long-Term Corporate Bond ETF,615221703.06,24.757413,2021-01-07,46431W812,24850000,"Jan 07, 2021",0.35,0.41,ICE Q70A Custom Index,NYSE Arca,etf
IGE,Equity,All Cap,North America,2001-10-22,iShares North American Natural Resources ETF,345416609.06,25.305246,2021-01-07,464287374,13650000,"Jan 08, 2021",0.46,0.46,S&P North American Natural Resources Sector Index(TM),Cboe BZX formerly known as BATS,etf
IGEB,Fixed Income,Credit,North America,2017-07-11,iShares Investment Grade Bond Factor ETF,160735750.37,54.486695,2021-01-07,46435G219,2950000,"Jan 08, 2021",0.18,0.18,BlackRock Investment Grade Enhanced Bond Index,Cboe BZX formerly known as BATS,etf
IGF,Equity,All Cap,Global,2007-12-10,iShares Global Infrastructure ETF,3181673006.79,44.374798,2021-01-07,464288372,72000000,"Jan 08, 2021",0.46,0.46,S&P Global Infrastructure Index,NASDAQ,etf
IGIB,Fixed Income,Credit,North America,2007-01-05,iShares 5-10 Year Investment Grade Corporate Bond ETF,11024768283.49,61.248713,2021-01-07,464288638,180000000,"Jan 07, 2021",0.06,0.06,ICE BofA 5-10 Year US Corporate Index,NASDAQ,etf
IGLB,Fixed Income,Credit,North America,2009-12-08,iShares 10+ Year Investment Grade Corporate Bond ETF,2514751229.86,70.838063,2021-01-07,464289511,35500000,"Jan 07, 2021",0.06,0.06,ICE BofA 10+ Year US Corporate Index,NYSE Arca,etf
IGM,Equity,All Cap,North America,2001-03-13,iShares Expanded Tech Sector ETF,3170691861.95,350.352692,2021-01-07,464287549,9050000,"Jan 07, 2021",0.46,0.46,S&P North American Expanded Technology Sector Index,NYSE Arca,etf
IGN,Equity,All Cap,North America,2001-07-10,iShares North American Tech-Multimedia Networking ETF,58156904.48,61.217794,2021-01-07,464287531,950000,"Jan 08, 2021",0.46,0.46,S&P North American Technology-Multimedia Networking Index(TM),NYSE Arca,etf
IGOV,Fixed Income,Government,Global,2009-01-21,iShares International Treasury Bond ETF,1160649121.94,55.400913,2021-01-07,464288117,20950000,"Jan 08, 2021",0.35,0.35,FTSE World Government Bond Index - Developed Markets Capped,NASDAQ,etf
IGRO,Equity,Large/Mid Cap,Global,2016-05-17,iShares International Dividend Growth ETF,147199174.02,63.999641,2021-01-07,46435G524,2350000,"Jan 08, 2021",0.15,0.15,Morningstar® Global ex-US Dividend Growth Index℠,Cboe BZX formerly known as BATS,etf
IGSB,Fixed Income,Credit,North America,2007-01-05,iShares 1-5 Year Investment Grade Corporate Bond ETF,22383203194.79,55.036152,2021-01-07,464288646,406700000,"Jan 07, 2021",0.06,0.06,ICE BofA 1-5 Year US Corporate Index,NASDAQ,etf
IGV,Equity,All Cap,North America,2001-07-10,iShares Expanded Tech-Software Sector ETF,5858537444.51,349.76343,2021-01-07,464287515,16800000,"Jan 08, 2021",0.46,0.46,S&P North American Expanded Technology Software Index,Cboe BZX formerly known as BATS,etf
IHAK,Equity,Large/Mid Cap,Global,2019-06-11,iShares Cybersecurity and Tech ETF,300010999.35,40.269933,2021-01-07,46435U135,7450000,"Jan 08, 2021",0.47,0.47,NYSE FactSet Global Cyber Security Index,NYSE Arca,etf
IHE,Equity,All Cap,North America,2006-05-01,iShares U.S. Pharmaceuticals ETF,366102798.72,183.051399,2021-01-07,464288836,2000000,"Jan 07, 2021",0.42,0.42,Dow Jones U.S. Select Pharmaceuticals Index,NYSE Arca,etf
IHF,Equity,All Cap,North America,2006-05-01,iShares U.S. Healthcare Providers ETF,1191862830.51,250.918491,2021-01-07,464288828,4750000,"Jan 07, 2021",0.42,0.42,Dow Jones U.S. Select Healthcare Providers Index,NYSE Arca,etf
IHI,Equity,All Cap,North America,2006-05-01,iShares U.S. Medical Devices ETF,9501897762.69,335.756105,2021-01-07,464288810,28300000,"Jan 07, 2021",0.42,0.42,Dow Jones U.S. Select Medical Equipment Index,NYSE Arca,etf
IJH,Equity,Mid Cap,North America,2000-05-22,iShares Core S&P Mid-Cap ETF,56230912714.09,241.334389,2021-01-07,464287507,233000000,"Jan 07, 2021",0.05,0.05,S&P MidCap 400 Index,NYSE Arca,etf
IJJ,Equity,Mid Cap,North America,2000-07-24,iShares S&P Mid-Cap 400 Value ETF,6067382775.62,90.355663,2021-01-07,464287705,67500000,"Jan 08, 2021",0.18,0.18,S&P MidCap 400(R) Value Index,NYSE Arca,etf
IJK,Equity,Mid Cap,North America,2000-07-24,iShares S&P Mid-Cap 400 Growth ETF,8010172041.39,76.07001,2021-01-07,464287606,105300000,"Jan 08, 2021",0.17,0.17,S&P MidCap 400(R) Growth Index,NYSE Arca,etf
IJR,Equity,Small Cap,North America,2000-05-22,iShares Core S&P Small-Cap ETF,60279244937.08,98.53575,2021-01-07,464287804,611750000,"Jan 07, 2021",0.06,0.06,S&P SmallCap 600 Index,NYSE Arca,etf
IJS,Equity,Small Cap,North America,2000-07-24,iShares S&P Small-Cap 600 Value ETF,7153311164.04,87.395372,2021-01-07,464287879,81850000,"Jan 07, 2021",0.18,0.18,S&P SmallCap 600(R) Value Index,NYSE Arca,etf
IJT,Equity,Small Cap,North America,2000-07-24,iShares S&P Small-Cap 600 Growth ETF,5908881119.87,122.084321,2021-01-07,464287887,48350000,"Jan 08, 2021",0.18,0.18,S&P SmallCap 600(R) Growth Index,NASDAQ,etf
ILF,Equity,Large Cap,Latin America,2001-10-25,iShares Latin America 40 ETF,1616039814.55,30.348166,2021-01-07,464287390,53250000,"Jan 08, 2021",0.48,0.48,S&P Latin America 40 Index,NYSE Arca,etf
ILTB,Fixed Income,Multi Sectors,North America,2009-12-08,iShares Core 10+ Year USD Bond ETF,437022069.13,74.071537,2021-01-07,464289479,5900000,"Jan 07, 2021",0.06,0.06,Bloomberg Barclays U.S. Universal 10+ Year Index,NYSE Arca,etf
IMTB,Fixed Income,Multi Sectors,North America,2016-11-01,iShares Core 5-10 Year USD Bond ETF,125154139.94,52.147558,2021-01-07,46435G417,2400000,"Jan 08, 2021",0.06,0.07,Bloomberg Barclays US Universal 5-10 Years Index,NYSE Arca,etf
IMTM,Equity,Large/Mid Cap,Global,2015-01-13,iShares MSCI Intl Momentum Factor ETF,715934316.84,38.909474,2021-01-08,46434V449,18400000,"Jan 08, 2021",0.3,0.3,MSCI World ex USA Momentum Index,NYSE Arca,etf
INDA,Equity,Large/Mid Cap,Asia Pacific,2012-02-02,iShares MSCI India ETF,4959879413.19,40.555024,2021-01-07,46429B598,122300000,"Jan 08, 2021",0.64,0.69,MSCI India Index,Cboe BZX formerly known as BATS,etf
INDY,Equity,Large Cap,Asia Pacific,2009-11-18,iShares India 50 ETF,672010570.59,42.939973,2021-01-07,464289529,15650000,"Jan 08, 2021",0.89,0.93,Nifty 50 Index,NASDAQ,etf
INTF,Equity,Large/Mid Cap,Global,2015-04-28,iShares MSCI Intl Multifactor ETF,958809762.96,27.953637,2021-01-07,46434V274,34300000,"Jan 08, 2021",0.3,0.3,MSCI World ex USA Diversified Multiple-Factor Index,NYSE Arca,etf
IOO,Equity,Large Cap,Global,2000-12-05,iShares Global 100 ETF,2854102634.84,63.707648,2021-01-07,464287572,44800000,"Jan 08, 2021",0.4,0.4,S&P Global 100 Index,NYSE Arca,etf
IPAC,Equity,All Cap,Asia Pacific,2014-06-10,iShares Core MSCI Pacific ETF,1120478481.29,65.144098,2021-01-07,46434V696,17200000,"Jan 08, 2021",0.09,0.09,MSCI Pacific Investable Market Index,NYSE Arca,etf
IPFF,Equity,All Cap,Global,2011-11-15,iShares International Preferred Stock ETF,44326585.12,15.553188,2021-01-07,46429B135,2850000,"Jan 07, 2021",0.55,0.55,S&P International Preferred Stock Index,Cboe BZX formerly known as BATS,etf
IQLT,Equity,Large/Mid Cap,Global,2015-01-13,iShares MSCI Intl Quality Factor ETF,2729377200.09,36.734552,2021-01-08,46434V456,74300000,"Jan 08, 2021",0.3,0.3,MSCI World ex USA Sector Neutral Quality Index,NYSE Arca,etf
IRBO,Equity,All Cap,Global,2018-06-26,iShares Robotics and Artificial Intelligence Multisector ETF,307349417.5,41.533705,2021-01-07,46435U556,7400000,"Jan 08, 2021",0.47,0.47,NYSE FactSet Global Robotics and Artificial Intelligence Index,NYSE Arca,etf
ISCF,Equity,Small Cap,Global,2015-04-28,iShares MSCI Intl Small-Cap Multifactor ETF,159218430.5,33.876262,2021-01-07,46434V266,4700000,"Jan 08, 2021",0.4,0.4,MSCI World exUSA Small Cap Diversified Multiple-Factor Index,NYSE Arca,etf
ISHG,Fixed Income,Government,Global,2009-01-21,iShares 1-3 Year International Treasury Bond ETF,59615966.61,85.165667,2021-01-07,464288125,700000,"Jan 08, 2021",0.35,0.35,FTSE World Government Bond Index-Dev Markets 1-3 Years Capped Select Index,NASDAQ,etf
ISTB,Fixed Income,Multi Sectors,North America,2012-10-18,iShares Core 1-5 Year USD Bond ETF,4704784790.2,51.531049,2021-01-07,46432F859,91300000,"Jan 07, 2021",0.06,0.06,Bloomberg Barclays U.S. Universal 1-5 Year Index,NASDAQ,etf
ISZE,Equity,Large/Mid Cap,Global,2015-06-16,iShares MSCI Intl Size Factor ETF,30366768.67,30.366769,2021-01-08,46435G508,1000000,"Jan 08, 2021",0.3,0.3,MSCI World ex USA Low Size Index,NYSE Arca,etf
ITA,Equity,All Cap,North America,2006-05-01,iShares U.S. Aerospace & Defense ETF,2802086415.56,93.715265,2021-01-07,464288760,29900000,"Jan 07, 2021",0.42,0.42,Dow Jones U.S. Select Aerospace & Defense Index,Cboe BZX formerly known as BATS,etf
ITB,Equity,All Cap,North America,2006-05-01,iShares U.S. Home Construction ETF,1962215915.55,56.711443,2021-01-07,464288752,34600000,"Jan 07, 2021",0.42,0.42,Dow Jones U.S. Select Home Construction Index,Cboe BZX formerly known as BATS,etf
ITOT,Equity,All Cap,North America,2004-01-20,iShares Core S&P Total U.S. Stock Market ETF,32872027180.97,87.881372,2021-01-07,464287150,374050000,"Jan 07, 2021",0.03,0.03,S&P Total Market Index (TMI),NYSE Arca,etf
IUSB,Fixed Income,Multi Sectors,North America,2014-06-10,iShares Core Total USD Bond Market ETF,5994241439.61,54.099652,2021-01-07,46434V613,111000000,"Jan 08, 2021",0.06,0.07,Bloomberg Barclays U.S. Universal Index,NASDAQ,etf
IUSG,Equity,All Cap,North America,2000-07-24,iShares Core S&P U.S. Growth ETF,10593413918.27,89.282882,2021-01-07,464287671,118650000,"Jan 07, 2021",0.04,0.04,S&P 900 Growth Index,NASDAQ,etf
IUSV,Equity,All Cap,North America,2000-07-24,iShares Core S&P U.S. Value ETF,7866046442.22,63.744299,2021-01-07,464287663,123400000,"Jan 08, 2021",0.04,0.04,S&P 900 Value Index,NASDAQ,etf
IVE,Equity,Large Cap,North America,2000-05-22,iShares S&P 500 Value ETF,18996339003.91,131.099648,2021-01-07,464287408,144900000,"Jan 08, 2021",0.18,0.18,S&P 500(R) Value Index,NYSE Arca,etf
IVLU,Equity,Large/Mid Cap,Global,2015-06-16,iShares MSCI Intl Value Factor ETF,586187812.64,23.828773,2021-01-08,46435G409,24600000,"Jan 08, 2021",0.3,0.3,MSCI World ex USA Enhanced Value Index,NYSE Arca,etf
IVV,Equity,Large Cap,North America,2000-05-15,iShares Core S&P 500 ETF,242051385888.53,380.464297,2021-01-07,464287200,636200000,"Jan 07, 2021",0.03,0.03,S&P 500 Index,NYSE Arca,etf
IVW,Equity,Large Cap,North America,2000-05-22,iShares S&P 500 Growth ETF,32097224150.32,64.091901,2021-01-07,464287309,500800000,"Jan 07, 2021",0.18,0.18,S&P 500(R) Growth Index,NYSE Arca,etf
IWB,Equity,Large/Mid Cap,North America,2000-05-15,iShares Russell 1000 ETF,26144061373.21,215.17746,2021-01-07,464287622,121500000,"Jan 07, 2021",0.15,0.15,Russell 1000 Index,NYSE Arca,etf
IWC,Equity,Small Cap,North America,2005-08-12,iShares Micro-Cap ETF,1064734829.16,127.513153,2021-01-07,464288869,8350000,"Jan 07, 2021",0.6,0.6,Russell Microcap(R) Index,NYSE Arca,etf
IWD,Equity,Large/Mid Cap,North America,2000-05-22,iShares Russell 1000 Value ETF,45109611739.49,140.659843,2021-01-07,464287598,320700000,"Jan 07, 2021",0.19,0.19,Russell 1000 Value Index,NYSE Arca,etf
IWF,Equity,Large/Mid Cap,North America,2000-05-22,iShares Russell 1000 Growth ETF,64454735389.94,241.81105,2021-01-07,464287614,266550000,"Jan 07, 2021",0.19,0.19,Russell 1000 Growth Index,NYSE Arca,etf
IWFH,Equity,All Cap,Global,2020-09-29,iShares Virtual Work and Life Multisector ETF,6200972.5,31.004863,2021-01-08,46436E585,200000,"Jan 08, 2021",0.47,0.47,NYSE FactSet Global Virtual Work and Life Index,NYSE Arca,etf
IWL,Equity,Large Cap,North America,2009-09-22,iShares Russell Top 200 ETF,930929699.17,91.267618,2021-01-07,464289446,10200000,"Jan 08, 2021",0.15,0.15,Russell Top 200 Index,NYSE Arca,etf
IWM,Equity,Small Cap,North America,2000-05-22,iShares Russell 2000 ETF,64573827876.39,208.13482,2021-01-07,464287655,310250000,"Jan 07, 2021",0.19,0.19,Russell 2000 Index,NYSE Arca,etf
IWN,Equity,Small Cap,North America,2000-07-24,iShares Russell 2000 Value ETF,12783189776.74,140.939248,2021-01-07,464287630,90700000,"Jan 07, 2021",0.24,0.24,Russell 2000 Value Index,NYSE Arca,etf
IWO,Equity,Small Cap,North America,2000-07-24,iShares Russell 2000 Growth ETF,12417262673.82,302.123179,2021-01-07,464287648,41100000,"Jan 08, 2021",0.24,0.24,Russell 2000 Growth Index,NYSE Arca,etf
IWP,Equity,Mid Cap,North America,2001-07-17,iShares Russell Mid-Cap Growth ETF,15509263505.67,104.934124,2021-01-07,464287481,147800000,"Jan 07, 2021",0.24,0.24,Russell MidCap Growth Index,NYSE Arca,etf
IWR,Equity,Mid Cap,North America,2001-07-17,iShares Russell Mid-Cap ETF,25563333434.92,70.558469,2021-01-07,464287499,362300000,"Jan 08, 2021",0.19,0.19,Russell MidCap Index,NYSE Arca,etf
IWS,Equity,Mid Cap,North America,2001-07-17,iShares Russell Mid-Cap Value ETF,12153170504.06,100.149736,2021-01-07,464287473,121350000,"Jan 08, 2021",0.24,0.24,Russell MidCap Value Index,NYSE Arca,etf
IWV,Equity,All Cap,North America,2000-05-22,iShares Russell 3000 ETF,10880422251.25,227.862246,2021-01-07,464287689,47750000,"Jan 08, 2021",0.2,0.2,Russell 3000 Index,NYSE Arca,etf
IWX,Equity,Large Cap,North America,2009-09-22,iShares Russell Top 200 Value ETF,948425024.56,59.462384,2021-01-07,464289420,15950000,"Jan 08, 2021",0.2,0.2,Russell Top 200 Value Index,NYSE Arca,etf
IWY,Equity,Large Cap,North America,2009-09-22,iShares Russell Top 200 Growth ETF,3432575285.74,132.788212,2021-01-07,464289438,25900000,"Jan 08, 2021",0.2,0.2,Russell Top 200 Growth Index,NYSE Arca,etf
IXC,Equity,All Cap,Global,2001-11-12,iShares Global Energy ETF,1095261592.6,22.261414,2021-01-07,464287341,49200000,"Jan 08, 2021",0.46,0.46,S&P Global 1200 Energy Sector Index(TM),NYSE Arca,etf
IXG,Equity,All Cap,Global,2001-11-12,iShares Global Financials ETF,356231325.95,67.853586,2021-01-07,464287333,5250000,"Jan 08, 2021",0.46,0.46,S&P Global 1200 Financials Sector Index(TM),NYSE Arca,etf
IXJ,Equity,All Cap,Global,2001-11-13,iShares Global Healthcare ETF,2531704230.45,77.778932,2021-01-07,464287325,32550000,"Jan 07, 2021",0.46,0.46,S&P Global 1200 Healthcare Sector Index(TM),NYSE Arca,etf
IXN,Equity,All Cap,Global,2001-11-12,iShares Global Tech ETF,5056163528.64,300.962115,2021-01-07,464287291,16800000,"Jan 08, 2021",0.46,0.46,S&P Global 1200 Information Technology Sector Index(TM),NYSE Arca,etf
IXP,Equity,All Cap,Global,2001-11-12,iShares Global Comm Services ETF,328094939.31,74.567032,2021-01-07,464287275,4350000,"Jan 08, 2021",0.46,0.46,S&P Global 1200 Communication Services 4.5/22.5/45 Capped Index,NYSE Arca,etf
IXUS,Equity,All Cap,Global,2012-10-18,iShares Core MSCI Total International Stock ETF,25842021390.81,68.94883,2021-01-07,46432F834,374800000,"Jan 08, 2021",0.09,0.09,MSCI ACWI ex USA IMI Index,NASDAQ,etf
IYC,Equity,All Cap,North America,2000-06-12,iShares U.S. Consumer Services ETF,1257848942.26,70.864729,2021-01-07,464287580,17750000,"Jan 07, 2021",0.43,0.43,Dow Jones U.S. Consumer Services Capped Index,NYSE Arca,etf
IYE,Equity,All Cap,North America,2000-06-12,iShares U.S. Energy ETF,557502576.01,22.1671,2021-01-07,464287796,25150000,"Jan 07, 2021",0.42,0.42,Dow Jones U.S. Oil & Gas Index,NYSE Arca,etf
IYF,Equity,All Cap,North America,2000-05-22,iShares U.S. Financials ETF,1591363079.73,68.445724,2021-01-07,464287788,23250000,"Jan 07, 2021",0.42,0.42,Dow Jones U.S. Financials Capped Index,NYSE Arca,etf
IYG,Equity,All Cap,North America,2000-06-12,iShares U.S. Financial Services ETF,1274256843.18,157.31566,2021-01-07,464287770,8100000,"Jan 07, 2021",0.42,0.42,Dow Jones U.S. Financial Services Index,NYSE Arca,etf
IYH,Equity,All Cap,North America,2000-06-12,iShares U.S. Healthcare ETF,2571070244.21,253.307413,2021-01-07,464287762,10150000,"Jan 07, 2021",0.43,0.43,Dow Jones U.S. Health Care Index,NYSE Arca,etf
IYJ,Equity,All Cap,North America,2000-06-12,iShares U.S. Industrials ETF,1291638771.56,98.976151,2021-01-07,464287754,13050000,"Jan 07, 2021",0.42,0.42,Dow Jones U.S. Industrials Index,Cboe BZX formerly known as BATS,etf
IYK,Equity,All Cap,North America,2000-06-12,iShares U.S. Consumer Goods ETF,754881520.71,177.619181,2021-01-07,464287812,4250000,"Jan 07, 2021",0.43,0.43,Dow Jones U.S. Consumer Goods Index,NYSE Arca,etf
IYLD,Multi Asset,Static Allocation,Global,2012-04-03,iShares Morningstar Multi-Asset Income ETF,269486833.07,23.954385,2021-01-07,46432F875,11200000,"Jan 08, 2021",0.25,0.63,Morningstar Multi-Asset High Income Index,Cboe BZX formerly known as BATS,etf
IYM,Equity,All Cap,North America,2000-06-12,iShares U.S. Basic Materials ETF,627098374.79,121.766675,2021-01-07,464287838,5150000,"Jan 07, 2021",0.43,0.43,Dow Jones U.S. Basic Materials Index,NYSE Arca,etf
IYR,Real Estate,Real Estate Securities,North America,2000-06-12,iShares U.S. Real Estate ETF,4208384843.31,82.679466,2021-01-07,464287739,50900000,"Jan 07, 2021",0.42,0.42,Dow Jones U.S. Real Estate Index,NYSE Arca,etf
IYT,Equity,All Cap,North America,2003-10-06,iShares Transportation Average ETF,1582135178.35,226.019311,2021-01-07,464287192,7000000,"Jan 07, 2021",0.42,0.42,Dow Jones Transportation Average Index,Cboe BZX formerly known as BATS,etf
IYW,Equity,All Cap,North America,2000-05-15,iShares U.S. Technology ETF,6775285059.44,85.438651,2021-01-07,464287721,79300000,"Jan 07, 2021",0.43,0.43,Dow Jones U.S. Technology Capped Index,NYSE Arca,etf
IYY,Equity,All Cap,North America,2000-06-12,iShares Dow Jones U.S. ETF,1462150683.43,95.878733,2021-01-07,464287846,15250000,"Jan 07, 2021",0.2,0.2,Dow Jones U.S. Index,NYSE Arca,etf
IYZ,Equity,All Cap,North America,2000-05-22,iShares U.S. Telecommunications ETF,419337634.54,31.062047,2021-01-07,464287713,13500000,"Jan 07, 2021",0.42,0.42,Dow Jones U.S. Select Telecommunications Index,Cboe BZX formerly known as BATS,etf
JKD,Equity,Large Cap,North America,2004-06-28,iShares Morningstar Large-Cap ETF,875497768.87,218.874442,2021-01-07,464287127,4000000,"Jan 07, 2021",0.2,0.2,Morningstar Large Core Index,NYSE Arca,etf
JKE,Equity,Large Cap,North America,2004-06-28,iShares Morningstar Large-Cap Growth ETF,1878224398.81,291.197581,2021-01-07,464287119,6450000,"Jan 07, 2021",0.25,0.25,Morningstar Large Growth Index,NYSE Arca,etf
JKF,Equity,Large Cap,North America,2004-06-28,iShares Morningstar Large-Cap Value ETF,557885240.85,115.027885,2021-01-07,464288109,4850000,"Jan 07, 2021",0.25,0.25,Morningstar Large Value Index,NYSE Arca,etf
JKG,Equity,Mid Cap,North America,2004-06-28,iShares Morningstar Mid-Cap ETF,829378602.61,240.399595,2021-01-07,464288208,3450000,"Jan 07, 2021",0.25,0.25,Morningstar Mid Core Index,NYSE Arca,etf
JKH,Equity,Mid Cap,North America,2004-06-28,iShares Morningstar Mid-Cap Growth ETF,1550473788.19,392.52501,2021-01-07,464288307,3950000,"Jan 07, 2021",0.3,0.3,Morningstar Mid Growth Index,NYSE Arca,etf
JKI,Equity,Mid Cap,North America,2004-06-28,iShares Morningstar Mid-Cap Value ETF,398036492.03,162.463874,2021-01-07,464288406,2450000,"Jan 08, 2021",0.3,0.3,Morningstar Mid Value Index,NASDAQ,etf
JKJ,Equity,Small Cap,North America,2004-06-28,iShares Morningstar Small-Cap ETF,227570601.63,206.882365,2021-01-07,464288505,1100000,"Jan 07, 2021",0.25,0.25,Morningstar Small Core Index,NYSE Arca,etf
JKK,Equity,Small Cap,North America,2004-06-28,iShares Morningstar Small-Cap Growth ETF,731567137.73,318.072669,2021-01-07,464288604,2300000,"Jan 07, 2021",0.3,0.3,Morningstar Small Growth Index,NYSE Arca,etf
JKL,Equity,Small Cap,North America,2004-06-28,iShares Morningstar Small-Cap Value ETF,342376858.17,148.859504,2021-01-07,464288703,2300000,"Jan 07, 2021",0.3,0.3,Morningstar Small Value Index,NYSE Arca,etf
JPXN,Equity,Large/Mid Cap,Asia Pacific,2001-10-23,iShares JPX-Nikkei 400 ETF,98151329.09,72.704688,2021-01-07,464287382,1350000,"Jan 08, 2021",0.48,0.48,JPX-Nikkei Index 400,NYSE Arca,etf
JXI,Equity,All Cap,Global,2006-09-12,iShares Global Utilities ETF,147879981.54,60.359176,2021-01-07,464288711,2450000,"Jan 07, 2021",0.46,0.46,S&P Global 1200 Utilities Sector Index(TM),NYSE Arca,etf
KSA,Equity,All Cap,Middle East and Africa,2015-09-16,iShares MSCI Saudi Arabia ETF,642493778.39,31.34116,2021-01-08,46434V423,20500000,"Jan 08, 2021",0.74,0.74,MSCI Saudi Arabia IMI 25/50 Index,NYSE Arca,etf
KWT,Equity,All Cap,Global,2020-09-01,iShares MSCI Kuwait ETF,14861095.16,27.020173,2021-01-08,46436E817,550000,"Jan 08, 2021",0.74,0.74,MSCI All Kuwait Select Size Liquidity Capped Index,Cboe BZX formerly known as BATS,etf
KXI,Equity,All Cap,Global,2006-09-12,iShares Global Consumer Staples ETF,604986509.19,57.893446,2021-01-07,464288737,10450000,"Jan 08, 2021",0.46,0.46,S&P Global 1200 Consumer Staples Sector Capped Index,NYSE Arca,etf
LDEM,Equity,Large/Mid Cap,Global,2020-02-05,iShares ESG MSCI EM Leaders ETF,841895466.4,62.594458,2021-01-08,46436E601,13450000,"Jan 08, 2021",0.16,0.16,MSCI EM Extended ESG Leaders 5% Issuer Capped Net Index,NASDAQ,etf
LEMB,Fixed Income,Government,Global,2011-10-18,iShares J.P. Morgan EM Local Currency Bond ETF,530454927.55,44.953807,2021-01-07,464286517,11800000,"Jan 07, 2021",0.3,0.3,J.P. Morgan GBI-EM Global Diversified 15% Cap 4.5% Floor Index,NYSE Arca,etf
LQD,Fixed Income,Credit,North America,2002-07-22,iShares iBoxx $ Investment Grade Corporate Bond ETF,54042662162.34,135.513195,2021-01-07,464287242,398800000,"Jan 07, 2021",0.14,0.14,Markit iBoxx USD Liquid Investment Grade Index,NYSE Arca,etf
LQDH,Fixed Income,Credit,North America,2014-05-27,iShares Interest Rate Hedged Corporate Bond ETF,456157664.8,95.032847,2021-01-07,46431W705,4800000,"Jan 08, 2021",0.3,0.44,Markit iBoxx USD Liquid Investment Grade Interest Rate Hedged Swaps Index,NYSE Arca,etf
LQDI,Fixed Income,Credit,North America,2018-05-08,iShares Inflation Hedged Corporate Bond ETF,21636485.03,28.848647,2021-01-08,46431W580,750000,"Jan 08, 2021",0.2,0.34,iBoxx USD Liquid Investment Grade Inflation Hedged Index,Cboe BZX formerly known as BATS,etf
LRGF,Equity,Large/Mid Cap,North America,2015-04-28,iShares MSCI USA Multifactor ETF,905069922.3,38.595732,2021-01-07,46434V282,23500000,"Jan 08, 2021",0.2,0.2,MSCI USA Diversified Multiple-Factor Index,NYSE Arca,etf
MAIIX,Equity,All Cap,Global,1997-04-09,iShares MSCI EAFE International Index Fund,1028292505.13,15.03,2021-01-07,09253F408,,,,,MSCI EAFE Index (Net Total Return),,mf
MASKX,Equity,Small Cap,North America,1997-04-09,iShares Russell 2000 Small-Cap Index Fund,351344438.2,25.69,2021-01-07,09253F804,,,,,Russell 2000 Index (Gross Total Return),,mf
MBB,Fixed Income,Mortgages,North America,2007-03-13,iShares MBS ETF,25305273613.17,110.166624,2021-01-07,464288588,229700000,"Jan 07, 2021",0.06,0.07,Bloomberg Barclays US Mortgage Backed Securities Index,NASDAQ,etf
MCHI,Equity,Large/Mid Cap,Asia Pacific,2011-03-29,iShares MSCI China ETF,6663538624.68,82.674176,2021-01-07,46429B671,80600000,"Jan 07, 2021",0.59,0.59,MSCI China Index,NASDAQ,etf
MDIIX,Equity,All Cap,Global,1997-04-09,iShares MSCI EAFE International Index Fund,356446433.11,14.93,2021-01-07,09253F309,,,,,MSCI EAFE Index (Net Total Return),,mf
MDSKX,Equity,Small Cap,North America,1997-04-09,iShares Russell 2000 Small-Cap Index Fund,272228467.65,25.71,2021-01-07,09253F705,,,,,Russell 2000 Index (Gross Total Return),,mf
MEAR,Fixed Income,Municipals,North America,2015-03-03,BlackRock Short Maturity Municipal Bond ETF,283685408.35,50.209807,2021-01-08,46431W838,5650000,"Jan 08, 2021",0.25,0.25,Bloomberg Barclays Municipal Bond: 1 Year (1-2) Index,Cboe BZX formerly known as BATS,etf
MIDF,Equity,Mid Cap,North America,2019-06-04,iShares MSCI USA Mid-Cap Multifactor ETF,3264376.84,32.643768,2021-01-07,46435U143,100000,"Jan 08, 2021",0.25,0.25,MSCI USA Mid Cap Diversified Multiple-Factor Index,NYSE Arca,etf
