ticker,asset_class,sub_class,region,inception,name,net_assets,nav,nav_as_of,cusip,shares_outstanding,shares_outstanding_as_of,mgmt_fee,expense_ratio,benchmark_index,exchange,type
AAXJ,Equity,Large/Mid Cap,Asia Pacific,2008-08-13,iShares MSCI All Country Asia ex Japan ETF,6004249542.55,92.089717,2021-01-07,464288182,65200000,"Jan 07, 2021",0.7,0.7,MSCI AC Asia ex Japan Index,NASDAQ,etf
ACWF,Equity,Large/Mid Cap,Global,2015-04-28,iShares MSCI Global Multifactor ETF,91683019.26,34.597366,2021-01-07,46434V316,2650000,"Jan 08, 2021",0.35,0.35,MSCI ACWI Diversified Multiple-Factor Index,NYSE Arca,etf
ACWI,Equity,Large/Mid Cap,Global,2008-03-26,iShares MSCI ACWI ETF,14630796354.51,92.48291,2021-01-07,464288257,158200000,"Jan 07, 2021",0.32,0.33,MSCI ACWI Index,NASDAQ,etf
ACWV,Equity,Large/Mid Cap,Global,2011-10-18,iShares MSCI Global Min Vol Factor ETF,5853574472.25,97.397246,2021-01-07,464286525,60100000,"Jan 07, 2021",0.32,0.32,MSCI All Country World Minimum Volatility Index,Cboe BZX formerly known as BATS,etf
ACWX,Equity,Large/Mid Cap,Global,2008-03-26,iShares MSCI ACWI ex U.S. ETF,3831965855.34,54.431333,2021-01-07,464288240,70400000,"Jan 07, 2021",0.32,0.34,MSCI ACWI ex USA Index,NASDAQ,etf
AGG,Fixed Income,Multi Sectors,North America,2003-09-22,iShares Core U.S. Aggregate Bond ETF,84717422111.93,117.158653,2021-01-07,464287226,723100000,"Jan 07, 2021",0.04,0.04,Bloomberg Barclays US Aggregate Bond Index,NYSE Arca,etf
AGT,Equity,All Cap,Latin America,2017-04-25,iShares MSCI Argentina and Global Exposure ETF,7749907.66,25.833026,2021-01-07,46435G276,300000,"Jan 08, 2021",0.59,0.59,MSCI All Argentina 25/50 Index,Cboe BZX formerly known as BATS,etf
AGZ,Fixed Income,Government,North America,2008-11-05,iShares Agency Bond ETF,917683445.59,119.179668,2021-01-07,464288166,7700000,"Jan 07, 2021",0.2,0.2,Bloomberg Barclays U.S. Agency Bond Index,NYSE Arca,etf
AIA,Equity,Large Cap,Asia Pacific,2007-11-13,iShares Asia 50 ETF,2757410655.89,90.111459,2021-01-07,464288430,30600000,"Jan 07, 2021",0.5,0.5,S&P Asia 50 Index,NASDAQ,etf
AMCA,Equity,Large/Mid Cap,North America,2017-08-08,iShares Russell 1000 Pure U.S. Revenue ETF,3248538.18,32.485382,2021-01-07,46435G169,100000,"Jan 08, 2021",0.15,0.15,Russell 1000 Pure Domestic Exposure Index,NASDAQ,etf
AOA,Multi Asset,Static Allocation,Global,2008-11-04,iShares Core Aggressive Allocation ETF,1207472523.95,65.268785,2021-01-07,464289859,18500000,"Jan 07, 2021",0.25,0.31,S&P Target Risk Aggressive Index,NYSE Arca,etf
AOK,Multi Asset,Static Allocation,Global,2008-11-04,iShares Core Conservative Allocation ETF,836960268.37,38.838063,2021-01-07,464289883,21600000,"Jan 08, 2021",0.25,0.31,S&P Target Risk Conservative Index,NYSE Arca,etf
AOM,Multi Asset,Static Allocation,Global,2008-11-04,iShares Core Moderate Allocation ETF,1479168845.67,43.441082,2021-01-07,464289875,34050000,"Jan 07, 2021",0.25,0.3,S&P Target Risk Moderate Index,NYSE Arca,etf
AOR,Multi Asset,Static Allocation,Global,2008-11-04,iShares Core Growth Allocation ETF,1621627762.81,52.821751,2021-01-07,464289867,30700000,"Jan 07, 2021",0.25,0.31,S&P Target Risk Growth Index,NYSE Arca,etf
BAIPX,Fixed Income,Inflation,North America,2016-02-16,iShares Short-Term TIPS Bond Index Fund,1479622.58,10.37,2021-01-07,09258N877,,,,,BBG Barc US TIPS 0-5 Years Index,,mf
BARDX,Real Estate,Real Estate Securities,Global,2015-08-13,iShares Developed Real Estate Index Fund,1563510.75,9.67,2021-01-07,091936211,,,,,FTSE EPRA Nareit Developed Index (Net) in USD,,mf
BASMX,Equity,All Cap,North America,2015-08-13,iShares Total U.S. Stock Market Index Fund,129241956.32,18.3,2021-01-07,091936179,,,,,Russell 3000 Index,,mf
BDBKX,Equity,Small Cap,North America,2011-03-31,iShares Russell 2000 Small-Cap Index Fund,1942179824.68,25.76,2021-01-07,09253F887,,,,,Russell 2000 Index (Gross Total Return),,mf
BDBPX,Equity,Small Cap,North America,2018-08-06,iShares Russell 2000 Small-Cap Index Fund,349709612.42,25.63,2021-01-07,066923244,,,,,Russell 2000 Index (Gross Total Return),,mf
BDOAX,Equity,Large Cap,Global,2011-06-30,iShares MSCI Total International Index Fund,376507688.95,10.34,2021-01-07,066923624,,,,,MSCI All Country World ex US Index (Net TR),,mf
BDOIX,Equity,Large Cap,Global,2011-06-30,iShares MSCI Total International Index Fund,156580125.5,10.37,2021-01-07,066923616,,,,,MSCI All Country World ex US Index (Net TR),,mf
BDOKX,Equity,Large Cap,Global,2011-06-30,iShares MSCI Total International Index Fund,685102111.84,10.7,2021-01-07,066923590,,,,,MSCI All Country World ex US Index (Net TR),,mf
BFTR,Equity,Mid/Small Cap,North America,2020-09-29,BlackRock Future Innovators ETF,8800680.07,48.892667,2021-01-08,09290C202,180000,"Jan 08, 2021",0.8,0.8,Russell 2500 Growth Index,NYSE Arca,etf
BGRN,Fixed Income,Multi Sectors,Global,2018-11-13,iShares Global Green Bond ETF,164565639.81,55.784963,2021-01-07,46435U440,2950000,"Jan 08, 2021",0.25,0.25,Bloomberg Barclays MSCI Global Green Bond Select (USD Hedged) Index,NASDAQ,etf
BIDAX,Fixed Income,Municipals,North America,2018-11-16,iShares Municipal Bond Index Fund,23281634.76,12.29,2021-01-07,09258N356,,,,,ICE BofA US Municipal Securities Index,,mf
BIDIX,Fixed Income,Municipals,North America,2018-11-16,iShares Municipal Bond Index Fund,6136922.8,12.29,2021-01-07,09258N349,,,,,ICE BofA US Municipal Securities Index,,mf
BIDKX,Fixed Income,Municipals,North America,2018-11-16,iShares Municipal Bond Index Fund,107034.27,12.29,2021-01-07,09258N331,,,,,ICE BofA US Municipal Securities Index,,mf
BIDPX,Fixed Income,Municipals,North America,2018-11-16,iShares Municipal Bond Index Fund,317195247.84,12.29,2021-01-07,066923210,,,,,ICE BofA US Municipal Securities Index,,mf
BIEVX,Equity,Large Cap,Global,2016-07-13,iShares Edge MSCI Min Vol EAFE Index Fund,25734505.8,10.23,2021-01-07,09258N588,,,,,MSCI EAFE Minimum Volatility (USD Optimized) Index - USD Net,,mf
BIIMX,Equity,Large Cap,Global,2016-07-13,iShares Edge MSCI Multifactor Intl Index Fund,737597.63,11.32,2021-01-07,09258N679,,,,,MSCI World ex USA Diversified Multiple-Factor Net Index,,mf
BIIPX,Fixed Income,Inflation,North America,2016-02-16,iShares Short-Term TIPS Bond Index Fund,16598025.97,10.33,2021-01-07,09258N885,,,,,BBG Barc US TIPS 0-5 Years Index,,mf
BIMFX,Equity,Large Cap,North America,2016-07-13,iShares Edge MSCI Multifactor USA Index Fund,776237.18,14.35,2021-01-07,09258N729,,,,,MSCI USA Diversified Multiple-Factor Gross Index,,mf
BIMVX,Equity,Large Cap,North America,2016-07-13,iShares Edge MSCI Min Vol USA Index Fund,67678661.75,14.27,2021-01-07,09258N638,,,,,MSCI USA Minimum Volatility (USD Optimized) Index - USD Gross,,mf
BIRDX,Real Estate,Real Estate Securities,Global,2015-08-13,iShares Developed Real Estate Index Fund,45852550.51,9.68,2021-01-07,091936195,,,,,FTSE EPRA Nareit Developed Index (Net) in USD,,mf
BITSX,Equity,All Cap,North America,2015-08-13,iShares Total U.S. Stock Market Index Fund,102198385.3,18.32,2021-01-07,091936161,,,,,Russell 3000 Index,,mf
BKEVX,Equity,Large Cap,Global,2016-07-13,iShares Edge MSCI Min Vol EAFE Index Fund,12308724.72,10.23,2021-01-07,09258N596,,,,,MSCI EAFE Minimum Volatility (USD Optimized) Index - USD Net,,mf
BKF,Equity,Large/Mid Cap,Global,2007-11-12,iShares MSCI BRIC ETF,181527084.9,53.390319,2021-01-07,464286657,3400000,"Jan 07, 2021",0.7,0.7,MSCI BRIC Index,NYSE Arca,etf
BKIMX,Equity,Large Cap,Global,2016-07-13,iShares Edge MSCI Multifactor Intl Index Fund,11231146.9,11.32,2021-01-07,09258N687,,,,,MSCI World ex USA Diversified Multiple-Factor Net Index,,mf
BKIPX,Fixed Income,Inflation,North America,2016-02-16,iShares Short-Term TIPS Bond Index Fund,41704137.84,10.37,2021-01-07,09258N869,,,,,BBG Barc US TIPS 0-5 Years Index,,mf
BKMFX,Equity,Large Cap,North America,2016-07-13,iShares Edge MSCI Multifactor USA Index Fund,15223662.18,14.36,2021-01-07,09258N737,,,,,MSCI USA Diversified Multiple-Factor Gross Index,,mf
BKMVX,Equity,Large Cap,North America,2016-07-13,iShares Edge MSCI Min Vol USA Index Fund,24431864.77,14.27,2021-01-07,09258N646,,,,,MSCI USA Minimum Volatility (USD Optimized) Index - USD Gross,,mf
BKRDX,Real Estate,Real Estate Securities,Global,2015-08-13,iShares Developed Real Estate Index Fund,1920644970.8,9.67,2021-01-07,091936187,,,,,FTSE EPRA Nareit Developed Index (Net) in USD,,mf
BKTSX,Equity,All Cap,North America,2015-08-13,iShares Total U.S. Stock Market Index Fund,1278277520.38,18.31,2021-01-07,091936153,,,,,Russell 3000 Index,,mf
BMED,Equity,Mid/Small Cap,Global,2020-09-29,BlackRock Future Health ETF,7350723.86,30.628016,2021-01-08,09290C400,240000,"Jan 08, 2021",0.85,0.85,MSCI All Country World Index,NYSE Arca,etf
BMOAX,Fixed Income,Multi Sectors,North America,2011-03-31,iShares U.S. Aggregate Bond Index Fund,159039501.04,10.79,2021-01-07,066923400,,,,,BBG Barc U.S. Aggregate Index,,mf
BMOIX,Fixed Income,Multi Sectors,North America,2011-03-31,iShares U.S. Aggregate Bond Index Fund,366739350.22,10.79,2021-01-07,066923509,,,,,BBG Barc U.S. Aggregate Index,,mf
BMOPX,Fixed Income,Multi Sectors,North America,2018-08-06,iShares U.S. Aggregate Bond Index Fund,6952402.44,10.79,2021-01-07,066923228,,,,,BBG Barc U.S. Aggregate Index,,mf
BRGAX,Equity,Large Cap,North America,2011-03-31,iShares Russell 1000 Large-Cap Index Fund,86213892.29,25.29,2021-01-07,066923103,,,,,Russell 1000 Index (Gross Total Return),,mf
BRGKX,Equity,Large Cap,North America,2011-03-31,iShares Russell 1000 Large-Cap Index Fund,431566281.55,25.35,2021-01-07,066923301,,,,,Russell 1000 Index (Gross Total Return),,mf
BRGNX,Equity,Large Cap,North America,2011-03-31,iShares Russell 1000 Large-Cap Index Fund,127289807.7,25.45,2021-01-07,066923202,,,,,Russell 1000 Index (Gross Total Return),,mf
BRMAX,Equity,Mid Cap,North America,2015-11-30,iShares Russell Mid-Cap Index Fund,113506576.49,13.11,2021-01-07,09258N307,,,,,Russell MidCap Index,,mf
BRMIX,Equity,Mid Cap,North America,2015-05-13,iShares Russell Mid-Cap Index Fund,220613086.9,13.16,2021-01-07,091936294,,,,,Russell MidCap Index,,mf
BRMKX,Equity,Mid Cap,North America,2015-05-13,iShares Russell Mid-Cap Index Fund,1146808761.5,13.19,2021-01-07,091936286,,,,,Russell MidCap Index,,mf
BSMAX,Equity,Mid/Small Cap,North America,2015-08-13,iShares Russell Small/Mid-Cap Index Fund,83110554.53,15.85,2021-01-07,091936245,,,,,Russell 2500 Total Return Index,,mf
BSMIX,Equity,Mid/Small Cap,North America,2015-08-13,iShares Russell Small/Mid-Cap Index Fund,98343053.82,15.87,2021-01-07,091936237,,,,,Russell 2500 Total Return Index,,mf
BSMKX,Equity,Mid/Small Cap,North America,2015-08-13,iShares Russell Small/Mid-Cap Index Fund,192518302.25,15.87,2021-01-07,091936229,,,,,Russell 2500 Total Return Index,,mf
BSPAX,Equity,Large Cap,North America,2013-04-11,iShares S&P 500 Index Fund,2593902715.95,449.9,2021-01-07,066923566,,,,,S&P 500 Index,,mf
BSPGX,Equity,Large Cap,North America,2019-07-01,iShares S&P 500 Index Fund,7481331870.83,450.08,2021-01-07,066923194,,,,,S&P 500 Index,,mf
BSPIX,Equity,Large Cap,North America,2013-04-11,iShares S&P 500 Index Fund,4186644292.04,449.99,2021-01-07,066923558,,,,,S&P 500 Index,,mf
BSPPX,Equity,Large Cap,North America,2018-08-06,iShares S&P 500 Index Fund,1404825600.14,449.51,2021-01-07,066923236,,,,,S&P 500 Index,,mf
BSPSX,Equity,Large Cap,North America,2013-04-22,iShares S&P 500 Index Fund,591851613.74,449.93,2021-01-07,066923533,,,,,S&P 500 Index,,mf
BTEK,Equity,Mid/Small Cap,Global,2020-09-29,BlackRock Future Tech ETF,8759835.62,36.499315,2021-01-08,09290C301,240000,"Jan 08, 2021",0.88,0.88,MSCI All Country World Index,NYSE Arca,etf
BTMKX,Equity,All Cap,Global,2011-03-31,iShares MSCI EAFE International Index Fund,,15.17,2021-01-08,09253F879,,,,,MSCI EAFE Index (Net Total Return),,mf
BTMPX,Equity,All Cap,Global,2018-08-06,iShares MSCI EAFE International Index Fund,150183623.33,14.88,2021-01-07,066923251,,,,,MSCI EAFE Index (Net Total Return),,mf
BYLD,Fixed Income,Multi Sectors,North America,2014-04-22,iShares Yield Optimized Bond ETF,207825998.28,25.657531,2021-01-07,46434V787,8100000,"Jan 08, 2021",0.28,0.48,Morningstar U.S. Bond Market Yield-Optimized Index,NYSE Arca,etf
CCRV,Commodity,Multi Commodity,North America,2020-09-01,iShares Commodity Curve Carry Strategy ETF,32668172.9,21.778782,2021-01-07,46431W564,1500000,"Jan 08, 2021",0.4,0.4,ICE BofA Commodity Carry Total Return Index,NYSE Arca,etf
CEMB,Fixed Income,Credit,Global,2012-04-17,iShares J.P. Morgan EM Corporate Bond ETF,247141572.32,52.583313,2021-01-07,464286251,4700000,"Jan 07, 2021",0.5,0.5,J.P. Morgan CEMBI Broad Diversified Core Index,Cboe BZX formerly known as BATS,etf
CMBS,Fixed Income,Mortgages,North America,2012-02-14,iShares CMBS ETF,469704605.4,54.936211,2021-01-07,46429B366,8550000,"Jan 07, 2021",0.25,0.25,Bloomberg Barclays U.S. CMBS (ERISA Only) Index,NYSE Arca,etf
CMDY,Commodity,Multi Commodity,Global,2018-04-03,iShares Bloomberg Roll Select Commodity Strategy ETF,49023389.75,46.688943,2021-01-07,46431W598,1050000,"Jan 08, 2021",0.28,0.29,Bloomberg Roll Select Commodity Total Return Index,NYSE Arca,etf
CMF,Fixed Income,Municipals,North America,2007-10-04,iShares California Muni Bond ETF,1680929706.64,62.721258,2021-01-07,464288356,26800000,"Jan 07, 2021",0.25,0.25,S&P California AMT-Free Municipal bond Index,NYSE Arca,etf
CNYA,Equity,Large/Mid Cap,Asia Pacific,2016-06-13,iShares MSCI China A ETF,639257949.56,45.337443,2021-01-08,46434V514,14100000,"Jan 08, 2021",0.6,0.6,MSCI China A Inclusion Index,Cboe BZX formerly known as BATS,etf
COMT,Commodity,Multi Commodity,Global,2014-10-15,iShares Commodities Select Strategy ETF,216406256.55,27.393197,2021-01-07,46431W853,7900000,"Jan 07, 2021",0.48,0.48,,NASDAQ,etf
CRBN,Equity,Large/Mid Cap,Global,2014-12-08,iShares MSCI ACWI Low Carbon Target ETF,629049707.0,151.578243,2021-01-07,46434V464,4150000,"Jan 08, 2021",0.2,0.2,MSCI ACWI Low Carbon Target Index,NYSE Arca,etf
DEFA,Equity,Large/Mid Cap,Global,2016-01-05,iShares Adaptive Currency Hedged MSCI EAFE ETF,6189578.01,30.94789,2021-01-07,46435G656,200000,"Jan 08, 2021",0.38,0.7,MSCI EAFE Adaptive Hedge to USD Index,Cboe BZX formerly known as BATS,etf
DGRO,Equity,All Cap,North America,2014-06-10,iShares Core Dividend Growth ETF,14987945331.15,45.583775,2021-01-07,46434V621,329250000,"Jan 08, 2021",0.08,0.08,Morningstar US Dividend Growth Index,NYSE Arca,etf
DIVB,Equity,All Cap,North America,2017-11-07,iShares U.S. Dividend and Buyback ETF,42492757.32,33.994206,2021-01-07,46435U861,1250000,"Jan 08, 2021",0.25,0.25,Morningstar US Dividend and Buyback Index,Cboe BZX formerly known as BATS,etf
DMXF,Equity,Large Cap,Global,2020-06-16,iShares ESG Advanced MSCI EAFE ETF,64788907.41,64.788907,2021-01-08,46436E759,1000000,"Jan 08, 2021",0.12,0.12,MSCI EAFE Choice ESG Screened Net Index in USD,NASDAQ,etf
DSI,Equity,Large/Mid Cap,North America,2006-11-14,iShares MSCI KLD 400 Social ETF,2676734860.5,72.54024,2021-01-07,464288570,37000000,"Jan 08, 2021",0.25,0.25,MSCI KLD 400 Social Index,NYSE Arca,etf
DVY,Equity,All Cap,North America,2003-11-03,iShares Select Dividend ETF,15103578156.11,99.89139,2021-01-07,464287168,151200000,"Jan 07, 2021",0.39,0.39,Dow Jones U.S. Select Dividend IndexSM,NASDAQ,etf
DVYA,Equity,All Cap,Asia Pacific,2012-02-23,iShares Asia/Pacific Dividend ETF,31117740.99,38.897176,2021-01-07,464286293,800000,"Jan 07, 2021",0.49,0.49,Dow Jones Asia/Pacific Select Dividend 50 Index,NYSE Arca,etf
DVYE,Equity,All Cap,Global,2012-02-23,iShares Emerging Markets Dividend ETF,683606771.29,37.560812,2021-01-07,464286319,18200000,"Jan 07, 2021",0.49,0.49,Dow Jones Emerging Markets Select Dividend Index,NYSE Arca,etf
DYNF,Equity,Large/Mid Cap,North America,2019-03-19,BlackRock U.S. Equity Factor Rotation ETF,93852579.03,32.362958,2021-01-07,09290C103,2900000,"Jan 08, 2021",0.3,0.3,MSCI Developed - US Gross TR Index,NYSE Arca,etf
EAGG,Fixed Income,Multi Sectors,North America,2018-10-18,iShares ESG Aware U.S. Aggregate Bond ETF,767337642.74,56.010047,2021-01-07,46435U549,13700000,"Jan 08, 2021",0.1,0.11,Bloomberg Barclays MSCI US Aggregate ESG Focus Index,NYSE Arca,etf
EAOA,Multi Asset,Multi Strategy,North America,2020-06-12,iShares ESG Aware Aggressive Allocation ETF,4679932.67,31.199551,2021-01-08,46436E668,150000,"Jan 08, 2021",0.18,0.33,BlackRock ESG Aware Aggressive Allocation Index,Cboe BZX formerly known as BATS,etf
EAOK,Multi Asset,Multi Strategy,North America,2020-06-12,iShares ESG Aware Conservative Allocation ETF,4077342.64,27.182284,2021-01-08,46436E692,150000,"Jan 08, 2021",0.18,0.3,BlackRock ESG Aware Conservative Allocation Index,Cboe BZX formerly known as BATS,etf
EAOM,Multi Asset,Multi Strategy,North America,2020-06-12,iShares ESG Aware Moderate Allocation ETF,4194510.32,27.963402,2021-01-08,46436E684,150000,"Jan 08, 2021",0.18,0.31,BlackRock ESG Aware Moderate Allocation Index,Cboe BZX formerly known as BATS,etf
EAOR,Multi Asset,Multi Strategy,North America,2020-06-12,iShares ESG Aware Growth Allocation ETF,4433935.82,29.559572,2021-01-08,46436E676,150000,"Jan 08, 2021",0.18,0.32,BlackRock ESG Aware Growth Allocation Index,Cboe BZX formerly known as BATS,etf
ECH,Equity,All Cap,Latin America,2007-11-12,iShares MSCI Chile ETF,530315828.88,32.63482,2021-01-07,464286640,16250000,"Jan 08, 2021",0.59,0.59,MSCI Chile IMI 25/50 Index,Cboe BZX formerly known as BATS,etf
ECNS,Equity,Small Cap,Asia Pacific,2010-09-28,iShares MSCI China Small-Cap ETF,61090719.04,50.908933,2021-01-07,46429B200,1200000,"Jan 07, 2021",0.59,0.59,MSCI China Small Cap Index,NYSE Arca,etf
EDEN,Equity,All Cap,Europe,2012-01-25,iShares MSCI Denmark ETF,169071673.32,99.453925,2021-01-07,46429B523,1700000,"Jan 08, 2021",0.53,0.53,MSCI Denmark IMI 25/50 Index,Cboe BZX formerly known as BATS,etf
EEM,Equity,Large/Mid Cap,Global,2003-04-07,iShares MSCI Emerging Markets ETF,28979265488.75,53.046431,2021-01-07,464287234,546300000,"Jan 07, 2021",0.7,0.7,MSCI Emerging Markets Index(SM),NYSE Arca,etf
EEMA,Equity,Large/Mid Cap,Asia Pacific,2012-02-08,iShares MSCI Emerging Markets Asia ETF,723264600.78,89.846534,2021-01-07,464286426,8050000,"Jan 07, 2021",0.49,0.5,MSCI EM Asia Custom Capped Index,NASDAQ,etf
EEMS,Equity,Small Cap,Global,2011-08-16,iShares MSCI Emerging Markets Small-Cap ETF,248606224.51,54.044831,2021-01-07,464286475,4600000,"Jan 07, 2021",0.7,0.71,MSCI Emerging Markets Small Cap Index,NYSE Arca,etf
EEMV,Equity,Large/Mid Cap,Global,2011-10-18,iShares MSCI Emerging Markets Min Vol Factor ETF,4227883997.97,62.450281,2021-01-07,464286533,67700000,"Jan 08, 2021",0.7,0.7,MSCI Emerging Markets Minimum Volatility Index,Cboe BZX formerly known as BATS,etf
EFA,Equity,Large/Mid Cap,Global,2001-08-14,iShares MSCI EAFE ETF,53827297425.87,74.822487,2021-01-07,464287465,719400000,"Jan 07, 2021",0.32,0.32,MSCI EAFE Index,NYSE Arca,etf
EFAV,Equity,Large/Mid Cap,Global,2011-10-18,iShares MSCI EAFE Min Vol Factor ETF,10665798726.89,74.016646,2021-01-07,46429B689,143800000,"Jan 08, 2021",0.32,0.32,MSCI EAFE Minimum Volatility (USD) Index,Cboe BZX formerly known as BATS,etf
EFG,Equity,Large/Mid Cap,Global,2005-08-01,iShares MSCI EAFE Growth ETF,10035878139.71,101.577714,2021-01-07,464288885,98800000,"Jan 07, 2021",0.39,0.39,MSCI EAFE Growth Index,Cboe BZX formerly known as BATS,etf
EFNL,Equity,All Cap,Europe,2012-01-25,iShares MSCI Finland ETF,30008430.82,46.166817,2021-01-07,46429B515,650000,"Jan 07, 2021",0.53,0.53,MSCI Finland IMI 25/50 Index,Cboe BZX formerly known as BATS,etf
EFV,Equity,Large/Mid Cap,Global,2005-08-01,iShares MSCI EAFE Value ETF,7484222047.67,49.109069,2021-01-07,464288877,152400000,"Jan 07, 2021",0.39,0.39,MSCI EAFE Value Index,Cboe BZX formerly known as BATS,etf
EIDO,Equity,All Cap,Asia Pacific,2010-05-05,iShares MSCI Indonesia ETF,391294544.67,24.079664,2021-01-07,46429B309,16250000,"Jan 07, 2021",0.59,0.59,MSCI Indonesia IMI 25/50 Index,NYSE Arca,etf
EIRL,Equity,All Cap,Europe,2010-05-05,iShares MSCI Ireland ETF,62037979.28,53.946069,2021-01-07,46429B507,1150000,"Jan 07, 2021",0.51,0.51,MSCI All Ireland Capped Index,NYSE Arca,etf
EIS,Equity,All Cap,Europe,2008-03-26,iShares MSCI Israel ETF,123090500.6,64.784474,2021-01-07,464286632,1900000,"Jan 08, 2021",0.59,0.59,MSCI Israel Capped Investable Market Index,NYSE Arca,etf
EMB,Fixed Income,Government,Global,2007-12-17,iShares J.P. Morgan USD Emerging Markets Bond ETF,19072995570.73,114.004755,2021-01-07,464288281,167300000,"Jan 07, 2021",0.39,0.39,J.P. Morgan EMBI Global Core Index,NASDAQ,etf
EMBH,Fixed Income,Government,Global,2015-07-22,iShares Interest Rate Hedged Emerging Markets Bond ETF,5968308.73,23.873235,2021-01-08,46431W820,250000,"Jan 08, 2021",0.75,1.13,JPM Swaps-Hedged EMBIG Core Index,NYSE Arca,etf
EMGF,Equity,Large/Mid Cap,Global,2015-12-08,iShares MSCI Emerging Markets Multifactor ETF,671445319.88,49.73669,2021-01-07,46434G889,13500000,"Jan 08, 2021",0.45,0.45,MSCI Emerging Market Diversified Multiple-Factor Index,Cboe BZX formerly known as BATS,etf
EMHY,Fixed Income,High Yield,Global,2012-04-03,iShares J.P. Morgan EM High Yield Bond ETF,323834246.39,45.933936,2021-01-07,464286285,7050000,"Jan 07, 2021",0.5,0.5,J.P. Morgan USD Emerging Markets High Yield Bond Index,Cboe BZX formerly known as BATS,etf
EMIF,Equity,All Cap,Global,2009-06-16,iShares Emerging Markets Infrastructure ETF,16272200.15,25.034154,2021-01-07,464288216,650000,"Jan 07, 2021",0.6,0.6,S&P Emerging Markets Infrastructure Index,NASDAQ,etf
EMXC,Equity,All Cap,Global,2017-07-18,iShares MSCI Emerging Markets ex China ETF,169280107.02,58.372451,2021-01-07,46434G764,2900000,"Jan 08, 2021",0.25,0.34,MSCI Emerging Markets ex China Index,NASDAQ,etf
EMXF,Equity,Large/Mid Cap,Global,2020-10-06,iShares ESG Advanced MSCI EM ETF,13205342.34,44.017808,2021-01-08,46436E742,300000,"Jan 08, 2021",0.16,0.16,MSCI Emerging Markets Choice ESG Screened 5% Issuer Capped Index,NASDAQ,etf
ENOR,Equity,All Cap,Europe,2012-01-23,iShares MSCI Norway ETF,24848487.15,26.156302,2021-01-07,46429B499,950000,"Jan 07, 2021",0.53,0.53,MSCI Norway IMI 25/50 Index,Cboe BZX formerly known as BATS,etf
ENZL,Equity,All Cap,Asia Pacific,2010-09-01,iShares MSCI New Zealand ETF,221007124.79,70.160992,2021-01-07,464289123,3150000,"Jan 08, 2021",0.51,0.51,MSCI New Zealand IMI 25/50 Index,NASDAQ,etf
EPHE,Equity,All Cap,Asia Pacific,2010-09-28,iShares MSCI Philippines ETF,154754315.99,32.240482,2021-01-07,46429B408,4800000,"Jan 07, 2021",0.59,0.59,MSCI Philippines IMI 25-50 NET Index,NYSE Arca,etf
EPOL,Equity,All Cap,Europe,2010-05-25,iShares MSCI Poland ETF,313226094.91,20.339357,2021-01-07,46429B606,15400000,"Jan 07, 2021",0.59,0.59,MSCI Poland IMI 25/50 Index,NYSE Arca,etf
EPP,Equity,Large/Mid Cap,Asia Pacific,2001-10-25,iShares MSCI Pacific ex Japan ETF,2122116998.47,49.123079,2021-01-07,464286665,43200000,"Jan 07, 2021",0.48,0.48,MSCI Pacific ex-Japan Index,NYSE Arca,etf
EPU,Equity,All Cap,Latin America,2009-06-19,iShares MSCI Peru ETF,178679487.45,36.465202,2021-01-07,464289842,4900000,"Jan 08, 2021",0.59,0.59,MSCI All Peru Capped Index,NYSE Arca,etf
ERUS,Equity,Large/Mid Cap,Europe,2010-11-09,iShares MSCI Russia ETF,483417329.55,38.673386,2021-01-07,46434G798,12500000,"Jan 07, 2021",0.59,0.59,MSCI Russia 25 / 50 Index,NYSE Arca,etf
ESGD,Equity,Large/Mid Cap,Global,2016-06-28,iShares ESG Aware MSCI EAFE ETF,4089898417.39,74.769624,2021-01-07,46435G516,54900000,"Jan 08, 2021",0.2,0.2,MSCI EAFE Extended ESG Focus Index,NASDAQ,etf
ESGE,Equity,Large/Mid Cap,Global,2016-06-28,iShares ESG Aware MSCI EM ETF,6352199722.17,43.036583,2021-01-07,46434G863,149600000,"Jan 08, 2021",0.25,0.25,MSCI Emerging Markets Extended ESG Focus Index,NASDAQ,etf
ESGU,Equity,Large/Mid Cap,North America,2016-12-01,iShares ESG Aware MSCI USA ETF,13744784910.24,87.268476,2021-01-07,46435G425,157950000,"Jan 08, 2021",0.15,0.15,MSCI USA Extended ESG Focus Index,NASDAQ,etf
ESML,Equity,All Cap,North America,2018-04-10,iShares ESG Aware MSCI USA Small-Cap ETF,540118507.87,36.007901,2021-01-07,46435U663,15000000,"Jan 08, 2021",0.17,0.17,MSCI USA Small Cap Extended ESG Focus Index,Cboe BZX formerly known as BATS,etf
EUFN,Equity,All Cap,Europe,2010-01-20,iShares MSCI Europe Financials ETF,1103752369.51,18.380556,2021-01-07,464289180,60050000,"Jan 07, 2021",0.48,0.48,MSCI Europe Financials Index,NASDAQ,etf
EUSA,Equity,Large/Mid Cap,North America,2010-05-05,iShares MSCI USA Equal Weighted ETF,292438046.53,74.034948,2021-01-07,464286681,3950000,"Jan 08, 2021",0.15,0.15,MSCI USA Equal Weighted Index,NYSE Arca,etf
EUSB,Fixed Income,Multi Sectors,North America,2020-06-23,iShares ESG Advanced Total USD Bond Market ETF,155663396.17,50.213999,2021-01-08,46436E619,3100000,"Jan 08, 2021",0.12,0.13,Bloomberg Barclays MSCI US Universal Choice ESG Screened Index,NYSE Arca,etf
EWA,Equity,Large/Mid Cap,Asia Pacific,1996-03-12,iShares MSCI Australia ETF,1814943705.44,24.592733,2021-01-07,464286103,73800000,"Jan 07, 2021",0.51,0.51,MSCI Australia Index,NYSE Arca,etf
EWC,Equity,Large/Mid Cap,North America,1996-03-12,iShares MSCI Canada ETF,2981153593.19,32.020984,2021-01-07,464286509,93100000,"Jan 08, 2021",0.51,0.51,MSCI Canada Custom Capped Index,NYSE Arca,etf
EWD,Equity,Large/Mid Cap,Europe,1996-03-12,iShares MSCI Sweden ETF,411894933.79,41.605549,2021-01-07,464286756,9900000,"Jan 07, 2021",0.51,0.51,MSCI Sweden 25/50 Index,NYSE Arca,etf
EWG,Equity,Large/Mid Cap,Europe,1996-03-12,iShares MSCI Germany ETF,2608097778.62,32.68293,2021-01-07,464286806,79800000,"Jan 07, 2021",0.51,0.51,MSCI Germany Index,NYSE Arca,etf
EWGS,Equity,Small Cap,Europe,2012-01-25,iShares MSCI Germany Small-Cap ETF,38895847.11,77.791694,2021-01-07,46429B465,500000,"Jan 07, 2021",0.59,0.59,MSCI Germany Small Cap Index,Cboe BZX formerly known as BATS,etf
EWH,Equity,Large/Mid Cap,Asia Pacific,1996-03-12,iShares MSCI Hong Kong ETF,1481930863.44,25.235093,2021-01-07,464286871,58725000,"Jan 07, 2021",0.51,0.51,MSCI Hong Kong 25/50 Index,NYSE Arca,etf
EWI,Equity,Large/Mid Cap,Europe,1996-03-12,iShares MSCI Italy ETF,188841440.0,30.335974,2021-01-07,46434G830,6225000,"Jan 07, 2021",0.51,0.51,MSCI Italy 25/50 Index,NYSE Arca,etf
