ticker,asset_class,sub_class,region,inception,name,net_assets,nav,nav_as_of,cusip,shares_outstanding,shares_outstanding_as_of,mgmt_fee,expense_ratio,benchmark_index,exchange,type
AAXJ,Equity,Large/Mid Cap,Asia Pacific,2008-08-13,iShares MSCI All Country Asia ex Japan ETF,6610155967.33,97.208176,2021-02-02,464288182,68000000,"Feb 02, 2021",0.7,0.7,MSCI AC Asia ex Japan Index,NASDAQ,etf
ACWF,Equity,Large/Mid Cap,Global,2015-04-28,iShares MSCI Global Multifactor ETF,91941630.78,34.694955,2021-02-02,46434V316,2650000,"Feb 02, 2021",0.35,0.35,MSCI ACWI Diversified Multiple-Factor Index,NYSE Arca,etf
ACWI,Equity,Large/Mid Cap,Global,2008-03-26,iShares MSCI ACWI ETF,14714090623.12,93.009422,2021-02-02,464288257,158200000,"Feb 02, 2021",0.32,0.33,MSCI ACWI Index,NASDAQ,etf
ACWV,Equity,Large/Mid Cap,Global,2011-10-18,iShares MSCI Global Min Vol Factor ETF,5637320860.16,96.69504,2021-02-02,464286525,58300000,"Feb 02, 2021",0.32,0.32,MSCI All Country World Minimum Volatility Index,Cboe BZX formerly known as BATS,etf
ACWX,Equity,Large/Mid Cap,Global,2008-03-26,iShares MSCI ACWI ex U.S. ETF,3841482785.02,54.566517,2021-02-02,464288240,70400000,"Feb 02, 2021",0.32,0.34,MSCI ACWI ex USA Index,NASDAQ,etf
AGG,Fixed Income,Multi Sectors,North America,2003-09-22,iShares Core U.S. Aggregate Bond ETF,86153139711.05,117.008203,2021-02-02,464287226,736300000,"Feb 02, 2021",0.04,0.04,Bloomberg Barclays US Aggregate Bond Index,NYSE Arca,etf
AGT,Equity,All Cap,Latin America,2017-04-25,iShares MSCI Argentina and Global Exposure ETF,7818769.0,26.062563,2021-02-02,46435G276,300000,"Feb 02, 2021",0.59,0.59,MSCI All Argentina 25/50 Index,Cboe BZX formerly known as BATS,etf
AGZ,Fixed Income,Government,North America,2008-11-05,iShares Agency Bond ETF,769182437.12,119.253091,2021-02-02,464288166,6450000,"Feb 02, 2021",0.2,0.2,Bloomberg Barclays U.S. Agency Bond Index,NYSE Arca,etf
AIA,Equity,Large Cap,Asia Pacific,2007-11-13,iShares Asia 50 ETF,3054492164.45,97.743749,2021-02-02,464288430,31250000,"Feb 02, 2021",0.5,0.5,S&P Asia 50 Index,NASDAQ,etf
AMCA,Equity,Large/Mid Cap,North America,2017-08-08,iShares Russell 1000 Pure U.S. Revenue ETF,3204350.64,32.043506,2021-02-02,46435G169,100000,"Feb 02, 2021",0.15,0.15,Russell 1000 Pure Domestic Exposure Index,NASDAQ,etf
AOA,Multi Asset,Static Allocation,Global,2008-11-04,iShares Core Aggressive Allocation ETF,1228111627.93,65.499287,2021-02-02,464289859,18750000,"Feb 02, 2021",0.25,0.31,S&P Target Risk Aggressive Index,NYSE Arca,etf
AOK,Multi Asset,Static Allocation,Global,2008-11-04,iShares Core Conservative Allocation ETF,845288486.59,38.863838,2021-02-02,464289883,21750000,"Feb 02, 2021",0.25,0.31,S&P Target Risk Conservative Index,NYSE Arca,etf
AOM,Multi Asset,Static Allocation,Global,2008-11-04,iShares Core Moderate Allocation ETF,1451569064.64,43.525309,2021-02-02,464289875,33350000,"Feb 02, 2021",0.25,0.3,S&P Target Risk Moderate Index,NYSE Arca,etf
AOR,Multi Asset,Static Allocation,Global,2008-11-04,iShares Core Growth Allocation ETF,1636683522.41,52.967104,2021-02-02,464289867,30900000,"Feb 02, 2021",0.25,0.31,S&P Target Risk Growth Index,NYSE Arca,etf
BAIPX,Fixed Income,Inflation,North America,2016-02-16,iShares Short-Term TIPS Bond Index Fund,1844969.86,10.4,2021-02-02,09258N877,,,,,BBG Barc US TIPS 0-5 Years Index,,mf
BARDX,Real Estate,Real Estate Securities,Global,2015-08-13,iShares Developed Real Estate Index Fund,1484138.34,9.91,2021-02-02,091936211,,,,,FTSE EPRA Nareit Developed Index (Net) in USD,,mf
BASMX,Equity,All Cap,North America,2015-08-13,iShares Total U.S. Stock Market Index Fund,128861051.3,18.45,2021-02-02,091936179,,,,,Russell 3000 Index,,mf
BDBKX,Equity,Small Cap,North America,2011-03-31,iShares Russell 2000 Small-Cap Index Fund,2022921108.01,26.44,2021-02-02,09253F887,,,,,Russell 2000 Index (Gross Total Return),,mf
BDBPX,Equity,Small Cap,North America,2018-08-06,iShares Russell 2000 Small-Cap Index Fund,356408452.72,26.29,2021-02-02,066923244,,,,,Russell 2000 Index (Gross Total Return),,mf
BDOAX,Equity,Large Cap,Global,2011-06-30,iShares MSCI Total International Index Fund,376581995.06,10.36,2021-02-02,066923624,,,,,MSCI All Country World ex US Index (Net TR),,mf
BDOIX,Equity,Large Cap,Global,2011-06-30,iShares MSCI Total International Index Fund,158491514.68,10.39,2021-02-02,066923616,,,,,MSCI All Country World ex US Index (Net TR),,mf
BDOKX,Equity,Large Cap,Global,2011-06-30,iShares MSCI Total International Index Fund,702835786.02,10.72,2021-02-02,066923590,,,,,MSCI All Country World ex US Index (Net TR),,mf
BFTR,Equity,Mid/Small Cap,North America,2020-09-29,BlackRock Future Innovators ETF,11964882.25,52.021227,2021-02-03,09290C202,230000,"Feb 03, 2021",0.8,0.8,Russell 2500 Growth Index,NYSE Arca,etf
BGRN,Fixed Income,Multi Sectors,Global,2018-11-13,iShares Global Green Bond ETF,191714240.17,55.569345,2021-02-02,46435U440,3450000,"Feb 02, 2021",0.25,0.25,Bloomberg Barclays MSCI Global Green Bond Select (USD Hedged) Index,NASDAQ,etf
BIDAX,Fixed Income,Municipals,North America,2018-11-16,iShares Municipal Bond Index Fund,23370597.81,12.35,2021-02-02,09258N356,,,,,ICE BofA US Municipal Securities Index,,mf
BIDIX,Fixed Income,Municipals,North America,2018-11-16,iShares Municipal Bond Index Fund,6468262.25,12.35,2021-02-02,09258N349,,,,,ICE BofA US Municipal Securities Index,,mf
BIDKX,Fixed Income,Municipals,North America,2018-11-16,iShares Municipal Bond Index Fund,107513.79,12.35,2021-02-02,09258N331,,,,,ICE BofA US Municipal Securities Index,,mf
BIDPX,Fixed Income,Municipals,North America,2018-11-16,iShares Municipal Bond Index Fund,317066144.67,12.35,2021-02-02,066923210,,,,,ICE BofA US Municipal Securities Index,,mf
BIEVX,Equity,Large Cap,Global,2016-07-13,iShares Edge MSCI Min Vol EAFE Index Fund,24068827.94,7.39,2021-02-02,09258N588,,,,,MSCI EAFE Minimum Volatility (USD Optimized) Index - USD Net,,mf
BIIPX,Fixed Income,Inflation,North America,2016-02-16,iShares Short-Term TIPS Bond Index Fund,16450696.58,10.36,2021-02-02,09258N885,,,,,BBG Barc US TIPS 0-5 Years Index,,mf
BIMVX,Equity,Large Cap,North America,2016-07-13,iShares Edge MSCI Min Vol USA Index Fund,34318458.53,8.91,2021-02-02,09258N638,,,,,MSCI USA Minimum Volatility (USD Optimized) Index - USD Gross,,mf
BIRDX,Real Estate,Real Estate Securities,Global,2015-08-13,iShares Developed Real Estate Index Fund,47781152.97,9.93,2021-02-02,091936195,,,,,FTSE EPRA Nareit Developed Index (Net) in USD,,mf
BITSX,Equity,All Cap,North America,2015-08-13,iShares Total U.S. Stock Market Index Fund,102473768.74,18.48,2021-02-02,091936161,,,,,Russell 3000 Index,,mf
BKEVX,Equity,Large Cap,Global,2016-07-13,iShares Edge MSCI Min Vol EAFE Index Fund,9526509.57,7.39,2021-02-02,09258N596,,,,,MSCI EAFE Minimum Volatility (USD Optimized) Index - USD Net,,mf
BKF,Equity,Large/Mid Cap,Global,2007-11-12,iShares MSCI BRIC ETF,193721103.46,56.976795,2021-02-02,464286657,3400000,"Feb 02, 2021",0.7,0.7,MSCI BRIC Index,NYSE Arca,etf
BKIPX,Fixed Income,Inflation,North America,2016-02-16,iShares Short-Term TIPS Bond Index Fund,43120686.62,10.4,2021-02-02,09258N869,,,,,BBG Barc US TIPS 0-5 Years Index,,mf
BKMVX,Equity,Large Cap,North America,2016-07-13,iShares Edge MSCI Min Vol USA Index Fund,16298092.88,8.91,2021-02-02,09258N646,,,,,MSCI USA Minimum Volatility (USD Optimized) Index - USD Gross,,mf
BKRDX,Real Estate,Real Estate Securities,Global,2015-08-13,iShares Developed Real Estate Index Fund,1993946454.65,9.91,2021-02-02,091936187,,,,,FTSE EPRA Nareit Developed Index (Net) in USD,,mf
BKTSX,Equity,All Cap,North America,2015-08-13,iShares Total U.S. Stock Market Index Fund,1312017465.22,18.48,2021-02-02,091936153,,,,,Russell 3000 Index,,mf
BMED,Equity,Mid/Small Cap,Global,2020-09-29,BlackRock Future Health ETF,7417634.25,30.906809,2021-02-03,09290C400,240000,"Feb 03, 2021",0.85,0.85,MSCI All Country World Index,NYSE Arca,etf
BMOAX,Fixed Income,Multi Sectors,North America,2011-03-31,iShares U.S. Aggregate Bond Index Fund,156195967.68,10.78,2021-02-02,066923400,,,,,BBG Barc U.S. Aggregate Index,,mf
BMOIX,Fixed Income,Multi Sectors,North America,2011-03-31,iShares U.S. Aggregate Bond Index Fund,378130289.44,10.78,2021-02-02,066923509,,,,,BBG Barc U.S. Aggregate Index,,mf
BMOPX,Fixed Income,Multi Sectors,North America,2018-08-06,iShares U.S. Aggregate Bond Index Fund,7371250.9,10.78,2021-02-02,066923228,,,,,BBG Barc U.S. Aggregate Index,,mf
BRGAX,Equity,Large Cap,North America,2011-03-31,iShares Russell 1000 Large-Cap Index Fund,84879357.81,25.48,2021-02-02,066923103,,,,,Russell 1000 Index (Gross Total Return),,mf
BRGKX,Equity,Large Cap,North America,2011-03-31,iShares Russell 1000 Large-Cap Index Fund,434801925.09,25.54,2021-02-02,066923301,,,,,Russell 1000 Index (Gross Total Return),,mf
BRGNX,Equity,Large Cap,North America,2011-03-31,iShares Russell 1000 Large-Cap Index Fund,128165138.84,25.65,2021-02-02,066923202,,,,,Russell 1000 Index (Gross Total Return),,mf
BRMAX,Equity,Mid Cap,North America,2015-11-30,iShares Russell Mid-Cap Index Fund,110999470.35,13.11,2021-02-02,09258N307,,,,,Russell MidCap Index,,mf
BRMIX,Equity,Mid Cap,North America,2015-05-13,iShares Russell Mid-Cap Index Fund,227877999.21,13.16,2021-02-02,091936294,,,,,Russell MidCap Index,,mf
BRMKX,Equity,Mid Cap,North America,2015-05-13,iShares Russell Mid-Cap Index Fund,1149180745.05,13.19,2021-02-02,091936286,,,,,Russell MidCap Index,,mf
BSMAX,Equity,Mid/Small Cap,North America,2015-08-13,iShares Russell Small/Mid-Cap Index Fund,88147388.51,16.04,2021-02-02,091936245,,,,,Russell 2500 Total Return Index,,mf
BSMIX,Equity,Mid/Small Cap,North America,2015-08-13,iShares Russell Small/Mid-Cap Index Fund,101877185.04,16.07,2021-02-02,091936237,,,,,Russell 2500 Total Return Index,,mf
BSMKX,Equity,Mid/Small Cap,North America,2015-08-13,iShares Russell Small/Mid-Cap Index Fund,196145640.3,16.07,2021-02-02,091936229,,,,,Russell 2500 Total Return Index,,mf
BSPAX,Equity,Large Cap,North America,2013-04-11,iShares S&P 500 Index Fund,2574519978.06,452.73,2021-02-02,066923566,,,,,S&P 500 Index,,mf
BSPGX,Equity,Large Cap,North America,2019-07-01,iShares S&P 500 Index Fund,7731525526.62,453.02,2021-02-02,066923194,,,,,S&P 500 Index,,mf
BSPIX,Equity,Large Cap,North America,2013-04-11,iShares S&P 500 Index Fund,4057272631.91,452.9,2021-02-02,066923558,,,,,S&P 500 Index,,mf
BSPPX,Equity,Large Cap,North America,2018-08-06,iShares S&P 500 Index Fund,1402470194.11,452.34,2021-02-02,066923236,,,,,S&P 500 Index,,mf
BSPSX,Equity,Large Cap,North America,2013-04-22,iShares S&P 500 Index Fund,603255879.16,452.8,2021-02-02,066923533,,,,,S&P 500 Index,,mf
BTEK,Equity,Mid/Small Cap,Global,2020-09-29,BlackRock Future Tech ETF,12336735.32,38.552298,2021-02-03,09290C301,320000,"Feb 03, 2021",0.88,0.88,MSCI All Country World Index,NYSE Arca,etf
BTMKX,Equity,All Cap,Global,2011-03-31,iShares MSCI EAFE International Index Fund,,14.86,2021-02-03,09253F879,,,,,MSCI EAFE Index (Net Total Return),,mf
BTMPX,Equity,All Cap,Global,2018-08-06,iShares MSCI EAFE International Index Fund,146435827.35,14.63,2021-02-02,066923251,,,,,MSCI EAFE Index (Net Total Return),,mf
BYLD,Fixed Income,Multi Sectors,North America,2014-04-22,iShares Yield Optimized Bond ETF,199821351.53,25.618122,2021-02-02,46434V787,7800000,"Feb 02, 2021",0.28,0.48,Morningstar U.S. Bond Market Yield-Optimized Index,NYSE Arca,etf
CCRV,Commodity,Multi Commodity,North America,2020-09-01,iShares Commodity Curve Carry Strategy ETF,32727659.37,21.81844,2021-02-02,46431W564,1500000,"Feb 02, 2021",0.4,0.4,ICE BofA Commodity Carry Total Return Index,NYSE Arca,etf
CEMB,Fixed Income,Credit,Global,2012-04-17,iShares J.P. Morgan EM Corporate Bond ETF,278343444.36,52.517631,2021-02-02,464286251,5300000,"Feb 02, 2021",0.5,0.5,J.P. Morgan CEMBI Broad Diversified Core Index,Cboe BZX formerly known as BATS,etf
CMBS,Fixed Income,Mortgages,North America,2012-02-14,iShares CMBS ETF,503385500.0,55.014809,2021-02-02,46429B366,9150000,"Feb 02, 2021",0.25,0.25,Bloomberg Barclays U.S. CMBS (ERISA Only) Index,NYSE Arca,etf
CMDY,Commodity,Multi Commodity,Global,2018-04-03,iShares Bloomberg Roll Select Commodity Strategy ETF,51640929.27,46.946299,2021-02-02,46431W598,1100000,"Feb 02, 2021",0.28,0.29,Bloomberg Roll Select Commodity Total Return Index,NYSE Arca,etf
CMF,Fixed Income,Municipals,North America,2007-10-04,iShares California Muni Bond ETF,1714399915.54,62.913758,2021-02-02,464288356,27250000,"Feb 02, 2021",0.25,0.25,S&P California AMT-Free Municipal bond Index,NYSE Arca,etf
CNYA,Equity,Large/Mid Cap,Asia Pacific,2016-06-13,iShares MSCI China A ETF,664698979.39,45.371944,2021-02-03,46434V514,14650000,"Feb 03, 2021",0.6,0.6,MSCI China A Inclusion Index,Cboe BZX formerly known as BATS,etf
COMT,Commodity,Multi Commodity,Global,2014-10-15,iShares Commodities Select Strategy ETF,232968600.56,28.068506,2021-02-02,46431W853,8300000,"Feb 02, 2021",0.48,0.48,,NASDAQ,etf
CRBN,Equity,Large/Mid Cap,Global,2014-12-08,iShares MSCI ACWI Low Carbon Target ETF,662754032.98,152.357249,2021-02-02,46434V464,4350000,"Feb 02, 2021",0.2,0.2,MSCI ACWI Low Carbon Target Index,NYSE Arca,etf
DEFA,Equity,Large/Mid Cap,Global,2016-01-05,iShares Adaptive Currency Hedged MSCI EAFE ETF,6125237.19,30.626186,2021-02-02,46435G656,200000,"Feb 02, 2021",0.38,0.7,MSCI EAFE Adaptive Hedge to USD Index,Cboe BZX formerly known as BATS,etf
DGRO,Equity,All Cap,North America,2014-06-10,iShares Core Dividend Growth ETF,15460713012.71,45.140768,2021-02-02,46434V621,342500000,"Feb 02, 2021",0.08,0.08,Morningstar US Dividend Growth Index,NYSE Arca,etf
DIVB,Equity,All Cap,North America,2017-11-07,iShares U.S. Dividend and Buyback ETF,45574083.58,33.75858,2021-02-02,46435U861,1350000,"Feb 02, 2021",0.25,0.25,Morningstar US Dividend and Buyback Index,Cboe BZX formerly known as BATS,etf
DMXF,Equity,Large Cap,Global,2020-06-16,iShares ESG Advanced MSCI EAFE ETF,89472773.85,63.909124,2021-02-03,46436E759,1400000,"Feb 03, 2021",0.12,0.12,MSCI EAFE Choice ESG Screened Net Index in USD,NASDAQ,etf
DSI,Equity,Large/Mid Cap,North America,2006-11-14,iShares MSCI KLD 400 Social ETF,2667346908.76,73.178242,2021-02-02,464288570,36450000,"Feb 02, 2021",0.25,0.25,MSCI KLD 400 Social Index,NYSE Arca,etf
DVY,Equity,All Cap,North America,2003-11-03,iShares Select Dividend ETF,14953396139.8,98.963575,2021-02-02,464287168,151100000,"Feb 02, 2021",0.39,0.39,Dow Jones U.S. Select Dividend IndexSM,NASDAQ,etf
DVYA,Equity,All Cap,Asia Pacific,2012-02-23,iShares Asia/Pacific Dividend ETF,34954947.51,38.838831,2021-02-02,464286293,900000,"Feb 02, 2021",0.49,0.49,Dow Jones Asia/Pacific Select Dividend 50 Index,NYSE Arca,etf
DVYE,Equity,All Cap,Global,2012-02-23,iShares Emerging Markets Dividend ETF,731647125.62,37.424405,2021-02-02,,,,,,,,etf
DYNF,Equity,Large/Mid Cap,North America,2019-03-19,BlackRock U.S. Equity Factor Rotation ETF,74976236.55,32.598364,2021-02-02,09290C103,2300000,"Feb 02, 2021",0.3,0.3,MSCI Developed - US Gross TR Index,NYSE Arca,etf
EAGG,Fixed Income,Multi Sectors,North America,2018-10-18,iShares ESG Aware U.S. Aggregate Bond ETF,1063394722.12,55.968143,2021-02-02,46435U549,19000000,"Feb 02, 2021",0.1,0.11,Bloomberg Barclays MSCI US Aggregate ESG Focus Index,NYSE Arca,etf
EAOA,Multi Asset,Multi Strategy,North America,2020-06-12,iShares ESG Aware Aggressive Allocation ETF,4685228.91,31.234859,2021-02-03,46436E668,150000,"Feb 03, 2021",0.18,0.33,BlackRock ESG Aware Aggressive Allocation Index,Cboe BZX formerly known as BATS,etf
EAOK,Multi Asset,Multi Strategy,North America,2020-06-12,iShares ESG Aware Conservative Allocation ETF,4076892.47,27.179283,2021-02-03,46436E692,150000,"Feb 03, 2021",0.18,0.3,BlackRock ESG Aware Conservative Allocation Index,Cboe BZX formerly known as BATS,etf
EAOM,Multi Asset,Multi Strategy,North America,2020-06-12,iShares ESG Aware Moderate Allocation ETF,4197186.5,27.981243,2021-02-03,46436E684,150000,"Feb 03, 2021",0.18,0.31,BlackRock ESG Aware Moderate Allocation Index,Cboe BZX formerly known as BATS,etf
EAOR,Multi Asset,Multi Strategy,North America,2020-06-12,iShares ESG Aware Growth Allocation ETF,4437889.68,29.585931,2021-02-03,46436E676,150000,"Feb 03, 2021",0.18,0.32,BlackRock ESG Aware Growth Allocation Index,Cboe BZX formerly known as BATS,etf
ECH,Equity,All Cap,Latin America,2007-11-12,iShares MSCI Chile ETF,470401707.94,30.846014,2021-02-02,464286640,15250000,"Feb 02, 2021",0.59,0.59,MSCI Chile IMI 25/50 Index,Cboe BZX formerly known as BATS,etf
ECNS,Equity,Small Cap,Asia Pacific,2010-09-28,iShares MSCI China Small-Cap ETF,77534836.9,57.433213,2021-02-02,46429B200,1350000,"Feb 02, 2021",0.59,0.59,MSCI China Small Cap Index,NYSE Arca,etf
EDEN,Equity,All Cap,Europe,2012-01-25,iShares MSCI Denmark ETF,173239328.06,96.244071,2021-02-02,46429B523,1800000,"Feb 02, 2021",0.53,0.53,MSCI Denmark IMI 25/50 Index,Cboe BZX formerly known as BATS,etf
EEM,Equity,Large/Mid Cap,Global,2003-04-07,iShares MSCI Emerging Markets ETF,30288241481.02,55.442507,2021-02-02,464287234,546300000,"Feb 02, 2021",0.7,0.7,MSCI Emerging Markets Index(SM),NYSE Arca,etf
EEMA,Equity,Large/Mid Cap,Asia Pacific,2012-02-08,iShares MSCI Emerging Markets Asia ETF,859723284.87,94.475086,2021-02-02,464286426,9100000,"Feb 02, 2021",0.49,0.5,MSCI EM Asia Custom Capped Index,NASDAQ,etf
EEMS,Equity,Small Cap,Global,2011-08-16,iShares MSCI Emerging Markets Small-Cap ETF,273968153.75,54.793631,2021-02-02,464286475,5000000,"Feb 02, 2021",0.7,0.71,MSCI Emerging Markets Small Cap Index,NYSE Arca,etf
EEMV,Equity,Large/Mid Cap,Global,2011-10-18,iShares MSCI Emerging Markets Min Vol Factor ETF,4190836857.86,63.401465,2021-02-02,464286533,66100000,"Feb 02, 2021",0.7,0.7,MSCI Emerging Markets Minimum Volatility Index,Cboe BZX formerly known as BATS,etf
EFA,Equity,Large/Mid Cap,Global,2001-08-14,iShares MSCI EAFE ETF,52925423811.1,73.56884,2021-02-02,464287465,719400000,"Feb 02, 2021",0.32,0.32,MSCI EAFE Index,NYSE Arca,etf
EFAV,Equity,Large/Mid Cap,Global,2011-10-18,iShares MSCI EAFE Min Vol Factor ETF,10115609406.54,73.301517,2021-02-02,46429B689,138000000,"Feb 02, 2021",0.32,0.32,MSCI EAFE Minimum Volatility (USD) Index,Cboe BZX formerly known as BATS,etf
EFG,Equity,Large/Mid Cap,Global,2005-08-01,iShares MSCI EAFE Growth ETF,10111275640.13,101.518832,2021-02-02,464288885,99600000,"Feb 02, 2021",0.39,0.39,MSCI EAFE Growth Index,Cboe BZX formerly known as BATS,etf
EFNL,Equity,All Cap,Europe,2012-01-25,iShares MSCI Finland ETF,29751573.34,45.771651,2021-02-02,46429B515,650000,"Feb 02, 2021",0.53,0.53,MSCI Finland IMI 25/50 Index,Cboe BZX formerly known as BATS,etf
EFV,Equity,Large/Mid Cap,Global,2005-08-01,iShares MSCI EAFE Value ETF,10419219376.83,47.532935,2021-02-02,464288877,219200000,"Feb 02, 2021",0.39,0.39,MSCI EAFE Value Index,Cboe BZX formerly known as BATS,etf
EIDO,Equity,All Cap,Asia Pacific,2010-05-05,iShares MSCI Indonesia ETF,361883423.23,23.347318,2021-02-02,46429B309,15500000,"Feb 02, 2021",0.59,0.59,MSCI Indonesia IMI 25/50 Index,NYSE Arca,etf
EIRL,Equity,All Cap,Europe,2010-05-05,iShares MSCI Ireland ETF,57266998.66,49.79739,2021-02-02,46429B507,1150000,"Feb 02, 2021",0.51,0.51,MSCI All Ireland Capped Index,NYSE Arca,etf
EIS,Equity,All Cap,Europe,2008-03-26,iShares MSCI Israel ETF,165292716.46,66.117087,2021-02-02,464286632,2500000,"Feb 02, 2021",0.59,0.59,MSCI Israel Capped Investable Market Index,NYSE Arca,etf
EMB,Fixed Income,Government,Global,2007-12-17,iShares J.P. Morgan USD Emerging Markets Bond ETF,18725593944.46,113.488448,2021-02-02,464288281,165000000,"Feb 02, 2021",0.39,0.39,J.P. Morgan EMBI Global Core Index,NASDAQ,etf
EMBH,Fixed Income,Government,Global,2015-07-22,iShares Interest Rate Hedged Emerging Markets Bond ETF,5964978.88,23.859916,2021-02-03,46431W820,250000,"Feb 03, 2021",0.75,1.13,JPM Swaps-Hedged EMBIG Core Index,NYSE Arca,etf
EMGF,Equity,Large/Mid Cap,Global,2015-12-08,iShares MSCI Emerging Markets Multifactor ETF,709990047.76,52.205151,2021-02-02,46434G889,13600000,"Feb 02, 2021",0.45,0.45,MSCI Emerging Market Diversified Multiple-Factor Index,Cboe BZX formerly known as BATS,etf
EMHY,Fixed Income,High Yield,Global,2012-04-03,iShares J.P. Morgan EM High Yield Bond ETF,346645988.34,45.611314,2021-02-02,464286285,7600000,"Feb 02, 2021",0.5,0.5,J.P. Morgan USD Emerging Markets High Yield Bond Index,Cboe BZX formerly known as BATS,etf
EMIF,Equity,All Cap,Global,2009-06-16,iShares Emerging Markets Infrastructure ETF,15689540.92,24.137755,2021-02-02,464288216,650000,"Feb 02, 2021",0.6,0.6,S&P Emerging Markets Infrastructure Index,NASDAQ,etf
EMXC,Equity,All Cap,Global,2017-07-18,iShares MSCI Emerging Markets ex China ETF,383369354.59,58.979901,2021-02-02,46434G764,6500000,"Feb 02, 2021",0.25,0.34,MSCI Emerging Markets ex China Index,NASDAQ,etf
EMXF,Equity,Large/Mid Cap,Global,2020-10-06,iShares ESG Advanced MSCI EM ETF,13574363.1,45.247877,2021-02-03,46436E742,300000,"Feb 03, 2021",0.16,0.16,MSCI Emerging Markets Choice ESG Screened 5% Issuer Capped Index,NASDAQ,etf
ENOR,Equity,All Cap,Europe,2012-01-23,iShares MSCI Norway ETF,29329610.39,25.504009,2021-02-02,46429B499,1150000,"Feb 02, 2021",0.53,0.53,MSCI Norway IMI 25/50 Index,Cboe BZX formerly known as BATS,etf
ENZL,Equity,All Cap,Asia Pacific,2010-09-01,iShares MSCI New Zealand ETF,188240923.4,67.228901,2021-02-02,464289123,2800000,"Feb 02, 2021",0.51,0.51,MSCI New Zealand IMI 25/50 Index,NASDAQ,etf
EPHE,Equity,All Cap,Asia Pacific,2010-09-28,iShares MSCI Philippines ETF,149768622.63,31.201796,2021-02-02,46429B408,4800000,"Feb 02, 2021",0.59,0.59,MSCI Philippines IMI 25-50 NET Index,NYSE Arca,etf
EPOL,Equity,All Cap,Europe,2010-05-25,iShares MSCI Poland ETF,278737570.47,19.157221,2021-02-02,46429B606,14550000,"Feb 02, 2021",0.59,0.59,MSCI Poland IMI 25/50 Index,NYSE Arca,etf
EPP,Equity,Large/Mid Cap,Asia Pacific,2001-10-25,iShares MSCI Pacific ex Japan ETF,2213041735.91,48.853018,2021-02-02,464286665,45300000,"Feb 02, 2021",0.48,0.48,MSCI Pacific ex-Japan Index,NYSE Arca,etf
EPU,Equity,All Cap,Latin America,2009-06-19,iShares MSCI Peru ETF,174684224.74,35.649842,2021-02-02,464289842,4900000,"Feb 02, 2021",0.59,0.59,MSCI All Peru Capped Index,NYSE Arca,etf
ERUS,Equity,Large/Mid Cap,Europe,2010-11-09,iShares MSCI Russia ETF,459908200.32,37.543527,2021-02-02,46434G798,12250000,"Feb 02, 2021",0.59,0.59,MSCI Russia 25 / 50 Index,NYSE Arca,etf
ESGD,Equity,Large/Mid Cap,Global,2016-06-28,iShares ESG Aware MSCI EAFE ETF,4290814867.84,73.472857,2021-02-02,46435G516,58400000,"Feb 02, 2021",0.2,0.2,MSCI EAFE Extended ESG Focus Index,NASDAQ,etf
ESGE,Equity,Large/Mid Cap,Global,2016-06-28,iShares ESG Aware MSCI EM ETF,7092790553.01,45.062202,2021-02-02,46434G863,157400000,"Feb 02, 2021",0.25,0.25,MSCI Emerging Markets Extended ESG Focus Index,NASDAQ,etf
ESGU,Equity,Large/Mid Cap,North America,2016-12-01,iShares ESG Aware MSCI USA ETF,13472740158.07,88.230125,2021-02-02,46435G425,152700000,"Feb 02, 2021",0.15,0.15,MSCI USA Extended ESG Focus Index,NASDAQ,etf
ESML,Equity,All Cap,North America,2018-04-10,iShares ESG Aware MSCI USA Small-Cap ETF,584148398.12,36.509275,2021-02-02,46435U663,16000000,"Feb 02, 2021",0.17,0.17,MSCI USA Small Cap Extended ESG Focus Index,Cboe BZX formerly known as BATS,etf
EUFN,Equity,All Cap,Europe,2010-01-20,iShares MSCI Europe Financials ETF,1036139385.71,17.341245,2021-02-02,464289180,59750000,"Feb 02, 2021",0.48,0.48,MSCI Europe Financials Index,NASDAQ,etf
EUSA,Equity,Large/Mid Cap,North America,2010-05-05,iShares MSCI USA Equal Weighted ETF,298563909.29,73.719484,2021-02-02,464286681,4050000,"Feb 02, 2021",0.15,0.15,MSCI USA Equal Weighted Index,NYSE Arca,etf
EUSB,Fixed Income,Multi Sectors,North America,2020-06-23,iShares ESG Advanced Total USD Bond Market ETF,175597502.49,50.170715,2021-02-03,46436E619,3500000,"Feb 03, 2021",0.12,0.13,Bloomberg Barclays MSCI US Universal Choice ESG Screened Index,NYSE Arca,etf
EWA,Equity,Large/Mid Cap,Asia Pacific,1996-03-12,iShares MSCI Australia ETF,1721403119.21,24.245114,2021-02-02,464286103,71000000,"Feb 02, 2021",0.51,0.51,MSCI Australia Index,NYSE Arca,etf
EWC,Equity,Large/Mid Cap,North America,1996-03-12,iShares MSCI Canada ETF,2881569119.04,31.423873,2021-02-02,464286509,91700000,"Feb 02, 2021",0.51,0.51,MSCI Canada Custom Capped Index,NYSE Arca,etf
EWD,Equity,Large/Mid Cap,Europe,1996-03-12,iShares MSCI Sweden ETF,433168453.36,41.550931,2021-02-02,464286756,10425000,"Feb 02, 2021",0.51,0.51,MSCI Sweden 25/50 Index,NYSE Arca,etf
EWG,Equity,Large/Mid Cap,Europe,1996-03-12,iShares MSCI Germany ETF,2573643499.37,32.130381,2021-02-02,464286806,80100000,"Feb 02, 2021",0.51,0.51,MSCI Germany Index,NYSE Arca,etf
EWGS,Equity,Small Cap,Europe,2012-01-25,iShares MSCI Germany Small-Cap ETF,43504315.95,79.098756,2021-02-02,46429B465,550000,"Feb 02, 2021",0.59,0.59,MSCI Germany Small Cap Index,Cboe BZX formerly known as BATS,etf
EWH,Equity,Large/Mid Cap,Asia Pacific,1996-03-12,iShares MSCI Hong Kong ETF,1513074917.24,25.765431,2021-02-02,464286871,58725000,"Feb 02, 2021",0.51,0.51,MSCI Hong Kong 25/50 Index,NYSE Arca,etf
EWI,Equity,Large/Mid Cap,Europe,1996-03-12,iShares MSCI Italy ETF,162065505.38,28.811645,2021-02-02,46434G830,5625000,"Feb 02, 2021",0.51,0.51,MSCI Italy 25/50 Index,NYSE Arca,etf
EWJ,Equity,Large/Mid Cap,Asia Pacific,1996-03-12,iShares MSCI Japan ETF,13436991582.65,67.709708,2021-02-02,46434G822,198450000,"Feb 02, 2021",0.51,0.51,MSCI Japan Index,NYSE Arca,etf
EWJE,Equity,Large/Mid Cap,Asia Pacific,2019-03-05,iShares MSCI Japan Equal Weighted ETF,7852201.23,39.261006,2021-02-02,46435U382,200000,"Feb 02, 2021",0.15,0.15,MSCI Japan Equal Weighted Index (USD),NASDAQ,etf
EWJV,Equity,Large/Mid Cap,Asia Pacific,2019-03-05,iShares MSCI Japan Value ETF,15724095.74,26.206826,2021-02-02,46435U374,600000,"Feb 02, 2021",0.15,0.15,MSCI Japan Value Index (USD),NASDAQ,etf
EWK,Equity,All Cap,Europe,1996-03-12,iShares MSCI Belgium ETF,38157663.27,19.873783,2021-02-02,464286301,1920000,"Feb 02, 2021",0.51,0.51,MSCI Belgium IMI 25/50 Index,NYSE Arca,etf
