ticker,asset_class,sub_class,region,inception,name,net_assets,nav,nav_as_of,cusip,shares_outstanding,shares_outstanding_as_of,mgmt_fee,expense_ratio,benchmark_index,exchange,type
NYF,Fixed Income,Municipals,North America,2007-10-04,iShares New York Muni Bond ETF,495045245.75,58.240617,2021-01-22,464288323,8550000,"Jan 25, 2021",0.25,0.25,S&P New York AMT-Free Municipal Bond Index,NYSE Arca,etf
OEF,Equity,Large Cap,North America,2000-10-23,iShares S&P 100 ETF,7250906673.3,176.206724,2021-01-22,464287101,41150000,"Jan 25, 2021",0.2,0.2,S&P 100 Index,NYSE Arca,etf
PFF,Equity,All Cap,North America,2007-03-26,iShares Preferred and Income Securities ETF,19400405191.95,38.363467,2021-01-22,464288687,506250000,"Jan 25, 2021",0.46,0.46,ICE Exchange-Listed Preferred & Hybrid Securities Index,NASDAQ,etf
PICK,Equity,All Cap,Global,2012-01-31,iShares MSCI Global Metals & Mining Producers ETF,650645151.95,39.077787,2021-01-22,46434G848,16650000,"Jan 25, 2021",0.39,0.39,MSCI ACWI Select Metals & Mining Producers Ex Gold & Silver Investable Market Index,Cboe BZX formerly known as BATS,etf
QAT,Equity,All Cap,Middle East and Africa,2014-04-29,iShares MSCI Qatar ETF,97288865.78,19.076248,2021-01-22,46434V779,5100000,"Jan 25, 2021",0.59,0.59,MSCI All Qatar Capped Index,NASDAQ,etf
QLTA,Fixed Income,Credit,North America,2012-02-14,iShares Aaa - A Rated Corporate Bond ETF,1421576656.75,57.670453,2021-01-22,46429B291,24650000,"Jan 22, 2021",0.15,0.15,Bloomberg Barclays U.S. Corporate Aaa - A Capped Index,NYSE Arca,etf
QUAL,Equity,Large/Mid Cap,North America,2013-07-16,iShares MSCI USA Quality Factor ETF,21479504996.39,116.73644,2021-01-22,46432F339,180150000,"Jan 25, 2021",0.15,0.15,MSCI USA Sector Neutral Quality Index,Cboe BZX formerly known as BATS,etf
REET,Real Estate,Real Estate Securities,Global,2014-07-08,iShares Global REIT ETF,2477720376.82,23.985676,2021-01-22,46434V647,103300000,"Jan 25, 2021",0.14,0.14,FTSE EPRA Nareit Global REITS Net Total Return Index,NYSE Arca,etf
REM,Real Estate,Real Estate Securities,North America,2007-05-01,iShares Mortgage Real Estate ETF,1351550947.82,32.489205,2021-01-22,46435G342,41600000,"Jan 22, 2021",0.48,0.48,FTSE Nareit All Mortgage Capped Index,Cboe BZX formerly known as BATS,etf
REZ,Real Estate,Real Estate Securities,North America,2007-05-01,iShares Residential and Multisector Real Estate ETF,417303664.32,68.410437,2021-01-22,464288562,6100000,"Jan 25, 2021",0.48,0.48,FTSE Nareit All Residential Capped Index,NYSE Arca,etf
RING,Equity,All Cap,Global,2012-01-31,iShares MSCI Global Gold Miners ETF,474507672.51,29.564341,2021-01-22,46434G855,16050000,"Jan 22, 2021",0.39,0.39,MSCI ACWI Select Gold Miners Investable Market Index,NASDAQ,etf
RXI,Equity,All Cap,Global,2006-09-12,iShares Global Consumer Discretionary ETF,447817601.71,162.842764,2021-01-22,464288745,2750000,"Jan 25, 2021",0.46,0.46,S&P Global 1200 Consumer Discretionary Sector Capped Index,NYSE Arca,etf
SCJ,Equity,Small Cap,Asia Pacific,2007-12-20,iShares MSCI Japan Small-Cap ETF,63632272.28,79.54034,2021-01-22,464286582,800000,"Jan 25, 2021",0.51,0.51,MSCI Japan Small Cap Index,NYSE Arca,etf
SCZ,Equity,Small Cap,Global,2007-12-10,iShares MSCI EAFE Small-Cap ETF,11923703074.72,69.974783,2021-01-22,464288273,170400000,"Jan 25, 2021",0.4,0.4,MSCI EAFE Small Cap Index,NASDAQ,etf
SDG,Equity,Large/Mid Cap,Global,2016-04-20,iShares MSCI Global Impact ETF,350955339.29,98.860659,2021-01-22,46435G532,3600000,"Jan 25, 2021",0.49,0.49,MSCI ACWI Sustainable Impact Index,NASDAQ,etf
SGOV,Fixed Income,Government,North America,2020-05-26,iShares 0-3 Month Treasury Bond ETF,845156882.28,100.018566,2021-01-25,46436E718,8450000,"Jan 25, 2021",0.12,0.12,ICE 0-3 Month US Treasury Securities Index,NYSE Arca,etf
SHV,Fixed Income,Government,North America,2007-01-05,iShares Short Treasury Bond ETF,16641667460.79,110.517117,2021-01-25,464288679,150580000,"Jan 25, 2021",0.15,0.15,ICE Short US Treasury Securities Index,NASDAQ,etf
SHY,Fixed Income,Government,North America,2002-07-22,iShares 1-3 Year Treasury Bond ETF,19001126151.33,86.368755,2021-01-22,464287457,220000000,"Jan 22, 2021",0.15,0.15,ICE U.S. Treasury 1-3 Year Bond Index,NASDAQ,etf
SHYG,Fixed Income,High Yield,North America,2013-10-15,iShares 0-5 Year High Yield Corporate Bond ETF,4974782765.19,45.473334,2021-01-22,46434V407,109400000,"Jan 25, 2021",0.3,0.3,Markit iBoxx USD Liquid High Yield 0-5 Index,NYSE Arca,etf
SIZE,Equity,Large/Mid Cap,North America,2013-04-16,iShares MSCI USA Size Factor ETF,956535388.75,114.555136,2021-01-22,46432F370,8000000,"Jan 25, 2021",0.15,0.15,MSCI USA Low Size Index,NYSE Arca,etf
SLQD,Fixed Income,Credit,North America,2013-10-15,iShares 0-5 Year Investment Grade Corporate Bond ETF,2169697461.99,52.093577,2021-01-22,46434V100,41900000,"Jan 25, 2021",0.06,0.06,Markit iBoxx USD Liquid Investment Grade 0-5 Index,NASDAQ,etf
SLV,Commodity,Precious Metals,Global,2006-04-21,iShares Silver Trust,14769554040.52,23.816099,2021-01-25,46428Q109,620150000,"Jan 25, 2021",,,,NYSE Arca,etf
SLVP,Equity,All Cap,Global,2012-01-31,iShares MSCI Global Silver and Metals Miners ETF,240491355.24,15.718389,2021-01-22,464286327,15300000,"Jan 25, 2021",0.39,0.39,MSCI ACWI Select Silver Miners Investable Market Index,Cboe BZX formerly known as BATS,etf
SMIN,Equity,Small Cap,Asia Pacific,2012-02-08,iShares MSCI India Small-Cap ETF,238784282.54,43.81363,2021-01-22,46429B614,5450000,"Jan 22, 2021",0.74,0.81,MSCI India Small Cap Index,Cboe BZX formerly known as BATS,etf
SMLF,Equity,Small Cap,North America,2015-04-28,iShares MSCI USA Small-Cap Multifactor ETF,798327395.86,49.895462,2021-01-22,46434V290,16000000,"Jan 25, 2021",0.3,0.3,MSCI USA Small Cap Diversified Multiple-Factor Index,NYSE Arca,etf
SMMD,Equity,Mid/Small Cap,North America,2017-07-06,iShares Russell 2500 ETF,216258619.8,60.917921,2021-01-22,46435G268,3600000,"Jan 25, 2021",0.15,0.23,Russell 2500 Index,Cboe BZX formerly known as BATS,etf
SMMV,Equity,Small Cap,North America,2016-09-07,iShares MSCI USA Small-Cap Min Vol Factor ETF,908131348.33,35.612994,2021-01-22,46435G433,25500000,"Jan 25, 2021",0.2,0.2,MSCI USA Small Cap Minimum Volatility (USD) Index,Cboe BZX formerly known as BATS,etf
SOXX,Equity,All Cap,North America,2001-07-10,iShares PHLX Semiconductor ETF,5485501421.35,417.148397,2021-01-22,464287523,13100000,"Jan 25, 2021",0.46,0.46,PHLX SOX Semiconductor Sector Index,NASDAQ,etf
STIP,Fixed Income,Inflation,North America,2010-12-01,iShares 0-5 Year TIPS Bond ETF,3311505164.2,104.960544,2021-01-22,46429B747,31550000,"Jan 22, 2021",0.05,0.05,Bloomberg Barclays U.S. Treasury Inflation-Protected Securities (TIPS) 0-5 Years Index (Series-L),NYSE Arca,etf
STLC,Equity,Large/Mid Cap,North America,2020-04-14,iShares Factors US Blend Style ETF,5534332.94,36.895553,2021-01-22,46436E791,150000,"Jan 25, 2021",0.25,0.25,Russell US Large Cap Factors Blend Style Index,Cboe BZX formerly known as BATS,etf
STLG,Equity,Large/Mid Cap,North America,2020-01-14,iShares Factors US Growth Style ETF,4994915.62,33.299437,2021-01-25,46436E403,150000,"Jan 25, 2021",0.25,0.25,Russell US Large Cap Factors Growth Style Index,Cboe BZX formerly known as BATS,etf
STLV,Equity,Large/Mid Cap,North America,2020-01-14,iShares Factors US Value Style ETF,6375705.87,25.502823,2021-01-25,46436E304,250000,"Jan 25, 2021",0.25,0.25,Russell US Large Cap Factors Value Style Index,Cboe BZX formerly known as BATS,etf
STMB,Equity,Mid Cap,North America,2020-04-14,iShares Factors US Mid Blend Style ETF,5810613.84,38.737426,2021-01-22,46436E783,150000,"Jan 25, 2021",0.3,0.3,Russell US Mid Cap Factors Blend Style Index,Cboe BZX formerly known as BATS,etf
STSB,Equity,Small Cap,North America,2020-04-14,iShares Factors US Small Blend Style ETF,6651885.75,44.345905,2021-01-22,46436E775,150000,"Jan 25, 2021",0.35,0.35,Russell US Small Cap Factors Blend Style Index,Cboe BZX formerly known as BATS,etf
SUB,Fixed Income,Municipals,North America,2008-11-05,iShares Short-Term National Muni Bond ETF,4293207575.59,107.734193,2021-01-22,464288158,39850000,"Jan 25, 2021",0.07,0.07,S&P Short Term National AMT-Free Municipal Bond Index,NYSE Arca,etf
SUSA,Equity,Large/Mid Cap,North America,2005-01-24,iShares MSCI USA ESG Select ETF,2460587900.82,84.847859,2021-01-22,464288802,29000000,"Jan 25, 2021",0.25,0.25,MSCI USA Extended ESG Select Index,NYSE Arca,etf
SUSB,Fixed Income,Credit,North America,2017-07-11,iShares ESG Aware 1-5 Year USD Corporate Bond ETF,574828062.18,26.128548,2021-01-22,46435G243,22300000,"Jan 25, 2021",0.12,0.12,Bloomberg Barclays MSCI US Corporate 1-5 Year ESG Focus Index,NASDAQ,etf
SUSC,Fixed Income,Credit,North America,2017-07-11,iShares ESG Aware USD Corporate Bond ETF,767404391.22,27.956444,2021-01-22,46435G193,27650000,"Jan 25, 2021",0.18,0.18,Bloomberg Barclays MSCI US Corporate ESG Focus Index,NASDAQ,etf
SUSL,Equity,Large/Mid Cap,North America,2019-05-07,iShares ESG MSCI USA Leaders ETF,3017040606.28,66.308585,2021-01-22,46435U218,45500000,"Jan 25, 2021",0.1,0.1,MSCI USA Extended ESG Leaders Index,NASDAQ,etf
SVAL,Equity,Small Cap,North America,2020-10-27,iShares US Small Cap Value Factor ETF,45686953.71,26.874679,2021-01-22,46436E536,1700000,"Jan 25, 2021",0.3,0.3,Russell 2000 Focused Value Select Index,Cboe BZX formerly known as BATS,etf
TECB,Equity,All Cap,North America,2020-01-08,U.S. Tech Breakthrough Multisector ETF,359459710.17,36.309062,2021-01-25,46436E502,9900000,"Jan 25, 2021",0.4,0.4,NYSE FactSet U.S. Tech Breakthrough Index,NYSE Arca,etf
TFLO,Fixed Income,Government,North America,2014-02-03,iShares Treasury Floating Rate Bond ETF,377128638.42,50.283818,2021-01-22,46434V860,7500000,"Jan 25, 2021",0.15,0.15,Bloomberg Barclays US Treasury Floating Rate Bond Index,NYSE Arca,etf
THD,Equity,All Cap,Asia Pacific,2008-03-26,iShares MSCI Thailand ETF,469210798.68,79.527254,2021-01-22,464286624,5900000,"Jan 22, 2021",0.59,0.59,MSCI Thailand IMI 25/50 Index,NYSE Arca,etf
TIP,Fixed Income,Inflation,North America,2003-12-04,iShares TIPS Bond ETF,27271935110.51,127.737401,2021-01-22,464287176,213500000,"Jan 22, 2021",0.19,0.19,Bloomberg Barclays U.S. Treasury Inflation Protected Securities (TIPS) Index (Series-L),NYSE Arca,etf
TLH,Fixed Income,Government,North America,2007-01-05,iShares 10-20 Year Treasury Bond ETF,1435692797.12,154.37557,2021-01-22,464288653,9300000,"Jan 22, 2021",0.15,0.15,ICE U.S. Treasury 10-20 Year Bond Index,NYSE Arca,etf
TLT,Fixed Income,Government,North America,2002-07-22,iShares 20+ Year Treasury Bond ETF,17258674037.8,151.791328,2021-01-22,464287432,113700000,"Jan 22, 2021",0.15,0.15,ICE U.S. Treasury 20+ Year Bond Index,NASDAQ,etf
TOK,Equity,Large/Mid Cap,Global,2007-12-10,iShares MSCI Kokusai ETF,180510780.15,85.957514,2021-01-22,464288265,2100000,"Jan 25, 2021",0.25,0.25,MSCI Kokusai Index,NYSE Arca,etf
TUR,Equity,All Cap,Europe,2008-03-26,iShares MSCI Turkey ETF,311646404.55,27.95035,2021-01-22,464286715,11100000,"Jan 25, 2021",0.59,0.59,MSCI Turkey IMI 25/50 Index,NASDAQ,etf
UAE,Equity,All Cap,Middle East and Africa,2014-04-29,iShares MSCI UAE ETF,15126941.13,13.153862,2021-01-22,46434V761,1150000,"Jan 25, 2021",0.59,0.59,MSCI All UAE Capped Index,NASDAQ,etf
URTH,Equity,Large/Mid Cap,Global,2012-01-10,iShares MSCI World ETF,1131094535.37,115.41781,2021-01-22,464286392,9800000,"Jan 22, 2021",0.24,0.24,MSCI World Index,NYSE Arca,etf
USHY,Fixed Income,High Yield,North America,2017-10-25,iShares Broad USD High Yield Corporate Bond ETF,7553786990.73,41.221211,2021-01-22,46435U853,183250000,"Jan 25, 2021",0.22,0.22,ICE BofA US High Yield Constrained Index,Cboe BZX formerly known as BATS,etf
USIG,Fixed Income,Credit,North America,2007-01-05,iShares Broad USD Investment Grade Corporate Bond ETF,5925068577.22,61.272684,2021-01-22,464288620,96700000,"Jan 22, 2021",0.06,0.06,ICE BofA US Corporate Index,NASDAQ,etf
USMV,Equity,Large/Mid Cap,North America,2011-10-18,iShares MSCI USA Min Vol Factor ETF,30990861180.98,67.724784,2021-01-22,46429B697,457600000,"Jan 22, 2021",0.15,0.15,MSCI USA Minimum Volatility (USD) Index,Cboe BZX formerly known as BATS,etf
USRT,Real Estate,Real Estate Securities,North America,2007-05-01,iShares Core U.S. REIT ETF,1632100491.89,48.865284,2021-01-22,464288521,33400000,"Jan 22, 2021",0.08,0.08,FTSE Nareit Equity REITS Index,NYSE Arca,etf
USXF,Equity,Large Cap,North America,2020-06-16,iShares ESG Advanced MSCI USA ETF,93409379.06,32.210131,2021-01-25,46436E767,2900000,"Jan 25, 2021",0.1,0.1,MSCI USA Choice ESG Screened Index in USD,NASDAQ,etf
VEGI,Equity,All Cap,Global,2012-01-31,iShares MSCI Global Agriculture Producers ETF,42010634.4,36.530986,2021-01-22,464286350,1150000,"Jan 25, 2021",0.39,0.39,MSCI ACWI Select Agriculture Producers Investable Market Index,NYSE Arca,etf
VLUE,Equity,Large/Mid Cap,North America,2013-04-16,iShares MSCI USA Value Factor ETF,10854455841.57,93.051486,2021-01-22,46432F388,116900000,"Jan 25, 2021",0.15,0.15,MSCI USA Enhanced Value Index,Cboe BZX formerly known as BATS,etf
WFBIX,Fixed Income,Multi Sectors,North America,2010-02-02,iShares U.S. Aggregate Bond Index Fund,2186689144.26,10.81,2021-01-22,066922105,,,,,BBG Barc U.S. Aggregate Index,,mf
WFSPX,Equity,Large Cap,North America,1993-07-31,iShares S&P 500 Index Fund,10593794519.99,454.72,2021-01-22,066922204,,,,,S&P 500 Index,,mf
WOOD,Equity,All Cap,Global,2008-06-24,iShares Global Timber & Forestry ETF,317995562.45,82.811344,2021-01-22,464288174,3840000,"Jan 25, 2021",0.46,0.46,S&P Global Timber & Forestry Index,NASDAQ,etf
WPS,Real Estate,Real Estate Securities,Global,2007-07-30,iShares International Developed Property ETF,81262479.61,35.331513,2021-01-22,464288422,2300000,"Jan 22, 2021",0.48,0.48,S&P Developed ex-U.S. Property Index,NYSE Arca,etf
XJH,Equity,Mid Cap,North America,2020-09-22,iShares ESG Screened S&P Mid-Cap ETF,13525542.87,33.813857,2021-01-25,46436E551,400000,"Jan 25, 2021",0.12,0.12,S&P MidCap 400 Sustainability Screened Index,Cboe BZX formerly known as BATS,etf
XJR,Equity,Small Cap,North America,2020-09-22,iShares ESG Screened S&P Small-Cap ETF,7288462.63,36.442313,2021-01-25,46436E544,200000,"Jan 25, 2021",0.12,0.12,S&P SmallCap 600 Sustainability Screened Index,Cboe BZX formerly known as BATS,etf
XT,Equity,Large Cap,Global,2015-03-19,iShares Exponential Technologies ETF,3304732933.91,60.415593,2021-01-22,46434V381,54750000,"Jan 25, 2021",0.47,0.47,Morningstar Exponential Technologies Index,NASDAQ,etf
XVV,Equity,Large Cap,North America,2020-09-22,iShares ESG Screened S&P 500 ETF,7334692.67,29.338771,2021-01-25,46436E569,250000,"Jan 25, 2021",0.08,0.08,S&P 500 Sustainability Screened Index,Cboe BZX formerly known as BATS,etf
