ticker,asset_class,sub_class,region,inception,name,net_assets,nav,nav_as_of,cusip,shares_outstanding,shares_outstanding_as_of,mgmt_fee,expense_ratio,benchmark_index,exchange,type
EWJ,Equity,Large/Mid Cap,Asia Pacific,1996-03-12,iShares MSCI Japan ETF,13521377243.43,67.674561,2021-01-07,46434G822,199800000,"Jan 07, 2021",0.51,0.51,MSCI Japan Index,NYSE Arca,etf
EWJE,Equity,Large/Mid Cap,Asia Pacific,2019-03-05,iShares MSCI Japan Equal Weighted ETF,7740357.04,38.701785,2021-01-07,46435U382,200000,"Jan 08, 2021",0.15,0.15,MSCI Japan Equal Weighted Index (USD),NASDAQ,etf
EWJV,Equity,Large/Mid Cap,Asia Pacific,2019-03-05,iShares MSCI Japan Value ETF,15686107.14,26.143512,2021-01-07,46435U374,600000,"Jan 08, 2021",0.15,0.15,MSCI Japan Value Index (USD),NASDAQ,etf
EWK,Equity,All Cap,Europe,1996-03-12,iShares MSCI Belgium ETF,38808258.11,20.212634,2021-01-07,464286301,1920000,"Jan 08, 2021",0.51,0.51,MSCI Belgium IMI 25/50 Index,NYSE Arca,etf
EWL,Equity,Large/Mid Cap,Europe,1996-03-12,iShares MSCI Switzerland ETF,1782685410.66,45.27455,2021-01-07,464286749,39375000,"Jan 08, 2021",0.51,0.51,MSCI Switzerland 25/50 Index,NYSE Arca,etf
EWM,Equity,Large/Mid Cap,Asia Pacific,1996-03-12,iShares MSCI Malaysia ETF,399133215.85,28.009348,2021-01-07,46434G814,14400000,"Jan 08, 2021",0.51,0.51,MSCI Malaysia Index,NYSE Arca,etf
EWN,Equity,All Cap,Europe,1996-03-12,iShares MSCI Netherlands ETF,270236100.84,42.224391,2021-01-07,464286814,6400000,"Jan 07, 2021",0.51,0.51,MSCI Netherlands IMI 25/50 Index,NYSE Arca,etf
EWO,Equity,All Cap,Europe,1996-03-12,iShares MSCI Austria ETF,58279617.22,21.192588,2021-01-07,464286202,2750000,"Jan 07, 2021",0.51,0.51,MSCI Austria IMI 25/50 Index,NYSE Arca,etf
EWP,Equity,Large/Mid Cap,Europe,1996-03-12,iShares MSCI Spain ETF,560030802.88,28.391929,2021-01-07,464286764,19725000,"Jan 07, 2021",0.51,0.51,MSCI Spain 25/50 Index,NYSE Arca,etf
EWQ,Equity,Large/Mid Cap,Europe,1996-03-12,iShares MSCI France ETF,828279324.64,34.226418,2021-01-07,464286707,24200000,"Jan 08, 2021",0.51,0.51,MSCI France Index,NYSE Arca,etf
EWS,Equity,Large/Mid Cap,Asia Pacific,1996-03-12,iShares MSCI Singapore ETF,667046207.66,21.978458,2021-01-07,46434G780,30350000,"Jan 08, 2021",0.51,0.51,MSCI Singapore 25/50 Index,NYSE Arca,etf
EWT,Equity,Large/Mid Cap,Asia Pacific,2000-06-20,iShares MSCI Taiwan ETF,5804863176.48,55.284411,2021-01-07,46434G772,105000000,"Jan 07, 2021",0.59,0.59,MSCI Taiwan 25/50 Index,NYSE Arca,etf
EWU,Equity,Large/Mid Cap,Europe,1996-03-12,iShares MSCI United Kingdom ETF,3012509556.91,30.992897,2021-01-07,46435G334,97200000,"Jan 07, 2021",0.51,0.51,MSCI United Kingdom Index,NYSE Arca,etf
EWUS,Equity,Small Cap,Europe,2012-01-25,iShares MSCI United Kingdom Small-Cap ETF,68742518.78,42.964074,2021-01-07,46429B416,1600000,"Jan 08, 2021",0.59,0.59,MSCI United Kingdom Small Cap Index,Cboe BZX formerly known as BATS,etf
EWW,Equity,All Cap,Latin America,1996-03-12,iShares MSCI Mexico ETF,1444818320.99,44.731217,2021-01-07,464286822,32300000,"Jan 07, 2021",0.51,0.51,MSCI Mexico IMI 25/50 Index,NYSE Arca,etf
EWY,Equity,Large/Mid Cap,Asia Pacific,2000-05-09,iShares MSCI South Korea ETF,7710270280.14,91.353913,2021-01-07,464286772,84400000,"Jan 08, 2021",0.59,0.59,MSCI Korea 25/50 Index,NYSE Arca,etf
EWZ,Equity,Large/Mid Cap,Latin America,2000-07-10,iShares MSCI Brazil ETF,6568710978.8,37.237591,2021-01-07,464286400,176400000,"Jan 08, 2021",0.59,0.59,MSCI Brazil 25/50 Index,NYSE Arca,etf
EWZS,Equity,Small Cap,Latin America,2010-09-28,iShares MSCI Brazil Small-Cap ETF,109898161.34,15.699737,2021-01-07,464289131,7000000,"Jan 07, 2021",0.59,0.59,MSCI Brazil Small Cap Index,NASDAQ,etf
EXI,Equity,All Cap,Global,2006-09-12,iShares Global Industrials ETF,413614595.66,108.845946,2021-01-07,464288729,3800000,"Jan 08, 2021",0.46,0.46,S&P Global 1200 Industrials Sector Index(TM),NYSE Arca,etf
EZA,Equity,Large/Mid Cap,Middle East and Africa,2003-02-03,iShares MSCI South Africa ETF,428581981.01,42.858198,2021-01-07,464286780,10000000,"Jan 08, 2021",0.59,0.59,MSCI South Africa 25/50 Index,NYSE Arca,etf
EZU,Equity,Large/Mid Cap,Europe,2000-07-25,iShares MSCI Eurozone ETF,5211359658.27,45.395119,2021-01-07,464286608,114800000,"Jan 07, 2021",0.51,0.51,MSCI EMU Index,Cboe BZX formerly known as BATS,etf
FALN,Fixed Income,High Yield,North America,2016-06-14,iShares Fallen Angels USD Bond ETF,410974490.35,29.250853,2021-01-07,46435G474,14550000,"Jan 08, 2021",0.25,0.25,Bloomberg Barclays US High Yield Fallen Angel 3% Capped Index,NASDAQ,etf
FIBR,Fixed Income,Multi Sectors,North America,2015-02-24,iShares U.S. Fixed Income Balanced Risk Factor ETF,122465512.05,102.054593,2021-01-08,46435U796,1200000,"Jan 08, 2021",0.25,0.25,Bloomberg Barclays U.S. Fixed Income Balanced Risk Index,Cboe BZX formerly known as BATS,etf
FILL,Equity,All Cap,Global,2012-01-31,iShares MSCI Global Energy Producers ETF,56483897.08,14.120974,2021-01-07,464286343,4050000,"Jan 08, 2021",0.39,0.39,MSCI ACWI Select Energy Producers Investable Market Index,NYSE Arca,etf
FLOT,Fixed Income,Credit,North America,2011-06-14,iShares Floating Rate Bond ETF,5378702441.93,50.742476,2021-01-07,46429B655,106000000,"Jan 07, 2021",0.2,0.2,Bloomberg Barclays US Floating Rate Note < 5 Years Index,Cboe BZX formerly known as BATS,etf
FM,Equity,All Cap,Global,2012-09-12,iShares MSCI Frontier 100 ETF,424517878.13,29.176486,2021-01-07,464286145,14550000,"Jan 07, 2021",0.79,0.79,MSCI Frontier Markets 100 Index,NYSE Arca,etf
FOVL,Equity,Large/Mid Cap,North America,2019-03-19,iShares Focused Value Factor ETF,27586670.88,45.977785,2021-01-07,46435U333,600000,"Jan 08, 2021",0.25,0.25,Focused Value Select Index,NYSE Arca,etf
FXI,Equity,Large Cap,Asia Pacific,2004-10-05,iShares China Large-Cap ETF,4165377431.49,47.387684,2021-01-07,464287184,87900000,"Jan 07, 2021",0.74,0.74,FTSE China 50 Index,NYSE Arca,etf
GBF,Fixed Income,Multi Sectors,North America,2007-01-05,iShares Government/Credit Bond ETF,173918276.1,124.22734,2021-01-07,464288596,1400000,"Jan 07, 2021",0.2,0.2,Bloomberg Barclays U.S. Government/Credit Bond Index,NYSE Arca,etf
GHYG,Fixed Income,High Yield,Global,2012-04-03,iShares US & Intl High Yield Corp Bond ETF,187213953.43,50.598366,2021-01-07,464286178,3700000,"Jan 07, 2021",0.4,0.4,Markit iBoxx Global Developed Markets High Yield Index,Cboe BZX formerly known as BATS,etf
GNMA,Fixed Income,Mortgages,North America,2012-02-14,iShares GNMA Bond ETF,515103356.45,51.000332,2021-01-07,46429B333,10100000,"Jan 07, 2021",0.15,0.17,Bloomberg Barclays U.S. GNMA Bond Index,NASDAQ,etf
GOVT,Fixed Income,Government,North America,2012-02-14,iShares U.S. Treasury Bond ETF,14426038943.25,27.096241,2021-01-07,46429B267,532400000,"Jan 07, 2021",0.15,0.15,ICE U.S. Treasury Core Bond Index,Cboe BZX formerly known as BATS,etf
GOVZ,Fixed Income,Government,North America,2020-09-22,iShares 25+ Year Treasury STRIPS Bond ETF,15608548.03,22.297926,2021-01-08,46436E577,700000,"Jan 08, 2021",0.15,0.15,ICE BofA Long US Treasury Principal STRIPS Index,Cboe BZX formerly known as BATS,etf
GSG,Commodity,Multi Commodity,Global,2006-07-10,iShares S&P GSCI Commodity-Indexed Trust,849561632.58,12.717989,2021-01-07,46428R107,66800000,"Jan 08, 2021",,,S&P GSCI(R) Total Return Index,NYSE Arca,etf
GVI,Fixed Income,Multi Sectors,North America,2007-01-05,iShares Intermediate Government/Credit Bond ETF,2346866543.24,117.0507,2021-01-07,464288612,20050000,"Jan 07, 2021",0.2,0.2,Bloomberg Barclays U.S. Intermediate Government/Credit Bond Index,Cboe BZX formerly known as BATS,etf
HAWX,Equity,Large/Mid Cap,Global,2015-06-29,iShares Currency Hedged MSCI ACWI ex U.S. ETF,91129545.33,30.376515,2021-01-07,46435G847,3000000,"Jan 08, 2021",0.38,0.7,MSCI ACWI ex USA 100% Hedged to USD Index,NYSE Arca,etf
HDV,Equity,All Cap,North America,2011-03-29,iShares Core High Dividend ETF,5905935117.41,89.14619,2021-01-07,46429B663,66200000,"Jan 08, 2021",0.08,0.08,Morningstar Dividend Yield Focus Index,NYSE Arca,etf
HEEM,Equity,Large/Mid Cap,Global,2014-09-23,iShares Currency Hedged MSCI Emerging Markets ETF,202525832.4,31.893832,2021-01-07,46434G509,6350000,"Jan 08, 2021",0.78,1.48,MSCI Emerging Markets 100% USD Hedged Index,Cboe BZX formerly known as BATS,etf
HEFA,Equity,Large/Mid Cap,Global,2014-01-31,iShares Currency Hedged MSCI EAFE ETF,2404204480.83,31.34556,2021-01-07,46434V803,76950000,"Jan 08, 2021",0.38,0.7,MSCI EAFE 100% Hedged to USD Index,Cboe BZX formerly known as BATS,etf
HEWC,Equity,Large/Mid Cap,North America,2015-06-29,iShares Currency Hedged MSCI Canada ETF,12626661.02,28.059247,2021-01-07,46435G706,450000,"Jan 08, 2021",0.62,1.13,MSCI Canada 100% Hedged to USD Index,NYSE Arca,etf
HEWG,Equity,Large/Mid Cap,Europe,2014-01-31,iShares Currency Hedged MSCI Germany ETF,63038835.76,30.018493,2021-01-07,46434V704,2100000,"Jan 08, 2021",0.53,1.04,MSCI Germany 100% Hedged to USD Index,NASDAQ,etf
HEWJ,Equity,Large/Mid Cap,Asia Pacific,2014-01-31,iShares Currency Hedged MSCI Japan ETF,332138992.89,36.299343,2021-01-07,46434V886,9150000,"Jan 08, 2021",0.53,1.04,MSCI Japan 100% Hedged to USD Index,NYSE Arca,etf
HEWU,Equity,Large/Mid Cap,Europe,2015-06-29,iShares Currency Hedged MSCI United Kingdom ETF,7651549.4,21.86157,2021-01-07,46435G862,350000,"Jan 07, 2021",0.62,1.13,MSCI United Kingdom 100% Hedged to USD Index,NYSE Arca,etf
HEWW,Equity,Large/Mid Cap,Latin America,2015-06-29,iShares Currency Hedged MSCI Mexico ETF,840882.77,16.817655,2021-01-07,46435G805,50000,"Jan 08, 2021",0.62,1.13,MSCI Mexico IMI 25/50 100% Hedged to USD Index,NYSE Arca,etf
HEZU,Equity,Large/Mid Cap,Europe,2014-07-09,iShares Currency Hedged MSCI Eurozone ETF,514496211.47,32.156013,2021-01-07,46434V639,16000000,"Jan 08, 2021",0.62,1.13,MSCI EMU 100% USD Hedged Index,NYSE Arca,etf
HJPX,Equity,Large/Mid Cap,Asia Pacific,2015-09-29,iShares Currency Hedged JPX-Nikkei 400 ETF,3302239.56,33.022396,2021-01-07,46435G722,100000,"Jan 08, 2021",0.59,1.07,JPX-Nikkei 400 Net Total Return USD Hedged Index,NYSE Arca,etf
HSCZ,Equity,Small Cap,Global,2015-06-29,iShares Currency Hedged MSCI EAFE Small-Cap ETF,62670252.71,32.984344,2021-01-07,46435G839,1900000,"Jan 08, 2021",0.43,0.83,MSCI EAFE Small-Cap 100% Hedged to USD Index,NYSE Arca,etf
HYBB,Fixed Income,High Yield,North America,2020-10-06,iShares BB Rated Corporate Bond ETF,90812188.63,51.892679,2021-01-07,46435U473,1850000,"Jan 08, 2021",0.25,0.25,ICE BofA BB US High Yield Constrained Index,NYSE Arca,etf
HYDB,Fixed Income,High Yield,North America,2017-07-11,iShares High Yield Bond Factor ETF,45992405.38,51.102673,2021-01-07,46435G250,900000,"Jan 08, 2021",0.35,0.35,BlackRock High Yield Defensive Bond Index,Cboe BZX formerly known as BATS,etf
HYG,Fixed Income,High Yield,North America,2007-04-04,iShares iBoxx $ High Yield Corporate Bond ETF,24678239454.82,87.048464,2021-01-07,464288513,283500000,"Jan 07, 2021",0.49,0.49,Markit iBoxx USD Liquid High Yield Index,NYSE Arca,etf
HYGH,Fixed Income,High Yield,North America,2014-05-27,iShares Interest Rate Hedged High Yield Bond ETF,56267896.43,86.565995,2021-01-07,46431W606,650000,"Jan 08, 2021",0.65,1.13,Markit iBoxx USD Liquid High Yield Interest Rate Hedged Swaps Index,NYSE Arca,etf
HYXF,Fixed Income,High Yield,North America,2016-06-14,iShares ESG Advanced High Yield Corporate Bond ETF,78572296.15,52.381531,2021-01-07,46435G441,1500000,"Jan 08, 2021",0.35,0.35,Bloomberg Barclays MSCI US High Yield Choice ESG Screened Index,NASDAQ,etf
HYXU,Fixed Income,High Yield,Global,2012-04-03,iShares International High Yield Bond ETF,50910766.62,56.567518,2021-01-07,464286210,900000,"Jan 07, 2021",0.4,0.4,Markit iBoxx Global Developed Markets ex-US High Yield Index,Cboe BZX formerly known as BATS,etf
IAGG,Fixed Income,Multi Sectors,Global,2015-11-10,iShares Core International Aggregate Bond ETF,3361347943.37,55.92925,2021-01-08,46435G672,60100000,"Jan 08, 2021",0.08,0.08,Bloomberg Barclays Global Aggregate ex USD 10% Issuer Capped (Hedged) Index,Cboe BZX formerly known as BATS,etf
IAI,Equity,All Cap,North America,2006-05-01,iShares U.S. Broker-Dealers & Securities Exchanges ETF,183882844.15,85.526904,2021-01-07,464288794,2150000,"Jan 07, 2021",0.42,0.42,Dow Jones U.S. Select Investment Services Index,NYSE Arca,etf
IAK,Equity,All Cap,North America,2006-05-01,iShares U.S. Insurance ETF,65740630.99,69.200664,2021-01-07,464288786,950000,"Jan 07, 2021",0.42,0.42,Dow Jones U.S. Select Insurance Index,NYSE Arca,etf
IAT,Equity,All Cap,North America,2006-05-01,iShares U.S. Regional Banks ETF,323231490.11,49.727922,2021-01-07,464288778,6500000,"Jan 07, 2021",0.42,0.42,Dow Jones U.S. Select Regional Banks Index,NYSE Arca,etf
IAU,Commodity,Precious Metals,Global,2005-01-21,iShares Gold Trust,31685782253.57,17.7586,2021-01-08,464285105,1784250000,"Jan 08, 2021",,,,NYSE Arca,etf
IAUF,Commodity,Precious Metals,Global,2018-06-06,iShares Gold Strategy ETF,23611580.95,59.028952,2021-01-07,46431W614,400000,"Jan 08, 2021",0.25,0.32,Bloomberg Composite Gold Index,Cboe BZX formerly known as BATS,etf
IBB,Equity,All Cap,North America,2001-02-05,iShares Nasdaq Biotechnology ETF,10734533046.9,157.167395,2021-01-07,464287556,68300000,"Jan 07, 2021",0.46,0.46,Nasdaq Biotechnology Index(R),NASDAQ,etf
IBCE,Fixed Income,Credit,North America,2013-04-17,iShares® iBonds® Mar 2023 Term Corporate ex-Financials ETF,27472351.43,24.974865,2021-01-07,46432FAN7,1100000,"Jan 07, 2021",0.1,0.1,Bloomberg Barclays 2023 Maturity High Quality Corporate Index,NYSE Arca,etf
IBDD,Fixed Income,Credit,North America,2013-07-09,iShares® iBonds® Mar 2023 Term Corporate ETF,72190636.41,27.24175,2021-01-07,46432FAZ0,2650000,"Jan 08, 2021",0.1,0.1,Bloomberg Barclays 2023 Maturity Corporate Index,NYSE Arca,etf
IBDM,Fixed Income,Credit,North America,2015-03-10,iShares® iBonds® Dec 2021 Term Corporate ETF,1568263278.41,24.893068,2021-01-08,46434VBK5,63000000,"Jan 08, 2021",0.1,0.1,Bloomberg Barclays December 2021 Maturity Corporate Index,NYSE Arca,etf
IBDN,Fixed Income,Credit,North America,2015-03-10,iShares® iBonds® Dec 2022 Term Corporate ETF,1436696080.44,25.51858,2021-01-08,46434VBA7,56300000,"Jan 08, 2021",0.1,0.1,Bloomberg Barclays December 2022 Maturity Corporate Index,NYSE Arca,etf
IBDO,Fixed Income,Credit,North America,2015-03-11,iShares® iBonds® Dec 2023 Term Corporate ETF,1400839980.84,26.208419,2021-01-08,46434VAX8,53450000,"Jan 08, 2021",0.1,0.1,Bloomberg Barclays December 2023 Maturity Corporate Index,NYSE Arca,etf
IBDP,Fixed Income,Credit,North America,2015-03-11,iShares® iBonds® Dec 2024 Term Corporate ETF,1157066632.05,26.507827,2021-01-08,46434VBG4,43650000,"Jan 08, 2021",0.1,0.1,Bloomberg Barclays December 2024 Maturity Corporate Index,NYSE Arca,etf
IBDQ,Fixed Income,Credit,North America,2015-03-11,iShares® iBonds® Dec 2025 Term Corporate ETF,952494583.07,27.175309,2021-01-08,46434VBD1,35050000,"Jan 08, 2021",0.1,0.1,Bloomberg Barclays December 2025 Maturity Corporate Index,NYSE Arca,etf
IBDR,Fixed Income,Credit,North America,2016-09-13,iShares® iBonds® Dec 2026 Term Corporate ETF,593822834.93,26.930741,2021-01-07,46435GAA0,22150000,"Jan 08, 2021",0.1,0.1,Bloomberg Barclays December 2026 Maturity Corporate Index,NYSE Arca,etf
IBDS,Fixed Income,Credit,North America,2017-09-12,iShares® iBonds® Dec 2027 Term Corporate ETF,412647740.93,27.418455,2021-01-07,46435UAA9,15050000,"Jan 08, 2021",0.1,0.1,Bloomberg Barclays December 2027 Maturity Corporate Index,NYSE Arca,etf
IBDT,Fixed Income,Credit,North America,2018-09-18,iShares® iBonds® Dec 2028 Term Corporate ETF,219156767.97,29.220902,2021-01-07,46435U515,7500000,"Jan 08, 2021",0.1,0.1,Bloomberg Barclays December 2028 Maturity Corporate Index,NYSE Arca,etf
IBDU,Fixed Income,Credit,North America,2019-09-17,iShares® iBonds® Dec 2029 Term Corporate ETF,89593971.69,27.149688,2021-01-07,46436E205,3300000,"Jan 08, 2021",0.1,0.1,Bloomberg Barclays December 2029 Maturity Corporate Index,NYSE Arca,etf
IBDV,Fixed Income,Credit,North America,2020-06-23,iShares® iBonds® Dec 2030 Term Corporate ETF,59453266.92,25.849246,2021-01-08,46436E726,2300000,"Jan 08, 2021",0.1,0.1,Bloomberg Barclays December 2030 Maturity Corporate Index,NYSE Arca,etf
IBHA,Fixed Income,High Yield,North America,2019-05-07,iShares® iBonds® 2021 Term High Yield and Income ETF,29037370.16,24.197808,2021-01-07,46435U226,1200000,"Jan 08, 2021",0.35,0.35,Bloomberg Barclays 2021 Term High Yield and Income Index,Cboe BZX formerly known as BATS,etf
IBHB,Fixed Income,High Yield,North America,2019-05-07,iShares® iBonds® 2022 Term High Yield and Income ETF,31414596.07,24.165074,2021-01-07,46435U176,1300000,"Jan 08, 2021",0.35,0.35,Bloomberg Barclays 2022 Term High Yield and Income Index,Cboe BZX formerly known as BATS,etf
IBHC,Fixed Income,High Yield,North America,2019-05-07,iShares® iBonds® 2023 Term High Yield and Income ETF,19456157.8,24.320197,2021-01-07,46435U150,900000,"Jan 08, 2021",0.35,0.35,Bloomberg Barclays 2023 Term High Yield and Income Index,Cboe BZX formerly known as BATS,etf
IBHD,Fixed Income,High Yield,North America,2019-05-07,iShares® iBonds® 2024 Term High Yield and Income ETF,14566389.86,24.277316,2021-01-07,46435U184,600000,"Jan 08, 2021",0.35,0.35,Bloomberg Barclays 2024 Term High Yield and Income Index,Cboe BZX formerly known as BATS,etf
IBHE,Fixed Income,High Yield,North America,2019-05-07,iShares® iBonds® 2025 Term High Yield and Income ETF,17405570.88,24.865101,2021-01-07,46435U168,700000,"Jan 08, 2021",0.35,0.35,Bloomberg Barclays 2025 Term High Yield and Income Index,Cboe BZX formerly known as BATS,etf
IBHF,Fixed Income,High Yield,North America,2020-11-10,iShares® iBonds® 2026 Term High Yield and Income ETF,10142754.87,25.356887,2021-01-08,46436E528,400000,"Jan 08, 2021",0.35,0.35,Bloomberg Barclays 2026 Term High Yield and Income Index,Cboe BZX formerly known as BATS,etf
IBMJ,Fixed Income,Municipals,North America,2015-09-01,iShares® iBonds® Dec 2021 Term Muni Bond ETF,318139148.68,25.760255,2021-01-08,46435G789,12350000,"Jan 08, 2021",0.18,0.18,S&P AMT- Free Municipal Series Dec 2021 Index,NYSE Arca,etf
IBMK,Fixed Income,Municipals,North America,2015-09-01,iShares® iBonds® Dec 2022 Term Muni Bond ETF,370315942.31,26.357007,2021-01-08,46435G755,14050000,"Jan 08, 2021",0.18,0.18,S&P AMT-Free Municipal Series Dec 2022 Index,NYSE Arca,etf
IBML,Fixed Income,Municipals,North America,2017-04-11,iShares® iBonds® Dec 2023 Term Muni Bond ETF,293164582.84,26.175409,2021-01-07,46435G318,11250000,"Jan 08, 2021",0.18,0.18,S&P AMT-Free Municipal Series Dec 2023 Index,Cboe BZX formerly known as BATS,etf
IBMM,Fixed Income,Municipals,North America,2018-03-20,iShares® iBonds® Dec 2024 Term Muni Bond ETF,197555501.24,27.062397,2021-01-08,46435U697,7300000,"Jan 08, 2021",0.18,0.18,S&P AMT-Free Municipal Series Dec 2024 Index,Cboe BZX formerly known as BATS,etf
IBMN,Fixed Income,Municipals,North America,2018-11-13,iShares® iBonds® Dec 2025 Term Muni Bond ETF,135118727.72,28.149735,2021-01-07,46435U432,4800000,"Jan 08, 2021",0.18,0.18,S&P AMT-Free Municipal Series Dec 2025 Index,Cboe BZX formerly known as BATS,etf
IBMO,Fixed Income,Municipals,North America,2019-04-02,iShares® iBonds® Dec 2026 Term Muni Bond ETF,73041436.79,27.052384,2021-01-07,46435U259,2800000,"Jan 08, 2021",0.18,0.18,S&P AMT-Free Municipal Series Callable-Adjusted Dec 2026 Index,Cboe BZX formerly known as BATS,etf
IBMP,Fixed Income,Municipals,North America,2019-04-09,iShares® iBonds® Dec 2027 Term Muni Bond ETF,42248178.56,27.256889,2021-01-07,46435U283,1550000,"Jan 08, 2021",0.18,0.18,S&P AMT-Free Municipal Series Callable-Adjusted Dec 2027 Index,Cboe BZX formerly known as BATS,etf
IBMQ,Fixed Income,Municipals,North America,2019-04-16,iShares® iBonds® Dec 2028 Term Muni Bond ETF,56466221.45,27.544498,2021-01-07,46435U325,2050000,"Jan 08, 2021",0.18,0.18,S&P AMT-Free Municipal Series Callable-Adjusted Dec 2028 Index,Cboe BZX formerly known as BATS,etf
IBTA,Fixed Income,Government,North America,2020-02-25,iShares® iBonds® Dec 2021 Term Treasury ETF,11404939.95,25.344311,2021-01-08,46436E700,450000,"Jan 08, 2021",0.07,0.07,ICE 2021 Maturity US Treasury Index,NASDAQ,etf
IBTB,Fixed Income,Government,North America,2020-02-25,iShares® iBonds® Dec 2022 Term Treasury ETF,3812995.23,25.419968,2021-01-08,46436E809,150000,"Jan 08, 2021",0.07,0.07,ICE 2022 Maturity US Treasury Index,NASDAQ,etf
IBTD,Fixed Income,Government,North America,2020-02-25,iShares® iBonds® Dec 2023 Term Treasury ETF,17978098.71,25.682998,2021-01-08,46436E882,700000,"Jan 08, 2021",0.07,0.07,ICE 2023 Maturity US Treasury Index,NASDAQ,etf
IBTE,Fixed Income,Government,North America,2020-02-25,iShares® iBonds® Dec 2024 Term Treasury ETF,12924324.51,25.848649,2021-01-08,46436E874,500000,"Jan 08, 2021",0.07,0.07,ICE 2024 Maturity US Treasury Index,NASDAQ,etf
IBTF,Fixed Income,Government,North America,2020-02-25,iShares® iBonds® Dec 2025 Term Treasury ETF,15579347.15,25.965579,2021-01-08,46436E866,600000,"Jan 08, 2021",0.07,0.07,ICE 2025 Maturity US Treasury Index,NASDAQ,etf
IBTG,Fixed Income,Government,North America,2020-02-25,iShares® iBonds® Dec 2026 Term Treasury ETF,22123594.97,26.027759,2021-01-08,46436E858,850000,"Jan 08, 2021",0.07,0.07,ICE 2026 Maturity US Treasury Index,NASDAQ,etf
IBTH,Fixed Income,Government,North America,2020-02-25,iShares® iBonds® Dec 2027 Term Treasury ETF,14285792.6,25.974168,2021-01-08,46436E841,550000,"Jan 08, 2021",0.07,0.07,ICE 2027 Maturity US Treasury Index,NASDAQ,etf
IBTI,Fixed Income,Government,North America,2020-02-25,iShares® iBonds® Dec 2028 Term Treasury ETF,14298992.79,25.998169,2021-01-08,46436E833,550000,"Jan 08, 2021",0.07,0.07,ICE 2028 Maturity US Treasury Index,NASDAQ,etf
IBTJ,Fixed Income,Government,North America,2020-02-25,iShares® iBonds® Dec 2029 Term Treasury ETF,23286895.64,25.874328,2021-01-08,46436E825,900000,"Jan 08, 2021",0.07,0.07,ICE 2029 Maturity US Treasury Index,NASDAQ,etf
IBTK,Fixed Income,Government,North America,2020-07-14,iShares® iBonds® Dec 2030 Term Treasury ETF,2408394.39,24.083944,2021-01-08,46436E593,100000,"Jan 08, 2021",0.07,0.07,ICE 2030 Maturity US Treasury Index,NASDAQ,etf
ICF,Real Estate,Real Estate Securities,North America,2001-01-29,iShares Cohen & Steers REIT ETF,1888011863.73,51.797308,2021-01-07,464287564,36450000,"Jan 07, 2021",0.34,0.34,Cohen & Steers Realty Majors Index,Cboe BZX formerly known as BATS,etf
ICLN,Equity,All Cap,Global,2008-06-24,iShares Global Clean Energy ETF,5871720161.19,32.839598,2021-01-07,464288224,189300000,"Jan 08, 2021",0.46,0.46,S&P Global Clean Energy Index,NASDAQ,etf
ICOL,Equity,All Cap,Latin America,2013-06-18,iShares MSCI Colombia ETF,23586595.38,11.231712,2021-01-07,46434G202,2100000,"Jan 08, 2021",0.61,0.61,MSCI All Colombia Capped Index,NYSE Arca,etf
ICSH,Fixed Income,Multi Sectors,North America,2013-12-11,BlackRock Ultra Short-Term Bond ETF,5139879214.42,50.514783,2021-01-07,46434V878,101750000,"Jan 08, 2021",0.08,0.08,ICE BofA US 6-Month Treasury Bill Index,Cboe BZX formerly known as BATS,etf
ICVT,Fixed Income,Credit,North America,2015-06-02,iShares Convertible Bond ETF,1447298679.56,100.159078,2021-01-07,46435G102,14450000,"Jan 08, 2021",0.2,0.2,Bloomberg Barclays U.S. Convertible Cash Pay Bond > $250MM Index,Cboe BZX formerly known as BATS,etf
IDEV,Equity,Large/Mid Cap,Global,2017-03-21,iShares Core MSCI International Developed Markets ETF,4576902541.29,63.173258,2021-01-07,46435G326,72450000,"Jan 08, 2021",0.05,0.05,MSCI WORLD ex USA IMI Index,NYSE Arca,etf
IDNA,Equity,All Cap,Global,2019-06-11,iShares Genomics Immunology and Healthcare ETF,255968955.69,49.70271,2021-01-07,46435U192,5150000,"Jan 08, 2021",0.47,0.47,NYSE FactSet Global Genomics and Immuno Biopharma Index,NYSE Arca,etf
IDRV,Equity,All Cap,Global,2019-04-16,iShares Self-Driving EV and Tech ETF,158144810.74,45.184232,2021-01-07,46435U366,3600000,"Jan 08, 2021",0.47,0.47,NYSE® FactSet Global Autonomous Driving and Electric Vehicle Index,NYSE Arca,etf
IDU,Equity,All Cap,North America,2000-06-12,iShares U.S. Utilities ETF,766031650.9,76.603165,2021-01-07,464287697,10000000,"Jan 07, 2021",0.43,0.43,Dow Jones U.S. Utilities Index,NYSE Arca,etf
IDV,Equity,All Cap,Global,2007-06-11,iShares International Select Dividend ETF,3933341548.53,31.093609,2021-01-07,464288448,126500000,"Jan 07, 2021",0.49,0.49,Dow Jones EPAC Select Dividend Index,Cboe BZX formerly known as BATS,etf
IECS,Equity,All Cap,North America,2018-03-21,iShares Evolved U.S. Consumer Staples ETF,24359800.6,30.449751,2021-01-07,46431W671,800000,"Jan 08, 2021",0.18,0.18,,Cboe BZX formerly known as BATS,etf
IEDI,Equity,All Cap,North America,2018-03-21,iShares Evolved U.S. Discretionary Spending ETF,24310708.19,40.517847,2021-01-07,46431W663,600000,"Jan 08, 2021",0.18,0.18,,Cboe BZX formerly known as BATS,etf
IEF,Fixed Income,Government,North America,2002-07-22,iShares 7-10 Year Treasury Bond ETF,14671475535.41,118.605299,2021-01-07,464287440,123700000,"Jan 07, 2021",0.15,0.15,ICE U.S. Treasury 7-10 Year Bond Index,NASDAQ,etf
IEFA,Equity,All Cap,Global,2012-10-18,iShares Core MSCI EAFE ETF,85804824466.49,70.831125,2021-01-07,46432F842,1211400000,"Jan 08, 2021",0.07,0.07,MSCI EAFE IMI Index,Cboe BZX formerly known as BATS,etf
IEFN,Equity,All Cap,North America,2018-03-21,iShares Evolved U.S. Financials ETF,5350404.04,26.75202,2021-01-07,46431W655,200000,"Jan 08, 2021",0.18,0.18,,Cboe BZX formerly known as BATS,etf
IEHS,Equity,All Cap,North America,2018-03-21,iShares Evolved U.S. Healthcare Staples ETF,19356961.31,38.713923,2021-01-07,46431W689,500000,"Jan 08, 2021",0.18,0.18,,Cboe BZX formerly known as BATS,etf
IEI,Fixed Income,Government,North America,2007-01-05,iShares 3-7 Year Treasury Bond ETF,11214293897.72,132.400164,2021-01-07,464288661,84700000,"Jan 07, 2021",0.15,0.15,ICE U.S. Treasury 3-7 Year Bond Index,NASDAQ,etf
IEIH,Equity,All Cap,North America,2018-03-21,iShares Evolved U.S. Innovative Healthcare ETF,31508154.6,33.166479,2021-01-07,46431W622,950000,"Jan 08, 2021",0.18,0.18,,Cboe BZX formerly known as BATS,etf
