ticker,asset_class,sub_class,region,inception,name,net_assets,nav,nav_as_of,cusip,shares_outstanding,shares_outstanding_as_of,mgmt_fee,expense_ratio,benchmark_index,exchange,type
EWK,Equity,All Cap,Europe,1996-03-12,iShares MSCI Belgium ETF,37509041.07,20.385348,2021-03-29,464286301,1840000,"Mar 29, 2021",0.51,0.51,MSCI Belgium IMI 25/50 Index,NYSE Arca,etf
EWL,Equity,Large/Mid Cap,Europe,1996-03-12,iShares MSCI Switzerland ETF,1655215382.78,44.584926,2021-03-29,464286749,37125000,"Mar 29, 2021",0.51,0.51,MSCI Switzerland 25/50 Index,NYSE Arca,etf
EWM,Equity,Large/Mid Cap,Asia Pacific,1996-03-12,iShares MSCI Malaysia ETF,319459904.49,27.658866,2021-03-29,46434G814,11550000,"Mar 29, 2021",0.51,0.51,MSCI Malaysia Index,NYSE Arca,etf
EWN,Equity,All Cap,Europe,1996-03-12,iShares MSCI Netherlands ETF,315974765.18,45.793444,2021-03-29,464286814,6900000,"Mar 29, 2021",0.51,0.51,MSCI Netherlands IMI 25/50 Index,NYSE Arca,etf
EWO,Equity,All Cap,Europe,1996-03-12,iShares MSCI Austria ETF,57825119.21,21.8208,2021-03-29,464286202,2650000,"Mar 29, 2021",0.51,0.51,MSCI Austria IMI 25/50 Index,NYSE Arca,etf
EWP,Equity,Large/Mid Cap,Europe,1996-03-12,iShares MSCI Spain ETF,510500611.05,27.226699,2021-03-29,464286764,18750000,"Mar 29, 2021",0.51,0.51,MSCI Spain 25/50 Index,NYSE Arca,etf
EWQ,Equity,Large/Mid Cap,Europe,1996-03-12,iShares MSCI France ETF,776843251.53,34.680502,2021-03-29,464286707,22400000,"Mar 29, 2021",0.51,0.51,MSCI France Index,NYSE Arca,etf
EWS,Equity,Large/Mid Cap,Asia Pacific,1996-03-12,iShares MSCI Singapore ETF,719398241.17,23.281496,2021-03-29,46434G780,30900000,"Mar 29, 2021",0.51,0.51,MSCI Singapore 25/50 Index,NYSE Arca,etf
EWT,Equity,Large/Mid Cap,Asia Pacific,2000-06-20,iShares MSCI Taiwan ETF,6679207403.94,59.423553,2021-03-29,46434G772,112400000,"Mar 29, 2021",0.59,0.59,MSCI Taiwan 25/50 Index,NYSE Arca,etf
EWU,Equity,Large/Mid Cap,Europe,1996-03-12,iShares MSCI United Kingdom ETF,3495585859.13,31.322454,2021-03-29,46435G334,111600000,"Mar 29, 2021",0.51,0.51,MSCI United Kingdom Index,NYSE Arca,etf
EWUS,Equity,Small Cap,Europe,2012-01-25,iShares MSCI United Kingdom Small-Cap ETF,98716960.76,44.871346,2021-03-29,46429B416,2200000,"Mar 29, 2021",0.59,0.59,MSCI United Kingdom Small Cap Index,Cboe BZX formerly known as BATS,etf
EWW,Equity,All Cap,Latin America,1996-03-12,iShares MSCI Mexico ETF,1163718081.47,43.91389,2021-03-29,464286822,26500000,"Mar 29, 2021",0.51,0.51,MSCI Mexico IMI 25/50 Index,NYSE Arca,etf
EWY,Equity,Large/Mid Cap,Asia Pacific,2000-05-09,iShares MSCI South Korea ETF,7506860079.48,88.05701,2021-03-29,464286772,85250000,"Mar 29, 2021",0.59,0.59,MSCI Korea 25/50 Index,NYSE Arca,etf
EWZ,Equity,Large/Mid Cap,Latin America,2000-07-10,iShares MSCI Brazil ETF,5642774903.85,32.262864,2021-03-29,464286400,174900000,"Mar 29, 2021",0.59,0.59,MSCI Brazil 25/50 Index,NYSE Arca,etf
EWZS,Equity,Small Cap,Latin America,2010-09-28,iShares MSCI Brazil Small-Cap ETF,98657236.39,14.835675,2021-03-29,464289131,6650000,"Mar 29, 2021",0.59,0.59,MSCI Brazil Small Cap Index,NASDAQ,etf
EXI,Equity,All Cap,Global,2006-09-12,iShares Global Industrials ETF,450691307.87,115.561874,2021-03-29,464288729,3900000,"Mar 29, 2021",0.46,0.46,S&P Global 1200 Industrials Sector Index(TM),NYSE Arca,etf
EZA,Equity,Large/Mid Cap,Middle East and Africa,2003-02-03,iShares MSCI South Africa ETF,361224997.07,48.814189,2021-03-29,464286780,7400000,"Mar 29, 2021",0.59,0.59,MSCI South Africa 25/50 Index,NYSE Arca,etf
EZU,Equity,Large/Mid Cap,Europe,2000-07-25,iShares MSCI Eurozone ETF,4961244777.52,46.065411,2021-03-29,464286608,107700000,"Mar 29, 2021",0.51,0.51,MSCI EMU Index,Cboe BZX formerly known as BATS,etf
FALN,Fixed Income,High Yield,North America,2016-06-14,iShares Fallen Angels USD Bond ETF,2137116627.89,28.977853,2021-03-29,46435G474,73750000,"Mar 29, 2021",0.25,0.25,Bloomberg Barclays US High Yield Fallen Angel 3% Capped Index,NASDAQ,etf
FIBR,Fixed Income,Multi Sectors,North America,2015-02-24,iShares U.S. Fixed Income Balanced Risk Factor ETF,109679114.69,99.708286,2021-03-29,46435U796,1100000,"Mar 29, 2021",0.25,0.26,Bloomberg Barclays U.S. Fixed Income Balanced Risk Index,Cboe BZX formerly known as BATS,etf
FILL,Equity,All Cap,Global,2012-01-31,iShares MSCI Global Energy Producers ETF,70337747.23,15.806235,2021-03-29,464286343,4450000,"Mar 29, 2021",0.39,0.39,MSCI ACWI Select Energy Producers Investable Market Index,NYSE Arca,etf
FLOT,Fixed Income,Credit,North America,2011-06-14,iShares Floating Rate Bond ETF,6251710609.75,50.744404,2021-03-29,46429B655,123200000,"Mar 29, 2021",0.2,0.2,Bloomberg Barclays US Floating Rate Note < 5 Years Index,Cboe BZX formerly known as BATS,etf
FM,Equity,All Cap,Global,2012-09-12,iShares MSCI Frontier and Select EM ETF,430616064.74,29.595606,2021-03-29,464286145,14550000,"Mar 29, 2021",0.79,0.79,MSCI Frontier and Emerging Markets Select Index,NYSE Arca,etf
FOVL,Equity,Large/Mid Cap,North America,2019-03-19,iShares Focused Value Factor ETF,39792520.67,53.056694,2021-03-29,46435U333,750000,"Mar 29, 2021",0.25,0.25,Focused Value Select Index,NYSE Arca,etf
FXI,Equity,Large Cap,Asia Pacific,2004-10-05,iShares China Large-Cap ETF,4024381936.5,45.861902,2021-03-29,464287184,87750000,"Mar 29, 2021",0.74,0.74,FTSE China 50 Index,NYSE Arca,etf
GBF,Fixed Income,Multi Sectors,North America,2007-01-05,iShares Government/Credit Bond ETF,275580825.75,119.81775,2021-03-29,464288596,2300000,"Mar 29, 2021",0.2,0.2,Bloomberg Barclays U.S. Government/Credit Bond Index,NYSE Arca,etf
GHYG,Fixed Income,High Yield,Global,2012-04-03,iShares US & Intl High Yield Corp Bond ETF,184826050.69,49.952987,2021-03-29,464286178,3700000,"Mar 29, 2021",0.4,0.4,Markit iBoxx Global Developed Markets High Yield Index,Cboe BZX formerly known as BATS,etf
GNMA,Fixed Income,Mortgages,North America,2012-02-14,iShares GNMA Bond ETF,512609293.59,50.255813,2021-03-29,46429B333,10200000,"Mar 29, 2021",0.15,0.18,Bloomberg Barclays U.S. GNMA Bond Index,NASDAQ,etf
GOVT,Fixed Income,Government,North America,2012-02-14,iShares U.S. Treasury Bond ETF,14351732399.98,26.179738,2021-03-29,46429B267,548200000,"Mar 29, 2021",0.15,0.15,IDC US Treasury Core Index (4PM),Cboe BZX formerly known as BATS,etf
GOVZ,Fixed Income,Government,North America,2020-09-22,iShares 25+ Year Treasury STRIPS Bond ETF,24757642.09,19.04434,2021-03-29,46436E577,1300000,"Mar 29, 2021",0.15,0.15,ICE BofA Long US Treasury Principal STRIPS Index,Cboe BZX formerly known as BATS,etf
GSG,Commodity,Multi Commodity,Global,2006-07-10,iShares S&P GSCI Commodity-Indexed Trust,1136747513.14,14.147449,2021-03-29,46428R107,80350000,"Mar 29, 2021",,,S&P GSCI(R) Total Return Index,NYSE Arca,etf
GVI,Fixed Income,Multi Sectors,North America,2007-01-05,iShares Intermediate Government/Credit Bond ETF,2397934349.53,115.008842,2021-03-29,464288612,20850000,"Mar 29, 2021",0.2,0.2,Bloomberg Barclays U.S. Intermediate Government/Credit Bond Index,Cboe BZX formerly known as BATS,etf
HAWX,Equity,Large/Mid Cap,Global,2015-06-29,iShares Currency Hedged MSCI ACWI ex U.S. ETF,107859525.77,31.537873,2021-03-29,46435G847,3420000,"Mar 29, 2021",0.38,0.7,MSCI ACWI ex USA 100% Hedged to USD Index,NYSE Arca,etf
HDV,Equity,All Cap,North America,2011-03-29,iShares Core High Dividend ETF,6516422090.4,95.97087,2021-03-29,46429B663,67900000,"Mar 29, 2021",0.08,0.08,Morningstar Dividend Yield Focus Index,NYSE Arca,etf
HEEM,Equity,Large/Mid Cap,Global,2014-09-23,iShares Currency Hedged MSCI Emerging Markets ETF,212515559.92,32.005355,2021-03-29,46434G509,6640000,"Mar 29, 2021",0.78,1.48,MSCI Emerging Markets 100% USD Hedged Index,Cboe BZX formerly known as BATS,etf
HEFA,Equity,Large/Mid Cap,Global,2014-01-31,iShares Currency Hedged MSCI EAFE ETF,2602508171.68,33.026753,2021-03-29,46434V803,78800000,"Mar 29, 2021",0.38,0.7,MSCI EAFE 100% Hedged to USD Index,Cboe BZX formerly known as BATS,etf
HEWC,Equity,Large/Mid Cap,North America,2015-06-29,iShares Currency Hedged MSCI Canada ETF,11523764.47,29.548114,2021-03-29,46435G706,390000,"Mar 29, 2021",0.62,1.13,MSCI Canada 100% Hedged to USD Index,NYSE Arca,etf
HEWG,Equity,Large/Mid Cap,Europe,2014-01-31,iShares Currency Hedged MSCI Germany ETF,68149599.9,31.697488,2021-03-29,46434V704,2150000,"Mar 29, 2021",0.53,1.04,MSCI Germany 100% Hedged to USD Index,NASDAQ,etf
HEWJ,Equity,Large/Mid Cap,Asia Pacific,2014-01-31,iShares Currency Hedged MSCI Japan ETF,337813922.12,39.280689,2021-03-29,46434V886,8600000,"Mar 29, 2021",0.53,1.04,MSCI Japan 100% Hedged to USD Index,NYSE Arca,etf
HEWU,Equity,Large/Mid Cap,Europe,2015-06-29,iShares Currency Hedged MSCI United Kingdom ETF,7868275.78,21.856322,2021-03-29,46435G862,360000,"Mar 29, 2021",0.62,1.13,MSCI United Kingdom 100% Hedged to USD Index,NYSE Arca,etf
HEWW,Equity,Large/Mid Cap,Latin America,2015-06-29,iShares Currency Hedged MSCI Mexico ETF,682588.0,17.0647,2021-03-29,46435G805,40000,"Mar 29, 2021",0.62,1.13,MSCI Mexico IMI 25/50 100% Hedged to USD Index,NYSE Arca,etf
HEZU,Equity,Large/Mid Cap,Europe,2014-07-09,iShares Currency Hedged MSCI Eurozone ETF,498883802.32,34.053502,2021-03-29,46434V639,14650000,"Mar 29, 2021",0.62,1.13,MSCI EMU 100% USD Hedged Index,NYSE Arca,etf
HJPX,Equity,Large/Mid Cap,Asia Pacific,2015-09-29,iShares Currency Hedged JPX-Nikkei 400 ETF,3571685.27,35.716853,2021-03-29,46435G722,100000,"Mar 29, 2021",0.59,1.07,JPX-Nikkei 400 Net Total Return USD Hedged Index,NYSE Arca,etf
HSCZ,Equity,Small Cap,Global,2015-06-29,iShares Currency Hedged MSCI EAFE Small-Cap ETF,76098376.11,35.068376,2021-03-29,46435G839,2170000,"Mar 29, 2021",0.43,0.83,MSCI EAFE Small-Cap 100% Hedged to USD Index,NYSE Arca,etf
HYBB,Fixed Income,High Yield,North America,2020-10-06,iShares BB Rated Corporate Bond ETF,115206301.27,51.202801,2021-03-29,46435U473,2250000,"Mar 29, 2021",0.25,0.25,ICE BofA BB US High Yield Constrained Index,NYSE Arca,etf
HYDB,Fixed Income,High Yield,North America,2017-07-11,iShares High Yield Bond Factor ETF,89333609.53,51.047777,2021-03-29,46435G250,1750000,"Mar 29, 2021",0.35,0.35,BlackRock High Yield Defensive Bond Index,Cboe BZX formerly known as BATS,etf
HYG,Fixed Income,High Yield,North America,2007-04-04,iShares iBoxx $ High Yield Corporate Bond ETF,21055597679.71,86.612907,2021-03-29,464288513,243100000,"Mar 29, 2021",0.49,0.49,Markit iBoxx USD Liquid High Yield Index,NYSE Arca,etf
HYGH,Fixed Income,High Yield,North America,2014-05-27,iShares Interest Rate Hedged High Yield Bond ETF,74415073.02,87.547145,2021-03-29,46431W606,850000,"Mar 29, 2021",0.65,1.12,Markit iBoxx USD Liquid High Yield Interest Rate Hedged Swaps Index,NYSE Arca,etf
HYMU,Fixed Income,Municipals,North America,2021-03-16,BlackRock High Yield Muni Income Bond ETF,25224783.76,25.224784,2021-03-29,092528108,1000000,"Mar 29, 2021",0.45,0.45,BBG Barc Custom Blend,Cboe BZX formerly known as BATS,etf
HYXF,Fixed Income,High Yield,North America,2016-06-14,iShares ESG Advanced High Yield Corporate Bond ETF,98344645.33,51.76034,2021-03-29,46435G441,1900000,"Mar 29, 2021",0.35,0.35,Bloomberg Barclays MSCI US High Yield Choice ESG Screened Index,NASDAQ,etf
HYXU,Fixed Income,High Yield,Global,2012-04-03,iShares International High Yield Bond ETF,60539683.57,55.036076,2021-03-29,464286210,1100000,"Mar 29, 2021",0.4,0.4,Markit iBoxx Global Developed Markets ex-US High Yield Index,Cboe BZX formerly known as BATS,etf
IAGG,Fixed Income,Multi Sectors,Global,2015-11-10,iShares Core International Aggregate Bond ETF,3676640894.96,54.916219,2021-03-29,46435G672,66950000,"Mar 29, 2021",0.08,0.08,Bloomberg Barclays Global Aggregate ex USD 10% Issuer Capped (Hedged) Index,Cboe BZX formerly known as BATS,etf
IAI,Equity,All Cap,North America,2006-05-01,iShares U.S. Broker-Dealers & Securities Exchanges ETF,409811543.59,92.092482,2021-03-29,464288794,4450000,"Mar 29, 2021",0.42,0.42,Dow Jones U.S. Select Investment Services Index,NYSE Arca,etf
IAK,Equity,All Cap,North America,2006-05-01,iShares U.S. Insurance ETF,85718246.83,74.537606,2021-03-29,464288786,1150000,"Mar 29, 2021",0.42,0.42,Dow Jones U.S. Select Insurance Index,NYSE Arca,etf
IAT,Equity,All Cap,North America,2006-05-01,iShares U.S. Regional Banks ETF,623392760.31,55.909665,2021-03-29,464288778,11150000,"Mar 29, 2021",0.42,0.42,Dow Jones U.S. Select Regional Banks Index,NYSE Arca,etf
IAU,Commodity,Precious Metals,Global,2005-01-21,iShares Gold Trust,27795706547.09,16.253373,2021-03-29,464285105,1710150000,"Mar 29, 2021",,,,NYSE Arca,etf
IAUF,Commodity,Precious Metals,Global,2018-06-06,iShares Gold Strategy ETF,23702708.99,52.672687,2021-03-29,46431W614,450000,"Mar 29, 2021",0.25,0.37,Bloomberg Composite Gold Index,Cboe BZX formerly known as BATS,etf
IBB,Equity,All Cap,North America,2001-02-05,iShares Nasdaq Biotechnology ETF,9783225538.23,147.116174,2021-03-29,464287556,66500000,"Mar 29, 2021",0.46,0.46,Nasdaq Biotechnology Index(R),NASDAQ,etf
IBCE,Fixed Income,Credit,North America,2013-04-17,iShares® iBonds® Mar 2023 Term Corporate ex-Financials ETF,28625236.41,24.89151,2021-03-29,46432FAN7,1150000,"Mar 29, 2021",0.1,0.1,Bloomberg Barclays 2023 Maturity High Quality Corporate Index,NYSE Arca,etf
IBDD,Fixed Income,Credit,North America,2013-07-09,iShares® iBonds® Mar 2023 Term Corporate ETF,71944572.3,27.148895,2021-03-29,46432FAZ0,2650000,"Mar 29, 2021",0.1,0.1,Bloomberg Barclays 2023 Maturity Corporate Index,NYSE Arca,etf
IBDM,Fixed Income,Credit,North America,2015-03-10,iShares® iBonds® Dec 2021 Term Corporate ETF,1423303071.9,24.839495,2021-03-29,46434VBK5,57300000,"Mar 29, 2021",0.1,0.1,Bloomberg Barclays December 2021 Maturity Corporate Index,NYSE Arca,etf
IBDN,Fixed Income,Credit,North America,2015-03-10,iShares® iBonds® Dec 2022 Term Corporate ETF,1529624474.09,25.451322,2021-03-29,46434VBA7,60100000,"Mar 29, 2021",0.1,0.1,Bloomberg Barclays December 2022 Maturity Corporate Index,NYSE Arca,etf
IBDO,Fixed Income,Credit,North America,2015-03-11,iShares® iBonds® Dec 2023 Term Corporate ETF,1502103457.27,26.100842,2021-03-29,46434VAX8,57550000,"Mar 29, 2021",0.1,0.1,Bloomberg Barclays December 2023 Maturity Corporate Index,NYSE Arca,etf
IBDP,Fixed Income,Credit,North America,2015-03-11,iShares® iBonds® Dec 2024 Term Corporate ETF,1258687795.25,26.332381,2021-03-29,46434VBG4,47800000,"Mar 29, 2021",0.1,0.1,Bloomberg Barclays December 2024 Maturity Corporate Index,NYSE Arca,etf
IBDQ,Fixed Income,Credit,North America,2015-03-11,iShares® iBonds® Dec 2025 Term Corporate ETF,1033632864.96,26.778053,2021-03-29,46434VBD1,38600000,"Mar 29, 2021",0.1,0.1,Bloomberg Barclays December 2025 Maturity Corporate Index,NYSE Arca,etf
IBDR,Fixed Income,Credit,North America,2016-09-13,iShares® iBonds® Dec 2026 Term Corporate ETF,643189181.55,26.306306,2021-03-29,46435GAA0,24450000,"Mar 29, 2021",0.1,0.1,Bloomberg Barclays December 2026 Maturity Corporate Index,NYSE Arca,etf
IBDS,Fixed Income,Credit,North America,2017-09-12,iShares® iBonds® Dec 2027 Term Corporate ETF,426674359.78,26.667147,2021-03-29,46435UAA9,16000000,"Mar 29, 2021",0.1,0.1,Bloomberg Barclays December 2027 Maturity Corporate Index,NYSE Arca,etf
IBDT,Fixed Income,Credit,North America,2018-09-18,iShares® iBonds® Dec 2028 Term Corporate ETF,238446006.56,28.218462,2021-03-29,46435U515,8450000,"Mar 29, 2021",0.1,0.1,Bloomberg Barclays December 2028 Maturity Corporate Index,NYSE Arca,etf
IBDU,Fixed Income,Credit,North America,2019-09-17,iShares® iBonds® Dec 2029 Term Corporate ETF,95010585.59,26.030297,2021-03-29,46436E205,3650000,"Mar 29, 2021",0.1,0.1,Bloomberg Barclays December 2029 Maturity Corporate Index,NYSE Arca,etf
IBDV,Fixed Income,Credit,North America,2020-06-23,iShares® iBonds® Dec 2030 Term Corporate ETF,68982648.27,24.63666,2021-03-29,46436E726,2800000,"Mar 29, 2021",0.1,0.1,Bloomberg Barclays December 2030 Maturity Corporate Index,NYSE Arca,etf
IBHA,Fixed Income,High Yield,North America,2019-05-07,iShares® iBonds® 2021 Term High Yield and Income ETF,38706117.6,24.191324,2021-03-29,46435U226,1600000,"Mar 29, 2021",0.35,0.35,Bloomberg Barclays 2021 Term High Yield and Income Index,Cboe BZX formerly known as BATS,etf
IBHB,Fixed Income,High Yield,North America,2019-05-07,iShares® iBonds® 2022 Term High Yield and Income ETF,43557755.57,24.198753,2021-03-29,46435U176,1800000,"Mar 29, 2021",0.35,0.35,Bloomberg Barclays 2022 Term High Yield and Income Index,Cboe BZX formerly known as BATS,etf
IBHC,Fixed Income,High Yield,North America,2019-05-07,iShares® iBonds® 2023 Term High Yield and Income ETF,39223723.23,24.514827,2021-03-29,46435U150,1600000,"Mar 29, 2021",0.35,0.35,Bloomberg Barclays 2023 Term High Yield and Income Index,Cboe BZX formerly known as BATS,etf
IBHD,Fixed Income,High Yield,North America,2019-05-07,iShares® iBonds® 2024 Term High Yield and Income ETF,26916137.66,24.469216,2021-03-29,46435U184,1100000,"Mar 29, 2021",0.35,0.35,Bloomberg Barclays 2024 Term High Yield and Income Index,Cboe BZX formerly known as BATS,etf
IBHE,Fixed Income,High Yield,North America,2019-05-07,iShares® iBonds® 2025 Term High Yield and Income ETF,22449509.83,24.9439,2021-03-29,46435U168,900000,"Mar 29, 2021",0.35,0.35,Bloomberg Barclays 2025 Term High Yield and Income Index,Cboe BZX formerly known as BATS,etf
IBHF,Fixed Income,High Yield,North America,2020-11-10,iShares® iBonds® 2026 Term High Yield and Income ETF,15223359.44,25.372266,2021-03-29,46436E528,600000,"Mar 29, 2021",0.35,0.35,Bloomberg Barclays 2026 Term High Yield and Income Index,Cboe BZX formerly known as BATS,etf
IBMJ,Fixed Income,Municipals,North America,2015-09-01,iShares® iBonds® Dec 2021 Term Muni Bond ETF,322781870.66,25.719671,2021-03-29,46435G789,12550000,"Mar 29, 2021",0.18,0.18,S&P AMT- Free Municipal Series Dec 2021 Index,NYSE Arca,etf
IBMK,Fixed Income,Municipals,North America,2015-09-01,iShares® iBonds® Dec 2022 Term Muni Bond ETF,377888729.52,26.333709,2021-03-29,46435G755,14350000,"Mar 29, 2021",0.18,0.18,S&P AMT-Free Municipal Series Dec 2022 Index,NYSE Arca,etf
IBML,Fixed Income,Municipals,North America,2017-04-11,iShares® iBonds® Dec 2023 Term Muni Bond ETF,308551375.8,26.148422,2021-03-29,46435G318,11800000,"Mar 29, 2021",0.18,0.18,S&P AMT-Free Municipal Series Dec 2023 Index,Cboe BZX formerly known as BATS,etf
IBMM,Fixed Income,Municipals,North America,2018-03-20,iShares® iBonds® Dec 2024 Term Muni Bond ETF,215777360.37,26.97217,2021-03-29,46435U697,8000000,"Mar 29, 2021",0.18,0.18,S&P AMT-Free Municipal Series Dec 2024 Index,Cboe BZX formerly known as BATS,etf
IBMN,Fixed Income,Municipals,North America,2018-11-13,iShares® iBonds® Dec 2025 Term Muni Bond ETF,145189616.28,27.92108,2021-03-29,46435U432,5200000,"Mar 29, 2021",0.18,0.18,S&P AMT-Free Municipal Series Dec 2025 Index,Cboe BZX formerly known as BATS,etf
IBMO,Fixed Income,Municipals,North America,2019-04-02,iShares® iBonds® Dec 2026 Term Muni Bond ETF,93851732.71,26.814781,2021-03-29,46435U259,3500000,"Mar 29, 2021",0.18,0.18,S&P AMT-Free Municipal Series Callable-Adjusted Dec 2026 Index,Cboe BZX formerly known as BATS,etf
IBMP,Fixed Income,Municipals,North America,2019-04-09,iShares® iBonds® Dec 2027 Term Muni Bond ETF,45779552.09,26.929148,2021-03-29,46435U283,1700000,"Mar 29, 2021",0.18,0.18,S&P AMT-Free Municipal Series Callable-Adjusted Dec 2027 Index,Cboe BZX formerly known as BATS,etf
IBMQ,Fixed Income,Municipals,North America,2019-04-16,iShares® iBonds® Dec 2028 Term Muni Bond ETF,61111153.84,27.160513,2021-03-29,46435U325,2250000,"Mar 29, 2021",0.18,0.18,S&P AMT-Free Municipal Series Callable-Adjusted Dec 2028 Index,Cboe BZX formerly known as BATS,etf
IBTA,Fixed Income,Government,North America,2020-02-25,iShares® iBonds® Dec 2021 Term Treasury ETF,12676353.79,25.352708,2021-03-29,46436E700,500000,"Mar 29, 2021",0.07,0.07,ICE 2021 Maturity US Treasury Index,NASDAQ,etf
IBTB,Fixed Income,Government,North America,2020-02-25,iShares® iBonds® Dec 2022 Term Treasury ETF,48295073.31,25.41846,2021-03-29,46436E809,1900000,"Mar 29, 2021",0.07,0.07,ICE 2022 Maturity US Treasury Index,NASDAQ,etf
IBTD,Fixed Income,Government,North America,2020-02-25,iShares® iBonds® Dec 2023 Term Treasury ETF,35929954.31,25.664253,2021-03-29,46436E882,1400000,"Mar 29, 2021",0.07,0.07,ICE 2023 Maturity US Treasury Index,NASDAQ,etf
IBTE,Fixed Income,Government,North America,2020-02-25,iShares® iBonds® Dec 2024 Term Treasury ETF,16727318.18,25.734336,2021-03-29,46436E874,650000,"Mar 29, 2021",0.07,0.07,ICE 2024 Maturity US Treasury Index,NASDAQ,etf
IBTF,Fixed Income,Government,North America,2020-02-25,iShares® iBonds® Dec 2025 Term Treasury ETF,21804293.59,25.65211,2021-03-29,46436E866,850000,"Mar 29, 2021",0.07,0.07,ICE 2025 Maturity US Treasury Index,NASDAQ,etf
IBTG,Fixed Income,Government,North America,2020-02-25,iShares® iBonds® Dec 2026 Term Treasury ETF,19130089.74,25.506786,2021-03-29,46436E858,750000,"Mar 29, 2021",0.07,0.07,ICE 2026 Maturity US Treasury Index,NASDAQ,etf
IBTH,Fixed Income,Government,North America,2020-02-25,iShares® iBonds® Dec 2027 Term Treasury ETF,10081185.19,25.202963,2021-03-29,46436E841,400000,"Mar 29, 2021",0.07,0.07,ICE 2027 Maturity US Treasury Index,NASDAQ,etf
IBTI,Fixed Income,Government,North America,2020-02-25,iShares® iBonds® Dec 2028 Term Treasury ETF,21348730.55,25.116154,2021-03-29,46436E833,850000,"Mar 29, 2021",0.07,0.07,ICE 2028 Maturity US Treasury Index,NASDAQ,etf
IBTJ,Fixed Income,Government,North America,2020-02-25,iShares® iBonds® Dec 2029 Term Treasury ETF,19853905.13,24.817381,2021-03-29,46436E825,800000,"Mar 29, 2021",0.07,0.07,ICE 2029 Maturity US Treasury Index,NASDAQ,etf
IBTK,Fixed Income,Government,North America,2020-07-14,iShares® iBonds® Dec 2030 Term Treasury ETF,2288000.63,22.880006,2021-03-29,46436E593,100000,"Mar 29, 2021",0.07,0.07,ICE 2030 Maturity US Treasury Index,NASDAQ,etf
ICF,Real Estate,Real Estate Securities,North America,2001-01-29,iShares Cohen & Steers REIT ETF,2085103664.17,58.324578,2021-03-29,464287564,35750000,"Mar 29, 2021",0.34,0.34,Cohen & Steers Realty Majors Index,Cboe BZX formerly known as BATS,etf
ICLN,Equity,All Cap,Global,2008-06-24,iShares Global Clean Energy ETF,5134112840.25,22.390374,2021-03-29,464288224,229300000,"Mar 29, 2021",0.46,0.46,S&P Global Clean Energy Index,NASDAQ,etf
ICOL,Equity,All Cap,Latin America,2013-06-18,iShares MSCI Colombia ETF,21106649.7,10.050786,2021-03-29,46434G202,2100000,"Mar 29, 2021",0.61,0.61,MSCI All Colombia Capped Index,NYSE Arca,etf
ICSH,Fixed Income,Multi Sectors,North America,2013-12-11,BlackRock Ultra Short-Term Bond ETF,5267358967.55,50.502004,2021-03-29,46434V878,104300000,"Mar 29, 2021",0.08,0.08,ICE BofA US 6-Month Treasury Bill Index,Cboe BZX formerly known as BATS,etf
ICVT,Fixed Income,Credit,North America,2015-06-02,iShares Convertible Bond ETF,1563166132.44,95.606491,2021-03-29,46435G102,16350000,"Mar 29, 2021",0.2,0.2,Bloomberg Barclays U.S. Convertible Cash Pay Bond > $250MM Index,Cboe BZX formerly known as BATS,etf
IDEV,Equity,Large/Mid Cap,Global,2017-03-21,iShares Core MSCI International Developed Markets ETF,5154196309.93,64.588926,2021-03-29,46435G326,79800000,"Mar 29, 2021",0.05,0.05,MSCI WORLD ex USA IMI Index,NYSE Arca,etf
IDNA,Equity,All Cap,Global,2019-06-11,iShares Genomics Immunology and Healthcare ETF,273154908.96,43.357922,2021-03-29,46435U192,6300000,"Mar 29, 2021",0.47,0.47,NYSE FactSet Global Genomics and Immuno Biopharma Index,NYSE Arca,etf
IDRV,Equity,All Cap,Global,2019-04-16,iShares Self-Driving EV and Tech ETF,319982488.83,45.067956,2021-03-29,46435U366,7100000,"Mar 29, 2021",0.47,0.47,NYSE® FactSet Global Autonomous Driving and Electric Vehicle Index,NYSE Arca,etf
IDU,Equity,All Cap,North America,2000-06-12,iShares U.S. Utilities ETF,796629988.76,79.662999,2021-03-29,464287697,10000000,"Mar 29, 2021",0.43,0.43,Dow Jones U.S. Utilities Index,NYSE Arca,etf
IDV,Equity,All Cap,Global,2007-06-11,iShares International Select Dividend ETF,4060870740.64,31.394439,2021-03-29,464288448,129350000,"Mar 29, 2021",0.49,0.49,Dow Jones EPAC Select Dividend Index,Cboe BZX formerly known as BATS,etf
IECS,Equity,All Cap,North America,2018-03-21,iShares Evolved U.S. Consumer Staples ETF,14436842.93,32.081873,2021-03-29,46431W671,450000,"Mar 29, 2021",0.18,0.18,,Cboe BZX formerly known as BATS,etf
IEDI,Equity,All Cap,North America,2018-03-21,iShares Evolved U.S. Discretionary Spending ETF,22810810.33,41.474201,2021-03-29,46431W663,550000,"Mar 29, 2021",0.18,0.18,,Cboe BZX formerly known as BATS,etf
IEF,Fixed Income,Government,North America,2002-07-22,iShares 7-10 Year Treasury Bond ETF,14283619891.1,113.182408,2021-03-29,464287440,126200000,"Mar 29, 2021",0.15,0.15,IDC US Treasury 7-10 Year Index (4PM),NASDAQ,etf
IEFA,Equity,All Cap,Global,2012-10-18,iShares Core MSCI EAFE ETF,87396903465.75,72.145372,2021-03-29,46432F842,1211400000,"Mar 29, 2021",0.07,0.07,MSCI EAFE IMI Index,Cboe BZX formerly known as BATS,etf
IEFN,Equity,All Cap,North America,2018-03-21,iShares Evolved U.S. Financials ETF,5889844.93,29.449225,2021-03-29,46431W655,200000,"Mar 29, 2021",0.18,0.18,,Cboe BZX formerly known as BATS,etf
IEHS,Equity,All Cap,North America,2018-03-21,iShares Evolved U.S. Healthcare Staples ETF,25172709.01,38.727245,2021-03-29,46431W689,650000,"Mar 29, 2021",0.18,0.18,,Cboe BZX formerly known as BATS,etf
IEI,Fixed Income,Government,North America,2007-01-05,iShares 3-7 Year Treasury Bond ETF,11367576017.31,130.063799,2021-03-29,464288661,87400000,"Mar 29, 2021",0.15,0.15,IDC US Treasury 3-7 Year Index (4PM),NASDAQ,etf
IEIH,Equity,All Cap,North America,2018-03-21,iShares Evolved U.S. Innovative Healthcare ETF,35105882.09,31.914438,2021-03-29,46431W622,1100000,"Mar 29, 2021",0.18,0.18,,Cboe BZX formerly known as BATS,etf
IEME,Equity,All Cap,North America,2018-03-21,iShares Evolved U.S. Media and Entertainment ETF,19979022.65,36.325496,2021-03-29,46431W630,550000,"Mar 29, 2021",0.18,0.18,,Cboe BZX formerly known as BATS,etf
