ticker,asset_class,sub_class,region,inception,name,net_assets,nav,nav_as_of,cusip,shares_outstanding,shares_outstanding_as_of,mgmt_fee,expense_ratio,benchmark_index,exchange,type
NYF,Fixed Income,Municipals,North America,2007-10-04,iShares New York Muni Bond ETF,502598416.52,58.441676,2021-01-29,464288323,8600000,"Feb 01, 2021",0.25,0.25,S&P New York AMT-Free Municipal Bond Index,NYSE Arca,etf
OEF,Equity,Large Cap,North America,2000-10-23,iShares S&P 100 ETF,6943155118.01,170.803324,2021-01-29,464287101,40650000,"Feb 01, 2021",0.2,0.2,S&P 100 Index,NYSE Arca,etf
PFF,Others,Others,North America,2007-03-26,iShares Preferred and Income Securities ETF,19117723981.79,37.992297,2021-01-29,464288687,500700000,"Feb 01, 2021",0.46,0.46,ICE Exchange-Listed Preferred & Hybrid Securities Index,NASDAQ,etf
PICK,Equity,All Cap,Global,2012-01-31,iShares MSCI Global Metals & Mining Producers ETF,643512610.23,36.459638,2021-01-29,46434G848,17650000,"Feb 01, 2021",0.39,0.39,MSCI ACWI Select Metals & Mining Producers Ex Gold & Silver Investable Market Index,Cboe BZX formerly known as BATS,etf
QAT,Equity,All Cap,Middle East and Africa,2014-04-29,iShares MSCI Qatar ETF,95599401.9,18.744981,2021-01-29,46434V779,5100000,"Feb 01, 2021",0.59,0.59,MSCI All Qatar Capped Index,NASDAQ,etf
QLTA,Fixed Income,Credit,North America,2012-02-14,iShares Aaa - A Rated Corporate Bond ETF,1423419890.44,57.628336,2021-01-29,46429B291,24700000,"Feb 01, 2021",0.15,0.15,Bloomberg Barclays U.S. Corporate Aaa - A Capped Index,NYSE Arca,etf
QUAL,Equity,Large/Mid Cap,North America,2013-07-16,iShares MSCI USA Quality Factor ETF,19606680106.28,112.909186,2021-01-29,46432F339,169350000,"Feb 01, 2021",0.15,0.15,MSCI USA Sector Neutral Quality Index,Cboe BZX formerly known as BATS,etf
REET,Real Estate,Real Estate Securities,Global,2014-07-08,iShares Global REIT ETF,2495426590.02,23.834065,2021-01-29,46434V647,104700000,"Feb 01, 2021",0.14,0.14,FTSE EPRA Nareit Global REITS Net Total Return Index,NYSE Arca,etf
REM,Real Estate,Real Estate Securities,North America,2007-05-01,iShares Mortgage Real Estate ETF,1285988392.31,31.100082,2021-01-29,46435G342,41300000,"Feb 01, 2021",0.48,0.48,FTSE Nareit All Mortgage Capped Index,Cboe BZX formerly known as BATS,etf
REZ,Real Estate,Real Estate Securities,North America,2007-05-01,iShares Residential and Multisector Real Estate ETF,416987185.4,67.255998,2021-01-29,464288562,6200000,"Feb 01, 2021",0.48,0.48,FTSE Nareit All Residential Capped Index,NYSE Arca,etf
RING,Equity,All Cap,Global,2012-01-31,iShares MSCI Global Gold Miners ETF,462848120.41,28.837889,2021-01-29,46434G855,16050000,"Feb 01, 2021",0.39,0.39,MSCI ACWI Select Gold Miners Investable Market Index,NASDAQ,etf
RXI,Equity,All Cap,Global,2006-09-12,iShares Global Consumer Discretionary ETF,435199096.91,155.428249,2021-01-29,464288745,2800000,"Feb 01, 2021",0.46,0.46,S&P Global 1200 Consumer Discretionary Sector Capped Index,NYSE Arca,etf
SCJ,Equity,Small Cap,Asia Pacific,2007-12-20,iShares MSCI Japan Small-Cap ETF,62462517.8,78.078147,2021-01-29,464286582,800000,"Feb 01, 2021",0.51,0.51,MSCI Japan Small Cap Index,NYSE Arca,etf
SCZ,Equity,Small Cap,Global,2007-12-10,iShares MSCI EAFE Small-Cap ETF,11790989078.93,68.313958,2021-01-29,464288273,172600000,"Feb 01, 2021",0.4,0.4,MSCI EAFE Small Cap Index,NASDAQ,etf
SDG,Equity,Large/Mid Cap,Global,2016-04-20,iShares MSCI Global Impact ETF,373634687.93,95.803766,2021-01-29,46435G532,3900000,"Feb 01, 2021",0.49,0.49,MSCI ACWI Sustainable Impact Index,NASDAQ,etf
SGOV,Fixed Income,Government,North America,2020-05-26,iShares 0-3 Month Treasury Bond ETF,825126564.74,100.015341,2021-02-01,46436E718,8250000,"Feb 01, 2021",0.12,0.12,ICE 0-3 Month US Treasury Securities Index,NYSE Arca,etf
SHV,Fixed Income,Government,North America,2007-01-05,iShares Short Treasury Bond ETF,16453875928.24,110.517705,2021-02-01,464288679,148880000,"Feb 01, 2021",0.15,0.15,ICE Short US Treasury Securities Index,NASDAQ,etf
SHY,Fixed Income,Government,North America,2002-07-22,iShares 1-3 Year Treasury Bond ETF,18865530413.17,86.380634,2021-01-29,464287457,218700000,"Feb 01, 2021",0.15,0.15,ICE U.S. Treasury 1-3 Year Bond Index,NASDAQ,etf
SHYG,Fixed Income,High Yield,North America,2013-10-15,iShares 0-5 Year High Yield Corporate Bond ETF,4781549248.84,45.451989,2021-01-29,46434V407,105200000,"Feb 01, 2021",0.3,0.3,Markit iBoxx USD Liquid High Yield 0-5 Index,NYSE Arca,etf
SIZE,Equity,Large/Mid Cap,North America,2013-04-16,iShares MSCI USA Size Factor ETF,881228980.31,110.153623,2021-01-29,46432F370,8000000,"Feb 01, 2021",0.15,0.15,MSCI USA Low Size Index,NYSE Arca,etf
SLQD,Fixed Income,Credit,North America,2013-10-15,iShares 0-5 Year Investment Grade Corporate Bond ETF,2207003319.24,52.11342,2021-01-29,46434V100,42350000,"Feb 01, 2021",0.06,0.06,Markit iBoxx USD Liquid Investment Grade 0-5 Index,NASDAQ,etf
SLV,Commodity,Precious Metals,Global,2006-04-21,iShares Silver Trust,18352903062.14,27.484692,2021-02-01,46428Q109,667750000,"Feb 01, 2021",,,,NYSE Arca,etf
SLVP,Equity,All Cap,Global,2012-01-31,iShares MSCI Global Silver and Metals Miners ETF,251169621.59,16.204492,2021-01-29,464286327,15600000,"Feb 01, 2021",0.39,0.39,MSCI ACWI Select Silver Miners Investable Market Index,Cboe BZX formerly known as BATS,etf
SMIN,Equity,Small Cap,Asia Pacific,2012-02-08,iShares MSCI India Small-Cap ETF,232290555.86,42.62212,2021-01-29,46429B614,5450000,"Feb 01, 2021",0.74,0.81,MSCI India Small Cap Index,Cboe BZX formerly known as BATS,etf
SMLF,Equity,Small Cap,North America,2015-04-28,iShares MSCI USA Small-Cap Multifactor ETF,759186559.89,47.301343,2021-01-29,46434V290,16150000,"Feb 01, 2021",0.3,0.3,MSCI USA Small Cap Diversified Multiple-Factor Index,NYSE Arca,etf
SMMD,Equity,Mid/Small Cap,North America,2017-07-06,iShares Russell 2500 ETF,209200695.75,58.111304,2021-01-29,46435G268,3650000,"Feb 01, 2021",0.15,0.23,Russell 2500 Index,Cboe BZX formerly known as BATS,etf
SMMV,Equity,Small Cap,North America,2016-09-07,iShares MSCI USA Small-Cap Min Vol Factor ETF,876786497.1,34.587239,2021-01-29,46435G433,25300000,"Feb 01, 2021",0.2,0.2,MSCI USA Small Cap Minimum Volatility (USD) Index,Cboe BZX formerly known as BATS,etf
SOXX,Equity,All Cap,North America,2001-07-10,iShares PHLX Semiconductor ETF,5212455123.54,391.913919,2021-01-29,464287523,13250000,"Feb 01, 2021",0.46,0.46,PHLX SOX Semiconductor Sector Index,NASDAQ,etf
STIP,Fixed Income,Inflation,North America,2010-12-01,iShares 0-5 Year TIPS Bond ETF,3421562523.74,104.955906,2021-01-29,46429B747,32650000,"Feb 01, 2021",0.05,0.05,Bloomberg Barclays U.S. Treasury Inflation-Protected Securities (TIPS) 0-5 Years Index (Series-L),NYSE Arca,etf
STLC,Equity,Large/Mid Cap,North America,2020-04-14,iShares Factors US Blend Style ETF,5350913.6,35.672757,2021-01-29,46436E791,150000,"Feb 01, 2021",0.25,0.25,Russell US Large Cap Factors Blend Style Index,Cboe BZX formerly known as BATS,etf
STLG,Equity,Large/Mid Cap,North America,2020-01-14,iShares Factors US Growth Style ETF,4874920.91,32.499473,2021-02-01,46436E403,150000,"Feb 01, 2021",0.25,0.25,Russell US Large Cap Factors Growth Style Index,Cboe BZX formerly known as BATS,etf
STLV,Equity,Large/Mid Cap,North America,2020-01-14,iShares Factors US Value Style ETF,6235598.83,24.942395,2021-02-01,46436E304,250000,"Feb 01, 2021",0.25,0.25,Russell US Large Cap Factors Value Style Index,Cboe BZX formerly known as BATS,etf
STMB,Equity,Mid Cap,North America,2020-04-14,iShares Factors US Mid Blend Style ETF,5586455.21,37.243035,2021-01-29,46436E783,150000,"Feb 01, 2021",0.3,0.3,Russell US Mid Cap Factors Blend Style Index,Cboe BZX formerly known as BATS,etf
STSB,Equity,Small Cap,North America,2020-04-14,iShares Factors US Small Blend Style ETF,6434860.89,42.899073,2021-01-29,46436E775,150000,"Feb 01, 2021",0.35,0.35,Russell US Small Cap Factors Blend Style Index,Cboe BZX formerly known as BATS,etf
SUB,Fixed Income,Municipals,North America,2008-11-05,iShares Short-Term National Muni Bond ETF,4340977059.44,107.850362,2021-01-29,464288158,40350000,"Feb 01, 2021",0.07,0.07,S&P Short Term National AMT-Free Municipal Bond Index,NYSE Arca,etf
SUSA,Equity,Large/Mid Cap,North America,2005-01-24,iShares MSCI USA ESG Select ETF,2411253222.2,82.015416,2021-01-29,464288802,29450000,"Feb 01, 2021",0.25,0.25,MSCI USA Extended ESG Select Index,NYSE Arca,etf
SUSB,Fixed Income,Credit,North America,2017-07-11,iShares ESG Aware 1-5 Year USD Corporate Bond ETF,597141066.38,26.133088,2021-01-29,46435G243,22850000,"Feb 01, 2021",0.12,0.12,Bloomberg Barclays MSCI US Corporate 1-5 Year ESG Focus Index,NASDAQ,etf
SUSC,Fixed Income,Credit,North America,2017-07-11,iShares ESG Aware USD Corporate Bond ETF,791961166.0,27.935138,2021-01-29,46435G193,28350000,"Feb 01, 2021",0.18,0.18,Bloomberg Barclays MSCI US Corporate ESG Focus Index,NASDAQ,etf
SUSL,Equity,Large/Mid Cap,North America,2019-05-07,iShares ESG MSCI USA Leaders ETF,2931503668.46,64.357929,2021-01-29,46435U218,45550000,"Feb 01, 2021",0.1,0.1,MSCI USA Extended ESG Leaders Index,NASDAQ,etf
SVAL,Equity,Small Cap,North America,2020-10-27,iShares US Small Cap Value Factor ETF,42796351.41,25.174324,2021-01-29,46436E536,1700000,"Feb 01, 2021",0.3,0.3,Russell 2000 Focused Value Select Index,Cboe BZX formerly known as BATS,etf
TECB,Equity,All Cap,North America,2020-01-08,U.S. Tech Breakthrough Multisector ETF,356407966.52,36.000805,2021-02-01,46436E502,9900000,"Feb 01, 2021",0.4,0.4,NYSE FactSet U.S. Tech Breakthrough Index,NYSE Arca,etf
TFLO,Fixed Income,Government,North America,2014-02-03,iShares Treasury Floating Rate Bond ETF,377162296.82,50.288306,2021-01-29,46434V860,7500000,"Feb 01, 2021",0.15,0.15,Bloomberg Barclays US Treasury Floating Rate Bond Index,NYSE Arca,etf
THD,Equity,All Cap,Asia Pacific,2008-03-26,iShares MSCI Thailand ETF,458540237.11,77.718684,2021-01-29,464286624,5800000,"Feb 01, 2021",0.59,0.59,MSCI Thailand IMI 25/50 Index,NYSE Arca,etf
TIP,Fixed Income,Inflation,North America,2003-12-04,iShares TIPS Bond ETF,27602681965.67,127.967928,2021-01-29,464287176,215700000,"Feb 01, 2021",0.19,0.19,Bloomberg Barclays U.S. Treasury Inflation Protected Securities (TIPS) Index (Series-L),NYSE Arca,etf
TLH,Fixed Income,Government,North America,2007-01-05,iShares 10-20 Year Treasury Bond ETF,1436642025.39,154.477637,2021-01-29,464288653,9300000,"Feb 01, 2021",0.15,0.15,ICE U.S. Treasury 10-20 Year Bond Index,NYSE Arca,etf
TLT,Fixed Income,Government,North America,2002-07-22,iShares 20+ Year Treasury Bond ETF,17041931480.96,152.024366,2021-01-29,464287432,111800000,"Feb 01, 2021",0.15,0.15,ICE U.S. Treasury 20+ Year Bond Index,NASDAQ,etf
TOK,Equity,Large/Mid Cap,Global,2007-12-10,iShares MSCI Kokusai ETF,174421163.91,83.057697,2021-01-29,464288265,2100000,"Feb 01, 2021",0.25,0.25,MSCI Kokusai Index,NYSE Arca,etf
TUR,Equity,All Cap,Europe,2008-03-26,iShares MSCI Turkey ETF,299311831.23,26.96503,2021-01-29,464286715,11250000,"Feb 01, 2021",0.59,0.59,MSCI Turkey IMI 25/50 Index,NASDAQ,etf
UAE,Equity,All Cap,Middle East and Africa,2014-04-29,iShares MSCI UAE ETF,15072930.47,13.106896,2021-01-29,46434V761,1150000,"Feb 01, 2021",0.59,0.59,MSCI All UAE Capped Index,NASDAQ,etf
URTH,Equity,Large/Mid Cap,Global,2012-01-10,iShares MSCI World ETF,1092544142.85,111.484096,2021-01-29,464286392,9800000,"Feb 01, 2021",0.24,0.24,MSCI World Index,NYSE Arca,etf
USHY,Fixed Income,High Yield,North America,2017-10-25,iShares Broad USD High Yield Corporate Bond ETF,7544355836.12,41.169745,2021-01-29,46435U853,183250000,"Feb 01, 2021",0.22,0.22,ICE BofA US High Yield Constrained Index,Cboe BZX formerly known as BATS,etf
USIG,Fixed Income,Credit,North America,2007-01-05,iShares Broad USD Investment Grade Corporate Bond ETF,5988232909.96,61.229375,2021-01-29,464288620,96800000,"Feb 01, 2021",0.06,0.06,ICE BofA US Corporate Index,NASDAQ,etf
USMV,Equity,Large/Mid Cap,North America,2011-10-18,iShares MSCI USA Min Vol Factor ETF,29809318143.62,66.066751,2021-01-29,46429B697,449700000,"Feb 01, 2021",0.15,0.15,MSCI USA Minimum Volatility (USD) Index,Cboe BZX formerly known as BATS,etf
USRT,Real Estate,Real Estate Securities,North America,2007-05-01,iShares Core U.S. REIT ETF,1611996712.66,48.481104,2021-01-29,464288521,32750000,"Feb 01, 2021",0.08,0.08,FTSE Nareit Equity REITS Index,NYSE Arca,etf
USXF,Equity,Large Cap,North America,2020-06-16,iShares ESG Advanced MSCI USA ETF,99435834.49,31.566932,2021-02-01,46436E767,3150000,"Feb 01, 2021",0.1,0.1,MSCI USA Choice ESG Screened Index in USD,NASDAQ,etf
VEGI,Equity,All Cap,Global,2012-01-31,iShares MSCI Global Agriculture Producers ETF,40226034.45,34.97916,2021-01-29,464286350,1150000,"Feb 01, 2021",0.39,0.39,MSCI ACWI Select Agriculture Producers Investable Market Index,NYSE Arca,etf
VLUE,Equity,Large/Mid Cap,North America,2013-04-16,iShares MSCI USA Value Factor ETF,10541921319.22,89.756674,2021-01-29,46432F388,118150000,"Feb 01, 2021",0.15,0.15,MSCI USA Enhanced Value Index,Cboe BZX formerly known as BATS,etf
WFBIX,Fixed Income,Multi Sectors,North America,2010-02-02,iShares U.S. Aggregate Bond Index Fund,2175083021.26,10.8,2021-01-29,066922105,,,,,BBG Barc U.S. Aggregate Index,,mf
WFSPX,Equity,Large Cap,North America,1993-07-31,iShares S&P 500 Index Fund,10207882355.33,439.75,2021-01-29,066922204,,,,,S&P 500 Index,,mf
WOOD,Equity,All Cap,Global,2008-06-24,iShares Global Timber & Forestry ETF,304251370.33,79.232128,2021-01-29,464288174,3840000,"Feb 01, 2021",0.46,0.46,S&P Global Timber & Forestry Index,NASDAQ,etf
WPS,Real Estate,Real Estate Securities,Global,2007-07-30,iShares International Developed Property ETF,81073681.49,35.249427,2021-01-29,464288422,2300000,"Feb 01, 2021",0.48,0.48,S&P Developed ex-U.S. Property Index,NYSE Arca,etf
XJH,Equity,Mid Cap,North America,2020-09-22,iShares ESG Screened S&P Mid-Cap ETF,13164949.31,32.912373,2021-02-01,46436E551,400000,"Feb 01, 2021",0.12,0.12,S&P MidCap 400 Sustainability Screened Index,Cboe BZX formerly known as BATS,etf
XJR,Equity,Small Cap,North America,2020-09-22,iShares ESG Screened S&P Small-Cap ETF,8929747.61,35.71899,2021-02-01,46436E544,250000,"Feb 01, 2021",0.12,0.12,S&P SmallCap 600 Sustainability Screened Index,Cboe BZX formerly known as BATS,etf
XT,Equity,Large Cap,Global,2015-03-19,iShares Exponential Technologies ETF,3220033294.09,58.333936,2021-01-29,46434V381,55200000,"Feb 01, 2021",0.47,0.47,Morningstar Exponential Technologies Index,NASDAQ,etf
XVV,Equity,Large Cap,North America,2020-09-22,iShares ESG Screened S&P 500 ETF,7195096.65,28.780387,2021-02-01,46436E569,250000,"Feb 01, 2021",0.08,0.08,S&P 500 Sustainability Screened Index,Cboe BZX formerly known as BATS,etf
