ticker,asset_class,sub_class,region,inception,name,net_assets,nav,nav_as_of,cusip,shares_outstanding,shares_outstanding_as_of,mgmt_fee,expense_ratio,benchmark_index,exchange,type
IETC,Equity,All Cap,North America,2018-03-21,iShares Evolved U.S. Technology ETF,105871521.23,49.242568,2021-02-02,46431W648,2150000,"Feb 02, 2021",0.18,0.18,,Cboe BZX formerly known as BATS,etf
IEUR,Equity,All Cap,Europe,2014-06-10,iShares Core MSCI Europe ETF,3941677386.85,51.796023,2021-02-02,46434V738,76100000,"Feb 02, 2021",0.09,0.09,MSCI Europe Investable Market Index,NYSE Arca,etf
IEUS,Equity,Small Cap,Europe,2007-11-12,iShares MSCI Europe Small-Cap ETF,186812373.63,63.326228,2021-02-02,464288497,2950000,"Feb 02, 2021",0.4,0.4,MSCI Europe Small Cap Index,NASDAQ,etf
IEV,Equity,Large/Mid Cap,Europe,2000-07-25,iShares Europe ETF,1596225528.98,48.1516,2021-02-02,464287861,33150000,"Feb 02, 2021",0.59,0.59,S&P Europe 350 Index,NYSE Arca,etf
IEZ,Equity,All Cap,North America,2006-05-01,iShares U.S. Oil Equipment & Services ETF,144398909.41,11.835976,2021-02-02,464288844,12200000,"Feb 02, 2021",0.42,0.42,Dow Jones U.S. Select Oil Equipment & Services Index,NYSE Arca,etf
IFGL,Real Estate,Real Estate Securities,Global,2007-11-12,iShares International Developed Real Estate ETF,247660014.33,26.919567,2021-02-02,464288489,9200000,"Feb 02, 2021",0.48,0.48,FTSE EPRA Nareit Developed ex-U.S. Index,NASDAQ,etf
IFRA,Equity,All Cap,North America,2018-04-03,iShares U.S. Infrastructure ETF,180439408.43,30.582951,2021-02-03,46435U713,5900000,"Feb 03, 2021",0.4,0.4,NYSE FactSet U.S. Infrastructure Index,Cboe BZX formerly known as BATS,etf
IGBH,Fixed Income,Credit,North America,2015-07-22,iShares Interest Rate Hedged Long-Term Corporate Bond ETF,631770171.82,24.9219,2021-02-02,46431W812,25350000,"Feb 02, 2021",0.35,0.41,ICE Q70A Custom Index,NYSE Arca,etf
IGE,Equity,All Cap,North America,2001-10-22,iShares North American Natural Resources ETF,332751578.81,24.025385,2021-02-02,464287374,13850000,"Feb 02, 2021",0.46,0.46,S&P North American Natural Resources Sector Index(TM),Cboe BZX formerly known as BATS,etf
IGEB,Fixed Income,Credit,North America,2017-07-11,iShares Investment Grade Bond Factor ETF,160631190.33,54.451251,2021-02-02,46435G219,2950000,"Feb 02, 2021",0.18,0.18,BlackRock Investment Grade Enhanced Bond Index,Cboe BZX formerly known as BATS,etf
IGF,Equity,All Cap,Global,2007-12-10,iShares Global Infrastructure ETF,2985234872.76,43.707685,2021-02-02,464288372,68300000,"Feb 02, 2021",0.46,0.46,S&P Global Infrastructure Index,NASDAQ,etf
IGIB,Fixed Income,Credit,North America,2007-01-05,iShares 5-10 Year Investment Grade Corporate Bond ETF,11164539312.01,61.175558,2021-02-02,464288638,182500000,"Feb 02, 2021",0.06,0.06,ICE BofA 5-10 Year US Corporate Index,NASDAQ,etf
IGLB,Fixed Income,Credit,North America,2009-12-08,iShares 10+ Year Investment Grade Corporate Bond ETF,2474188450.93,70.691099,2021-02-02,464289511,35000000,"Feb 02, 2021",0.06,0.06,ICE BofA 10+ Year US Corporate Index,NYSE Arca,etf
IGM,Equity,All Cap,North America,2001-03-13,iShares Expanded Tech Sector ETF,3283198194.25,362.784331,2021-02-02,464287549,9050000,"Feb 02, 2021",0.46,0.46,S&P North American Expanded Technology Sector Index,NYSE Arca,etf
IGN,Equity,All Cap,North America,2001-07-10,iShares North American Tech-Multimedia Networking ETF,69231638.57,65.934894,2021-02-02,464287531,1050000,"Feb 02, 2021",0.46,0.46,S&P North American Technology-Multimedia Networking Index(TM),NYSE Arca,etf
IGOV,Fixed Income,Government,Global,2009-01-21,iShares International Treasury Bond ETF,1156348301.52,54.161513,2021-02-02,464288117,21350000,"Feb 02, 2021",0.35,0.35,FTSE World Government Bond Index - Developed Markets Capped,NASDAQ,etf
IGRO,Equity,Large/Mid Cap,Global,2016-05-17,iShares International Dividend Growth ETF,189265105.34,63.088368,2021-02-02,46435G524,3000000,"Feb 02, 2021",0.15,0.15,Morningstar® Global ex-US Dividend Growth Index℠,Cboe BZX formerly known as BATS,etf
IGSB,Fixed Income,Credit,North America,2007-01-05,iShares 1-5 Year Investment Grade Corporate Bond ETF,22493176229.28,55.002265,2021-02-02,464288646,408950000,"Feb 02, 2021",0.06,0.06,ICE BofA 1-5 Year US Corporate Index,NASDAQ,etf
IGV,Equity,All Cap,North America,2001-07-10,iShares Expanded Tech-Software Sector ETF,5924762271.32,366.858345,2021-02-02,464287515,16150000,"Feb 02, 2021",0.46,0.46,S&P North American Expanded Technology Software Index,Cboe BZX formerly known as BATS,etf
IHAK,Equity,Large/Mid Cap,Global,2019-06-11,iShares Cybersecurity and Tech ETF,350970214.59,42.032361,2021-02-02,46435U135,8350000,"Feb 02, 2021",0.47,0.47,NYSE FactSet Global Cyber Security Index,NYSE Arca,etf
IHE,Equity,All Cap,North America,2006-05-01,iShares U.S. Pharmaceuticals ETF,363616596.15,181.808298,2021-02-02,464288836,2000000,"Feb 02, 2021",0.42,0.42,Dow Jones U.S. Select Pharmaceuticals Index,NYSE Arca,etf
IHF,Equity,All Cap,North America,2006-05-01,iShares U.S. Healthcare Providers ETF,1151757149.65,242.475189,2021-02-02,464288828,4750000,"Feb 02, 2021",0.42,0.42,Dow Jones U.S. Select Healthcare Providers Index,NYSE Arca,etf
IHI,Equity,All Cap,North America,2006-05-01,iShares U.S. Medical Devices ETF,8871726965.29,339.262981,2021-02-02,464288810,26150000,"Feb 02, 2021",0.42,0.42,Dow Jones U.S. Select Medical Equipment Index,NYSE Arca,etf
IJH,Equity,Mid Cap,North America,2000-05-22,iShares Core S&P Mid-Cap ETF,55461672491.7,241.085297,2021-02-02,464287507,230050000,"Feb 02, 2021",0.05,0.05,S&P MidCap 400 Index,NYSE Arca,etf
IJJ,Equity,Mid Cap,North America,2000-07-24,iShares S&P Mid-Cap 400 Value ETF,6860923548.74,89.802664,2021-02-02,464287705,76400000,"Feb 02, 2021",0.18,0.18,S&P MidCap 400(R) Value Index,NYSE Arca,etf
IJK,Equity,Mid Cap,North America,2000-07-24,iShares S&P Mid-Cap 400 Growth ETF,7933246104.08,76.35463,2021-02-02,464287606,103900000,"Feb 02, 2021",0.17,0.17,S&P MidCap 400(R) Growth Index,NYSE Arca,etf
IJR,Equity,Small Cap,North America,2000-05-22,iShares Core S&P Small-Cap ETF,61580825306.65,99.588947,2021-02-02,464287804,618350000,"Feb 02, 2021",0.06,0.06,S&P SmallCap 600 Index,NYSE Arca,etf
IJS,Equity,Small Cap,North America,2000-07-24,iShares S&P Small-Cap 600 Value ETF,7241317046.81,87.56127,2021-02-02,464287879,82700000,"Feb 02, 2021",0.18,0.18,S&P SmallCap 600(R) Value Index,NYSE Arca,etf
IJT,Equity,Small Cap,North America,2000-07-24,iShares S&P Small-Cap 600 Growth ETF,6127767487.23,124.421675,2021-02-02,464287887,49250000,"Feb 02, 2021",0.18,0.18,S&P SmallCap 600(R) Growth Index,NASDAQ,etf
ILF,Equity,Large Cap,Latin America,2001-10-25,iShares Latin America 40 ETF,1681965890.09,28.268334,2021-02-02,464287390,59500000,"Feb 02, 2021",0.48,0.48,S&P Latin America 40 Index,NYSE Arca,etf
ILTB,Fixed Income,Multi Sectors,North America,2009-12-08,iShares Core 10+ Year USD Bond ETF,449871854.01,73.749484,2021-02-02,464289479,6100000,"Feb 02, 2021",0.06,0.06,Bloomberg Barclays U.S. Universal 10+ Year Index,NYSE Arca,etf
IMTB,Fixed Income,Multi Sectors,North America,2016-11-01,iShares Core 5-10 Year USD Bond ETF,125063432.98,52.109764,2021-02-02,46435G417,2400000,"Feb 02, 2021",0.06,0.07,Bloomberg Barclays US Universal 5-10 Years Index,NYSE Arca,etf
IMTM,Equity,Large/Mid Cap,Global,2015-01-13,iShares MSCI Intl Momentum Factor ETF,724288626.46,38.32215,2021-02-03,46434V449,18900000,"Feb 03, 2021",0.3,0.3,MSCI World ex USA Momentum Index,NYSE Arca,etf
INDA,Equity,Large/Mid Cap,Asia Pacific,2012-02-02,iShares MSCI India ETF,5112243994.94,41.445026,2021-02-02,46429B598,123350000,"Feb 02, 2021",0.64,0.69,MSCI India Index,Cboe BZX formerly known as BATS,etf
INDY,Equity,Large Cap,Asia Pacific,2009-11-18,iShares India 50 ETF,698727760.19,44.647141,2021-02-02,464289529,15650000,"Feb 02, 2021",0.89,0.93,Nifty 50 Index,NASDAQ,etf
INTF,Equity,Large/Mid Cap,Global,2015-04-28,iShares MSCI Intl Multifactor ETF,929348259.46,27.5771,2021-02-02,46434V274,33700000,"Feb 02, 2021",0.3,0.3,MSCI World ex USA Diversified Multiple-Factor Index,NYSE Arca,etf
IOO,Equity,Large Cap,Global,2000-12-05,iShares Global 100 ETF,2885587042.24,64.410425,2021-02-02,464287572,44800000,"Feb 02, 2021",0.4,0.4,S&P Global 100 Index,NYSE Arca,etf
IPAC,Equity,All Cap,Asia Pacific,2014-06-10,iShares Core MSCI Pacific ETF,1114643190.57,65.183812,2021-02-02,46434V696,17100000,"Feb 02, 2021",0.09,0.09,MSCI Pacific Investable Market Index,NYSE Arca,etf
IPFF,Others,Others,Global,2011-11-15,iShares International Preferred Stock ETF,44765322.47,15.707131,2021-02-02,46429B135,2850000,"Feb 02, 2021",0.55,0.55,S&P International Preferred Stock Index,Cboe BZX formerly known as BATS,etf
IQLT,Equity,Large/Mid Cap,Global,2015-01-13,iShares MSCI Intl Quality Factor ETF,2825712633.35,35.859297,2021-02-03,46434V456,78800000,"Feb 03, 2021",0.3,0.3,MSCI World ex USA Sector Neutral Quality Index,NYSE Arca,etf
IRBO,Equity,All Cap,Global,2018-06-26,iShares Robotics and Artificial Intelligence Multisector ETF,365381147.72,45.672643,2021-02-02,46435U556,8000000,"Feb 02, 2021",0.47,0.47,NYSE FactSet Global Robotics and Artificial Intelligence Index,NYSE Arca,etf
ISCF,Equity,Small Cap,Global,2015-04-28,iShares MSCI Intl Small-Cap Multifactor ETF,159379525.42,33.910537,2021-02-02,46434V266,4700000,"Feb 02, 2021",0.4,0.4,MSCI World exUSA Small Cap Diversified Multiple-Factor Index,NYSE Arca,etf
ISHG,Fixed Income,Government,Global,2009-01-21,iShares 1-3 Year International Treasury Bond ETF,58575674.01,83.679534,2021-02-02,464288125,700000,"Feb 02, 2021",0.35,0.35,FTSE World Government Bond Index-Dev Markets 1-3 Years Capped Select Index,NASDAQ,etf
ISTB,Fixed Income,Multi Sectors,North America,2012-10-18,iShares Core 1-5 Year USD Bond ETF,4834310917.22,51.538496,2021-02-02,46432F859,93800000,"Feb 02, 2021",0.06,0.06,Bloomberg Barclays U.S. Universal 1-5 Year Index,NASDAQ,etf
ISZE,Equity,Large/Mid Cap,Global,2015-06-16,iShares MSCI Intl Size Factor ETF,30053423.88,30.053424,2021-02-03,46435G508,1000000,"Feb 03, 2021",0.3,0.3,MSCI World ex USA Low Size Index,NYSE Arca,etf
ITA,Equity,All Cap,North America,2006-05-01,iShares U.S. Aerospace & Defense ETF,2698352439.37,93.207338,2021-02-02,464288760,28950000,"Feb 02, 2021",0.42,0.42,Dow Jones U.S. Select Aerospace & Defense Index,Cboe BZX formerly known as BATS,etf
ITB,Equity,All Cap,North America,2006-05-01,iShares U.S. Home Construction ETF,2265997527.97,60.669278,2021-02-02,464288752,37350000,"Feb 02, 2021",0.42,0.42,Dow Jones U.S. Select Home Construction Index,Cboe BZX formerly known as BATS,etf
ITOT,Equity,All Cap,North America,2004-01-20,iShares Core S&P Total U.S. Stock Market ETF,33557400011.67,88.729244,2021-02-02,464287150,378200000,"Feb 02, 2021",0.03,0.03,S&P Total Market Index (TMI),NYSE Arca,etf
IUSB,Fixed Income,Multi Sectors,North America,2014-06-10,iShares Core Total USD Bond Market ETF,9785879783.27,54.03578,2021-02-02,46434V613,181100000,"Feb 02, 2021",0.06,0.07,Bloomberg Barclays U.S. Universal Index,NASDAQ,etf
IUSG,Equity,All Cap,North America,2000-07-24,iShares Core S&P U.S. Growth ETF,10537118497.09,91.587297,2021-02-02,464287671,115050000,"Feb 02, 2021",0.04,0.04,S&P 900 Growth Index,NASDAQ,etf
IUSV,Equity,All Cap,North America,2000-07-24,iShares Core S&P U.S. Value ETF,7767951568.27,62.745974,2021-02-02,464287663,123800000,"Feb 02, 2021",0.04,0.04,S&P 900 Value Index,NASDAQ,etf
IVE,Equity,Large Cap,North America,2000-05-22,iShares S&P 500 Value ETF,18729025558.25,128.943377,2021-02-02,464287408,145250000,"Feb 02, 2021",0.18,0.18,S&P 500(R) Value Index,NYSE Arca,etf
IVLU,Equity,Large/Mid Cap,Global,2015-06-16,iShares MSCI Intl Value Factor ETF,599818271.78,23.339232,2021-02-03,46435G409,25700000,"Feb 03, 2021",0.3,0.3,MSCI World ex USA Enhanced Value Index,NYSE Arca,etf
IVV,Equity,Large Cap,North America,2000-05-15,iShares Core S&P 500 ETF,240827571184.68,382.965049,2021-02-02,464287200,628850000,"Feb 02, 2021",0.03,0.03,S&P 500 Index,NYSE Arca,etf
IVW,Equity,Large Cap,North America,2000-05-22,iShares S&P 500 Growth ETF,32651526877.88,65.829691,2021-02-02,464287309,496000000,"Feb 02, 2021",0.18,0.18,S&P 500(R) Growth Index,NYSE Arca,etf
IWB,Equity,Large/Mid Cap,North America,2000-05-15,iShares Russell 1000 ETF,26094007695.94,216.817679,2021-02-02,464287622,120350000,"Feb 02, 2021",0.15,0.15,Russell 1000 Index,NYSE Arca,etf
IWC,Equity,Small Cap,North America,2005-08-12,iShares Micro-Cap ETF,1154888636.3,138.310016,2021-02-02,464288869,8350000,"Feb 02, 2021",0.6,0.6,Russell Microcap(R) Index,NYSE Arca,etf
IWD,Equity,Large/Mid Cap,North America,2000-05-22,iShares Russell 1000 Value ETF,44187188057.51,138.887908,2021-02-02,464287598,318150000,"Feb 02, 2021",0.19,0.19,Russell 1000 Value Index,NYSE Arca,etf
IWF,Equity,Large/Mid Cap,North America,2000-05-22,iShares Russell 1000 Growth ETF,65033791968.74,248.315357,2021-02-02,464287614,261900000,"Feb 02, 2021",0.19,0.19,Russell 1000 Growth Index,NYSE Arca,etf
IWFH,Equity,All Cap,Global,2020-09-29,iShares Virtual Work and Life Multisector ETF,6566761.95,32.83381,2021-02-03,46436E585,200000,"Feb 03, 2021",0.47,0.47,NYSE FactSet Global Virtual Work and Life Index,NYSE Arca,etf
IWL,Equity,Large Cap,North America,2009-09-22,iShares Russell Top 200 ETF,866697946.94,92.201909,2021-02-02,464289446,9400000,"Feb 02, 2021",0.15,0.15,Russell Top 200 Index,NYSE Arca,etf
IWM,Equity,Small Cap,North America,2000-05-22,iShares Russell 2000 ETF,62256677654.14,213.573508,2021-02-02,464287655,291500000,"Feb 02, 2021",0.19,0.19,Russell 2000 Index,NYSE Arca,etf
IWN,Equity,Small Cap,North America,2000-07-24,iShares Russell 2000 Value ETF,13231675400.21,142.27608,2021-02-02,464287630,93000000,"Feb 02, 2021",0.24,0.24,Russell 2000 Value Index,NYSE Arca,etf
IWO,Equity,Small Cap,North America,2000-07-24,iShares Russell 2000 Growth ETF,12746893619.08,314.738114,2021-02-02,464287648,40500000,"Feb 02, 2021",0.24,0.24,Russell 2000 Growth Index,NYSE Arca,etf
IWP,Equity,Mid Cap,North America,2001-07-17,iShares Russell Mid-Cap Growth ETF,15485937110.78,106.505757,2021-02-02,464287481,145400000,"Feb 02, 2021",0.24,0.24,Russell MidCap Growth Index,NYSE Arca,etf
IWR,Equity,Mid Cap,North America,2001-07-17,iShares Russell Mid-Cap ETF,25619755221.22,70.577838,2021-02-02,464287499,363000000,"Feb 02, 2021",0.19,0.19,Russell MidCap Index,NYSE Arca,etf
IWS,Equity,Mid Cap,North America,2001-07-17,iShares Russell Mid-Cap Value ETF,12001511667.59,99.350262,2021-02-02,464287473,120800000,"Feb 02, 2021",0.24,0.24,Russell MidCap Value Index,NYSE Arca,etf
IWV,Equity,All Cap,North America,2000-05-22,iShares Russell 3000 ETF,10756748609.77,229.845056,2021-02-02,464287689,46800000,"Feb 02, 2021",0.2,0.2,Russell 3000 Index,NYSE Arca,etf
IWX,Equity,Large Cap,North America,2009-09-22,iShares Russell Top 200 Value ETF,977970991.96,58.561137,2021-02-02,464289420,16700000,"Feb 02, 2021",0.2,0.2,Russell Top 200 Value Index,NYSE Arca,etf
IWY,Equity,Large Cap,North America,2009-09-22,iShares Russell Top 200 Growth ETF,3554659449.02,136.717671,2021-02-02,464289438,26000000,"Feb 02, 2021",0.2,0.2,Russell Top 200 Growth Index,NYSE Arca,etf
IXC,Equity,All Cap,Global,2001-11-12,iShares Global Energy ETF,1034298916.0,21.086624,2021-02-02,464287341,49050000,"Feb 02, 2021",0.46,0.46,S&P Global 1200 Energy Sector Index(TM),NYSE Arca,etf
IXG,Equity,All Cap,Global,2001-11-12,iShares Global Financials ETF,368025149.56,65.718777,2021-02-02,464287333,5600000,"Feb 02, 2021",0.46,0.46,S&P Global 1200 Financials Sector Index(TM),NYSE Arca,etf
IXJ,Equity,All Cap,Global,2001-11-13,iShares Global Healthcare ETF,2546347606.48,77.279138,2021-02-02,464287325,32950000,"Feb 02, 2021",0.46,0.46,S&P Global 1200 Healthcare Sector Index(TM),NYSE Arca,etf
IXN,Equity,All Cap,Global,2001-11-12,iShares Global Tech ETF,5139319564.9,311.473913,2021-02-02,464287291,16500000,"Feb 02, 2021",0.46,0.46,S&P Global 1200 Information Technology Sector Index(TM),NYSE Arca,etf
IXP,Equity,All Cap,Global,2001-11-12,iShares Global Comm Services ETF,306774830.59,77.664514,2021-02-02,464287275,3950000,"Feb 02, 2021",0.46,0.46,S&P Global 1200 Communication Services 4.5/22.5/45 Capped Index,NYSE Arca,etf
IXUS,Equity,All Cap,Global,2012-10-18,iShares Core MSCI Total International Stock ETF,25908989754.25,69.127507,2021-02-02,46432F834,374800000,"Feb 02, 2021",0.09,0.09,MSCI ACWI ex USA IMI Index,NASDAQ,etf
IYC,Equity,All Cap,North America,2000-06-12,iShares U.S. Consumer Services ETF,1285564910.71,71.222433,2021-02-02,464287580,18050000,"Feb 02, 2021",0.43,0.43,Dow Jones U.S. Consumer Services Capped Index,NYSE Arca,etf
IYE,Equity,All Cap,North America,2000-06-12,iShares U.S. Energy ETF,525742387.06,21.415169,2021-02-02,464287796,24550000,"Feb 02, 2021",0.42,0.42,Dow Jones U.S. Oil & Gas Index,NYSE Arca,etf
IYF,Equity,All Cap,North America,2000-05-22,iShares U.S. Financials ETF,1582503683.09,67.628363,2021-02-02,464287788,23400000,"Feb 02, 2021",0.42,0.42,Dow Jones U.S. Financials Capped Index,NYSE Arca,etf
IYG,Equity,All Cap,North America,2000-06-12,iShares U.S. Financial Services ETF,1253584911.34,151.949686,2021-02-02,464287770,8250000,"Feb 02, 2021",0.42,0.42,Dow Jones U.S. Financial Services Index,NYSE Arca,etf
IYH,Equity,All Cap,North America,2000-06-12,iShares U.S. Healthcare ETF,2582068730.82,253.143993,2021-02-02,464287762,10200000,"Feb 02, 2021",0.43,0.43,Dow Jones U.S. Health Care Index,NYSE Arca,etf
IYJ,Equity,All Cap,North America,2000-06-12,iShares U.S. Industrials ETF,1308862148.92,96.594993,2021-02-02,464287754,13550000,"Feb 02, 2021",0.42,0.42,Dow Jones U.S. Industrials Index,Cboe BZX formerly known as BATS,etf
IYK,Equity,All Cap,North America,2000-06-12,iShares U.S. Consumer Goods ETF,765964216.19,178.131213,2021-02-02,464287812,4300000,"Feb 02, 2021",0.43,0.43,Dow Jones U.S. Consumer Goods Index,NYSE Arca,etf
IYLD,Multi Asset,Static Allocation,Global,2012-04-03,iShares Morningstar Multi-Asset Income ETF,262921086.97,23.793764,2021-02-02,46432F875,11050000,"Feb 02, 2021",0.25,0.63,Morningstar Multi-Asset High Income Index,Cboe BZX formerly known as BATS,etf
IYM,Equity,All Cap,North America,2000-06-12,iShares U.S. Basic Materials ETF,622711240.62,114.258943,2021-02-02,464287838,5450000,"Feb 02, 2021",0.43,0.43,Dow Jones U.S. Basic Materials Index,NYSE Arca,etf
IYR,Real Estate,Real Estate Securities,North America,2000-06-12,iShares U.S. Real Estate ETF,4314304310.41,87.778318,2021-02-02,464287739,49150000,"Feb 02, 2021",0.42,0.42,Dow Jones U.S. Real Estate Capped Index,NYSE Arca,etf
IYT,Equity,All Cap,North America,2003-10-06,iShares Transportation Average ETF,1608218308.59,220.303878,2021-02-02,464287192,7300000,"Feb 02, 2021",0.42,0.42,Dow Jones Transportation Average Index,Cboe BZX formerly known as BATS,etf
IYW,Equity,All Cap,North America,2000-05-15,iShares U.S. Technology ETF,7110059385.48,89.322354,2021-02-02,464287721,79600000,"Feb 02, 2021",0.43,0.43,Dow Jones U.S. Technology Capped Index,NYSE Arca,etf
IYY,Equity,All Cap,North America,2000-06-12,iShares Dow Jones U.S. ETF,1493370502.59,96.658285,2021-02-02,464287846,15450000,"Feb 02, 2021",0.2,0.2,Dow Jones U.S. Index,NYSE Arca,etf
IYZ,Equity,All Cap,North America,2000-05-22,iShares U.S. Telecommunications ETF,404564423.7,31.001105,2021-02-02,464287713,13050000,"Feb 02, 2021",0.42,0.42,Dow Jones U.S. Select Telecommunications Index,Cboe BZX formerly known as BATS,etf
JKD,Equity,Large Cap,North America,2004-06-28,iShares Morningstar Large-Cap ETF,851150294.59,218.243665,2021-02-02,464287127,3900000,"Feb 02, 2021",0.2,0.2,Morningstar Large Core Index,NYSE Arca,etf
JKE,Equity,Large Cap,North America,2004-06-28,iShares Morningstar Large-Cap Growth ETF,1899832349.91,301.56069,2021-02-02,464287119,6300000,"Feb 02, 2021",0.25,0.25,Morningstar Large Growth Index,NYSE Arca,etf
JKF,Equity,Large Cap,North America,2004-06-28,iShares Morningstar Large-Cap Value ETF,552531019.05,112.761432,2021-02-02,464288109,4900000,"Feb 02, 2021",0.25,0.25,Morningstar Large Value Index,NYSE Arca,etf
JKG,Equity,Mid Cap,North America,2004-06-28,iShares Morningstar Mid-Cap ETF,823503396.89,238.696637,2021-02-02,464288208,3450000,"Feb 02, 2021",0.25,0.25,Morningstar Mid Core Index,NYSE Arca,etf
JKH,Equity,Mid Cap,North America,2004-06-28,iShares Morningstar Mid-Cap Growth ETF,1588394754.13,397.098689,2021-02-02,464288307,4000000,"Feb 02, 2021",0.3,0.3,Morningstar Mid Growth Index,NYSE Arca,etf
JKI,Equity,Mid Cap,North America,2004-06-28,iShares Morningstar Mid-Cap Value ETF,377634291.4,160.695443,2021-02-02,464288406,2350000,"Feb 02, 2021",0.3,0.3,Morningstar Mid Value Index,NASDAQ,etf
JKJ,Equity,Small Cap,North America,2004-06-28,iShares Morningstar Small-Cap ETF,230874926.67,209.886297,2021-02-02,464288505,1100000,"Feb 02, 2021",0.25,0.25,Morningstar Small Core Index,NYSE Arca,etf
JKK,Equity,Small Cap,North America,2004-06-28,iShares Morningstar Small-Cap Growth ETF,827198811.35,330.879525,2021-02-02,464288604,2500000,"Feb 02, 2021",0.3,0.3,Morningstar Small Growth Index,NYSE Arca,etf
JKL,Equity,Small Cap,North America,2004-06-28,iShares Morningstar Small-Cap Value ETF,336918201.78,146.486175,2021-02-02,464288703,2300000,"Feb 02, 2021",0.3,0.3,Morningstar Small Value Index,NYSE Arca,etf
JPXN,Equity,Large/Mid Cap,Asia Pacific,2001-10-23,iShares JPX-Nikkei 400 ETF,87231148.2,72.692624,2021-02-02,464287382,1200000,"Feb 02, 2021",0.48,0.48,JPX-Nikkei Index 400,NYSE Arca,etf
JXI,Equity,All Cap,Global,2006-09-12,iShares Global Utilities ETF,146774007.21,59.907758,2021-02-02,464288711,2450000,"Feb 02, 2021",0.46,0.46,S&P Global 1200 Utilities Sector Index(TM),NYSE Arca,etf
KSA,Equity,All Cap,Middle East and Africa,2015-09-16,iShares MSCI Saudi Arabia ETF,637218965.89,30.709348,2021-02-03,46434V423,20750000,"Feb 03, 2021",0.74,0.74,MSCI Saudi Arabia IMI 25/50 Index,NYSE Arca,etf
KWT,Equity,All Cap,-,2020-09-01,iShares MSCI Kuwait ETF,15357857.62,27.923377,2021-02-03,46436E817,550000,"Feb 03, 2021",0.74,0.74,MSCI All Kuwait Select Size Liquidity Capped Index,Cboe BZX formerly known as BATS,etf
KXI,Equity,All Cap,Global,2006-09-12,iShares Global Consumer Staples ETF,509919794.14,56.344729,2021-02-02,464288737,9050000,"Feb 02, 2021",0.46,0.46,S&P Global 1200 Consumer Staples Sector Capped Index,NYSE Arca,etf
LDEM,Equity,Large/Mid Cap,Global,2020-02-05,iShares ESG MSCI EM Leaders ETF,876946708.99,65.200499,2021-02-03,46436E601,13450000,"Feb 03, 2021",0.16,0.16,MSCI EM Extended ESG Leaders 5% Issuer Capped Net Index,NASDAQ,etf
LEMB,Fixed Income,Government,Global,2011-10-18,iShares J.P. Morgan EM Local Currency Bond ETF,529935517.65,44.90979,2021-02-02,464286517,11800000,"Feb 02, 2021",0.3,0.3,J.P. Morgan GBI-EM Global Diversified 15% Cap 4.5% Floor Index,NYSE Arca,etf
LQD,Fixed Income,Credit,North America,2002-07-22,iShares iBoxx $ Investment Grade Corporate Bond ETF,50709032290.08,135.152005,2021-02-02,464287242,375200000,"Feb 02, 2021",0.14,0.14,Markit iBoxx USD Liquid Investment Grade Index,NYSE Arca,etf
LQDH,Fixed Income,Credit,North America,2014-05-27,iShares Interest Rate Hedged Corporate Bond ETF,466514099.13,95.206959,2021-02-02,46431W705,4900000,"Feb 02, 2021",0.3,0.44,Markit iBoxx USD Liquid Investment Grade Interest Rate Hedged Swaps Index,NYSE Arca,etf
LQDI,Fixed Income,Credit,North America,2018-05-08,iShares Inflation Hedged Corporate Bond ETF,27603412.37,29.056224,2021-02-03,46431W580,950000,"Feb 03, 2021",0.2,0.34,iBoxx USD Liquid Investment Grade Inflation Hedged Index,Cboe BZX formerly known as BATS,etf
LRGF,Equity,Large/Mid Cap,North America,2015-04-28,iShares MSCI USA Multifactor ETF,916666036.86,38.759663,2021-02-02,46434V282,23650000,"Feb 02, 2021",0.2,0.2,MSCI USA Diversified Multiple-Factor Index,NYSE Arca,etf
MAIIX,Equity,All Cap,Global,1997-04-09,iShares MSCI EAFE International Index Fund,1015674406.07,14.78,2021-02-02,09253F408,,,,,MSCI EAFE Index (Net Total Return),,mf
MASKX,Equity,Small Cap,North America,1997-04-09,iShares Russell 2000 Small-Cap Index Fund,369978946.77,26.36,2021-02-02,09253F804,,,,,Russell 2000 Index (Gross Total Return),,mf
MBB,Fixed Income,Mortgages,North America,2007-03-13,iShares MBS ETF,26326745176.04,110.153746,2021-02-02,464288588,239000000,"Feb 02, 2021",0.06,0.07,Bloomberg Barclays US Mortgage Backed Securities Index,NASDAQ,etf
MCHI,Equity,Large/Mid Cap,Asia Pacific,2011-03-29,iShares MSCI China ETF,7313398147.18,90.962664,2021-02-02,46429B671,80400000,"Feb 02, 2021",0.59,0.59,MSCI China Index,NASDAQ,etf
MDIIX,Equity,All Cap,Global,1997-04-09,iShares MSCI EAFE International Index Fund,349009937.6,14.68,2021-02-02,09253F309,,,,,MSCI EAFE Index (Net Total Return),,mf
MDSKX,Equity,Small Cap,North America,1997-04-09,iShares Russell 2000 Small-Cap Index Fund,279208086.41,26.38,2021-02-02,09253F705,,,,,Russell 2000 Index (Gross Total Return),,mf
MEAR,Fixed Income,Municipals,North America,2015-03-03,BlackRock Short Maturity Municipal Bond ETF,291353992.82,50.233447,2021-02-03,46431W838,5800000,"Feb 03, 2021",0.25,0.25,Bloomberg Barclays Municipal Bond: 1 Year (1-2) Index,Cboe BZX formerly known as BATS,etf
MIDF,Equity,Mid Cap,North America,2019-06-04,iShares MSCI USA Mid-Cap Multifactor ETF,3265987.91,32.659879,2021-02-02,46435U143,100000,"Feb 02, 2021",0.25,0.25,MSCI USA Mid Cap Diversified Multiple-Factor Index,NYSE Arca,etf
MTUM,Equity,Large/Mid Cap,North America,2013-04-16,iShares MSCI USA Momentum Factor ETF,15013954942.26,171.39218,2021-02-02,46432F396,87600000,"Feb 02, 2021",0.15,0.15,MSCI USA Momentum SR Variant Index,Cboe BZX formerly known as BATS,etf
MUB,Fixed Income,Municipals,North America,2007-09-07,iShares National Muni Bond ETF,21105847201.86,117.254707,2021-02-02,464288414,180000000,"Feb 02, 2021",0.07,0.07,S&P National AMT-Free Municipal Bond Index,NYSE Arca,etf
MXI,Equity,All Cap,Global,2006-09-12,iShares Global Materials ETF,631274152.43,81.983656,2021-02-02,464288695,7700000,"Feb 02, 2021",0.45,0.45,S&P Global 1200 Materials Sector Index(TM),NYSE Arca,etf
NEAR,Fixed Income,Multi Sectors,North America,2013-09-25,BlackRock Short Maturity Bond ETF,4561296880.6,50.2069,2021-02-02,46431W507,90850000,"Feb 02, 2021",0.25,0.26,,Cboe BZX formerly known as BATS,etf
