ticker,asset_class,sub_class,region,inception,name,net_assets,nav,nav_as_of,cusip,shares_outstanding,shares_outstanding_as_of,mgmt_fee,expense_ratio,benchmark_index,exchange,type
AAXJ,Equity,Large/Mid Cap,Asia Pacific,2008-08-13,iShares MSCI All Country Asia ex Japan ETF,6581392368.22,91.918888,2021-03-29,464288182,71600000,"Mar 29, 2021",0.7,0.7,MSCI AC Asia ex Japan Index,NASDAQ,etf
ACWF,Equity,Large/Mid Cap,Global,2015-04-28,iShares MSCI Global Multifactor ETF,102712344.08,36.039419,2021-03-29,46434V316,2850000,"Mar 29, 2021",0.35,0.35,MSCI ACWI Diversified Multiple-Factor Index,NYSE Arca,etf
ACWI,Equity,Large/Mid Cap,Global,2008-03-26,iShares MSCI ACWI ETF,15793912973.42,94.915342,2021-03-29,464288257,166400000,"Mar 29, 2021",0.32,0.33,MSCI ACWI Index,NASDAQ,etf
ACWV,Equity,Large/Mid Cap,Global,2011-10-18,iShares MSCI Global Min Vol Factor ETF,5227014217.25,99.562176,2021-03-29,464286525,52500000,"Mar 29, 2021",0.32,0.32,MSCI All Country World Minimum Volatility Index,Cboe BZX formerly known as BATS,etf
ACWX,Equity,Large/Mid Cap,Global,2008-03-26,iShares MSCI ACWI ex U.S. ETF,4095658486.2,55.049173,2021-03-29,464288240,74400000,"Mar 29, 2021",0.32,0.34,MSCI ACWI ex USA Index,NASDAQ,etf
AGG,Fixed Income,Multi Sectors,North America,2003-09-22,iShares Core U.S. Aggregate Bond ETF,84199532778.97,113.675621,2021-03-29,464287226,740700000,"Mar 29, 2021",0.04,0.04,Bloomberg Barclays US Aggregate Bond Index,NYSE Arca,etf
AGT,Equity,All Cap,Latin America,2017-04-25,iShares MSCI Argentina and Global Exposure ETF,7234292.37,24.114308,2021-03-29,46435G276,300000,"Mar 29, 2021",0.59,0.59,MSCI All Argentina 25/50 Index,Cboe BZX formerly known as BATS,etf
AGZ,Fixed Income,Government,North America,2008-11-05,iShares Agency Bond ETF,753040536.55,117.662584,2021-03-29,464288166,6400000,"Mar 29, 2021",0.2,0.2,Bloomberg Barclays U.S. Agency Bond Index,NYSE Arca,etf
AIA,Equity,Large Cap,Asia Pacific,2007-11-13,iShares Asia 50 ETF,3166322606.57,90.725576,2021-03-29,464288430,34900000,"Mar 29, 2021",0.5,0.5,S&P Asia 50 Index,NASDAQ,etf
AMCA,Equity,Large/Mid Cap,North America,2017-08-08,iShares Russell 1000 Pure U.S. Revenue ETF,3457078.08,34.570781,2021-03-29,46435G169,100000,"Mar 29, 2021",0.15,0.15,Russell 1000 Pure Domestic Exposure Index,NASDAQ,etf
AOA,Multi Asset,Static Allocation,Global,2008-11-04,iShares Core Aggressive Allocation ETF,1293462712.45,66.845618,2021-03-29,464289859,19350000,"Mar 29, 2021",0.25,0.31,S&P Target Risk Aggressive Index,NYSE Arca,etf
AOK,Multi Asset,Static Allocation,Global,2008-11-04,iShares Core Conservative Allocation ETF,878187626.54,38.601654,2021-03-29,464289883,22750000,"Mar 29, 2021",0.25,0.31,S&P Target Risk Conservative Index,NYSE Arca,etf
AOM,Multi Asset,Static Allocation,Global,2008-11-04,iShares Core Moderate Allocation ETF,1542312824.52,43.506709,2021-03-29,464289875,35450000,"Mar 29, 2021",0.25,0.3,S&P Target Risk Moderate Index,NYSE Arca,etf
AOR,Multi Asset,Static Allocation,Global,2008-11-04,iShares Core Growth Allocation ETF,1712381160.57,53.511911,2021-03-29,464289867,32000000,"Mar 29, 2021",0.25,0.31,S&P Target Risk Growth Index,NYSE Arca,etf
BAIPX,Fixed Income,Inflation,North America,2016-02-16,iShares Short-Term TIPS Bond Index Fund,1502993.63,10.44,2021-03-29,09258N877,,,,,BBG Barc US TIPS 0-5 Years Index,,mf
BARDX,Real Estate,Real Estate Securities,Global,2015-08-13,iShares Developed Real Estate Index Fund,1666090.4,10.49,2021-03-29,091936211,,,,,FTSE EPRA Nareit Developed Index (Net) in USD,,mf
BASMX,Equity,All Cap,North America,2015-08-13,iShares Total U.S. Stock Market Index Fund,133424196.78,19.02,2021-03-29,091936179,,,,,Russell 3000 Index,,mf
BDBKX,Equity,Small Cap,North America,2011-03-31,iShares Russell 2000 Small-Cap Index Fund,2083028816.56,26.56,2021-03-29,09253F887,,,,,Russell 2000 Index (Gross Total Return),,mf
BDBPX,Equity,Small Cap,North America,2018-08-06,iShares Russell 2000 Small-Cap Index Fund,354488102.62,26.41,2021-03-29,066923244,,,,,Russell 2000 Index (Gross Total Return),,mf
BDOAX,Equity,Large Cap,Global,2011-06-30,iShares MSCI Total International Index Fund,379509152.63,10.44,2021-03-29,066923624,,,,,MSCI All Country World ex US Index (Net TR),,mf
BDOIX,Equity,Large Cap,Global,2011-06-30,iShares MSCI Total International Index Fund,168030303.02,10.48,2021-03-29,066923616,,,,,MSCI All Country World ex US Index (Net TR),,mf
BDOKX,Equity,Large Cap,Global,2011-06-30,iShares MSCI Total International Index Fund,752040597.29,10.81,2021-03-29,066923590,,,,,MSCI All Country World ex US Index (Net TR),,mf
BFTR,Equity,Mid/Small Cap,North America,2020-09-29,BlackRock Future Innovators ETF,18286077.41,45.715194,2021-03-29,09290C202,400000,"Mar 29, 2021",0.8,0.8,Russell 2500 Growth Index,NYSE Arca,etf
BGRN,Fixed Income,Multi Sectors,Global,2018-11-13,iShares Global Green Bond ETF,201613575.16,54.490155,2021-03-29,46435U440,3700000,"Mar 29, 2021",0.25,0.25,Bloomberg Barclays MSCI Global Green Bond Select (USD Hedged) Index,NASDAQ,etf
BIDAX,Fixed Income,Municipals,North America,2018-11-16,iShares Municipal Bond Index Fund,23267513.85,12.17,2021-03-29,09258N356,,,,,ICE BofA US Municipal Securities Index,,mf
BIDIX,Fixed Income,Municipals,North America,2018-11-16,iShares Municipal Bond Index Fund,7961478.18,12.17,2021-03-29,09258N349,,,,,ICE BofA US Municipal Securities Index,,mf
BIDKX,Fixed Income,Municipals,North America,2018-11-16,iShares Municipal Bond Index Fund,105993.02,12.17,2021-03-29,09258N331,,,,,ICE BofA US Municipal Securities Index,,mf
BIDPX,Fixed Income,Municipals,North America,2018-11-16,iShares Municipal Bond Index Fund,310751691.52,12.17,2021-03-29,066923210,,,,,ICE BofA US Municipal Securities Index,,mf
BIEVX,Equity,Large Cap,Global,2016-07-13,iShares Edge MSCI Min Vol EAFE Index Fund,8402799.23,7.4658,2021-02-10,09258N588,,,,,MSCI EAFE Minimum Volatility (USD Optimized) Index - USD Net,,mf
BIIPX,Fixed Income,Inflation,North America,2016-02-16,iShares Short-Term TIPS Bond Index Fund,16093611.04,10.4,2021-03-29,09258N885,,,,,BBG Barc US TIPS 0-5 Years Index,,mf
BIMVX,Equity,Large Cap,North America,2016-07-13,iShares Edge MSCI Min Vol USA Index Fund,23389736.48,8.8574,2021-02-10,09258N638,,,,,MSCI USA Minimum Volatility (USD Optimized) Index - USD Gross,,mf
BIRDX,Real Estate,Real Estate Securities,Global,2015-08-13,iShares Developed Real Estate Index Fund,44135207.12,10.52,2021-03-29,091936195,,,,,FTSE EPRA Nareit Developed Index (Net) in USD,,mf
BITSX,Equity,All Cap,North America,2015-08-13,iShares Total U.S. Stock Market Index Fund,110550565.87,19.05,2021-03-29,091936161,,,,,Russell 3000 Index,,mf
BKEVX,Equity,Large Cap,Global,2016-07-13,iShares Edge MSCI Min Vol EAFE Index Fund,9345505.91,7.4672,2021-02-10,09258N596,,,,,MSCI EAFE Minimum Volatility (USD Optimized) Index - USD Net,,mf
BKF,Equity,Large/Mid Cap,Global,2007-11-12,iShares MSCI BRIC ETF,166553492.4,52.047966,2021-03-29,464286657,3200000,"Mar 29, 2021",0.7,0.7,MSCI BRIC Index,NYSE Arca,etf
BKIPX,Fixed Income,Inflation,North America,2016-02-16,iShares Short-Term TIPS Bond Index Fund,46288706.78,10.44,2021-03-29,09258N869,,,,,BBG Barc US TIPS 0-5 Years Index,,mf
BKMVX,Equity,Large Cap,North America,2016-07-13,iShares Edge MSCI Min Vol USA Index Fund,13514167.26,8.8607,2021-02-10,09258N646,,,,,MSCI USA Minimum Volatility (USD Optimized) Index - USD Gross,,mf
BKRDX,Real Estate,Real Estate Securities,Global,2015-08-13,iShares Developed Real Estate Index Fund,2132235355.97,10.5,2021-03-29,091936187,,,,,FTSE EPRA Nareit Developed Index (Net) in USD,,mf
BKTSX,Equity,All Cap,North America,2015-08-13,iShares Total U.S. Stock Market Index Fund,1560617859.11,19.05,2021-03-29,091936153,,,,,Russell 3000 Index,,mf
BMED,Equity,Mid/Small Cap,Global,2020-09-29,BlackRock Future Health ETF,6570400.67,27.376669,2021-03-29,09290C400,240000,"Mar 29, 2021",0.85,0.85,MSCI All Country World Index,NYSE Arca,etf
BMOAX,Fixed Income,Multi Sectors,North America,2011-03-31,iShares U.S. Aggregate Bond Index Fund,153979649.54,10.47,2021-03-29,066923400,,,,,Bloomberg Barclays US Aggregate Bond Index,,mf
BMOIX,Fixed Income,Multi Sectors,North America,2011-03-31,iShares U.S. Aggregate Bond Index Fund,387254311.08,10.47,2021-03-29,066923509,,,,,Bloomberg Barclays US Aggregate Bond Index,,mf
BMOPX,Fixed Income,Multi Sectors,North America,2018-08-06,iShares U.S. Aggregate Bond Index Fund,7080972.44,10.47,2021-03-29,066923228,,,,,Bloomberg Barclays US Aggregate Bond Index,,mf
BRGAX,Equity,Large Cap,North America,2011-03-31,iShares Russell 1000 Large-Cap Index Fund,42504482.74,26.3,2021-03-29,066923103,,,,,Russell 1000 Index (Gross Total Return),,mf
BRGKX,Equity,Large Cap,North America,2011-03-31,iShares Russell 1000 Large-Cap Index Fund,460548922.64,26.38,2021-03-29,066923301,,,,,Russell 1000 Index (Gross Total Return),,mf
BRGNX,Equity,Large Cap,North America,2011-03-31,iShares Russell 1000 Large-Cap Index Fund,124429322.03,26.48,2021-03-29,066923202,,,,,Russell 1000 Index (Gross Total Return),,mf
BRMAX,Equity,Mid Cap,North America,2015-11-30,iShares Russell Mid-Cap Index Fund,122626623.44,13.66,2021-03-29,09258N307,,,,,Russell MidCap Index,,mf
BRMIX,Equity,Mid Cap,North America,2015-05-13,iShares Russell Mid-Cap Index Fund,213376130.14,13.72,2021-03-29,091936294,,,,,Russell MidCap Index,,mf
BRMKX,Equity,Mid Cap,North America,2015-05-13,iShares Russell Mid-Cap Index Fund,1192299488.76,13.74,2021-03-29,091936286,,,,,Russell MidCap Index,,mf
BSMAX,Equity,Mid/Small Cap,North America,2015-08-13,iShares Russell Small/Mid-Cap Index Fund,94034672.31,16.41,2021-03-29,091936245,,,,,Russell 2500 Total Return Index,,mf
BSMIX,Equity,Mid/Small Cap,North America,2015-08-13,iShares Russell Small/Mid-Cap Index Fund,124732700.78,16.44,2021-03-29,091936237,,,,,Russell 2500 Total Return Index,,mf
BSMKX,Equity,Mid/Small Cap,North America,2015-08-13,iShares Russell Small/Mid-Cap Index Fund,195835448.05,16.44,2021-03-29,091936229,,,,,Russell 2500 Total Return Index,,mf
BSPAX,Equity,Large Cap,North America,2013-04-11,iShares S&P 500 Index Fund,2687739389.18,470.8,2021-03-29,066923566,,,,,S&P 500 Index,,mf
BSPGX,Equity,Large Cap,North America,2019-07-01,iShares S&P 500 Index Fund,8197173539.57,471.34,2021-03-29,066923194,,,,,S&P 500 Index,,mf
BSPIX,Equity,Large Cap,North America,2013-04-11,iShares S&P 500 Index Fund,4212514064.82,471.16,2021-03-29,066923558,,,,,S&P 500 Index,,mf
BSPPX,Equity,Large Cap,North America,2018-08-06,iShares S&P 500 Index Fund,1436244914.29,470.39,2021-03-29,066923236,,,,,S&P 500 Index,,mf
BSPSX,Equity,Large Cap,North America,2013-04-22,iShares S&P 500 Index Fund,635323892.86,470.97,2021-03-29,066923533,,,,,S&P 500 Index,,mf
BTEK,Equity,Mid/Small Cap,Global,2020-09-29,BlackRock Future Tech ETF,15558278.71,32.413081,2021-03-29,09290C301,480000,"Mar 29, 2021",0.88,0.88,MSCI All Country World Index,NYSE Arca,etf
BTMKX,Equity,All Cap,Global,2011-03-31,iShares MSCI EAFE International Index Fund,5768596926.21,15.28,2021-03-29,09253F879,,,,,MSCI EAFE Index (Net Total Return),,mf
BTMPX,Equity,All Cap,Global,2018-08-06,iShares MSCI EAFE International Index Fund,149136489.95,15.11,2021-03-29,066923251,,,,,MSCI EAFE Index (Net Total Return),,mf
BYLD,Fixed Income,Multi Sectors,North America,2014-04-22,iShares Yield Optimized Bond ETF,187068403.44,24.942454,2021-03-29,46434V787,7500000,"Mar 29, 2021",0.28,0.48,Morningstar U.S. Bond Market Yield-Optimized Index,NYSE Arca,etf
CCRV,Commodity,Multi Commodity,North America,2020-09-01,iShares Commodity Curve Carry Strategy ETF,34378749.56,22.919166,2021-03-29,46431W564,1500000,"Mar 29, 2021",,,ICE BofA Commodity Enhanced Carry Total Return Index,NYSE Arca,etf
CEMB,Fixed Income,Credit,Global,2012-04-17,iShares J.P. Morgan EM Corporate Bond ETF,325370894.84,51.646174,2021-03-29,464286251,6300000,"Mar 29, 2021",0.5,0.5,J.P. Morgan CEMBI Broad Diversified Core Index,Cboe BZX formerly known as BATS,etf
CMBS,Fixed Income,Mortgages,North America,2012-02-14,iShares CMBS ETF,556229987.52,53.742028,2021-03-29,46429B366,10350000,"Mar 29, 2021",0.25,0.25,Bloomberg Barclays U.S. CMBS (ERISA Only) Index,NYSE Arca,etf
CMDY,Commodity,Multi Commodity,Global,2018-04-03,iShares Bloomberg Roll Select Commodity Strategy ETF,65438409.88,48.472896,2021-03-29,46431W598,1350000,"Mar 29, 2021",,,Bloomberg Roll Select Commodity Total Return Index,NYSE Arca,etf
CMF,Fixed Income,Municipals,North America,2007-10-04,iShares California Muni Bond ETF,1717353913.82,62.110449,2021-03-29,464288356,27650000,"Mar 29, 2021",0.25,0.25,S&P California AMT-Free Municipal bond Index,NYSE Arca,etf
CNYA,Equity,Large/Mid Cap,Asia Pacific,2016-06-13,iShares MSCI China A ETF,639746368.89,40.748176,2021-03-29,46434V514,15700000,"Mar 29, 2021",0.6,0.6,MSCI China A Inclusion Index,Cboe BZX formerly known as BATS,etf
COMT,Commodity,Multi Commodity,Global,2014-10-15,iShares GSCI Commodity Dynamic Roll Strategy ETF,562413677.97,30.237295,2021-03-29,46431W853,18600000,"Mar 29, 2021",,,S&P GSCI Dynamic Roll (USD) Total Return Index,NASDAQ,etf
CRBN,Equity,Large/Mid Cap,Global,2014-12-08,iShares MSCI ACWI Low Carbon Target ETF,769313994.23,155.416969,2021-03-29,46434V464,4950000,"Mar 29, 2021",0.2,0.2,MSCI ACWI Low Carbon Target Index,NYSE Arca,etf
DEFA,Equity,Large/Mid Cap,Global,2016-01-05,iShares Adaptive Currency Hedged MSCI EAFE ETF,6347474.66,31.737373,2021-03-29,46435G656,200000,"Mar 29, 2021",0.38,0.7,MSCI EAFE Adaptive Hedge to USD Index,Cboe BZX formerly known as BATS,etf
DGRO,Equity,All Cap,North America,2014-06-10,iShares Core Dividend Growth ETF,17387376707.56,48.520655,2021-03-29,46434V621,358350000,"Mar 29, 2021",0.08,0.08,Morningstar US Dividend Growth Index,NYSE Arca,etf
DIVB,Equity,All Cap,North America,2017-11-07,iShares U.S. Dividend and Buyback ETF,61059112.28,37.005523,2021-03-29,46435U861,1650000,"Mar 29, 2021",0.25,0.25,Morningstar US Dividend and Buyback Index,Cboe BZX formerly known as BATS,etf
DMXF,Equity,Large Cap,Global,2020-06-16,iShares ESG Advanced MSCI EAFE ETF,97265283.87,64.843523,2021-03-29,46436E759,1500000,"Mar 29, 2021",0.12,0.12,MSCI EAFE Choice ESG Screened Net Index,NASDAQ,etf
DSI,Equity,Large/Mid Cap,North America,2006-11-14,iShares MSCI KLD 400 Social ETF,2880162089.4,76.094111,2021-03-29,464288570,37850000,"Mar 29, 2021",0.25,0.25,MSCI KLD 400 Social Index,NYSE Arca,etf
DVY,Equity,All Cap,North America,2003-11-03,iShares Select Dividend ETF,17669457601.58,114.217567,2021-03-29,464287168,154700000,"Mar 29, 2021",0.39,0.39,Dow Jones U.S. Select Dividend IndexSM,NASDAQ,etf
DVYA,Equity,All Cap,Asia Pacific,2012-02-23,iShares Asia/Pacific Dividend ETF,45134908.67,41.031735,2021-03-29,464286293,1100000,"Mar 29, 2021",0.49,0.49,Dow Jones Asia/Pacific Select Dividend 50 Index,NYSE Arca,etf
DVYE,Equity,All Cap,Global,2012-02-23,iShares Emerging Markets Dividend ETF,824714466.55,38.810093,2021-03-29,464286319,21250000,"Mar 29, 2021",0.49,0.49,Dow Jones Emerging Markets Select Dividend Index,NYSE Arca,etf
DYNF,Equity,Large/Mid Cap,North America,2019-03-19,BlackRock U.S. Equity Factor Rotation ETF,77745294.68,33.802302,2021-03-29,09290C103,2300000,"Mar 29, 2021",0.3,0.3,MSCI Developed - US Gross TR Index,NYSE Arca,etf
EAGG,Fixed Income,Multi Sectors,North America,2018-10-18,iShares ESG Aware U.S. Aggregate Bond ETF,1191853043.27,54.422513,2021-03-29,46435U549,21900000,"Mar 29, 2021",0.1,0.11,Bloomberg Barclays MSCI US Aggregate ESG Focus Index,NYSE Arca,etf
EAOA,Multi Asset,Multi Strategy,North America,2020-06-12,iShares ESG Aware Aggressive Allocation ETF,17360353.89,31.56428,2021-03-29,46436E668,550000,"Mar 29, 2021",0.18,0.33,BlackRock ESG Aware Aggressive Allocation Index,Cboe BZX formerly known as BATS,etf
EAOK,Multi Asset,Multi Strategy,North America,2020-06-12,iShares ESG Aware Conservative Allocation ETF,5371330.81,26.856654,2021-03-29,46436E692,200000,"Mar 29, 2021",0.18,0.3,BlackRock ESG Aware Conservative Allocation Index,Cboe BZX formerly known as BATS,etf
EAOM,Multi Asset,Multi Strategy,North America,2020-06-12,iShares ESG Aware Moderate Allocation ETF,5559369.63,27.796848,2021-03-29,46436E684,200000,"Mar 29, 2021",0.18,0.31,BlackRock ESG Aware Moderate Allocation Index,Cboe BZX formerly known as BATS,etf
EAOR,Multi Asset,Multi Strategy,North America,2020-06-12,iShares ESG Aware Growth Allocation ETF,5930382.66,29.651913,2021-03-29,46436E676,200000,"Mar 29, 2021",0.18,0.32,BlackRock ESG Aware Growth Allocation Index,Cboe BZX formerly known as BATS,etf
ECH,Equity,All Cap,Latin America,2007-11-12,iShares MSCI Chile ETF,524569341.39,33.62624,2021-03-29,464286640,15600000,"Mar 29, 2021",0.59,0.59,MSCI Chile IMI 25/50 Index,Cboe BZX formerly known as BATS,etf
ECNS,Equity,Small Cap,Asia Pacific,2010-09-28,iShares MSCI China Small-Cap ETF,103166144.29,54.297971,2021-03-29,46429B200,1900000,"Mar 29, 2021",0.59,0.59,MSCI China Small Cap Index,NYSE Arca,etf
EDEN,Equity,All Cap,Europe,2012-01-25,iShares MSCI Denmark ETF,167941246.46,95.966427,2021-03-29,46429B523,1750000,"Mar 29, 2021",0.53,0.53,MSCI Denmark IMI 25/50 Index,Cboe BZX formerly known as BATS,etf
EEM,Equity,Large/Mid Cap,Global,2003-04-07,iShares MSCI Emerging Markets ETF,28915094639.85,52.625525,2021-03-29,464287234,549450000,"Mar 29, 2021",0.7,0.7,MSCI Emerging Markets Index(SM),NYSE Arca,etf
EEMA,Equity,Large/Mid Cap,Asia Pacific,2012-02-08,iShares MSCI Emerging Markets Asia ETF,967994782.19,89.629146,2021-03-29,464286426,10800000,"Mar 29, 2021",0.49,0.5,MSCI EM Asia Custom Capped Index,NASDAQ,etf
EEMS,Equity,Small Cap,Global,2011-08-16,iShares MSCI Emerging Markets Small-Cap ETF,309799633.27,56.327206,2021-03-29,464286475,5500000,"Mar 29, 2021",0.7,0.71,MSCI Emerging Markets Small Cap Index,NYSE Arca,etf
EEMV,Equity,Large/Mid Cap,Global,2011-10-18,iShares MSCI Emerging Markets Min Vol Factor ETF,4098876333.1,62.578265,2021-03-29,464286533,65500000,"Mar 29, 2021",0.7,0.7,MSCI Emerging Markets Minimum Volatility Index,Cboe BZX formerly known as BATS,etf
EFA,Equity,Large/Mid Cap,Global,2001-08-14,iShares MSCI EAFE ETF,54681626133.69,76.010045,2021-03-29,464287465,719400000,"Mar 29, 2021",0.32,0.32,MSCI EAFE Index,NYSE Arca,etf
EFAV,Equity,Large/Mid Cap,Global,2011-10-18,iShares MSCI EAFE Min Vol Factor ETF,9433879424.0,73.875328,2021-03-29,46429B689,127700000,"Mar 29, 2021",0.32,0.32,MSCI EAFE Minimum Volatility (USD) Index,Cboe BZX formerly known as BATS,etf
EFG,Equity,Large/Mid Cap,Global,2005-08-01,iShares MSCI EAFE Growth ETF,9782376235.38,100.641731,2021-03-29,464288885,97200000,"Mar 29, 2021",0.39,0.39,MSCI EAFE Growth Index,Cboe BZX formerly known as BATS,etf
EFNL,Equity,All Cap,Europe,2012-01-25,iShares MSCI Finland ETF,34240028.86,45.653372,2021-03-29,46429B515,750000,"Mar 29, 2021",0.53,0.53,MSCI Finland IMI 25/50 Index,Cboe BZX formerly known as BATS,etf
EFV,Equity,Large/Mid Cap,Global,2005-08-01,iShares MSCI EAFE Value ETF,12027013781.18,51.048446,2021-03-29,464288877,235600000,"Mar 29, 2021",0.39,0.39,MSCI EAFE Value Index,Cboe BZX formerly known as BATS,etf
EIDO,Equity,All Cap,Asia Pacific,2010-05-05,iShares MSCI Indonesia ETF,345667081.1,22.519028,2021-03-29,46429B309,15350000,"Mar 29, 2021",0.59,0.59,MSCI Indonesia IMI 25/50 Index,NYSE Arca,etf
EIRL,Equity,All Cap,Europe,2010-05-05,iShares MSCI Ireland ETF,63433098.27,55.159216,2021-03-29,46429B507,1150000,"Mar 29, 2021",0.51,0.51,MSCI All Ireland Capped Index,NYSE Arca,etf
EIS,Equity,All Cap,Europe,2008-03-26,iShares MSCI Israel ETF,144069714.46,64.030984,2021-03-29,464286632,2250000,"Mar 29, 2021",0.59,0.59,MSCI Israel Capped Investable Market Index,NYSE Arca,etf
EMB,Fixed Income,Government,Global,2007-12-17,iShares J.P. Morgan USD Emerging Markets Bond ETF,17437187608.46,108.575265,2021-03-29,464288281,160600000,"Mar 29, 2021",0.39,0.39,J.P. Morgan EMBI Global Core Index,NASDAQ,etf
EMBH,Fixed Income,Government,Global,2015-07-22,iShares Interest Rate Hedged Emerging Markets Bond ETF,5951259.02,23.805036,2021-03-29,46431W820,250000,"Mar 29, 2021",0.75,1.12,JPM Swaps-Hedged EMBIG Core Index,NYSE Arca,etf
EMGF,Equity,Large/Mid Cap,Global,2015-12-08,iShares MSCI Emerging Markets Multifactor ETF,705259737.85,51.105778,2021-03-29,46434G889,13800000,"Mar 29, 2021",0.45,0.45,MSCI Emerging Market Diversified Multiple-Factor Index,Cboe BZX formerly known as BATS,etf
EMHY,Fixed Income,High Yield,Global,2012-04-03,iShares J.P. Morgan EM High Yield Bond ETF,391274355.72,44.211792,2021-03-29,464286285,8850000,"Mar 29, 2021",0.5,0.5,J.P. Morgan USD Emerging Markets High Yield Bond Index,Cboe BZX formerly known as BATS,etf
EMIF,Equity,All Cap,Global,2009-06-16,iShares Emerging Markets Infrastructure ETF,16061140.19,24.709446,2021-03-29,464288216,650000,"Mar 29, 2021",0.6,0.6,S&P Emerging Markets Infrastructure Index,NASDAQ,etf
EMXC,Equity,All Cap,Global,2017-07-18,iShares MSCI Emerging Markets ex China ETF,416114570.07,58.607686,2021-03-29,46434G764,7100000,"Mar 29, 2021",0.25,0.34,MSCI Emerging Markets ex China Index,NASDAQ,etf
EMXF,Equity,Large/Mid Cap,Global,2020-10-06,iShares ESG Advanced MSCI EM ETF,12849296.35,42.830988,2021-03-29,46436E742,300000,"Mar 29, 2021",0.16,0.16,MSCI Emerging Markets Choice ESG Screened 5% Issuer Capped Index,NASDAQ,etf
ENOR,Equity,All Cap,Europe,2012-01-23,iShares MSCI Norway ETF,33058205.59,27.548505,2021-03-29,46429B499,1200000,"Mar 29, 2021",0.53,0.53,MSCI Norway IMI 25/50 Index,Cboe BZX formerly known as BATS,etf
ENZL,Equity,All Cap,Asia Pacific,2010-09-01,iShares MSCI New Zealand ETF,185108245.11,61.702748,2021-03-29,464289123,3000000,"Mar 29, 2021",0.51,0.51,MSCI New Zealand IMI 25/50 Index,NASDAQ,etf
EPHE,Equity,All Cap,Asia Pacific,2010-09-28,iShares MSCI Philippines ETF,136338163.39,29.964432,2021-03-29,46429B408,4550000,"Mar 29, 2021",0.59,0.59,MSCI Philippines IMI 25-50 NET Index,NYSE Arca,etf
EPOL,Equity,All Cap,Europe,2010-05-25,iShares MSCI Poland ETF,227584027.16,18.062224,2021-03-29,46429B606,12600000,"Mar 29, 2021",0.59,0.59,MSCI Poland IMI 25/50 Index,NYSE Arca,etf
EPP,Equity,Large/Mid Cap,Asia Pacific,2001-10-25,iShares MSCI Pacific ex Japan ETF,2350072585.27,50.215226,2021-03-29,464286665,46800000,"Mar 29, 2021",0.48,0.48,MSCI Pacific ex-Japan Index,NYSE Arca,etf
EPU,Equity,All Cap,Latin America,2009-06-19,iShares MSCI Peru ETF,155545120.93,34.185741,2021-03-29,464289842,4550000,"Mar 29, 2021",0.59,0.59,MSCI All Peru Capped Index,NYSE Arca,etf
ERUS,Equity,Large/Mid Cap,Europe,2010-11-09,iShares MSCI Russia ETF,479684177.36,39.157892,2021-03-29,46434G798,12250000,"Mar 29, 2021",0.59,0.59,MSCI Russia 25 / 50 Index,NYSE Arca,etf
ESGD,Equity,Large/Mid Cap,Global,2016-06-28,iShares ESG Aware MSCI EAFE ETF,5005670537.88,75.958582,2021-03-29,46435G516,65900000,"Mar 29, 2021",0.2,0.2,MSCI EAFE Extended ESG Focus Index,NASDAQ,etf
ESGE,Equity,Large/Mid Cap,Global,2016-06-28,iShares ESG Aware MSCI EM ETF,7025804817.36,42.684112,2021-03-29,46434G863,164600000,"Mar 29, 2021",0.25,0.25,MSCI Emerging Markets Extended ESG Focus Index,NASDAQ,etf
ESGU,Equity,Large/Mid Cap,North America,2016-12-01,iShares ESG Aware MSCI USA ETF,15322393265.26,90.611433,2021-03-29,46435G425,169100000,"Mar 29, 2021",0.15,0.15,MSCI USA Extended ESG Focus Index,NASDAQ,etf
ESML,Equity,All Cap,North America,2018-04-10,iShares ESG Aware MSCI USA Small-Cap ETF,730647839.46,37.66226,2021-03-29,46435U663,19400000,"Mar 29, 2021",0.17,0.17,MSCI USA Small Cap Extended ESG Focus Index,Cboe BZX formerly known as BATS,etf
EUFN,Equity,All Cap,Europe,2010-01-20,iShares MSCI Europe Financials ETF,1216931902.61,19.089128,2021-03-29,464289180,63750000,"Mar 29, 2021",0.48,0.48,MSCI Europe Financials Index,NASDAQ,etf
EUSA,Equity,Large/Mid Cap,North America,2010-05-05,iShares MSCI USA Equal Weighted ETF,374548014.01,78.030836,2021-03-29,464286681,4800000,"Mar 29, 2021",0.15,0.15,MSCI USA Equal Weighted Index,NYSE Arca,etf
EUSB,Fixed Income,Multi Sectors,North America,2020-06-23,iShares ESG Advanced Total USD Bond Market ETF,210578995.13,48.971859,2021-03-29,46436E619,4300000,"Mar 29, 2021",0.12,0.13,Bloomberg Barclays MSCI US Universal Choice ESG Screened Index,NYSE Arca,etf
EWA,Equity,Large/Mid Cap,Asia Pacific,1996-03-12,iShares MSCI Australia ETF,1438665990.46,24.804586,2021-03-29,464286103,58000000,"Mar 29, 2021",0.51,0.51,MSCI Australia Index,NYSE Arca,etf
EWC,Equity,Large/Mid Cap,North America,1996-03-12,iShares MSCI Canada ETF,3713089089.81,33.971538,2021-03-29,464286509,109300000,"Mar 29, 2021",0.51,0.51,MSCI Canada Custom Capped Index,NYSE Arca,etf
EWD,Equity,Large/Mid Cap,Europe,1996-03-12,iShares MSCI Sweden ETF,468403458.72,44.293471,2021-03-29,464286756,10575000,"Mar 29, 2021",0.51,0.51,MSCI Sweden 25/50 Index,NYSE Arca,etf
EWG,Equity,Large/Mid Cap,Europe,1996-03-12,iShares MSCI Germany ETF,2670005596.97,33.085571,2021-03-29,464286806,80700000,"Mar 29, 2021",0.51,0.51,MSCI Germany Index,NYSE Arca,etf
EWGS,Equity,Small Cap,Europe,2012-01-25,iShares MSCI Germany Small-Cap ETF,42115740.7,76.574074,2021-03-29,46429B465,550000,"Mar 29, 2021",0.59,0.59,MSCI Germany Small Cap Index,Cboe BZX formerly known as BATS,etf
EWH,Equity,Large/Mid Cap,Asia Pacific,1996-03-12,iShares MSCI Hong Kong ETF,1412236513.98,26.78495,2021-03-29,464286871,52725000,"Mar 29, 2021",0.51,0.51,MSCI Hong Kong 25/50 Index,NYSE Arca,etf
EWI,Equity,Large/Mid Cap,Europe,1996-03-12,iShares MSCI Italy ETF,318529204.54,31.228353,2021-03-29,46434G830,10200000,"Mar 29, 2021",0.51,0.51,MSCI Italy 25/50 Index,NYSE Arca,etf
EWJ,Equity,Large/Mid Cap,Asia Pacific,1996-03-12,iShares MSCI Japan ETF,13128902443.05,69.520267,2021-03-29,46434G822,188850000,"Mar 29, 2021",0.51,0.51,MSCI Japan Index,NYSE Arca,etf
EWJE,Equity,Large/Mid Cap,Asia Pacific,2019-03-05,iShares MSCI Japan Equal Weighted ETF,8146620.49,40.733102,2021-03-29,46435U382,200000,"Mar 29, 2021",0.15,0.15,MSCI Japan Equal Weighted Index (USD),NASDAQ,etf
EWJV,Equity,Large/Mid Cap,Asia Pacific,2019-03-05,iShares MSCI Japan Value ETF,34093749.92,28.411458,2021-03-29,46435U374,1200000,"Mar 29, 2021",0.15,0.15,MSCI Japan Value Index (USD),NASDAQ,etf
