ticker,asset_class,sub_class,region,inception,name,net_assets,nav,nav_as_of,cusip,shares_outstanding,shares_outstanding_as_of,mgmt_fee,expense_ratio,benchmark_index,exchange,type
EWL,Equity,Large/Mid Cap,Europe,1996-03-12,iShares MSCI Switzerland ETF,1794509211.74,45.574837,2021-01-22,464286749,39625000,"Jan 25, 2021",0.51,0.51,MSCI Switzerland 25/50 Index,NYSE Arca,etf
EWM,Equity,Large/Mid Cap,Asia Pacific,1996-03-12,iShares MSCI Malaysia ETF,402775464.19,27.970518,2021-01-22,46434G814,14400000,"Jan 25, 2021",0.51,0.51,MSCI Malaysia Index,NYSE Arca,etf
EWN,Equity,All Cap,Europe,1996-03-12,iShares MSCI Netherlands ETF,311316981.59,44.158437,2021-01-22,464286814,7050000,"Jan 25, 2021",0.51,0.51,MSCI Netherlands IMI 25/50 Index,NYSE Arca,etf
EWO,Equity,All Cap,Europe,1996-03-12,iShares MSCI Austria ETF,59382998.26,21.593818,2021-01-22,464286202,2750000,"Jan 25, 2021",0.51,0.51,MSCI Austria IMI 25/50 Index,NYSE Arca,etf
EWP,Equity,Large/Mid Cap,Europe,1996-03-12,iShares MSCI Spain ETF,592346474.82,27.047784,2021-01-22,464286764,21900000,"Jan 22, 2021",0.51,0.51,MSCI Spain 25/50 Index,NYSE Arca,etf
EWQ,Equity,Large/Mid Cap,Europe,1996-03-12,iShares MSCI France ETF,808456439.3,33.407291,2021-01-22,464286707,24200000,"Jan 25, 2021",0.51,0.51,MSCI France Index,NYSE Arca,etf
EWS,Equity,Large/Mid Cap,Asia Pacific,1996-03-12,iShares MSCI Singapore ETF,685326570.23,22.396293,2021-01-22,46434G780,30600000,"Jan 22, 2021",0.51,0.51,MSCI Singapore 25/50 Index,NYSE Arca,etf
EWT,Equity,Large/Mid Cap,Asia Pacific,2000-06-20,iShares MSCI Taiwan ETF,6331823569.99,58.411657,2021-01-22,46434G772,108600000,"Jan 25, 2021",0.59,0.59,MSCI Taiwan 25/50 Index,NYSE Arca,etf
EWU,Equity,Large/Mid Cap,Europe,1996-03-12,iShares MSCI United Kingdom ETF,3039230659.55,30.575761,2021-01-22,46435G334,99400000,"Jan 25, 2021",0.51,0.51,MSCI United Kingdom Index,NYSE Arca,etf
EWUS,Equity,Small Cap,Europe,2012-01-25,iShares MSCI United Kingdom Small-Cap ETF,68116485.97,42.572804,2021-01-22,46429B416,1600000,"Jan 25, 2021",0.59,0.59,MSCI United Kingdom Small Cap Index,Cboe BZX formerly known as BATS,etf
EWW,Equity,All Cap,Latin America,1996-03-12,iShares MSCI Mexico ETF,1427163226.26,42.857755,2021-01-22,464286822,33500000,"Jan 25, 2021",0.51,0.51,MSCI Mexico IMI 25/50 Index,NYSE Arca,etf
EWY,Equity,Large/Mid Cap,Asia Pacific,2000-05-09,iShares MSCI South Korea ETF,7931447253.32,93.807774,2021-01-22,464286772,84550000,"Jan 22, 2021",0.59,0.59,MSCI Korea 25/50 Index,NYSE Arca,etf
EWZ,Equity,Large/Mid Cap,Latin America,2000-07-10,iShares MSCI Brazil ETF,6191246528.05,35.097769,2021-01-22,464286400,176400000,"Jan 22, 2021",0.59,0.59,MSCI Brazil 25/50 Index,NYSE Arca,etf
EWZS,Equity,Small Cap,Latin America,2010-09-28,iShares MSCI Brazil Small-Cap ETF,109181692.74,15.597385,2021-01-22,464289131,7000000,"Jan 25, 2021",0.59,0.59,MSCI Brazil Small Cap Index,NASDAQ,etf
EXI,Equity,All Cap,Global,2006-09-12,iShares Global Industrials ETF,421525360.85,108.083426,2021-01-22,464288729,3900000,"Jan 25, 2021",0.46,0.46,S&P Global 1200 Industrials Sector Index(TM),NYSE Arca,etf
EZA,Equity,Large/Mid Cap,Middle East and Africa,2003-02-03,iShares MSCI South Africa ETF,437580777.74,45.11142,2021-01-22,464286780,9700000,"Jan 22, 2021",0.59,0.59,MSCI South Africa 25/50 Index,NYSE Arca,etf
EZU,Equity,Large/Mid Cap,Europe,2000-07-25,iShares MSCI Eurozone ETF,5175651146.11,44.888562,2021-01-22,464286608,115300000,"Jan 22, 2021",0.51,0.51,MSCI EMU Index,Cboe BZX formerly known as BATS,etf
FALN,Fixed Income,High Yield,North America,2016-06-14,iShares Fallen Angels USD Bond ETF,1248795079.49,29.348886,2021-01-22,46435G474,43250000,"Jan 25, 2021",0.25,0.25,Bloomberg Barclays US High Yield Fallen Angel 3% Capped Index,NASDAQ,etf
FIBR,Fixed Income,Multi Sectors,North America,2015-02-24,iShares U.S. Fixed Income Balanced Risk Factor ETF,122713252.07,102.261043,2021-01-25,46435U796,1200000,"Jan 25, 2021",0.25,0.25,Bloomberg Barclays U.S. Fixed Income Balanced Risk Index,Cboe BZX formerly known as BATS,etf
FILL,Equity,All Cap,Global,2012-01-31,iShares MSCI Global Energy Producers ETF,61283008.89,14.088048,2021-01-22,464286343,4350000,"Jan 22, 2021",0.39,0.39,MSCI ACWI Select Energy Producers Investable Market Index,NYSE Arca,etf
FLOT,Fixed Income,Credit,North America,2011-06-14,iShares Floating Rate Bond ETF,5584994808.31,50.77268,2021-01-22,46429B655,110000000,"Jan 25, 2021",0.2,0.2,Bloomberg Barclays US Floating Rate Note < 5 Years Index,Cboe BZX formerly known as BATS,etf
FM,Equity,All Cap,Global,2012-09-12,iShares MSCI Frontier 100 ETF,434256350.79,29.845797,2021-01-22,464286145,14550000,"Jan 25, 2021",0.79,0.79,MSCI Frontier Markets 100 Index,NYSE Arca,etf
FOVL,Equity,Large/Mid Cap,North America,2019-03-19,iShares Focused Value Factor ETF,27579836.77,45.966395,2021-01-22,46435U333,600000,"Jan 25, 2021",0.25,0.25,Focused Value Select Index,NYSE Arca,etf
FXI,Equity,Large Cap,Asia Pacific,2004-10-05,iShares China Large-Cap ETF,4303559233.33,51.694405,2021-01-22,464287184,83250000,"Jan 25, 2021",0.74,0.74,FTSE China 50 Index,NYSE Arca,etf
GBF,Fixed Income,Multi Sectors,North America,2007-01-05,iShares Government/Credit Bond ETF,285960185.99,124.330516,2021-01-22,464288596,2300000,"Jan 22, 2021",0.2,0.2,Bloomberg Barclays U.S. Government/Credit Bond Index,NYSE Arca,etf
GHYG,Fixed Income,High Yield,Global,2012-04-03,iShares US & Intl High Yield Corp Bond ETF,187423561.33,50.655017,2021-01-22,464286178,3700000,"Jan 22, 2021",0.4,0.4,Markit iBoxx Global Developed Markets High Yield Index,Cboe BZX formerly known as BATS,etf
GNMA,Fixed Income,Mortgages,North America,2012-02-14,iShares GNMA Bond ETF,508634595.85,50.86346,2021-01-22,46429B333,10000000,"Jan 22, 2021",0.15,0.17,Bloomberg Barclays U.S. GNMA Bond Index,NASDAQ,etf
GOVT,Fixed Income,Government,North America,2012-02-14,iShares U.S. Treasury Bond ETF,14654383638.84,27.097603,2021-01-22,46429B267,542500000,"Jan 25, 2021",0.15,0.15,ICE U.S. Treasury Core Bond Index,Cboe BZX formerly known as BATS,etf
GOVZ,Fixed Income,Government,North America,2020-09-22,iShares 25+ Year Treasury STRIPS Bond ETF,29545959.94,22.727661,2021-01-25,46436E577,1300000,"Jan 25, 2021",0.15,0.15,ICE BofA Long US Treasury Principal STRIPS Index,Cboe BZX formerly known as BATS,etf
GSG,Commodity,Multi Commodity,Global,2006-07-10,iShares S&P GSCI Commodity-Indexed Trust,903478589.36,12.797147,2021-01-22,46428R107,71400000,"Jan 25, 2021",,,S&P GSCI(R) Total Return Index,NYSE Arca,etf
GVI,Fixed Income,Multi Sectors,North America,2007-01-05,iShares Intermediate Government/Credit Bond ETF,2312932416.98,117.110502,2021-01-22,464288612,19750000,"Jan 22, 2021",0.2,0.2,Bloomberg Barclays U.S. Intermediate Government/Credit Bond Index,Cboe BZX formerly known as BATS,etf
HAWX,Equity,Large/Mid Cap,Global,2015-06-29,iShares Currency Hedged MSCI ACWI ex U.S. ETF,97252510.44,30.873813,2021-01-22,46435G847,3150000,"Jan 25, 2021",0.38,0.7,MSCI ACWI ex USA 100% Hedged to USD Index,NYSE Arca,etf
HDV,Equity,All Cap,North America,2011-03-29,iShares Core High Dividend ETF,5898127921.97,89.230377,2021-01-22,46429B663,66100000,"Jan 22, 2021",0.08,0.08,Morningstar Dividend Yield Focus Index,NYSE Arca,etf
HEEM,Equity,Large/Mid Cap,Global,2014-09-23,iShares Currency Hedged MSCI Emerging Markets ETF,215638902.01,33.432388,2021-01-22,46434G509,6550000,"Jan 25, 2021",0.78,1.48,MSCI Emerging Markets 100% USD Hedged Index,Cboe BZX formerly known as BATS,etf
HEFA,Equity,Large/Mid Cap,Global,2014-01-31,iShares Currency Hedged MSCI EAFE ETF,2417845099.29,31.482358,2021-01-22,46434V803,76600000,"Jan 25, 2021",0.38,0.7,MSCI EAFE 100% Hedged to USD Index,Cboe BZX formerly known as BATS,etf
HEWC,Equity,Large/Mid Cap,North America,2015-06-29,iShares Currency Hedged MSCI Canada ETF,12473583.01,27.719073,2021-01-22,46435G706,450000,"Jan 25, 2021",0.62,1.13,MSCI Canada 100% Hedged to USD Index,NYSE Arca,etf
HEWG,Equity,Large/Mid Cap,Europe,2014-01-31,iShares Currency Hedged MSCI Germany ETF,61618410.45,30.057761,2021-01-22,46434V704,2050000,"Jan 25, 2021",0.53,1.04,MSCI Germany 100% Hedged to USD Index,NASDAQ,etf
HEWJ,Equity,Large/Mid Cap,Asia Pacific,2014-01-31,iShares Currency Hedged MSCI Japan ETF,334250408.44,36.933747,2021-01-22,46434V886,8900000,"Jan 25, 2021",0.53,1.04,MSCI Japan 100% Hedged to USD Index,NYSE Arca,etf
HEWU,Equity,Large/Mid Cap,Europe,2015-06-29,iShares Currency Hedged MSCI United Kingdom ETF,6417298.11,21.390994,2021-01-22,46435G862,300000,"Jan 25, 2021",0.62,1.13,MSCI United Kingdom 100% Hedged to USD Index,NYSE Arca,etf
HEWW,Equity,Large/Mid Cap,Latin America,2015-06-29,iShares Currency Hedged MSCI Mexico ETF,805411.24,16.108225,2021-01-22,46435G805,50000,"Jan 25, 2021",0.62,1.13,MSCI Mexico IMI 25/50 100% Hedged to USD Index,NYSE Arca,etf
HEZU,Equity,Large/Mid Cap,Europe,2014-07-09,iShares Currency Hedged MSCI Eurozone ETF,520278835.05,31.918947,2021-01-22,46434V639,16300000,"Jan 25, 2021",0.62,1.13,MSCI EMU 100% USD Hedged Index,NYSE Arca,etf
HJPX,Equity,Large/Mid Cap,Asia Pacific,2015-09-29,iShares Currency Hedged JPX-Nikkei 400 ETF,3354055.49,33.540555,2021-01-22,46435G722,100000,"Jan 25, 2021",0.59,1.07,JPX-Nikkei 400 Net Total Return USD Hedged Index,NYSE Arca,etf
HSCZ,Equity,Small Cap,Global,2015-06-29,iShares Currency Hedged MSCI EAFE Small-Cap ETF,62871787.82,33.090415,2021-01-22,46435G839,1900000,"Jan 25, 2021",0.43,0.83,MSCI EAFE Small-Cap 100% Hedged to USD Index,NYSE Arca,etf
HYBB,Fixed Income,High Yield,North America,2020-10-06,iShares BB Rated Corporate Bond ETF,96017820.23,51.901524,2021-01-22,46435U473,1850000,"Jan 25, 2021",0.25,0.25,ICE BofA BB US High Yield Constrained Index,NYSE Arca,etf
HYDB,Fixed Income,High Yield,North America,2017-07-11,iShares High Yield Bond Factor ETF,51272933.69,51.272934,2021-01-22,46435G250,1000000,"Jan 25, 2021",0.35,0.35,BlackRock High Yield Defensive Bond Index,Cboe BZX formerly known as BATS,etf
HYG,Fixed Income,High Yield,North America,2007-04-04,iShares iBoxx $ High Yield Corporate Bond ETF,23083559950.44,87.239456,2021-01-22,464288513,264600000,"Jan 22, 2021",0.49,0.49,Markit iBoxx USD Liquid High Yield Index,NYSE Arca,etf
HYGH,Fixed Income,High Yield,North America,2014-05-27,iShares Interest Rate Hedged High Yield Bond ETF,56316829.17,86.641276,2021-01-22,46431W606,650000,"Jan 25, 2021",0.65,1.13,Markit iBoxx USD Liquid High Yield Interest Rate Hedged Swaps Index,NYSE Arca,etf
HYXF,Fixed Income,High Yield,North America,2016-06-14,iShares ESG Advanced High Yield Corporate Bond ETF,81246381.57,52.41702,2021-01-22,46435G441,1550000,"Jan 25, 2021",0.35,0.35,Bloomberg Barclays MSCI US High Yield Choice ESG Screened Index,NASDAQ,etf
HYXU,Fixed Income,High Yield,Global,2012-04-03,iShares International High Yield Bond ETF,50773493.02,56.414992,2021-01-22,464286210,900000,"Jan 22, 2021",0.4,0.4,Markit iBoxx Global Developed Markets ex-US High Yield Index,Cboe BZX formerly known as BATS,etf
IAGG,Fixed Income,Multi Sectors,Global,2015-11-10,iShares Core International Aggregate Bond ETF,3436870469.19,55.929544,2021-01-25,46435G672,61450000,"Jan 25, 2021",0.08,0.08,Bloomberg Barclays Global Aggregate ex USD 10% Issuer Capped (Hedged) Index,Cboe BZX formerly known as BATS,etf
IAI,Equity,All Cap,North America,2006-05-01,iShares U.S. Broker-Dealers & Securities Exchanges ETF,210784849.0,84.31394,2021-01-22,464288794,2500000,"Jan 22, 2021",0.42,0.42,Dow Jones U.S. Select Investment Services Index,NYSE Arca,etf
IAK,Equity,All Cap,North America,2006-05-01,iShares U.S. Insurance ETF,65020914.62,68.443068,2021-01-22,464288786,950000,"Jan 25, 2021",0.42,0.42,Dow Jones U.S. Select Insurance Index,NYSE Arca,etf
IAT,Equity,All Cap,North America,2006-05-01,iShares U.S. Regional Banks ETF,328961602.72,49.098747,2021-01-22,464288778,6700000,"Jan 25, 2021",0.42,0.42,Dow Jones U.S. Select Regional Banks Index,NYSE Arca,etf
IAU,Commodity,Precious Metals,Global,2005-01-21,iShares Gold Trust,31541157950.95,17.698871,2021-01-25,464285105,1782100000,"Jan 25, 2021",,,,NYSE Arca,etf
IAUF,Commodity,Precious Metals,Global,2018-06-06,iShares Gold Strategy ETF,22905726.28,57.264316,2021-01-22,46431W614,400000,"Jan 25, 2021",0.25,0.32,Bloomberg Composite Gold Index,Cboe BZX formerly known as BATS,etf
IBB,Equity,All Cap,North America,2001-02-05,iShares Nasdaq Biotechnology ETF,11046248127.17,164.869375,2021-01-22,464287556,66800000,"Jan 25, 2021",0.46,0.46,Nasdaq Biotechnology Index(R),NASDAQ,etf
IBCE,Fixed Income,Credit,North America,2013-04-17,iShares® iBonds® Mar 2023 Term Corporate ex-Financials ETF,27474686.16,24.976987,2021-01-22,46432FAN7,1100000,"Jan 25, 2021",0.1,0.1,Bloomberg Barclays 2023 Maturity High Quality Corporate Index,NYSE Arca,etf
IBDD,Fixed Income,Credit,North America,2013-07-09,iShares® iBonds® Mar 2023 Term Corporate ETF,73564520.52,27.246119,2021-01-22,46432FAZ0,2700000,"Jan 25, 2021",0.1,0.1,Bloomberg Barclays 2023 Maturity Corporate Index,NYSE Arca,etf
IBDM,Fixed Income,Credit,North America,2015-03-10,iShares® iBonds® Dec 2021 Term Corporate ETF,1566284821.95,24.90119,2021-01-25,46434VBK5,62900000,"Jan 25, 2021",0.1,0.1,Bloomberg Barclays December 2021 Maturity Corporate Index,NYSE Arca,etf
IBDN,Fixed Income,Credit,North America,2015-03-10,iShares® iBonds® Dec 2022 Term Corporate ETF,1457579287.4,25.526783,2021-01-25,46434VBA7,57100000,"Jan 25, 2021",0.1,0.1,Bloomberg Barclays December 2022 Maturity Corporate Index,NYSE Arca,etf
IBDO,Fixed Income,Credit,North America,2015-03-11,iShares® iBonds® Dec 2023 Term Corporate ETF,1423422157.99,26.214036,2021-01-25,46434VAX8,54300000,"Jan 25, 2021",0.1,0.1,Bloomberg Barclays December 2023 Maturity Corporate Index,NYSE Arca,etf
IBDP,Fixed Income,Credit,North America,2015-03-11,iShares® iBonds® Dec 2024 Term Corporate ETF,1211635107.0,26.541842,2021-01-25,46434VBG4,45650000,"Jan 25, 2021",0.1,0.1,Bloomberg Barclays December 2024 Maturity Corporate Index,NYSE Arca,etf
IBDQ,Fixed Income,Credit,North America,2015-03-11,iShares® iBonds® Dec 2025 Term Corporate ETF,998498744.19,27.244168,2021-01-25,46434VBD1,36650000,"Jan 25, 2021",0.1,0.1,Bloomberg Barclays December 2025 Maturity Corporate Index,NYSE Arca,etf
IBDR,Fixed Income,Credit,North America,2016-09-13,iShares® iBonds® Dec 2026 Term Corporate ETF,618538324.98,26.951561,2021-01-22,46435GAA0,22950000,"Jan 25, 2021",0.1,0.1,Bloomberg Barclays December 2026 Maturity Corporate Index,NYSE Arca,etf
IBDS,Fixed Income,Credit,North America,2017-09-12,iShares® iBonds® Dec 2027 Term Corporate ETF,420762578.13,27.500822,2021-01-22,46435UAA9,15300000,"Jan 25, 2021",0.1,0.1,Bloomberg Barclays December 2027 Maturity Corporate Index,NYSE Arca,etf
IBDT,Fixed Income,Credit,North America,2018-09-18,iShares® iBonds® Dec 2028 Term Corporate ETF,225268175.54,29.255607,2021-01-22,46435U515,7700000,"Jan 25, 2021",0.1,0.1,Bloomberg Barclays December 2028 Maturity Corporate Index,NYSE Arca,etf
IBDU,Fixed Income,Credit,North America,2019-09-17,iShares® iBonds® Dec 2029 Term Corporate ETF,92353205.11,27.162707,2021-01-22,46436E205,3400000,"Jan 25, 2021",0.1,0.1,Bloomberg Barclays December 2029 Maturity Corporate Index,NYSE Arca,etf
IBDV,Fixed Income,Credit,North America,2020-06-23,iShares® iBonds® Dec 2030 Term Corporate ETF,64938693.76,25.975478,2021-01-25,46436E726,2500000,"Jan 25, 2021",0.1,0.1,Bloomberg Barclays December 2030 Maturity Corporate Index,NYSE Arca,etf
IBHA,Fixed Income,High Yield,North America,2019-05-07,iShares® iBonds® 2021 Term High Yield and Income ETF,36350660.12,24.233773,2021-01-22,46435U226,1500000,"Jan 25, 2021",0.35,0.35,Bloomberg Barclays 2021 Term High Yield and Income Index,Cboe BZX formerly known as BATS,etf
IBHB,Fixed Income,High Yield,North America,2019-05-07,iShares® iBonds® 2022 Term High Yield and Income ETF,36314520.81,24.209681,2021-01-22,46435U176,1500000,"Jan 25, 2021",0.35,0.35,Bloomberg Barclays 2022 Term High Yield and Income Index,Cboe BZX formerly known as BATS,etf
IBHC,Fixed Income,High Yield,North America,2019-05-07,iShares® iBonds® 2023 Term High Yield and Income ETF,29329371.63,24.441143,2021-01-22,46435U150,1200000,"Jan 25, 2021",0.35,0.35,Bloomberg Barclays 2023 Term High Yield and Income Index,Cboe BZX formerly known as BATS,etf
IBHD,Fixed Income,High Yield,North America,2019-05-07,iShares® iBonds® 2024 Term High Yield and Income ETF,19520790.3,24.400988,2021-01-22,46435U184,800000,"Jan 25, 2021",0.35,0.35,Bloomberg Barclays 2024 Term High Yield and Income Index,Cboe BZX formerly known as BATS,etf
IBHE,Fixed Income,High Yield,North America,2019-05-07,iShares® iBonds® 2025 Term High Yield and Income ETF,19931788.92,24.914736,2021-01-22,46435U168,800000,"Jan 25, 2021",0.35,0.35,Bloomberg Barclays 2025 Term High Yield and Income Index,Cboe BZX formerly known as BATS,etf
IBHF,Fixed Income,High Yield,North America,2020-11-10,iShares® iBonds® 2026 Term High Yield and Income ETF,15240937.46,25.401562,2021-01-25,46436E528,600000,"Jan 25, 2021",0.35,0.35,Bloomberg Barclays 2026 Term High Yield and Income Index,Cboe BZX formerly known as BATS,etf
IBMJ,Fixed Income,Municipals,North America,2015-09-01,iShares® iBonds® Dec 2021 Term Muni Bond ETF,320835496.05,25.769919,2021-01-25,46435G789,12450000,"Jan 25, 2021",0.18,0.18,S&P AMT- Free Municipal Series Dec 2021 Index,NYSE Arca,etf
IBMK,Fixed Income,Municipals,North America,2015-09-01,iShares® iBonds® Dec 2022 Term Muni Bond ETF,373225507.95,26.376361,2021-01-25,46435G755,14150000,"Jan 25, 2021",0.18,0.18,S&P AMT-Free Municipal Series Dec 2022 Index,NYSE Arca,etf
IBML,Fixed Income,Municipals,North America,2017-04-11,iShares® iBonds® Dec 2023 Term Muni Bond ETF,295940489.41,26.189424,2021-01-22,46435G318,11350000,"Jan 25, 2021",0.18,0.18,S&P AMT-Free Municipal Series Dec 2023 Index,Cboe BZX formerly known as BATS,etf
IBMM,Fixed Income,Municipals,North America,2018-03-20,iShares® iBonds® Dec 2024 Term Muni Bond ETF,199066066.79,27.083819,2021-01-25,46435U697,7350000,"Jan 25, 2021",0.18,0.18,S&P AMT-Free Municipal Series Dec 2024 Index,Cboe BZX formerly known as BATS,etf
IBMN,Fixed Income,Municipals,North America,2018-11-13,iShares® iBonds® Dec 2025 Term Muni Bond ETF,135056163.54,28.136701,2021-01-22,46435U432,4800000,"Jan 25, 2021",0.18,0.18,S&P AMT-Free Municipal Series Dec 2025 Index,Cboe BZX formerly known as BATS,etf
IBMO,Fixed Income,Municipals,North America,2019-04-02,iShares® iBonds® Dec 2026 Term Muni Bond ETF,77085596.11,27.047578,2021-01-22,46435U259,2850000,"Jan 25, 2021",0.18,0.18,S&P AMT-Free Municipal Series Callable-Adjusted Dec 2026 Index,Cboe BZX formerly known as BATS,etf
IBMP,Fixed Income,Municipals,North America,2019-04-09,iShares® iBonds® Dec 2027 Term Muni Bond ETF,42223343.42,27.240867,2021-01-22,46435U283,1550000,"Jan 25, 2021",0.18,0.18,S&P AMT-Free Municipal Series Callable-Adjusted Dec 2027 Index,Cboe BZX formerly known as BATS,etf
IBMQ,Fixed Income,Municipals,North America,2019-04-16,iShares® iBonds® Dec 2028 Term Muni Bond ETF,57822970.23,27.534748,2021-01-22,46435U325,2100000,"Jan 25, 2021",0.18,0.18,S&P AMT-Free Municipal Series Callable-Adjusted Dec 2028 Index,Cboe BZX formerly known as BATS,etf
IBTA,Fixed Income,Government,North America,2020-02-25,iShares® iBonds® Dec 2021 Term Treasury ETF,11407685.87,25.350413,2021-01-25,46436E700,450000,"Jan 25, 2021",0.07,0.07,ICE 2021 Maturity US Treasury Index,NASDAQ,etf
IBTB,Fixed Income,Government,North America,2020-02-25,iShares® iBonds® Dec 2022 Term Treasury ETF,47040369.67,25.427227,2021-01-25,46436E809,1850000,"Jan 25, 2021",0.07,0.07,ICE 2022 Maturity US Treasury Index,NASDAQ,etf
IBTD,Fixed Income,Government,North America,2020-02-25,iShares® iBonds® Dec 2023 Term Treasury ETF,35992507.91,25.708934,2021-01-25,46436E882,1400000,"Jan 25, 2021",0.07,0.07,ICE 2023 Maturity US Treasury Index,NASDAQ,etf
IBTE,Fixed Income,Government,North America,2020-02-25,iShares® iBonds® Dec 2024 Term Treasury ETF,12952449.66,25.904899,2021-01-25,46436E874,500000,"Jan 25, 2021",0.07,0.07,ICE 2024 Maturity US Treasury Index,NASDAQ,etf
IBTF,Fixed Income,Government,North America,2020-02-25,iShares® iBonds® Dec 2025 Term Treasury ETF,19536362.24,26.048483,2021-01-25,46436E866,750000,"Jan 25, 2021",0.07,0.07,ICE 2025 Maturity US Treasury Index,NASDAQ,etf
IBTG,Fixed Income,Government,North America,2020-02-25,iShares® iBonds® Dec 2026 Term Treasury ETF,22209280.51,26.128565,2021-01-25,46436E858,850000,"Jan 25, 2021",0.07,0.07,ICE 2026 Maturity US Treasury Index,NASDAQ,etf
IBTH,Fixed Income,Government,North America,2020-02-25,iShares® iBonds® Dec 2027 Term Treasury ETF,14361641.28,26.112075,2021-01-25,46436E841,550000,"Jan 25, 2021",0.07,0.07,ICE 2027 Maturity US Treasury Index,NASDAQ,etf
IBTI,Fixed Income,Government,North America,2020-02-25,iShares® iBonds® Dec 2028 Term Treasury ETF,27458532.62,26.150983,2021-01-25,46436E833,1050000,"Jan 25, 2021",0.07,0.07,ICE 2028 Maturity US Treasury Index,NASDAQ,etf
IBTJ,Fixed Income,Government,North America,2020-02-25,iShares® iBonds® Dec 2029 Term Treasury ETF,26031824.01,26.031824,2021-01-25,46436E825,1000000,"Jan 25, 2021",0.07,0.07,ICE 2029 Maturity US Treasury Index,NASDAQ,etf
IBTK,Fixed Income,Government,North America,2020-07-14,iShares® iBonds® Dec 2030 Term Treasury ETF,2425167.82,24.251678,2021-01-25,46436E593,100000,"Jan 25, 2021",0.07,0.07,ICE 2030 Maturity US Treasury Index,NASDAQ,etf
ICF,Real Estate,Real Estate Securities,North America,2001-01-29,iShares Cohen & Steers REIT ETF,1964856232.66,53.979567,2021-01-22,464287564,36400000,"Jan 22, 2021",0.34,0.34,Cohen & Steers Realty Majors Index,Cboe BZX formerly known as BATS,etf
ICLN,Equity,All Cap,Global,2008-06-24,iShares Global Clean Energy ETF,7015893412.86,32.861327,2021-01-22,464288224,214600000,"Jan 25, 2021",0.46,0.46,S&P Global Clean Energy Index,NASDAQ,etf
ICOL,Equity,All Cap,Latin America,2013-06-18,iShares MSCI Colombia ETF,22668367.44,10.794461,2021-01-22,46434G202,2100000,"Jan 25, 2021",0.61,0.61,MSCI All Colombia Capped Index,NYSE Arca,etf
ICSH,Fixed Income,Multi Sectors,North America,2013-12-11,BlackRock Ultra Short-Term Bond ETF,5196842660.32,50.528368,2021-01-22,46434V878,102850000,"Jan 25, 2021",0.08,0.08,ICE BofA US 6-Month Treasury Bill Index,Cboe BZX formerly known as BATS,etf
ICVT,Fixed Income,Credit,North America,2015-06-02,iShares Convertible Bond ETF,1459901932.41,103.539144,2021-01-22,46435G102,14100000,"Jan 25, 2021",0.2,0.2,Bloomberg Barclays U.S. Convertible Cash Pay Bond > $250MM Index,Cboe BZX formerly known as BATS,etf
IDEV,Equity,Large/Mid Cap,Global,2017-03-21,iShares Core MSCI International Developed Markets ETF,4662605948.37,63.307616,2021-01-22,46435G326,74400000,"Jan 25, 2021",0.05,0.05,MSCI WORLD ex USA IMI Index,NYSE Arca,etf
IDNA,Equity,All Cap,Global,2019-06-11,iShares Genomics Immunology and Healthcare ETF,266793292.06,51.306402,2021-01-22,46435U192,5200000,"Jan 25, 2021",0.47,0.47,NYSE FactSet Global Genomics and Immuno Biopharma Index,NYSE Arca,etf
IDRV,Equity,All Cap,Global,2019-04-16,iShares Self-Driving EV and Tech ETF,234897444.54,46.979489,2021-01-22,46435U366,5100000,"Jan 25, 2021",0.47,0.47,NYSE® FactSet Global Autonomous Driving and Electric Vehicle Index,NYSE Arca,etf
IDU,Equity,All Cap,North America,2000-06-12,iShares U.S. Utilities ETF,781003651.56,77.711806,2021-01-22,464287697,10050000,"Jan 22, 2021",0.43,0.43,Dow Jones U.S. Utilities Index,NYSE Arca,etf
IDV,Equity,All Cap,Global,2007-06-11,iShares International Select Dividend ETF,3864565035.4,30.549921,2021-01-22,464288448,126500000,"Jan 22, 2021",0.49,0.49,Dow Jones EPAC Select Dividend Index,Cboe BZX formerly known as BATS,etf
IECS,Equity,All Cap,North America,2018-03-21,iShares Evolved U.S. Consumer Staples ETF,23949498.54,29.936873,2021-01-22,46431W671,800000,"Jan 25, 2021",0.18,0.18,,Cboe BZX formerly known as BATS,etf
IEDI,Equity,All Cap,North America,2018-03-21,iShares Evolved U.S. Discretionary Spending ETF,24669712.21,41.116187,2021-01-22,46431W663,600000,"Jan 25, 2021",0.18,0.18,,Cboe BZX formerly known as BATS,etf
IEF,Fixed Income,Government,North America,2002-07-22,iShares 7-10 Year Treasury Bond ETF,14118581951.43,118.543929,2021-01-22,464287440,119100000,"Jan 22, 2021",0.15,0.15,ICE U.S. Treasury 7-10 Year Bond Index,NASDAQ,etf
IEFA,Equity,All Cap,Global,2012-10-18,iShares Core MSCI EAFE ETF,86108073761.92,71.081454,2021-01-22,46432F842,1211400000,"Jan 25, 2021",0.07,0.07,MSCI EAFE IMI Index,Cboe BZX formerly known as BATS,etf
IEFN,Equity,All Cap,North America,2018-03-21,iShares Evolved U.S. Financials ETF,5255031.51,26.275158,2021-01-22,46431W655,200000,"Jan 25, 2021",0.18,0.18,,Cboe BZX formerly known as BATS,etf
IEHS,Equity,All Cap,North America,2018-03-21,iShares Evolved U.S. Healthcare Staples ETF,21253278.72,38.642325,2021-01-22,46431W689,550000,"Jan 25, 2021",0.18,0.18,,Cboe BZX formerly known as BATS,etf
IEI,Fixed Income,Government,North America,2007-01-05,iShares 3-7 Year Treasury Bond ETF,11330438493.72,132.519748,2021-01-22,464288661,85500000,"Jan 25, 2021",0.15,0.15,ICE U.S. Treasury 3-7 Year Bond Index,NASDAQ,etf
IEIH,Equity,All Cap,North America,2018-03-21,iShares Evolved U.S. Innovative Healthcare ETF,34347118.3,34.347118,2021-01-22,46431W622,1000000,"Jan 25, 2021",0.18,0.18,,Cboe BZX formerly known as BATS,etf
IEME,Equity,All Cap,North America,2018-03-21,iShares Evolved U.S. Media and Entertainment ETF,14043337.22,35.108343,2021-01-22,46431W630,400000,"Jan 25, 2021",0.18,0.18,,Cboe BZX formerly known as BATS,etf
IEMG,Equity,All Cap,Global,2012-10-18,iShares Core MSCI Emerging Markets ETF,77052476949.7,66.712101,2021-01-22,46434G103,1155000000,"Jan 25, 2021",0.11,0.11,MSCI Emerging Markets Investable Market Index,NYSE Arca,etf
IEO,Equity,All Cap,North America,2006-05-01,iShares U.S. Oil & Gas Exploration & Production ETF,190192216.08,40.040467,2021-01-22,464288851,4750000,"Jan 25, 2021",0.42,0.42,Dow Jones U.S. Select Oil Exploration & Production Index,Cboe BZX formerly known as BATS,etf
