ticker,asset_class,sub_class,region,inception,name,net_assets,nav,nav_as_of,cusip,shares_outstanding,shares_outstanding_as_of,mgmt_fee,expense_ratio,benchmark_index,exchange,type
NYF,Fixed Income,Municipals,North America,2007-10-04,iShares New York Muni Bond ETF,501984659.39,58.370309,2021-02-02,464288323,8600000,"Feb 02, 2021",0.25,0.25,S&P New York AMT-Free Municipal Bond Index,NYSE Arca,etf
OEF,Equity,Large Cap,North America,2000-10-23,iShares S&P 100 ETF,7168562903.48,175.915654,2021-02-02,464287101,40750000,"Feb 02, 2021",0.2,0.2,S&P 100 Index,NYSE Arca,etf
PFF,Others,Others,North America,2007-03-26,iShares Preferred and Income Securities ETF,19045304285.38,38.132554,2021-02-02,464288687,499450000,"Feb 02, 2021",0.46,0.46,ICE Exchange-Listed Preferred & Hybrid Securities Index,NASDAQ,etf
PICK,Equity,All Cap,Global,2012-01-31,iShares MSCI Global Metals & Mining Producers ETF,656239640.12,37.180716,2021-02-02,46434G848,17650000,"Feb 02, 2021",0.39,0.39,MSCI ACWI Select Metals & Mining Producers Ex Gold & Silver Investable Market Index,Cboe BZX formerly known as BATS,etf
QAT,Equity,All Cap,Middle East and Africa,2014-04-29,iShares MSCI Qatar ETF,95721490.37,18.76892,2021-02-02,46434V779,5100000,"Feb 02, 2021",0.59,0.59,MSCI All Qatar Capped Index,NASDAQ,etf
QLTA,Fixed Income,Credit,North America,2012-02-14,iShares Aaa - A Rated Corporate Bond ETF,1421594275.05,57.438153,2021-02-02,46429B291,24750000,"Feb 02, 2021",0.15,0.15,Bloomberg Barclays U.S. Corporate Aaa - A Capped Index,NYSE Arca,etf
QUAL,Equity,Large/Mid Cap,North America,2013-07-16,iShares MSCI USA Quality Factor ETF,19665830952.61,116.193979,2021-02-02,46432F339,169250000,"Feb 02, 2021",0.15,0.15,MSCI USA Sector Neutral Quality Index,Cboe BZX formerly known as BATS,etf
REET,Real Estate,Real Estate Securities,Global,2014-07-08,iShares Global REIT ETF,2534207369.41,24.135308,2021-02-02,46434V647,105000000,"Feb 02, 2021",0.14,0.14,FTSE EPRA Nareit Global REITS Net Total Return Index,NYSE Arca,etf
REM,Real Estate,Real Estate Securities,North America,2007-05-01,iShares Mortgage Real Estate ETF,1327607669.51,32.30189,2021-02-02,46435G342,41100000,"Feb 02, 2021",0.48,0.48,FTSE Nareit All Mortgage Capped Index,Cboe BZX formerly known as BATS,etf
REZ,Real Estate,Real Estate Securities,North America,2007-05-01,iShares Residential and Multisector Real Estate ETF,426854408.46,68.847485,2021-02-02,464288562,6200000,"Feb 02, 2021",0.48,0.48,FTSE Nareit All Residential Capped Index,NYSE Arca,etf
RING,Equity,All Cap,Global,2012-01-31,iShares MSCI Global Gold Miners ETF,461114598.24,28.729882,2021-02-02,46434G855,16050000,"Feb 02, 2021",0.39,0.39,MSCI ACWI Select Gold Miners Investable Market Index,NASDAQ,etf
RXI,Equity,All Cap,Global,2006-09-12,iShares Global Consumer Discretionary ETF,453052051.92,161.804304,2021-02-02,464288745,2800000,"Feb 02, 2021",0.46,0.46,S&P Global 1200 Consumer Discretionary Sector Capped Index,NYSE Arca,etf
SCJ,Equity,Small Cap,Asia Pacific,2007-12-20,iShares MSCI Japan Small-Cap ETF,63583129.18,79.478911,2021-02-02,464286582,800000,"Feb 02, 2021",0.51,0.51,MSCI Japan Small Cap Index,NYSE Arca,etf
SCZ,Equity,Small Cap,Global,2007-12-10,iShares MSCI EAFE Small-Cap ETF,11989727537.61,69.465397,2021-02-02,464288273,172600000,"Feb 02, 2021",0.4,0.4,MSCI EAFE Small Cap Index,NASDAQ,etf
SDG,Equity,Large/Mid Cap,Global,2016-04-20,iShares MSCI Global Impact ETF,379140865.33,97.215606,2021-02-02,46435G532,3900000,"Feb 02, 2021",0.49,0.49,MSCI ACWI Sustainable Impact Index,NASDAQ,etf
SGOV,Fixed Income,Government,North America,2020-05-26,iShares 0-3 Month Treasury Bond ETF,825084902.62,100.010291,2021-02-03,46436E718,8250000,"Feb 03, 2021",0.12,0.12,ICE 0-3 Month US Treasury Securities Index,NYSE Arca,etf
SHV,Fixed Income,Government,North America,2007-01-05,iShares Short Treasury Bond ETF,16487211444.92,110.518913,2021-02-03,464288679,149180000,"Feb 03, 2021",0.15,0.15,ICE Short US Treasury Securities Index,NASDAQ,etf
SHY,Fixed Income,Government,North America,2002-07-22,iShares 1-3 Year Treasury Bond ETF,18964144820.74,86.357672,2021-02-02,464287457,219600000,"Feb 02, 2021",0.15,0.15,ICE U.S. Treasury 1-3 Year Bond Index,NASDAQ,etf
SHYG,Fixed Income,High Yield,North America,2013-10-15,iShares 0-5 Year High Yield Corporate Bond ETF,4636859048.27,45.370441,2021-02-02,46434V407,102200000,"Feb 02, 2021",0.3,0.3,Markit iBoxx USD Liquid High Yield 0-5 Index,NYSE Arca,etf
SIZE,Equity,Large/Mid Cap,North America,2013-04-16,iShares MSCI USA Size Factor ETF,891441368.36,113.55941,2021-02-02,46432F370,7850000,"Feb 02, 2021",0.15,0.15,MSCI USA Low Size Index,NYSE Arca,etf
SLQD,Fixed Income,Credit,North America,2013-10-15,iShares 0-5 Year Investment Grade Corporate Bond ETF,2203696069.43,52.035326,2021-02-02,46434V100,42350000,"Feb 02, 2021",0.06,0.06,Markit iBoxx USD Liquid Investment Grade 0-5 Index,NASDAQ,etf
SLV,Commodity,Precious Metals,Global,2006-04-21,iShares Silver Trust,17938057610.7,24.89668,2021-02-03,46428Q109,720500000,"Feb 03, 2021",,,,NYSE Arca,etf
SLVP,Equity,All Cap,Global,2012-01-31,iShares MSCI Global Silver and Metals Miners ETF,265944089.23,16.216103,2021-02-02,464286327,16400000,"Feb 02, 2021",0.39,0.39,MSCI ACWI Select Silver Miners Investable Market Index,Cboe BZX formerly known as BATS,etf
SMIN,Equity,Small Cap,Asia Pacific,2012-02-08,iShares MSCI India Small-Cap ETF,242247015.99,44.448994,2021-02-02,46429B614,5450000,"Feb 02, 2021",0.74,0.81,MSCI India Small Cap Index,Cboe BZX formerly known as BATS,etf
SMLF,Equity,Small Cap,North America,2015-04-28,iShares MSCI USA Small-Cap Multifactor ETF,792450368.14,49.068134,2021-02-02,46434V290,16150000,"Feb 02, 2021",0.3,0.3,MSCI USA Small Cap Diversified Multiple-Factor Index,NYSE Arca,etf
SMMD,Equity,Mid/Small Cap,North America,2017-07-06,iShares Russell 2500 ETF,219890840.04,60.244066,2021-02-02,46435G268,3650000,"Feb 02, 2021",0.15,0.23,Russell 2500 Index,Cboe BZX formerly known as BATS,etf
SMMV,Equity,Small Cap,North America,2016-09-07,iShares MSCI USA Small-Cap Min Vol Factor ETF,898313345.81,35.506456,2021-02-02,46435G433,25300000,"Feb 02, 2021",0.2,0.2,MSCI USA Small Cap Minimum Volatility (USD) Index,Cboe BZX formerly known as BATS,etf
SOXX,Equity,All Cap,North America,2001-07-10,iShares PHLX Semiconductor ETF,5418504733.66,413.626316,2021-02-02,464287523,13100000,"Feb 02, 2021",0.46,0.46,PHLX SOX Semiconductor Sector Index,NASDAQ,etf
STIP,Fixed Income,Inflation,North America,2010-12-01,iShares 0-5 Year TIPS Bond ETF,3449072131.18,104.994585,2021-02-02,46429B747,32850000,"Feb 02, 2021",0.05,0.05,Bloomberg Barclays U.S. Treasury Inflation-Protected Securities (TIPS) 0-5 Years Index (Series-L),NYSE Arca,etf
STLC,Equity,Large/Mid Cap,North America,2020-04-14,iShares Factors US Blend Style ETF,5483584.51,36.55723,2021-02-02,46436E791,150000,"Feb 02, 2021",0.25,0.25,Russell US Large Cap Factors Blend Style Index,Cboe BZX formerly known as BATS,etf
STLG,Equity,Large/Mid Cap,North America,2020-01-14,iShares Factors US Growth Style ETF,4912058.15,32.747054,2021-02-03,46436E403,150000,"Feb 03, 2021",0.25,0.25,Russell US Large Cap Factors Growth Style Index,Cboe BZX formerly known as BATS,etf
STLV,Equity,Large/Mid Cap,North America,2020-01-14,iShares Factors US Value Style ETF,6323090.62,25.292362,2021-02-03,46436E304,250000,"Feb 03, 2021",0.25,0.25,Russell US Large Cap Factors Value Style Index,Cboe BZX formerly known as BATS,etf
STMB,Equity,Mid Cap,North America,2020-04-14,iShares Factors US Mid Blend Style ETF,5736724.09,38.244827,2021-02-02,46436E783,150000,"Feb 02, 2021",0.3,0.3,Russell US Mid Cap Factors Blend Style Index,Cboe BZX formerly known as BATS,etf
STSB,Equity,Small Cap,North America,2020-04-14,iShares Factors US Small Blend Style ETF,6651698.83,44.344659,2021-02-02,46436E775,150000,"Feb 02, 2021",0.35,0.35,Russell US Small Cap Factors Blend Style Index,Cboe BZX formerly known as BATS,etf
SUB,Fixed Income,Municipals,North America,2008-11-05,iShares Short-Term National Muni Bond ETF,4359837767.45,107.783381,2021-02-02,464288158,40450000,"Feb 02, 2021",0.07,0.07,S&P Short Term National AMT-Free Municipal Bond Index,NYSE Arca,etf
SUSA,Equity,Large/Mid Cap,North America,2005-01-24,iShares MSCI USA ESG Select ETF,2504433492.45,84.46656,2021-02-02,464288802,29650000,"Feb 02, 2021",0.25,0.25,MSCI USA Extended ESG Select Index,NYSE Arca,etf
SUSB,Fixed Income,Credit,North America,2017-07-11,iShares ESG Aware 1-5 Year USD Corporate Bond ETF,596569794.68,26.108087,2021-02-02,46435G243,22850000,"Feb 02, 2021",0.12,0.12,Bloomberg Barclays MSCI US Corporate 1-5 Year ESG Focus Index,NASDAQ,etf
SUSC,Fixed Income,Credit,North America,2017-07-11,iShares ESG Aware USD Corporate Bond ETF,803623283.37,27.855226,2021-02-02,46435G193,28850000,"Feb 02, 2021",0.18,0.18,Bloomberg Barclays MSCI US Corporate ESG Focus Index,NASDAQ,etf
SUSL,Equity,Large/Mid Cap,North America,2019-05-07,iShares ESG MSCI USA Leaders ETF,3024581138.84,66.401342,2021-02-02,46435U218,45550000,"Feb 02, 2021",0.1,0.1,MSCI USA Extended ESG Leaders Index,NASDAQ,etf
SVAL,Equity,Small Cap,North America,2020-10-27,iShares US Small Cap Value Factor ETF,44446183.83,26.144814,2021-02-02,46436E536,1700000,"Feb 02, 2021",0.3,0.3,Russell 2000 Focused Value Select Index,Cboe BZX formerly known as BATS,etf
TECB,Equity,All Cap,North America,2020-01-08,U.S. Tech Breakthrough Multisector ETF,361845661.12,36.550067,2021-02-03,46436E502,9900000,"Feb 03, 2021",0.4,0.4,NYSE FactSet U.S. Tech Breakthrough Index,NYSE Arca,etf
TFLO,Fixed Income,Government,North America,2014-02-03,iShares Treasury Floating Rate Bond ETF,377156063.22,50.287475,2021-02-02,46434V860,7500000,"Feb 02, 2021",0.15,0.15,Bloomberg Barclays US Treasury Floating Rate Bond Index,NYSE Arca,etf
THD,Equity,All Cap,Asia Pacific,2008-03-26,iShares MSCI Thailand ETF,457419095.54,78.865361,2021-02-02,464286624,5800000,"Feb 02, 2021",0.59,0.59,MSCI Thailand IMI 25/50 Index,NYSE Arca,etf
TIP,Fixed Income,Inflation,North America,2003-12-04,iShares TIPS Bond ETF,27581818328.25,127.871202,2021-02-02,464287176,215700000,"Feb 02, 2021",0.19,0.19,Bloomberg Barclays U.S. Treasury Inflation Protected Securities (TIPS) Index (Series-L),NYSE Arca,etf
TLH,Fixed Income,Government,North America,2007-01-05,iShares 10-20 Year Treasury Bond ETF,1429572861.22,153.717512,2021-02-02,464288653,9300000,"Feb 02, 2021",0.15,0.15,ICE U.S. Treasury 10-20 Year Bond Index,NYSE Arca,etf
TLT,Fixed Income,Government,North America,2002-07-22,iShares 20+ Year Treasury Bond ETF,16886679217.26,151.043642,2021-02-02,464287432,111800000,"Feb 02, 2021",0.15,0.15,ICE U.S. Treasury 20+ Year Bond Index,NASDAQ,etf
TOK,Equity,Large/Mid Cap,Global,2007-12-10,iShares MSCI Kokusai ETF,170633524.98,85.316762,2021-02-02,464288265,2000000,"Feb 02, 2021",0.25,0.25,MSCI Kokusai Index,NYSE Arca,etf
TUR,Equity,All Cap,Europe,2008-03-26,iShares MSCI Turkey ETF,315732518.15,28.065113,2021-02-02,464286715,11250000,"Feb 02, 2021",0.59,0.59,MSCI Turkey IMI 25/50 Index,NASDAQ,etf
UAE,Equity,All Cap,Middle East and Africa,2014-04-29,iShares MSCI UAE ETF,15264462.79,13.273446,2021-02-02,46434V761,1150000,"Feb 02, 2021",0.59,0.59,MSCI All UAE Capped Index,NASDAQ,etf
URTH,Equity,Large/Mid Cap,Global,2012-01-10,iShares MSCI World ETF,1121230000.27,114.411225,2021-02-02,464286392,9800000,"Feb 02, 2021",0.24,0.24,MSCI World Index,NYSE Arca,etf
USHY,Fixed Income,High Yield,North America,2017-10-25,iShares Broad USD High Yield Corporate Bond ETF,7533398399.97,41.10995,2021-02-02,46435U853,183250000,"Feb 02, 2021",0.22,0.22,ICE BofA US High Yield Constrained Index,Cboe BZX formerly known as BATS,etf
USIG,Fixed Income,Credit,North America,2007-01-05,iShares Broad USD Investment Grade Corporate Bond ETF,5925227834.8,61.021914,2021-02-02,464288620,97100000,"Feb 02, 2021",0.06,0.06,ICE BofA US Corporate Index,NASDAQ,etf
USMV,Equity,Large/Mid Cap,North America,2011-10-18,iShares MSCI USA Min Vol Factor ETF,30187813258.16,67.293387,2021-02-02,46429B697,448600000,"Feb 02, 2021",0.15,0.15,MSCI USA Minimum Volatility (USD) Index,Cboe BZX formerly known as BATS,etf
USRT,Real Estate,Real Estate Securities,North America,2007-05-01,iShares Core U.S. REIT ETF,1624636515.6,49.607222,2021-02-02,464288521,32750000,"Feb 02, 2021",0.08,0.08,FTSE Nareit Equity REITS Index,NYSE Arca,etf
USXF,Equity,Large Cap,North America,2020-06-16,iShares ESG Advanced MSCI USA ETF,101262739.07,32.146901,2021-02-03,46436E767,3150000,"Feb 03, 2021",0.1,0.1,MSCI USA Choice ESG Screened Index in USD,NASDAQ,etf
VEGI,Equity,All Cap,Global,2012-01-31,iShares MSCI Global Agriculture Producers ETF,41482580.13,36.071809,2021-02-02,464286350,1150000,"Feb 02, 2021",0.39,0.39,MSCI ACWI Select Agriculture Producers Investable Market Index,NYSE Arca,etf
VLUE,Equity,Large/Mid Cap,North America,2013-04-16,iShares MSCI USA Value Factor ETF,10850654540.61,91.760292,2021-02-02,46432F388,118250000,"Feb 02, 2021",0.15,0.15,MSCI USA Enhanced Value Index,Cboe BZX formerly known as BATS,etf
WFBIX,Fixed Income,Multi Sectors,North America,2010-02-02,iShares U.S. Aggregate Bond Index Fund,2188366508.35,10.79,2021-02-02,066922105,,,,,BBG Barc U.S. Aggregate Index,,mf
WFSPX,Equity,Large Cap,North America,1993-07-31,iShares S&P 500 Index Fund,10502922813.47,453.03,2021-02-02,066922204,,,,,S&P 500 Index,,mf
WOOD,Equity,All Cap,Global,2008-06-24,iShares Global Timber & Forestry ETF,311517087.51,81.124242,2021-02-02,464288174,3840000,"Feb 02, 2021",0.46,0.46,S&P Global Timber & Forestry Index,NASDAQ,etf
WPS,Real Estate,Real Estate Securities,Global,2007-07-30,iShares International Developed Property ETF,81130759.54,35.274243,2021-02-02,464288422,2300000,"Feb 02, 2021",0.48,0.48,S&P Developed ex-U.S. Property Index,NYSE Arca,etf
XJH,Equity,Mid Cap,North America,2020-09-22,iShares ESG Screened S&P Mid-Cap ETF,13332284.0,33.33071,2021-02-03,46436E551,400000,"Feb 03, 2021",0.12,0.12,S&P MidCap 400 Sustainability Screened Index,Cboe BZX formerly known as BATS,etf
XJR,Equity,Small Cap,North America,2020-09-22,iShares ESG Screened S&P Small-Cap ETF,8977811.3,35.911245,2021-02-03,46436E544,250000,"Feb 03, 2021",0.12,0.12,S&P SmallCap 600 Sustainability Screened Index,Cboe BZX formerly known as BATS,etf
XT,Equity,Large Cap,Global,2015-03-19,iShares Exponential Technologies ETF,3311422017.84,59.989529,2021-02-02,46434V381,55200000,"Feb 02, 2021",0.47,0.47,Morningstar Exponential Technologies Index,NASDAQ,etf
XVV,Equity,Large Cap,North America,2020-09-22,iShares ESG Screened S&P 500 ETF,7296321.64,29.185287,2021-02-03,46436E569,250000,"Feb 03, 2021",0.08,0.08,S&P 500 Sustainability Screened Index,Cboe BZX formerly known as BATS,etf
