ticker,asset_class,sub_class,region,inception,name,net_assets,nav,nav_as_of,cusip,shares_outstanding,shares_outstanding_as_of,mgmt_fee,expense_ratio,benchmark_index,exchange,type
EWL,Equity,Large/Mid Cap,Europe,1996-03-12,iShares MSCI Switzerland ETF,1748706800.79,44.131402,2021-01-29,464286749,39625000,"Feb 01, 2021",0.51,0.51,MSCI Switzerland 25/50 Index,NYSE Arca,etf
EWM,Equity,Large/Mid Cap,Asia Pacific,1996-03-12,iShares MSCI Malaysia ETF,395824176.42,27.48779,2021-01-29,46434G814,14400000,"Feb 01, 2021",0.51,0.51,MSCI Malaysia Index,NYSE Arca,etf
EWN,Equity,All Cap,Europe,1996-03-12,iShares MSCI Netherlands ETF,299167540.4,42.435112,2021-01-29,464286814,7050000,"Feb 01, 2021",0.51,0.51,MSCI Netherlands IMI 25/50 Index,NYSE Arca,etf
EWO,Equity,All Cap,Europe,1996-03-12,iShares MSCI Austria ETF,57157207.15,20.784439,2021-01-29,464286202,2750000,"Feb 01, 2021",0.51,0.51,MSCI Austria IMI 25/50 Index,NYSE Arca,etf
EWP,Equity,Large/Mid Cap,Europe,1996-03-12,iShares MSCI Spain ETF,570344876.01,26.043145,2021-01-29,464286764,21900000,"Feb 01, 2021",0.51,0.51,MSCI Spain 25/50 Index,NYSE Arca,etf
EWQ,Equity,Large/Mid Cap,Europe,1996-03-12,iShares MSCI France ETF,784438530.37,32.414815,2021-01-29,464286707,24200000,"Feb 01, 2021",0.51,0.51,MSCI France Index,NYSE Arca,etf
EWS,Equity,Large/Mid Cap,Asia Pacific,1996-03-12,iShares MSCI Singapore ETF,663445716.05,21.681233,2021-01-29,46434G780,30600000,"Feb 01, 2021",0.51,0.51,MSCI Singapore 25/50 Index,NYSE Arca,etf
EWT,Equity,Large/Mid Cap,Asia Pacific,2000-06-20,iShares MSCI Taiwan ETF,6043083842.99,55.238426,2021-01-29,46434G772,109700000,"Feb 01, 2021",0.59,0.59,MSCI Taiwan 25/50 Index,NYSE Arca,etf
EWU,Equity,Large/Mid Cap,Europe,1996-03-12,iShares MSCI United Kingdom ETF,2942402183.32,29.394627,2021-01-29,46435G334,100600000,"Feb 01, 2021",0.51,0.51,MSCI United Kingdom Index,NYSE Arca,etf
EWUS,Equity,Small Cap,Europe,2012-01-25,iShares MSCI United Kingdom Small-Cap ETF,66999849.36,41.874906,2021-01-29,46429B416,1600000,"Feb 01, 2021",0.59,0.59,MSCI United Kingdom Small Cap Index,Cboe BZX formerly known as BATS,etf
EWW,Equity,All Cap,Latin America,1996-03-12,iShares MSCI Mexico ETF,1292872825.38,40.784632,2021-01-29,464286822,29300000,"Feb 01, 2021",0.51,0.51,MSCI Mexico IMI 25/50 Index,NYSE Arca,etf
EWY,Equity,Large/Mid Cap,Asia Pacific,2000-05-09,iShares MSCI South Korea ETF,7470045939.66,88.038255,2021-01-29,464286772,85000000,"Feb 01, 2021",0.59,0.59,MSCI Korea 25/50 Index,NYSE Arca,etf
EWZ,Equity,Large/Mid Cap,Latin America,2000-07-10,iShares MSCI Brazil ETF,6032063937.15,34.195374,2021-01-29,464286400,176400000,"Feb 01, 2021",0.59,0.59,MSCI Brazil 25/50 Index,NYSE Arca,etf
EWZS,Equity,Small Cap,Latin America,2010-09-28,iShares MSCI Brazil Small-Cap ETF,108794388.78,15.542056,2021-01-29,464289131,7000000,"Feb 01, 2021",0.59,0.59,MSCI Brazil Small Cap Index,NASDAQ,etf
EXI,Equity,All Cap,Global,2006-09-12,iShares Global Industrials ETF,404289450.53,103.663962,2021-01-29,464288729,3900000,"Feb 01, 2021",0.46,0.46,S&P Global 1200 Industrials Sector Index(TM),NYSE Arca,etf
EZA,Equity,Large/Mid Cap,Middle East and Africa,2003-02-03,iShares MSCI South Africa ETF,423235662.3,44.551122,2021-01-29,464286780,8500000,"Feb 01, 2021",0.59,0.59,MSCI South Africa 25/50 Index,NYSE Arca,etf
EZU,Equity,Large/Mid Cap,Europe,2000-07-25,iShares MSCI Eurozone ETF,4865037758.73,43.437837,2021-01-29,464286608,110400000,"Feb 01, 2021",0.51,0.51,MSCI EMU Index,Cboe BZX formerly known as BATS,etf
FALN,Fixed Income,High Yield,North America,2016-06-14,iShares Fallen Angels USD Bond ETF,1318374215.22,29.297205,2021-01-29,46435G474,45000000,"Feb 01, 2021",0.25,0.25,Bloomberg Barclays US High Yield Fallen Angel 3% Capped Index,NASDAQ,etf
FIBR,Fixed Income,Multi Sectors,North America,2015-02-24,iShares U.S. Fixed Income Balanced Risk Factor ETF,122583507.95,102.152923,2021-02-01,46435U796,1200000,"Feb 01, 2021",0.25,0.25,Bloomberg Barclays U.S. Fixed Income Balanced Risk Index,Cboe BZX formerly known as BATS,etf
FILL,Equity,All Cap,Global,2012-01-31,iShares MSCI Global Energy Producers ETF,59090168.64,13.27869,2021-01-29,464286343,4450000,"Feb 01, 2021",0.39,0.39,MSCI ACWI Select Energy Producers Investable Market Index,NYSE Arca,etf
FLOT,Fixed Income,Credit,North America,2011-06-14,iShares Floating Rate Bond ETF,5605898562.18,50.778067,2021-01-29,46429B655,110400000,"Feb 01, 2021",0.2,0.2,Bloomberg Barclays US Floating Rate Note < 5 Years Index,Cboe BZX formerly known as BATS,etf
FM,Equity,All Cap,Global,2012-09-12,iShares MSCI Frontier 100 ETF,429796830.3,29.539301,2021-01-29,464286145,14550000,"Feb 01, 2021",0.79,0.79,MSCI Frontier Markets 100 Index,NYSE Arca,etf
FOVL,Equity,Large/Mid Cap,North America,2019-03-19,iShares Focused Value Factor ETF,26084466.27,43.47411,2021-01-29,46435U333,600000,"Feb 01, 2021",0.25,0.25,Focused Value Select Index,NYSE Arca,etf
FXI,Equity,Large Cap,Asia Pacific,2004-10-05,iShares China Large-Cap ETF,4085441508.47,49.251857,2021-01-29,464287184,82950000,"Feb 01, 2021",0.74,0.74,FTSE China 50 Index,NYSE Arca,etf
GBF,Fixed Income,Multi Sectors,North America,2007-01-05,iShares Government/Credit Bond ETF,285940914.29,124.322137,2021-01-29,464288596,2300000,"Feb 01, 2021",0.2,0.2,Bloomberg Barclays U.S. Government/Credit Bond Index,NYSE Arca,etf
GHYG,Fixed Income,High Yield,Global,2012-04-03,iShares US & Intl High Yield Corp Bond ETF,186873749.96,50.506419,2021-01-29,464286178,3700000,"Feb 01, 2021",0.4,0.4,Markit iBoxx Global Developed Markets High Yield Index,Cboe BZX formerly known as BATS,etf
GNMA,Fixed Income,Mortgages,North America,2012-02-14,iShares GNMA Bond ETF,508560761.97,50.856076,2021-01-29,46429B333,10000000,"Feb 01, 2021",0.15,0.17,Bloomberg Barclays U.S. GNMA Bond Index,NASDAQ,etf
GOVT,Fixed Income,Government,North America,2012-02-14,iShares U.S. Treasury Bond ETF,14893796033.34,27.114138,2021-01-29,46429B267,549300000,"Feb 01, 2021",0.15,0.15,ICE U.S. Treasury Core Bond Index,Cboe BZX formerly known as BATS,etf
GOVZ,Fixed Income,Government,North America,2020-09-22,iShares 25+ Year Treasury STRIPS Bond ETF,29117641.22,22.398186,2021-02-01,46436E577,1300000,"Feb 01, 2021",0.15,0.15,ICE BofA Long US Treasury Principal STRIPS Index,Cboe BZX formerly known as BATS,etf
GSG,Commodity,Multi Commodity,Global,2006-07-10,iShares S&P GSCI Commodity-Indexed Trust,922542736.75,12.902696,2021-01-29,46428R107,71500000,"Feb 01, 2021",,,S&P GSCI(R) Total Return Index,NYSE Arca,etf
GVI,Fixed Income,Multi Sectors,North America,2007-01-05,iShares Intermediate Government/Credit Bond ETF,2330961122.95,117.133725,2021-01-29,464288612,19900000,"Feb 01, 2021",0.2,0.2,Bloomberg Barclays U.S. Intermediate Government/Credit Bond Index,Cboe BZX formerly known as BATS,etf
HAWX,Equity,Large/Mid Cap,Global,2015-06-29,iShares Currency Hedged MSCI ACWI ex U.S. ETF,93757713.17,29.764353,2021-01-29,46435G847,3150000,"Feb 01, 2021",0.38,0.7,MSCI ACWI ex USA 100% Hedged to USD Index,NYSE Arca,etf
HDV,Equity,All Cap,North America,2011-03-29,iShares Core High Dividend ETF,5716581471.69,86.746305,2021-01-29,46429B663,65900000,"Feb 01, 2021",0.08,0.08,Morningstar Dividend Yield Focus Index,NYSE Arca,etf
HEEM,Equity,Large/Mid Cap,Global,2014-09-23,iShares Currency Hedged MSCI Emerging Markets ETF,209549730.05,31.992325,2021-01-29,46434G509,6550000,"Feb 01, 2021",0.78,1.48,MSCI Emerging Markets 100% USD Hedged Index,Cboe BZX formerly known as BATS,etf
HEFA,Equity,Large/Mid Cap,Global,2014-01-31,iShares Currency Hedged MSCI EAFE ETF,2337093944.9,30.470586,2021-01-29,46434V803,76700000,"Feb 01, 2021",0.38,0.7,MSCI EAFE 100% Hedged to USD Index,Cboe BZX formerly known as BATS,etf
HEWC,Equity,Large/Mid Cap,North America,2015-06-29,iShares Currency Hedged MSCI Canada ETF,12124021.06,26.942269,2021-01-29,46435G706,450000,"Feb 01, 2021",0.62,1.13,MSCI Canada 100% Hedged to USD Index,NYSE Arca,etf
HEWG,Equity,Large/Mid Cap,Europe,2014-01-31,iShares Currency Hedged MSCI Germany ETF,59740479.1,29.141697,2021-01-29,46434V704,2050000,"Feb 01, 2021",0.53,1.04,MSCI Germany 100% Hedged to USD Index,NASDAQ,etf
HEWJ,Equity,Large/Mid Cap,Asia Pacific,2014-01-31,iShares Currency Hedged MSCI Japan ETF,328102538.98,36.055224,2021-01-29,46434V886,9100000,"Feb 01, 2021",0.53,1.04,MSCI Japan 100% Hedged to USD Index,NYSE Arca,etf
HEWU,Equity,Large/Mid Cap,Europe,2015-06-29,iShares Currency Hedged MSCI United Kingdom ETF,6115271.84,20.384239,2021-01-29,46435G862,330000,"Feb 01, 2021",0.62,1.13,MSCI United Kingdom 100% Hedged to USD Index,NYSE Arca,etf
HEWW,Equity,Large/Mid Cap,Latin America,2015-06-29,iShares Currency Hedged MSCI Mexico ETF,775270.63,15.505413,2021-01-29,46435G805,50000,"Feb 01, 2021",0.62,1.13,MSCI Mexico IMI 25/50 100% Hedged to USD Index,NYSE Arca,etf
HEZU,Equity,Large/Mid Cap,Europe,2014-07-09,iShares Currency Hedged MSCI Eurozone ETF,505308650.9,30.905728,2021-01-29,46434V639,16250000,"Feb 01, 2021",0.62,1.13,MSCI EMU 100% USD Hedged Index,NYSE Arca,etf
HJPX,Equity,Large/Mid Cap,Asia Pacific,2015-09-29,iShares Currency Hedged JPX-Nikkei 400 ETF,3279359.35,32.793594,2021-01-29,46435G722,100000,"Feb 01, 2021",0.59,1.07,JPX-Nikkei 400 Net Total Return USD Hedged Index,NYSE Arca,etf
HSCZ,Equity,Small Cap,Global,2015-06-29,iShares Currency Hedged MSCI EAFE Small-Cap ETF,64559924.88,32.279962,2021-01-29,46435G839,2000000,"Feb 01, 2021",0.43,0.83,MSCI EAFE Small-Cap 100% Hedged to USD Index,NYSE Arca,etf
HYBB,Fixed Income,High Yield,North America,2020-10-06,iShares BB Rated Corporate Bond ETF,95907838.7,51.842075,2021-01-29,46435U473,1850000,"Feb 01, 2021",0.25,0.25,ICE BofA BB US High Yield Constrained Index,NYSE Arca,etf
HYDB,Fixed Income,High Yield,North America,2017-07-11,iShares High Yield Bond Factor ETF,51223553.85,51.223554,2021-01-29,46435G250,1000000,"Feb 01, 2021",0.35,0.35,BlackRock High Yield Defensive Bond Index,Cboe BZX formerly known as BATS,etf
HYG,Fixed Income,High Yield,North America,2007-04-04,iShares iBoxx $ High Yield Corporate Bond ETF,21565324267.66,87.06227,2021-01-29,464288513,261700000,"Feb 01, 2021",0.49,0.49,Markit iBoxx USD Liquid High Yield Index,NYSE Arca,etf
HYGH,Fixed Income,High Yield,North America,2014-05-27,iShares Interest Rate Hedged High Yield Bond ETF,56117821.87,86.335111,2021-01-29,46431W606,650000,"Feb 01, 2021",0.65,1.13,Markit iBoxx USD Liquid High Yield Interest Rate Hedged Swaps Index,NYSE Arca,etf
HYXF,Fixed Income,High Yield,North America,2016-06-14,iShares ESG Advanced High Yield Corporate Bond ETF,81116891.09,52.333478,2021-01-29,46435G441,1600000,"Feb 01, 2021",0.35,0.35,Bloomberg Barclays MSCI US High Yield Choice ESG Screened Index,NASDAQ,etf
HYXU,Fixed Income,High Yield,Global,2012-04-03,iShares International High Yield Bond ETF,50520630.46,56.134034,2021-01-29,464286210,1000000,"Feb 01, 2021",0.4,0.4,Markit iBoxx Global Developed Markets ex-US High Yield Index,Cboe BZX formerly known as BATS,etf
IAGG,Fixed Income,Multi Sectors,Global,2015-11-10,iShares Core International Aggregate Bond ETF,3428875353.08,55.799436,2021-02-01,46435G672,61450000,"Feb 01, 2021",0.08,0.08,Bloomberg Barclays Global Aggregate ex USD 10% Issuer Capped (Hedged) Index,Cboe BZX formerly known as BATS,etf
IAI,Equity,All Cap,North America,2006-05-01,iShares U.S. Broker-Dealers & Securities Exchanges ETF,198483552.97,79.393421,2021-01-29,464288794,2500000,"Feb 01, 2021",0.42,0.42,Dow Jones U.S. Select Investment Services Index,NYSE Arca,etf
IAK,Equity,All Cap,North America,2006-05-01,iShares U.S. Insurance ETF,61972086.26,65.233775,2021-01-29,464288786,950000,"Feb 01, 2021",0.42,0.42,Dow Jones U.S. Select Insurance Index,NYSE Arca,etf
IAT,Equity,All Cap,North America,2006-05-01,iShares U.S. Regional Banks ETF,303984215.57,46.058214,2021-01-29,464288778,6600000,"Feb 01, 2021",0.42,0.42,Dow Jones U.S. Select Regional Banks Index,NYSE Arca,etf
IAU,Commodity,Precious Metals,Global,2005-01-21,iShares Gold Trust,31546508414.57,17.756175,2021-02-01,464285105,1776650000,"Feb 01, 2021",,,,NYSE Arca,etf
IAUF,Commodity,Precious Metals,Global,2018-06-06,iShares Gold Strategy ETF,22767330.34,56.918326,2021-01-29,46431W614,400000,"Feb 01, 2021",0.25,0.32,Bloomberg Composite Gold Index,Cboe BZX formerly known as BATS,etf
IBB,Equity,All Cap,North America,2001-02-05,iShares Nasdaq Biotechnology ETF,10912409236.42,160.831382,2021-01-29,464287556,67350000,"Feb 01, 2021",0.46,0.46,Nasdaq Biotechnology Index(R),NASDAQ,etf
IBCE,Fixed Income,Credit,North America,2013-04-17,iShares® iBonds® Mar 2023 Term Corporate ex-Financials ETF,27478073.81,24.980067,2021-01-29,46432FAN7,1100000,"Feb 01, 2021",0.1,0.1,Bloomberg Barclays 2023 Maturity High Quality Corporate Index,NYSE Arca,etf
IBDD,Fixed Income,Credit,North America,2013-07-09,iShares® iBonds® Mar 2023 Term Corporate ETF,73577085.3,27.250772,2021-01-29,46432FAZ0,2700000,"Feb 01, 2021",0.1,0.1,Bloomberg Barclays 2023 Maturity Corporate Index,NYSE Arca,etf
IBDM,Fixed Income,Credit,North America,2015-03-10,iShares® iBonds® Dec 2021 Term Corporate ETF,1539281546.18,24.86723,2021-02-01,46434VBK5,61900000,"Feb 01, 2021",0.1,0.1,Bloomberg Barclays December 2021 Maturity Corporate Index,NYSE Arca,etf
IBDN,Fixed Income,Credit,North America,2015-03-10,iShares® iBonds® Dec 2022 Term Corporate ETF,1480991084.96,25.49038,2021-02-01,46434VBA7,58100000,"Feb 01, 2021",0.1,0.1,Bloomberg Barclays December 2022 Maturity Corporate Index,NYSE Arca,etf
IBDO,Fixed Income,Credit,North America,2015-03-11,iShares® iBonds® Dec 2023 Term Corporate ETF,1435774312.51,26.176378,2021-02-01,46434VAX8,54850000,"Feb 01, 2021",0.1,0.1,Bloomberg Barclays December 2023 Maturity Corporate Index,NYSE Arca,etf
IBDP,Fixed Income,Credit,North America,2015-03-11,iShares® iBonds® Dec 2024 Term Corporate ETF,1221839773.34,26.504117,2021-02-01,46434VBG4,46100000,"Feb 01, 2021",0.1,0.1,Bloomberg Barclays December 2024 Maturity Corporate Index,NYSE Arca,etf
IBDQ,Fixed Income,Credit,North America,2015-03-11,iShares® iBonds® Dec 2025 Term Corporate ETF,1007572567.41,27.194941,2021-02-01,46434VBD1,37050000,"Feb 01, 2021",0.1,0.1,Bloomberg Barclays December 2025 Maturity Corporate Index,NYSE Arca,etf
IBDR,Fixed Income,Credit,North America,2016-09-13,iShares® iBonds® Dec 2026 Term Corporate ETF,625228440.07,26.949502,2021-01-29,46435GAA0,23200000,"Feb 01, 2021",0.1,0.1,Bloomberg Barclays December 2026 Maturity Corporate Index,NYSE Arca,etf
IBDS,Fixed Income,Credit,North America,2017-09-12,iShares® iBonds® Dec 2027 Term Corporate ETF,420708686.19,27.4973,2021-01-29,46435UAA9,15300000,"Feb 01, 2021",0.1,0.1,Bloomberg Barclays December 2027 Maturity Corporate Index,NYSE Arca,etf
IBDT,Fixed Income,Credit,North America,2018-09-18,iShares® iBonds® Dec 2028 Term Corporate ETF,225334190.8,29.264181,2021-01-29,46435U515,7700000,"Feb 01, 2021",0.1,0.1,Bloomberg Barclays December 2028 Maturity Corporate Index,NYSE Arca,etf
IBDU,Fixed Income,Credit,North America,2019-09-17,iShares® iBonds® Dec 2029 Term Corporate ETF,92308580.16,27.149582,2021-01-29,46436E205,3400000,"Feb 01, 2021",0.1,0.1,Bloomberg Barclays December 2029 Maturity Corporate Index,NYSE Arca,etf
IBDV,Fixed Income,Credit,North America,2020-06-23,iShares® iBonds® Dec 2030 Term Corporate ETF,64627765.89,25.851106,2021-02-01,46436E726,2500000,"Feb 01, 2021",0.1,0.1,Bloomberg Barclays December 2030 Maturity Corporate Index,NYSE Arca,etf
IBHA,Fixed Income,High Yield,North America,2019-05-07,iShares® iBonds® 2021 Term High Yield and Income ETF,36358180.34,24.238787,2021-01-29,46435U226,1500000,"Feb 01, 2021",0.35,0.35,Bloomberg Barclays 2021 Term High Yield and Income Index,Cboe BZX formerly known as BATS,etf
IBHB,Fixed Income,High Yield,North America,2019-05-07,iShares® iBonds® 2022 Term High Yield and Income ETF,36327828.54,24.218552,2021-01-29,46435U176,1500000,"Feb 01, 2021",0.35,0.35,Bloomberg Barclays 2022 Term High Yield and Income Index,Cboe BZX formerly known as BATS,etf
IBHC,Fixed Income,High Yield,North America,2019-05-07,iShares® iBonds® 2023 Term High Yield and Income ETF,29316365.54,24.430305,2021-01-29,46435U150,1200000,"Feb 01, 2021",0.35,0.35,Bloomberg Barclays 2023 Term High Yield and Income Index,Cboe BZX formerly known as BATS,etf
IBHD,Fixed Income,High Yield,North America,2019-05-07,iShares® iBonds® 2024 Term High Yield and Income ETF,26815915.05,24.378105,2021-01-29,46435U184,1100000,"Feb 01, 2021",0.35,0.35,Bloomberg Barclays 2024 Term High Yield and Income Index,Cboe BZX formerly known as BATS,etf
IBHE,Fixed Income,High Yield,North America,2019-05-07,iShares® iBonds® 2025 Term High Yield and Income ETF,19899286.66,24.874108,2021-01-29,46435U168,800000,"Feb 01, 2021",0.35,0.35,Bloomberg Barclays 2025 Term High Yield and Income Index,Cboe BZX formerly known as BATS,etf
IBHF,Fixed Income,High Yield,North America,2020-11-10,iShares® iBonds® 2026 Term High Yield and Income ETF,15165595.84,25.275993,2021-02-01,46436E528,600000,"Feb 01, 2021",0.35,0.35,Bloomberg Barclays 2026 Term High Yield and Income Index,Cboe BZX formerly known as BATS,etf
IBMJ,Fixed Income,Municipals,North America,2015-09-01,iShares® iBonds® Dec 2021 Term Muni Bond ETF,320532378.94,25.745573,2021-02-01,46435G789,12450000,"Feb 01, 2021",0.18,0.18,S&P AMT- Free Municipal Series Dec 2021 Index,NYSE Arca,etf
IBMK,Fixed Income,Municipals,North America,2015-09-01,iShares® iBonds® Dec 2022 Term Muni Bond ETF,375620594.51,26.35934,2021-02-01,46435G755,14250000,"Feb 01, 2021",0.18,0.18,S&P AMT-Free Municipal Series Dec 2022 Index,NYSE Arca,etf
IBML,Fixed Income,Municipals,North America,2017-04-11,iShares® iBonds® Dec 2023 Term Muni Bond ETF,298863028.61,26.216055,2021-01-29,46435G318,11400000,"Feb 01, 2021",0.18,0.18,S&P AMT-Free Municipal Series Dec 2023 Index,Cboe BZX formerly known as BATS,etf
IBMM,Fixed Income,Municipals,North America,2018-03-20,iShares® iBonds® Dec 2024 Term Muni Bond ETF,203244256.32,27.099234,2021-02-01,46435U697,7500000,"Feb 01, 2021",0.18,0.18,S&P AMT-Free Municipal Series Dec 2024 Index,Cboe BZX formerly known as BATS,etf
IBMN,Fixed Income,Municipals,North America,2018-11-13,iShares® iBonds® Dec 2025 Term Muni Bond ETF,136757937.44,28.197513,2021-01-29,46435U432,4850000,"Feb 01, 2021",0.18,0.18,S&P AMT-Free Municipal Series Dec 2025 Index,Cboe BZX formerly known as BATS,etf
IBMO,Fixed Income,Municipals,North America,2019-04-02,iShares® iBonds® Dec 2026 Term Muni Bond ETF,77323757.93,27.131143,2021-01-29,46435U259,2850000,"Feb 01, 2021",0.18,0.18,S&P AMT-Free Municipal Series Callable-Adjusted Dec 2026 Index,Cboe BZX formerly known as BATS,etf
IBMP,Fixed Income,Municipals,North America,2019-04-09,iShares® iBonds® Dec 2027 Term Muni Bond ETF,43757348.07,27.348343,2021-01-29,46435U283,1600000,"Feb 01, 2021",0.18,0.18,S&P AMT-Free Municipal Series Callable-Adjusted Dec 2027 Index,Cboe BZX formerly known as BATS,etf
IBMQ,Fixed Income,Municipals,North America,2019-04-16,iShares® iBonds® Dec 2028 Term Muni Bond ETF,59460832.91,27.656201,2021-01-29,46435U325,2150000,"Feb 01, 2021",0.18,0.18,S&P AMT-Free Municipal Series Callable-Adjusted Dec 2028 Index,Cboe BZX formerly known as BATS,etf
IBTA,Fixed Income,Government,North America,2020-02-25,iShares® iBonds® Dec 2021 Term Treasury ETF,11407331.42,25.349625,2021-02-01,46436E700,450000,"Feb 01, 2021",0.07,0.07,ICE 2021 Maturity US Treasury Index,NASDAQ,etf
IBTB,Fixed Income,Government,North America,2020-02-25,iShares® iBonds® Dec 2022 Term Treasury ETF,47022095.24,25.417349,2021-02-01,46436E809,1850000,"Feb 01, 2021",0.07,0.07,ICE 2022 Maturity US Treasury Index,NASDAQ,etf
IBTD,Fixed Income,Government,North America,2020-02-25,iShares® iBonds® Dec 2023 Term Treasury ETF,35983347.81,25.702391,2021-02-01,46436E882,1400000,"Feb 01, 2021",0.07,0.07,ICE 2023 Maturity US Treasury Index,NASDAQ,etf
IBTE,Fixed Income,Government,North America,2020-02-25,iShares® iBonds® Dec 2024 Term Treasury ETF,12946631.24,25.893262,2021-02-01,46436E874,500000,"Feb 01, 2021",0.07,0.07,ICE 2024 Maturity US Treasury Index,NASDAQ,etf
IBTF,Fixed Income,Government,North America,2020-02-25,iShares® iBonds® Dec 2025 Term Treasury ETF,19526322.15,26.035096,2021-02-01,46436E866,750000,"Feb 01, 2021",0.07,0.07,ICE 2025 Maturity US Treasury Index,NASDAQ,etf
IBTG,Fixed Income,Government,North America,2020-02-25,iShares® iBonds® Dec 2026 Term Treasury ETF,22185635.54,26.100748,2021-02-01,46436E858,850000,"Feb 01, 2021",0.07,0.07,ICE 2026 Maturity US Treasury Index,NASDAQ,etf
IBTH,Fixed Income,Government,North America,2020-02-25,iShares® iBonds® Dec 2027 Term Treasury ETF,14336325.88,26.066047,2021-02-01,46436E841,550000,"Feb 01, 2021",0.07,0.07,ICE 2027 Maturity US Treasury Index,NASDAQ,etf
IBTI,Fixed Income,Government,North America,2020-02-25,iShares® iBonds® Dec 2028 Term Treasury ETF,27396464.6,26.091871,2021-02-01,46436E833,1050000,"Feb 01, 2021",0.07,0.07,ICE 2028 Maturity US Treasury Index,NASDAQ,etf
IBTJ,Fixed Income,Government,North America,2020-02-25,iShares® iBonds® Dec 2029 Term Treasury ETF,25960046.92,25.960047,2021-02-01,46436E825,1000000,"Feb 01, 2021",0.07,0.07,ICE 2029 Maturity US Treasury Index,NASDAQ,etf
IBTK,Fixed Income,Government,North America,2020-07-14,iShares® iBonds® Dec 2030 Term Treasury ETF,2416822.71,24.168227,2021-02-01,46436E593,100000,"Feb 01, 2021",0.07,0.07,ICE 2030 Maturity US Treasury Index,NASDAQ,etf
ICF,Real Estate,Real Estate Securities,North America,2001-01-29,iShares Cohen & Steers REIT ETF,1949057047.36,53.693032,2021-01-29,464287564,36100000,"Feb 01, 2021",0.34,0.34,Cohen & Steers Realty Majors Index,Cboe BZX formerly known as BATS,etf
ICLN,Equity,All Cap,Global,2008-06-24,iShares Global Clean Energy ETF,6509976178.87,29.834905,2021-01-29,464288224,219200000,"Feb 01, 2021",0.46,0.46,S&P Global Clean Energy Index,NASDAQ,etf
ICOL,Equity,All Cap,Latin America,2013-06-18,iShares MSCI Colombia ETF,21343459.62,10.163552,2021-01-29,46434G202,2100000,"Feb 01, 2021",0.61,0.61,MSCI All Colombia Capped Index,NYSE Arca,etf
ICSH,Fixed Income,Multi Sectors,North America,2013-12-11,BlackRock Ultra Short-Term Bond ETF,5197403791.06,50.533824,2021-01-29,46434V878,102850000,"Feb 01, 2021",0.08,0.08,ICE BofA US 6-Month Treasury Bill Index,Cboe BZX formerly known as BATS,etf
ICVT,Fixed Income,Credit,North America,2015-06-02,iShares Convertible Bond ETF,1405677348.02,99.693429,2021-01-29,46435G102,14100000,"Feb 01, 2021",0.2,0.2,Bloomberg Barclays U.S. Convertible Cash Pay Bond > $250MM Index,Cboe BZX formerly known as BATS,etf
IDEV,Equity,Large/Mid Cap,Global,2017-03-21,iShares Core MSCI International Developed Markets ETF,4628021738.47,61.217219,2021-01-29,46435G326,75600000,"Feb 01, 2021",0.05,0.05,MSCI WORLD ex USA IMI Index,NYSE Arca,etf
IDNA,Equity,All Cap,Global,2019-06-11,iShares Genomics Immunology and Healthcare ETF,274110002.48,50.295413,2021-01-29,46435U192,5450000,"Feb 01, 2021",0.47,0.47,NYSE FactSet Global Genomics and Immuno Biopharma Index,NYSE Arca,etf
IDRV,Equity,All Cap,Global,2019-04-16,iShares Self-Driving EV and Tech ETF,244548157.72,44.463301,2021-01-29,46435U366,5500000,"Feb 01, 2021",0.47,0.47,NYSE® FactSet Global Autonomous Driving and Electric Vehicle Index,NYSE Arca,etf
IDU,Equity,All Cap,North America,2000-06-12,iShares U.S. Utilities ETF,783230252.09,76.78728,2021-01-29,464287697,10200000,"Feb 01, 2021",0.43,0.43,Dow Jones U.S. Utilities Index,NYSE Arca,etf
IDV,Equity,All Cap,Global,2007-06-11,iShares International Select Dividend ETF,3765666143.6,29.650915,2021-01-29,464288448,127200000,"Feb 01, 2021",0.49,0.49,Dow Jones EPAC Select Dividend Index,Cboe BZX formerly known as BATS,etf
IECS,Equity,All Cap,North America,2018-03-21,iShares Evolved U.S. Consumer Staples ETF,23606027.34,29.507534,2021-01-29,46431W671,800000,"Feb 01, 2021",0.18,0.18,,Cboe BZX formerly known as BATS,etf
IEDI,Equity,All Cap,North America,2018-03-21,iShares Evolved U.S. Discretionary Spending ETF,23673409.58,39.455683,2021-01-29,46431W663,600000,"Feb 01, 2021",0.18,0.18,,Cboe BZX formerly known as BATS,etf
IEF,Fixed Income,Government,North America,2002-07-22,iShares 7-10 Year Treasury Bond ETF,13883376965.58,118.661342,2021-01-29,464287440,117000000,"Feb 01, 2021",0.15,0.15,ICE U.S. Treasury 7-10 Year Bond Index,NASDAQ,etf
IEFA,Equity,All Cap,Global,2012-10-18,iShares Core MSCI EAFE ETF,83271353535.5,68.739767,2021-01-29,46432F842,1211400000,"Feb 01, 2021",0.07,0.07,MSCI EAFE IMI Index,Cboe BZX formerly known as BATS,etf
IEFN,Equity,All Cap,North America,2018-03-21,iShares Evolved U.S. Financials ETF,4993033.13,24.965166,2021-01-29,46431W655,200000,"Feb 01, 2021",0.18,0.18,,Cboe BZX formerly known as BATS,etf
IEHS,Equity,All Cap,North America,2018-03-21,iShares Evolved U.S. Healthcare Staples ETF,20856265.74,37.920483,2021-01-29,46431W689,550000,"Feb 01, 2021",0.18,0.18,,Cboe BZX formerly known as BATS,etf
IEI,Fixed Income,Government,North America,2007-01-05,iShares 3-7 Year Treasury Bond ETF,11322735180.03,132.584721,2021-01-29,464288661,85900000,"Feb 01, 2021",0.15,0.15,ICE U.S. Treasury 3-7 Year Bond Index,NASDAQ,etf
IEIH,Equity,All Cap,North America,2018-03-21,iShares Evolved U.S. Innovative Healthcare ETF,35302102.54,33.62105,2021-01-29,46431W622,1050000,"Feb 01, 2021",0.18,0.18,,Cboe BZX formerly known as BATS,etf
IEME,Equity,All Cap,North America,2018-03-21,iShares Evolved U.S. Media and Entertainment ETF,15659507.37,34.798905,2021-01-29,46431W630,450000,"Feb 01, 2021",0.18,0.18,,Cboe BZX formerly known as BATS,etf
IEMG,Equity,All Cap,Global,2012-10-18,iShares Core MSCI Emerging Markets ETF,73725508276.0,63.831609,2021-01-29,46434G103,1155000000,"Feb 01, 2021",0.11,0.11,MSCI Emerging Markets Investable Market Index,NYSE Arca,etf
IEO,Equity,All Cap,North America,2006-05-01,iShares U.S. Oil & Gas Exploration & Production ETF,174697846.41,37.569429,2021-01-29,464288851,4650000,"Feb 01, 2021",0.42,0.42,Dow Jones U.S. Select Oil Exploration & Production Index,Cboe BZX formerly known as BATS,etf
