ticker,asset_class,sub_class,region,inception,name,net_assets,nav,nav_as_of,cusip,shares_outstanding,shares_outstanding_as_of,mgmt_fee,expense_ratio,benchmark_index,exchange,type
AAXJ,Equity,Large/Mid Cap,Asia Pacific,2008-08-13,iShares MSCI All Country Asia ex Japan ETF,6522986068.84,96.780209,2021-01-19,464288182,67400000,"Jan 19, 2021",0.7,0.7,MSCI AC Asia ex Japan Index,NASDAQ,etf
ACWF,Equity,Large/Mid Cap,Global,2015-04-28,iShares MSCI Global Multifactor ETF,93033622.66,35.107027,2021-01-19,46434V316,2650000,"Jan 19, 2021",0.35,0.35,MSCI ACWI Diversified Multiple-Factor Index,NYSE Arca,etf
ACWI,Equity,Large/Mid Cap,Global,2008-03-26,iShares MSCI ACWI ETF,14710568760.89,92.98716,2021-01-19,464288257,158200000,"Jan 19, 2021",0.32,0.33,MSCI ACWI Index,NASDAQ,etf
ACWV,Equity,Large/Mid Cap,Global,2011-10-18,iShares MSCI Global Min Vol Factor ETF,5795633239.84,97.569583,2021-01-19,464286525,59400000,"Jan 19, 2021",0.32,0.32,MSCI All Country World Minimum Volatility Index,Cboe BZX formerly known as BATS,etf
ACWX,Equity,Large/Mid Cap,Global,2008-03-26,iShares MSCI ACWI ex U.S. ETF,3881939169.6,55.141181,2021-01-19,464288240,70400000,"Jan 19, 2021",0.32,0.34,MSCI ACWI ex USA Index,NASDAQ,etf
AGG,Fixed Income,Multi Sectors,North America,2003-09-22,iShares Core U.S. Aggregate Bond ETF,85628826670.77,117.364072,2021-01-19,464287226,729600000,"Jan 19, 2021",0.04,0.04,Bloomberg Barclays US Aggregate Bond Index,NYSE Arca,etf
AGT,Equity,All Cap,Latin America,2017-04-25,iShares MSCI Argentina and Global Exposure ETF,7957593.43,26.525311,2021-01-19,46435G276,300000,"Jan 19, 2021",0.59,0.59,MSCI All Argentina 25/50 Index,Cboe BZX formerly known as BATS,etf
AGZ,Fixed Income,Government,North America,2008-11-05,iShares Agency Bond ETF,805535887.6,119.33865,2021-01-19,464288166,6750000,"Jan 19, 2021",0.2,0.2,Bloomberg Barclays U.S. Agency Bond Index,NYSE Arca,etf
AIA,Equity,Large Cap,Asia Pacific,2007-11-13,iShares Asia 50 ETF,3023343496.73,96.746992,2021-01-19,464288430,31250000,"Jan 19, 2021",0.5,0.5,S&P Asia 50 Index,NASDAQ,etf
AMCA,Equity,Large/Mid Cap,North America,2017-08-08,iShares Russell 1000 Pure U.S. Revenue ETF,3261180.96,32.61181,2021-01-19,46435G169,100000,"Jan 19, 2021",0.15,0.15,Russell 1000 Pure Domestic Exposure Index,NASDAQ,etf
AOA,Multi Asset,Static Allocation,Global,2008-11-04,iShares Core Aggressive Allocation ETF,1217568649.73,65.46068,2021-01-19,464289859,18600000,"Jan 19, 2021",0.25,0.31,S&P Target Risk Aggressive Index,NYSE Arca,etf
AOK,Multi Asset,Static Allocation,Global,2008-11-04,iShares Core Conservative Allocation ETF,852585961.62,38.930866,2021-01-19,464289883,21900000,"Jan 19, 2021",0.25,0.31,S&P Target Risk Conservative Index,NYSE Arca,etf
AOM,Multi Asset,Static Allocation,Global,2008-11-04,iShares Core Moderate Allocation ETF,1480695457.72,43.549866,2021-01-19,464289875,34000000,"Jan 19, 2021",0.25,0.3,S&P Target Risk Moderate Index,NYSE Arca,etf
AOR,Multi Asset,Static Allocation,Global,2008-11-04,iShares Core Growth Allocation ETF,1633999260.0,52.96594,2021-01-19,464289867,30850000,"Jan 19, 2021",0.25,0.31,S&P Target Risk Growth Index,NYSE Arca,etf
BAIPX,Fixed Income,Inflation,North America,2016-02-16,iShares Short-Term TIPS Bond Index Fund,1861840.34,10.38,2021-01-19,09258N877,,,,,BBG Barc US TIPS 0-5 Years Index,,mf
BARDX,Real Estate,Real Estate Securities,Global,2015-08-13,iShares Developed Real Estate Index Fund,1572785.48,9.79,2021-01-19,091936211,,,,,FTSE EPRA Nareit Developed Index (Net) in USD,,mf
BASMX,Equity,All Cap,North America,2015-08-13,iShares Total U.S. Stock Market Index Fund,128761288.96,18.34,2021-01-19,091936179,,,,,Russell 3000 Index,,mf
BDBKX,Equity,Small Cap,North America,2011-03-31,iShares Russell 2000 Small-Cap Index Fund,1997243839.59,26.43,2021-01-19,09253F887,,,,,Russell 2000 Index (Gross Total Return),,mf
BDBPX,Equity,Small Cap,North America,2018-08-06,iShares Russell 2000 Small-Cap Index Fund,358112061.27,26.29,2021-01-19,066923244,,,,,Russell 2000 Index (Gross Total Return),,mf
BDOAX,Equity,Large Cap,Global,2011-06-30,iShares MSCI Total International Index Fund,380871813.61,10.46,2021-01-19,066923624,,,,,MSCI All Country World ex US Index (Net TR),,mf
BDOIX,Equity,Large Cap,Global,2011-06-30,iShares MSCI Total International Index Fund,159237534.72,10.49,2021-01-19,066923616,,,,,MSCI All Country World ex US Index (Net TR),,mf
BDOKX,Equity,Large Cap,Global,2011-06-30,iShares MSCI Total International Index Fund,698079339.38,10.83,2021-01-19,066923590,,,,,MSCI All Country World ex US Index (Net TR),,mf
BFTR,Equity,Mid/Small Cap,North America,2020-09-29,BlackRock Future Innovators ETF,9394261.2,52.19034,2021-01-20,09290C202,180000,"Jan 20, 2021",0.8,0.8,Russell 2500 Growth Index,NYSE Arca,etf
BGRN,Fixed Income,Multi Sectors,Global,2018-11-13,iShares Global Green Bond ETF,169998296.65,55.737146,2021-01-19,46435U440,3050000,"Jan 19, 2021",0.25,0.25,Bloomberg Barclays MSCI Global Green Bond Select (USD Hedged) Index,NASDAQ,etf
BIDAX,Fixed Income,Municipals,North America,2018-11-16,iShares Municipal Bond Index Fund,23257688.45,12.29,2021-01-19,09258N356,,,,,ICE BofA US Municipal Securities Index,,mf
BIDIX,Fixed Income,Municipals,North America,2018-11-16,iShares Municipal Bond Index Fund,6342767.93,12.28,2021-01-19,09258N349,,,,,ICE BofA US Municipal Securities Index,,mf
BIDKX,Fixed Income,Municipals,North America,2018-11-16,iShares Municipal Bond Index Fund,106977.69,12.29,2021-01-19,09258N331,,,,,ICE BofA US Municipal Securities Index,,mf
BIDPX,Fixed Income,Municipals,North America,2018-11-16,iShares Municipal Bond Index Fund,315343467.31,12.29,2021-01-19,066923210,,,,,ICE BofA US Municipal Securities Index,,mf
BIEVX,Equity,Large Cap,Global,2016-07-13,iShares Edge MSCI Min Vol EAFE Index Fund,25650075.97,10.2,2021-01-19,09258N588,,,,,MSCI EAFE Minimum Volatility (USD Optimized) Index - USD Net,,mf
BIIMX,Equity,Large Cap,Global,2016-07-13,iShares Edge MSCI Multifactor Intl Index Fund,292550.74,11.2,2021-01-19,09258N679,,,,,MSCI World ex USA Diversified Multiple-Factor Net Index,,mf
BIIPX,Fixed Income,Inflation,North America,2016-02-16,iShares Short-Term TIPS Bond Index Fund,16622822.9,10.34,2021-01-19,09258N885,,,,,BBG Barc US TIPS 0-5 Years Index,,mf
BIMFX,Equity,Large Cap,North America,2016-07-13,iShares Edge MSCI Multifactor USA Index Fund,776625.0,14.36,2021-01-19,09258N729,,,,,MSCI USA Diversified Multiple-Factor Gross Index,,mf
BIMVX,Equity,Large Cap,North America,2016-07-13,iShares Edge MSCI Min Vol USA Index Fund,63501643.64,14.2,2021-01-19,09258N638,,,,,MSCI USA Minimum Volatility (USD Optimized) Index - USD Gross,,mf
BIRDX,Real Estate,Real Estate Securities,Global,2015-08-13,iShares Developed Real Estate Index Fund,46277132.35,9.81,2021-01-19,091936195,,,,,FTSE EPRA Nareit Developed Index (Net) in USD,,mf
BITSX,Equity,All Cap,North America,2015-08-13,iShares Total U.S. Stock Market Index Fund,102282645.6,18.36,2021-01-19,091936161,,,,,Russell 3000 Index,,mf
BKEVX,Equity,Large Cap,Global,2016-07-13,iShares Edge MSCI Min Vol EAFE Index Fund,12289780.6,10.2,2021-01-19,09258N596,,,,,MSCI EAFE Minimum Volatility (USD Optimized) Index - USD Net,,mf
BKF,Equity,Large/Mid Cap,Global,2007-11-12,iShares MSCI BRIC ETF,191292417.65,56.262476,2021-01-19,464286657,3400000,"Jan 19, 2021",0.7,0.7,MSCI BRIC Index,NYSE Arca,etf
BKIMX,Equity,Large Cap,Global,2016-07-13,iShares Edge MSCI Multifactor Intl Index Fund,11090558.16,11.2,2021-01-19,09258N687,,,,,MSCI World ex USA Diversified Multiple-Factor Net Index,,mf
BKIPX,Fixed Income,Inflation,North America,2016-02-16,iShares Short-Term TIPS Bond Index Fund,42217585.72,10.38,2021-01-19,09258N869,,,,,BBG Barc US TIPS 0-5 Years Index,,mf
BKMFX,Equity,Large Cap,North America,2016-07-13,iShares Edge MSCI Multifactor USA Index Fund,15217272.9,14.36,2021-01-19,09258N737,,,,,MSCI USA Diversified Multiple-Factor Gross Index,,mf
BKMVX,Equity,Large Cap,North America,2016-07-13,iShares Edge MSCI Min Vol USA Index Fund,23887361.25,14.2,2021-01-19,09258N646,,,,,MSCI USA Minimum Volatility (USD Optimized) Index - USD Gross,,mf
BKRDX,Real Estate,Real Estate Securities,Global,2015-08-13,iShares Developed Real Estate Index Fund,1952032248.73,9.79,2021-01-19,091936187,,,,,FTSE EPRA Nareit Developed Index (Net) in USD,,mf
BKTSX,Equity,All Cap,North America,2015-08-13,iShares Total U.S. Stock Market Index Fund,1303473307.27,18.36,2021-01-19,091936153,,,,,Russell 3000 Index,,mf
BMED,Equity,Mid/Small Cap,Global,2020-09-29,BlackRock Future Health ETF,7596288.04,31.6512,2021-01-20,09290C400,240000,"Jan 20, 2021",0.85,0.85,MSCI All Country World Index,NYSE Arca,etf
BMOAX,Fixed Income,Multi Sectors,North America,2011-03-31,iShares U.S. Aggregate Bond Index Fund,157665405.81,10.81,2021-01-19,066923400,,,,,BBG Barc U.S. Aggregate Index,,mf
BMOIX,Fixed Income,Multi Sectors,North America,2011-03-31,iShares U.S. Aggregate Bond Index Fund,371620681.66,10.81,2021-01-19,066923509,,,,,BBG Barc U.S. Aggregate Index,,mf
BMOPX,Fixed Income,Multi Sectors,North America,2018-08-06,iShares U.S. Aggregate Bond Index Fund,7120495.8,10.81,2021-01-19,066923228,,,,,BBG Barc U.S. Aggregate Index,,mf
BRGAX,Equity,Large Cap,North America,2011-03-31,iShares Russell 1000 Large-Cap Index Fund,84253766.79,25.31,2021-01-19,066923103,,,,,Russell 1000 Index (Gross Total Return),,mf
BRGKX,Equity,Large Cap,North America,2011-03-31,iShares Russell 1000 Large-Cap Index Fund,426226655.99,25.37,2021-01-19,066923301,,,,,Russell 1000 Index (Gross Total Return),,mf
BRGNX,Equity,Large Cap,North America,2011-03-31,iShares Russell 1000 Large-Cap Index Fund,127156089.14,25.47,2021-01-19,066923202,,,,,Russell 1000 Index (Gross Total Return),,mf
BRMAX,Equity,Mid Cap,North America,2015-11-30,iShares Russell Mid-Cap Index Fund,112627541.27,13.22,2021-01-19,09258N307,,,,,Russell MidCap Index,,mf
BRMIX,Equity,Mid Cap,North America,2015-05-13,iShares Russell Mid-Cap Index Fund,224011191.3,13.27,2021-01-19,091936294,,,,,Russell MidCap Index,,mf
BRMKX,Equity,Mid Cap,North America,2015-05-13,iShares Russell Mid-Cap Index Fund,1158192805.24,13.3,2021-01-19,091936286,,,,,Russell MidCap Index,,mf
BSMAX,Equity,Mid/Small Cap,North America,2015-08-13,iShares Russell Small/Mid-Cap Index Fund,86022027.19,16.15,2021-01-19,091936245,,,,,Russell 2500 Total Return Index,,mf
BSMIX,Equity,Mid/Small Cap,North America,2015-08-13,iShares Russell Small/Mid-Cap Index Fund,101852524.19,16.17,2021-01-19,091936237,,,,,Russell 2500 Total Return Index,,mf
BSMKX,Equity,Mid/Small Cap,North America,2015-08-13,iShares Russell Small/Mid-Cap Index Fund,197424031.03,16.17,2021-01-19,091936229,,,,,Russell 2500 Total Return Index,,mf
BSPAX,Equity,Large Cap,North America,2013-04-11,iShares S&P 500 Index Fund,2566311748.07,449.41,2021-01-19,066923566,,,,,S&P 500 Index,,mf
BSPGX,Equity,Large Cap,North America,2019-07-01,iShares S&P 500 Index Fund,7495130479.15,449.64,2021-01-19,066923194,,,,,S&P 500 Index,,mf
BSPIX,Equity,Large Cap,North America,2013-04-11,iShares S&P 500 Index Fund,4058899377.49,449.53,2021-01-19,066923558,,,,,S&P 500 Index,,mf
BSPPX,Equity,Large Cap,North America,2018-08-06,iShares S&P 500 Index Fund,1400362725.28,449.02,2021-01-19,066923236,,,,,S&P 500 Index,,mf
BSPSX,Equity,Large Cap,North America,2013-04-22,iShares S&P 500 Index Fund,596525310.06,449.45,2021-01-19,066923533,,,,,S&P 500 Index,,mf
BTEK,Equity,Mid/Small Cap,Global,2020-09-29,BlackRock Future Tech ETF,9189236.25,38.288484,2021-01-20,09290C301,240000,"Jan 20, 2021",0.88,0.88,MSCI All Country World Index,NYSE Arca,etf
BTMKX,Equity,All Cap,Global,2011-03-31,iShares MSCI EAFE International Index Fund,,15.11,2021-01-20,09253F879,,,,,MSCI EAFE Index (Net Total Return),,mf
BTMPX,Equity,All Cap,Global,2018-08-06,iShares MSCI EAFE International Index Fund,149655608.43,14.86,2021-01-19,066923251,,,,,MSCI EAFE Index (Net Total Return),,mf
BYLD,Fixed Income,Multi Sectors,North America,2014-04-22,iShares Yield Optimized Bond ETF,200091414.61,25.652745,2021-01-19,46434V787,7800000,"Jan 19, 2021",0.28,0.48,Morningstar U.S. Bond Market Yield-Optimized Index,NYSE Arca,etf
CCRV,Commodity,Multi Commodity,North America,2020-09-01,iShares Commodity Curve Carry Strategy ETF,32959837.15,21.973225,2021-01-19,46431W564,1500000,"Jan 19, 2021",0.4,0.4,ICE BofA Commodity Carry Total Return Index,NYSE Arca,etf
CEMB,Fixed Income,Credit,Global,2012-04-17,iShares J.P. Morgan EM Corporate Bond ETF,262426112.59,52.485223,2021-01-19,464286251,5000000,"Jan 19, 2021",0.5,0.5,J.P. Morgan CEMBI Broad Diversified Core Index,Cboe BZX formerly known as BATS,etf
CMBS,Fixed Income,Mortgages,North America,2012-02-14,iShares CMBS ETF,470855509.35,55.07082,2021-01-19,46429B366,8550000,"Jan 19, 2021",0.25,0.25,Bloomberg Barclays U.S. CMBS (ERISA Only) Index,NYSE Arca,etf
CMDY,Commodity,Multi Commodity,Global,2018-04-03,iShares Bloomberg Roll Select Commodity Strategy ETF,51157937.08,46.507216,2021-01-19,46431W598,1100000,"Jan 19, 2021",0.28,0.29,Bloomberg Roll Select Commodity Total Return Index,NYSE Arca,etf
CMF,Fixed Income,Municipals,North America,2007-10-04,iShares California Muni Bond ETF,1695352965.36,62.674786,2021-01-19,464288356,27050000,"Jan 19, 2021",0.25,0.25,S&P California AMT-Free Municipal bond Index,NYSE Arca,etf
CNYA,Equity,Large/Mid Cap,Asia Pacific,2016-06-13,iShares MSCI China A ETF,659207233.22,44.997081,2021-01-20,46434V514,14650000,"Jan 20, 2021",0.6,0.6,MSCI China A Inclusion Index,Cboe BZX formerly known as BATS,etf
COMT,Commodity,Multi Commodity,Global,2014-10-15,iShares Commodities Select Strategy ETF,225619272.5,27.854231,2021-01-19,46431W853,8100000,"Jan 19, 2021",0.48,0.48,,NASDAQ,etf
CRBN,Equity,Large/Mid Cap,Global,2014-12-08,iShares MSCI ACWI Low Carbon Target ETF,639400213.59,152.238146,2021-01-19,46434V464,4200000,"Jan 19, 2021",0.2,0.2,MSCI ACWI Low Carbon Target Index,NYSE Arca,etf
DEFA,Equity,Large/Mid Cap,Global,2016-01-05,iShares Adaptive Currency Hedged MSCI EAFE ETF,6189310.52,30.946553,2021-01-19,46435G656,200000,"Jan 19, 2021",0.38,0.7,MSCI EAFE Adaptive Hedge to USD Index,Cboe BZX formerly known as BATS,etf
DGRO,Equity,All Cap,North America,2014-06-10,iShares Core Dividend Growth ETF,15095240464.55,45.694689,2021-01-19,46434V621,330350000,"Jan 19, 2021",0.08,0.08,Morningstar US Dividend Growth Index,NYSE Arca,etf
DIVB,Equity,All Cap,North America,2017-11-07,iShares U.S. Dividend and Buyback ETF,42741805.7,34.193445,2021-01-19,46435U861,1250000,"Jan 19, 2021",0.25,0.25,Morningstar US Dividend and Buyback Index,Cboe BZX formerly known as BATS,etf
DMXF,Equity,Large Cap,Global,2020-06-16,iShares ESG Advanced MSCI EAFE ETF,64491948.12,64.491948,2021-01-20,46436E759,1000000,"Jan 20, 2021",0.12,0.12,MSCI EAFE Choice ESG Screened Net Index in USD,NASDAQ,etf
DSI,Equity,Large/Mid Cap,North America,2006-11-14,iShares MSCI KLD 400 Social ETF,2652754495.09,72.479631,2021-01-19,464288570,36600000,"Jan 19, 2021",0.25,0.25,MSCI KLD 400 Social Index,NYSE Arca,etf
DVY,Equity,All Cap,North America,2003-11-03,iShares Select Dividend ETF,15185084204.56,101.16645,2021-01-19,464287168,150100000,"Jan 19, 2021",0.39,0.39,Dow Jones U.S. Select Dividend IndexSM,NASDAQ,etf
DVYA,Equity,All Cap,Asia Pacific,2012-02-23,iShares Asia/Pacific Dividend ETF,31858775.62,39.82347,2021-01-19,464286293,800000,"Jan 19, 2021",0.49,0.49,Dow Jones Asia/Pacific Select Dividend 50 Index,NYSE Arca,etf
DVYE,Equity,All Cap,Global,2012-02-23,iShares Emerging Markets Dividend ETF,721432026.12,38.682682,2021-01-19,464286319,18650000,"Jan 19, 2021",0.49,0.49,Dow Jones Emerging Markets Select Dividend Index,NYSE Arca,etf
DYNF,Equity,Large/Mid Cap,North America,2019-03-19,BlackRock U.S. Equity Factor Rotation ETF,94579758.52,32.61371,2021-01-19,09290C103,2900000,"Jan 19, 2021",0.3,0.3,MSCI Developed - US Gross TR Index,NYSE Arca,etf
EAGG,Fixed Income,Multi Sectors,North America,2018-10-18,iShares ESG Aware U.S. Aggregate Bond ETF,1026781072.7,56.108255,2021-01-19,46435U549,18300000,"Jan 19, 2021",0.1,0.11,Bloomberg Barclays MSCI US Aggregate ESG Focus Index,NYSE Arca,etf
EAOA,Multi Asset,Multi Strategy,North America,2020-06-12,iShares ESG Aware Aggressive Allocation ETF,4716982.31,31.446549,2021-01-20,46436E668,150000,"Jan 20, 2021",0.18,0.33,BlackRock ESG Aware Aggressive Allocation Index,Cboe BZX formerly known as BATS,etf
EAOK,Multi Asset,Multi Strategy,North America,2020-06-12,iShares ESG Aware Conservative Allocation ETF,4097615.55,27.317437,2021-01-20,46436E692,150000,"Jan 20, 2021",0.18,0.3,BlackRock ESG Aware Conservative Allocation Index,Cboe BZX formerly known as BATS,etf
EAOM,Multi Asset,Multi Strategy,North America,2020-06-12,iShares ESG Aware Moderate Allocation ETF,4217975.28,28.119835,2021-01-20,46436E684,150000,"Jan 20, 2021",0.18,0.31,BlackRock ESG Aware Moderate Allocation Index,Cboe BZX formerly known as BATS,etf
EAOR,Multi Asset,Multi Strategy,North America,2020-06-12,iShares ESG Aware Growth Allocation ETF,4464030.03,29.7602,2021-01-20,46436E676,150000,"Jan 20, 2021",0.18,0.32,BlackRock ESG Aware Growth Allocation Index,Cboe BZX formerly known as BATS,etf
ECH,Equity,All Cap,Latin America,2007-11-12,iShares MSCI Chile ETF,512731260.09,32.348975,2021-01-19,464286640,15850000,"Jan 19, 2021",0.59,0.59,MSCI Chile IMI 25/50 Index,Cboe BZX formerly known as BATS,etf
ECNS,Equity,Small Cap,Asia Pacific,2010-09-28,iShares MSCI China Small-Cap ETF,65048192.84,54.206827,2021-01-19,46429B200,1200000,"Jan 19, 2021",0.59,0.59,MSCI China Small Cap Index,NYSE Arca,etf
EDEN,Equity,All Cap,Europe,2012-01-25,iShares MSCI Denmark ETF,167837292.21,98.727819,2021-01-19,46429B523,1700000,"Jan 19, 2021",0.53,0.53,MSCI Denmark IMI 25/50 Index,Cboe BZX formerly known as BATS,etf
EEM,Equity,Large/Mid Cap,Global,2003-04-07,iShares MSCI Emerging Markets ETF,30262181863.06,55.394805,2021-01-19,464287234,546300000,"Jan 19, 2021",0.7,0.7,MSCI Emerging Markets Index(SM),NYSE Arca,etf
EEMA,Equity,Large/Mid Cap,Asia Pacific,2012-02-08,iShares MSCI Emerging Markets Asia ETF,808212031.72,93.978143,2021-01-19,464286426,8600000,"Jan 19, 2021",0.49,0.5,MSCI EM Asia Custom Capped Index,NASDAQ,etf
EEMS,Equity,Small Cap,Global,2011-08-16,iShares MSCI Emerging Markets Small-Cap ETF,262517181.57,54.691079,2021-01-19,464286475,4800000,"Jan 19, 2021",0.7,0.71,MSCI Emerging Markets Small Cap Index,NYSE Arca,etf
EEMV,Equity,Large/Mid Cap,Global,2011-10-18,iShares MSCI Emerging Markets Min Vol Factor ETF,4247599774.49,63.586823,2021-01-19,464286533,66800000,"Jan 19, 2021",0.7,0.7,MSCI Emerging Markets Minimum Volatility Index,Cboe BZX formerly known as BATS,etf
EFA,Equity,Large/Mid Cap,Global,2001-08-14,iShares MSCI EAFE ETF,53808114062.17,74.795822,2021-01-19,464287465,719400000,"Jan 19, 2021",0.32,0.32,MSCI EAFE Index,NYSE Arca,etf
EFAV,Equity,Large/Mid Cap,Global,2011-10-18,iShares MSCI EAFE Min Vol Factor ETF,10570613742.02,73.972105,2021-01-19,46429B689,142900000,"Jan 19, 2021",0.32,0.32,MSCI EAFE Minimum Volatility (USD) Index,Cboe BZX formerly known as BATS,etf
EFG,Equity,Large/Mid Cap,Global,2005-08-01,iShares MSCI EAFE Growth ETF,10091836953.71,102.144099,2021-01-19,464288885,98800000,"Jan 19, 2021",0.39,0.39,MSCI EAFE Growth Index,Cboe BZX formerly known as BATS,etf
EFNL,Equity,All Cap,Europe,2012-01-25,iShares MSCI Finland ETF,29678592.0,45.659372,2021-01-19,46429B515,650000,"Jan 19, 2021",0.53,0.53,MSCI Finland IMI 25/50 Index,Cboe BZX formerly known as BATS,etf
EFV,Equity,Large/Mid Cap,Global,2005-08-01,iShares MSCI EAFE Value ETF,9489836819.44,48.816033,2021-01-19,464288877,194400000,"Jan 19, 2021",0.39,0.39,MSCI EAFE Value Index,Cboe BZX formerly known as BATS,etf
EIDO,Equity,All Cap,Asia Pacific,2010-05-05,iShares MSCI Indonesia ETF,399394424.14,24.427794,2021-01-19,46429B309,16350000,"Jan 19, 2021",0.59,0.59,MSCI Indonesia IMI 25/50 Index,NYSE Arca,etf
EIRL,Equity,All Cap,Europe,2010-05-05,iShares MSCI Ireland ETF,58896733.34,51.214551,2021-01-19,46429B507,1150000,"Jan 19, 2021",0.51,0.51,MSCI All Ireland Capped Index,NYSE Arca,etf
EIS,Equity,All Cap,Europe,2008-03-26,iShares MSCI Israel ETF,146462625.2,66.573921,2021-01-19,464286632,2200000,"Jan 19, 2021",0.59,0.59,MSCI Israel Capped Investable Market Index,NYSE Arca,etf
EMB,Fixed Income,Government,Global,2007-12-17,iShares J.P. Morgan USD Emerging Markets Bond ETF,18717227590.36,113.231867,2021-01-19,464288281,165300000,"Jan 19, 2021",0.39,0.39,J.P. Morgan EMBI Global Core Index,NASDAQ,etf
EMBH,Fixed Income,Government,Global,2015-07-22,iShares Interest Rate Hedged Emerging Markets Bond ETF,5915600.19,23.662401,2021-01-20,46431W820,250000,"Jan 20, 2021",0.75,1.13,JPM Swaps-Hedged EMBIG Core Index,NYSE Arca,etf
EMGF,Equity,Large/Mid Cap,Global,2015-12-08,iShares MSCI Emerging Markets Multifactor ETF,710656685.36,52.254168,2021-01-19,46434G889,13600000,"Jan 19, 2021",0.45,0.45,MSCI Emerging Market Diversified Multiple-Factor Index,Cboe BZX formerly known as BATS,etf
EMHY,Fixed Income,High Yield,Global,2012-04-03,iShares J.P. Morgan EM High Yield Bond ETF,327265393.63,45.453527,2021-01-19,464286285,7200000,"Jan 19, 2021",0.5,0.5,J.P. Morgan USD Emerging Markets High Yield Bond Index,Cboe BZX formerly known as BATS,etf
EMIF,Equity,All Cap,Global,2009-06-16,iShares Emerging Markets Infrastructure ETF,16083216.73,24.74341,2021-01-19,464288216,650000,"Jan 19, 2021",0.6,0.6,S&P Emerging Markets Infrastructure Index,NASDAQ,etf
EMXC,Equity,All Cap,Global,2017-07-18,iShares MSCI Emerging Markets ex China ETF,191385368.52,59.807928,2021-01-19,46434G764,3200000,"Jan 19, 2021",0.25,0.34,MSCI Emerging Markets ex China Index,NASDAQ,etf
EMXF,Equity,Large/Mid Cap,Global,2020-10-06,iShares ESG Advanced MSCI EM ETF,13630883.55,45.436279,2021-01-20,46436E742,300000,"Jan 20, 2021",0.16,0.16,MSCI Emerging Markets Choice ESG Screened 5% Issuer Capped Index,NASDAQ,etf
ENOR,Equity,All Cap,Europe,2012-01-23,iShares MSCI Norway ETF,30182376.29,26.245545,2021-01-19,46429B499,1150000,"Jan 19, 2021",0.53,0.53,MSCI Norway IMI 25/50 Index,Cboe BZX formerly known as BATS,etf
ENZL,Equity,All Cap,Asia Pacific,2010-09-01,iShares MSCI New Zealand ETF,196922352.47,65.640784,2021-01-19,464289123,3000000,"Jan 19, 2021",0.51,0.51,MSCI New Zealand IMI 25/50 Index,NASDAQ,etf
EPHE,Equity,All Cap,Asia Pacific,2010-09-28,iShares MSCI Philippines ETF,157922050.51,32.561248,2021-01-19,46429B408,4850000,"Jan 19, 2021",0.59,0.59,MSCI Philippines IMI 25-50 NET Index,NYSE Arca,etf
EPOL,Equity,All Cap,Europe,2010-05-25,iShares MSCI Poland ETF,288921080.37,19.390677,2021-01-19,46429B606,14900000,"Jan 19, 2021",0.59,0.59,MSCI Poland IMI 25/50 Index,NYSE Arca,etf
EPP,Equity,Large/Mid Cap,Asia Pacific,2001-10-25,iShares MSCI Pacific ex Japan ETF,2154807549.65,49.879804,2021-01-19,464286665,43200000,"Jan 19, 2021",0.48,0.48,MSCI Pacific ex-Japan Index,NYSE Arca,etf
EPU,Equity,All Cap,Latin America,2009-06-19,iShares MSCI Peru ETF,173317668.39,35.370953,2021-01-19,464289842,4900000,"Jan 19, 2021",0.59,0.59,MSCI All Peru Capped Index,NYSE Arca,etf
ERUS,Equity,Large/Mid Cap,Europe,2010-11-09,iShares MSCI Russia ETF,494397364.88,39.551789,2021-01-19,46434G798,12500000,"Jan 19, 2021",0.59,0.59,MSCI Russia 25 / 50 Index,NYSE Arca,etf
ESGD,Equity,Large/Mid Cap,Global,2016-06-28,iShares ESG Aware MSCI EAFE ETF,4177480931.87,74.731323,2021-01-19,46435G516,55900000,"Jan 19, 2021",0.2,0.2,MSCI EAFE Extended ESG Focus Index,NASDAQ,etf
ESGE,Equity,Large/Mid Cap,Global,2016-06-28,iShares ESG Aware MSCI EM ETF,7071613786.37,44.927661,2021-01-19,46434G863,157400000,"Jan 19, 2021",0.25,0.25,MSCI Emerging Markets Extended ESG Focus Index,NASDAQ,etf
ESGU,Equity,Large/Mid Cap,North America,2016-12-01,iShares ESG Aware MSCI USA ETF,13257631397.13,87.422561,2021-01-19,46435G425,151650000,"Jan 19, 2021",0.15,0.15,MSCI USA Extended ESG Focus Index,NASDAQ,etf
ESML,Equity,All Cap,North America,2018-04-10,iShares ESG Aware MSCI USA Small-Cap ETF,579363383.86,36.784977,2021-01-19,46435U663,15750000,"Jan 19, 2021",0.17,0.17,MSCI USA Small Cap Extended ESG Focus Index,Cboe BZX formerly known as BATS,etf
EUFN,Equity,All Cap,Europe,2010-01-20,iShares MSCI Europe Financials ETF,1072987911.7,17.868242,2021-01-19,464289180,60050000,"Jan 19, 2021",0.48,0.48,MSCI Europe Financials Index,NASDAQ,etf
EUSA,Equity,Large/Mid Cap,North America,2010-05-05,iShares MSCI USA Equal Weighted ETF,294005360.07,74.431737,2021-01-19,464286681,3950000,"Jan 19, 2021",0.15,0.15,MSCI USA Equal Weighted Index,NYSE Arca,etf
EUSB,Fixed Income,Multi Sectors,North America,2020-06-23,iShares ESG Advanced Total USD Bond Market ETF,166107175.46,50.335508,2021-01-20,46436E619,3300000,"Jan 20, 2021",0.12,0.13,Bloomberg Barclays MSCI US Universal Choice ESG Screened Index,NYSE Arca,etf
EWA,Equity,Large/Mid Cap,Asia Pacific,1996-03-12,iShares MSCI Australia ETF,1744978751.62,24.577166,2021-01-19,464286103,71000000,"Jan 19, 2021",0.51,0.51,MSCI Australia Index,NYSE Arca,etf
EWC,Equity,Large/Mid Cap,North America,1996-03-12,iShares MSCI Canada ETF,2994065182.9,31.885678,2021-01-19,464286509,93900000,"Jan 19, 2021",0.51,0.51,MSCI Canada Custom Capped Index,NYSE Arca,etf
EWD,Equity,Large/Mid Cap,Europe,1996-03-12,iShares MSCI Sweden ETF,429478705.76,41.196998,2021-01-19,464286756,10425000,"Jan 19, 2021",0.51,0.51,MSCI Sweden 25/50 Index,NYSE Arca,etf
EWG,Equity,Large/Mid Cap,Europe,1996-03-12,iShares MSCI Germany ETF,2611798195.64,32.125439,2021-01-19,464286806,81300000,"Jan 19, 2021",0.51,0.51,MSCI Germany Index,NYSE Arca,etf
EWGS,Equity,Small Cap,Europe,2012-01-25,iShares MSCI Germany Small-Cap ETF,38646717.67,77.293435,2021-01-19,46429B465,500000,"Jan 19, 2021",0.59,0.59,MSCI Germany Small Cap Index,Cboe BZX formerly known as BATS,etf
EWH,Equity,Large/Mid Cap,Asia Pacific,1996-03-12,iShares MSCI Hong Kong ETF,1557694891.16,26.525243,2021-01-19,464286871,58725000,"Jan 19, 2021",0.51,0.51,MSCI Hong Kong 25/50 Index,NYSE Arca,etf
EWI,Equity,Large/Mid Cap,Europe,1996-03-12,iShares MSCI Italy ETF,166675438.15,29.631189,2021-01-19,46434G830,5625000,"Jan 19, 2021",0.51,0.51,MSCI Italy 25/50 Index,NYSE Arca,etf
