ticker,asset_class,sub_class,region,inception,name,net_assets,nav,nav_as_of,cusip,shares_outstanding,shares_outstanding_as_of,mgmt_fee,expense_ratio,benchmark_index,exchange,type
EWL,Equity,Large/Mid Cap,Europe,1996-03-12,iShares MSCI Switzerland ETF,1767736989.86,44.611659,2021-02-04,464286749,39625000,"Feb 05, 2021",0.51,0.51,MSCI Switzerland 25/50 Index,NYSE Arca,etf
EWM,Equity,Large/Mid Cap,Asia Pacific,1996-03-12,iShares MSCI Malaysia ETF,388308570.08,27.686886,2021-02-04,46434G814,14025000,"Feb 05, 2021",0.51,0.51,MSCI Malaysia Index,NYSE Arca,etf
EWN,Equity,All Cap,Europe,1996-03-12,iShares MSCI Netherlands ETF,307250946.99,43.581695,2021-02-04,464286814,7050000,"Feb 05, 2021",0.51,0.51,MSCI Netherlands IMI 25/50 Index,NYSE Arca,etf
EWO,Equity,All Cap,Europe,1996-03-12,iShares MSCI Austria ETF,58332325.63,21.211755,2021-02-04,464286202,2750000,"Feb 05, 2021",0.51,0.51,MSCI Austria IMI 25/50 Index,NYSE Arca,etf
EWP,Equity,Large/Mid Cap,Europe,1996-03-12,iShares MSCI Spain ETF,542875676.17,26.808675,2021-02-04,464286764,20250000,"Feb 05, 2021",0.51,0.51,MSCI Spain 25/50 Index,NYSE Arca,etf
EWQ,Equity,Large/Mid Cap,Europe,1996-03-12,iShares MSCI France ETF,803363732.98,33.196848,2021-02-04,464286707,24200000,"Feb 05, 2021",0.51,0.51,MSCI France Index,NYSE Arca,etf
EWS,Equity,Large/Mid Cap,Asia Pacific,1996-03-12,iShares MSCI Singapore ETF,659357119.99,21.547618,2021-02-04,46434G780,30450000,"Feb 05, 2021",0.51,0.51,MSCI Singapore 25/50 Index,NYSE Arca,etf
EWT,Equity,Large/Mid Cap,Asia Pacific,2000-06-20,iShares MSCI Taiwan ETF,6299786879.79,57.42741,2021-02-04,46434G772,109700000,"Feb 05, 2021",0.59,0.59,MSCI Taiwan 25/50 Index,NYSE Arca,etf
EWU,Equity,Large/Mid Cap,Europe,1996-03-12,iShares MSCI United Kingdom ETF,2980139450.48,29.623653,2021-02-04,46435G334,100600000,"Feb 05, 2021",0.51,0.51,MSCI United Kingdom Index,NYSE Arca,etf
EWUS,Equity,Small Cap,Europe,2012-01-25,iShares MSCI United Kingdom Small-Cap ETF,68727684.65,42.954803,2021-02-04,46429B416,1650000,"Feb 05, 2021",0.59,0.59,MSCI United Kingdom Small Cap Index,Cboe BZX formerly known as BATS,etf
EWW,Equity,All Cap,Latin America,1996-03-12,iShares MSCI Mexico ETF,1134180779.95,41.393459,2021-02-04,464286822,26300000,"Feb 05, 2021",0.51,0.51,MSCI Mexico IMI 25/50 Index,NYSE Arca,etf
EWY,Equity,Large/Mid Cap,Asia Pacific,2000-05-09,iShares MSCI South Korea ETF,7812192121.52,91.370668,2021-02-04,464286772,85500000,"Feb 05, 2021",0.59,0.59,MSCI Korea 25/50 Index,NYSE Arca,etf
EWZ,Equity,Large/Mid Cap,Latin America,2000-07-10,iShares MSCI Brazil ETF,6281503710.83,35.609431,2021-02-04,464286400,176400000,"Feb 05, 2021",0.59,0.59,MSCI Brazil 25/50 Index,NYSE Arca,etf
EWZS,Equity,Small Cap,Latin America,2010-09-28,iShares MSCI Brazil Small-Cap ETF,115062248.49,16.437464,2021-02-04,464289131,7000000,"Feb 05, 2021",0.59,0.59,MSCI Brazil Small Cap Index,NASDAQ,etf
EXI,Equity,All Cap,Global,2006-09-12,iShares Global Industrials ETF,418445449.64,107.293705,2021-02-04,464288729,3900000,"Feb 05, 2021",0.46,0.46,S&P Global 1200 Industrials Sector Index(TM),NYSE Arca,etf
EZA,Equity,Large/Mid Cap,Middle East and Africa,2003-02-03,iShares MSCI South Africa ETF,383678181.5,45.675974,2021-02-04,464286780,8400000,"Feb 05, 2021",0.59,0.59,MSCI South Africa 25/50 Index,NYSE Arca,etf
EZU,Equity,Large/Mid Cap,Europe,2000-07-25,iShares MSCI Eurozone ETF,4931858075.25,44.672627,2021-02-04,464286608,110400000,"Feb 05, 2021",0.51,0.51,MSCI EMU Index,Cboe BZX formerly known as BATS,etf
FALN,Fixed Income,High Yield,North America,2016-06-14,iShares Fallen Angels USD Bond ETF,1392631782.78,29.380417,2021-02-04,46435G474,47400000,"Feb 05, 2021",0.25,0.25,Bloomberg Barclays US High Yield Fallen Angel 3% Capped Index,NASDAQ,etf
FIBR,Fixed Income,Multi Sectors,North America,2015-02-24,iShares U.S. Fixed Income Balanced Risk Factor ETF,122461997.76,102.051665,2021-02-05,46435U796,1200000,"Feb 05, 2021",0.25,0.25,Bloomberg Barclays U.S. Fixed Income Balanced Risk Index,Cboe BZX formerly known as BATS,etf
FILL,Equity,All Cap,Global,2012-01-31,iShares MSCI Global Energy Producers ETF,61454173.3,13.809927,2021-02-04,464286343,4450000,"Feb 05, 2021",0.39,0.39,MSCI ACWI Select Energy Producers Investable Market Index,NYSE Arca,etf
FLOT,Fixed Income,Credit,North America,2011-06-14,iShares Floating Rate Bond ETF,5634664277.78,50.762741,2021-02-04,46429B655,112100000,"Feb 05, 2021",0.2,0.2,Bloomberg Barclays US Floating Rate Note < 5 Years Index,Cboe BZX formerly known as BATS,etf
FM,Equity,All Cap,Global,2012-09-12,iShares MSCI Frontier 100 ETF,431706985.26,29.670583,2021-02-04,464286145,14550000,"Feb 05, 2021",0.79,0.79,MSCI Frontier Markets 100 Index,NYSE Arca,etf
FOVL,Equity,Large/Mid Cap,North America,2019-03-19,iShares Focused Value Factor ETF,27796135.72,46.326893,2021-02-04,46435U333,600000,"Feb 05, 2021",0.25,0.25,Focused Value Select Index,NYSE Arca,etf
FXI,Equity,Large Cap,Asia Pacific,2004-10-05,iShares China Large-Cap ETF,4260551369.93,51.362886,2021-02-04,464287184,82950000,"Feb 05, 2021",0.74,0.74,FTSE China 50 Index,NYSE Arca,etf
GBF,Fixed Income,Multi Sectors,North America,2007-01-05,iShares Government/Credit Bond ETF,284614101.51,123.745262,2021-02-04,464288596,2300000,"Feb 05, 2021",0.2,0.2,Bloomberg Barclays U.S. Government/Credit Bond Index,NYSE Arca,etf
GHYG,Fixed Income,High Yield,Global,2012-04-03,iShares US & Intl High Yield Corp Bond ETF,186623882.86,50.438887,2021-02-04,464286178,3700000,"Feb 05, 2021",0.4,0.4,Markit iBoxx Global Developed Markets High Yield Index,Cboe BZX formerly known as BATS,etf
GNMA,Fixed Income,Mortgages,North America,2012-02-14,iShares GNMA Bond ETF,507662242.63,50.766224,2021-02-04,46429B333,10000000,"Feb 05, 2021",0.15,0.17,Bloomberg Barclays U.S. GNMA Bond Index,NASDAQ,etf
GOVT,Fixed Income,Government,North America,2012-02-14,iShares U.S. Treasury Bond ETF,14835874842.97,26.979223,2021-02-04,46429B267,549900000,"Feb 04, 2021",0.15,0.15,ICE U.S. Treasury Core Bond Index,Cboe BZX formerly known as BATS,etf
GOVZ,Fixed Income,Government,North America,2020-09-22,iShares 25+ Year Treasury STRIPS Bond ETF,29045937.1,21.515509,2021-02-05,46436E577,1350000,"Feb 05, 2021",0.15,0.15,ICE BofA Long US Treasury Principal STRIPS Index,Cboe BZX formerly known as BATS,etf
GSG,Commodity,Multi Commodity,Global,2006-07-10,iShares S&P GSCI Commodity-Indexed Trust,1007325840.47,13.38639,2021-02-04,46428R107,75250000,"Feb 05, 2021",,,S&P GSCI(R) Total Return Index,NYSE Arca,etf
GVI,Fixed Income,Multi Sectors,North America,2007-01-05,iShares Intermediate Government/Credit Bond ETF,2320544376.55,116.903999,2021-02-04,464288612,20050000,"Feb 05, 2021",0.2,0.2,Bloomberg Barclays U.S. Intermediate Government/Credit Bond Index,Cboe BZX formerly known as BATS,etf
HAWX,Equity,Large/Mid Cap,Global,2015-06-29,iShares Currency Hedged MSCI ACWI ex U.S. ETF,97715400.44,30.922595,2021-02-04,46435G847,3160000,"Feb 05, 2021",0.38,0.7,MSCI ACWI ex USA 100% Hedged to USD Index,NYSE Arca,etf
HDV,Equity,All Cap,North America,2011-03-29,iShares Core High Dividend ETF,5842705972.49,88.727501,2021-02-04,46429B663,65850000,"Feb 05, 2021",0.08,0.08,Morningstar Dividend Yield Focus Index,NYSE Arca,etf
HEEM,Equity,Large/Mid Cap,Global,2014-09-23,iShares Currency Hedged MSCI Emerging Markets ETF,219131032.93,33.45512,2021-02-04,46434G509,6610000,"Feb 05, 2021",0.78,1.48,MSCI Emerging Markets 100% USD Hedged Index,Cboe BZX formerly known as BATS,etf
HEFA,Equity,Large/Mid Cap,Global,2014-01-31,iShares Currency Hedged MSCI EAFE ETF,2413061158.18,31.543283,2021-02-04,46434V803,76500000,"Feb 05, 2021",0.38,0.7,MSCI EAFE 100% Hedged to USD Index,Cboe BZX formerly known as BATS,etf
HEWC,Equity,Large/Mid Cap,North America,2015-06-29,iShares Currency Hedged MSCI Canada ETF,12605330.94,28.011847,2021-02-04,46435G706,450000,"Feb 05, 2021",0.62,1.13,MSCI Canada 100% Hedged to USD Index,NYSE Arca,etf
HEWG,Equity,Large/Mid Cap,Europe,2014-01-31,iShares Currency Hedged MSCI Germany ETF,64031299.4,30.491095,2021-02-04,46434V704,2200000,"Feb 05, 2021",0.53,1.04,MSCI Germany 100% Hedged to USD Index,NASDAQ,etf
HEWJ,Equity,Large/Mid Cap,Asia Pacific,2014-01-31,iShares Currency Hedged MSCI Japan ETF,335343243.28,37.26036,2021-02-04,46434V886,9000000,"Feb 05, 2021",0.53,1.04,MSCI Japan 100% Hedged to USD Index,NYSE Arca,etf
HEWU,Equity,Large/Mid Cap,Europe,2015-06-29,iShares Currency Hedged MSCI United Kingdom ETF,7255531.95,20.730091,2021-02-04,46435G862,350000,"Feb 05, 2021",0.62,1.13,MSCI United Kingdom 100% Hedged to USD Index,NYSE Arca,etf
HEWW,Equity,Large/Mid Cap,Latin America,2015-06-29,iShares Currency Hedged MSCI Mexico ETF,795758.79,15.915176,2021-02-04,46435G805,50000,"Feb 05, 2021",0.62,1.13,MSCI Mexico IMI 25/50 100% Hedged to USD Index,NYSE Arca,etf
HEZU,Equity,Large/Mid Cap,Europe,2014-07-09,iShares Currency Hedged MSCI Eurozone ETF,522004367.38,32.322252,2021-02-04,46434V639,16150000,"Feb 05, 2021",0.62,1.13,MSCI EMU 100% USD Hedged Index,NYSE Arca,etf
HJPX,Equity,Large/Mid Cap,Asia Pacific,2015-09-29,iShares Currency Hedged JPX-Nikkei 400 ETF,3377773.37,33.777734,2021-02-04,46435G722,100000,"Feb 05, 2021",0.59,1.07,JPX-Nikkei 400 Net Total Return USD Hedged Index,NYSE Arca,etf
HSCZ,Equity,Small Cap,Global,2015-06-29,iShares Currency Hedged MSCI EAFE Small-Cap ETF,67148982.91,33.574491,2021-02-04,46435G839,2000000,"Feb 05, 2021",0.43,0.83,MSCI EAFE Small-Cap 100% Hedged to USD Index,NYSE Arca,etf
HYBB,Fixed Income,High Yield,North America,2020-10-06,iShares BB Rated Corporate Bond ETF,96153217.05,51.974712,2021-02-04,46435U473,1850000,"Feb 05, 2021",0.25,0.25,ICE BofA BB US High Yield Constrained Index,NYSE Arca,etf
HYDB,Fixed Income,High Yield,North America,2017-07-11,iShares High Yield Bond Factor ETF,59005440.41,51.309079,2021-02-04,46435G250,1150000,"Feb 05, 2021",0.35,0.35,BlackRock High Yield Defensive Bond Index,Cboe BZX formerly known as BATS,etf
HYG,Fixed Income,High Yield,North America,2007-04-04,iShares iBoxx $ High Yield Corporate Bond ETF,23695446812.71,87.276047,2021-02-04,464288513,271500000,"Feb 04, 2021",0.49,0.49,Markit iBoxx USD Liquid High Yield Index,NYSE Arca,etf
HYGH,Fixed Income,High Yield,North America,2014-05-27,iShares Interest Rate Hedged High Yield Bond ETF,56459709.87,86.861092,2021-02-04,46431W606,650000,"Feb 05, 2021",0.65,1.13,Markit iBoxx USD Liquid High Yield Interest Rate Hedged Swaps Index,NYSE Arca,etf
HYXF,Fixed Income,High Yield,North America,2016-06-14,iShares ESG Advanced High Yield Corporate Bond ETF,83787708.79,52.367318,2021-02-04,46435G441,1600000,"Feb 05, 2021",0.35,0.35,Bloomberg Barclays MSCI US High Yield Choice ESG Screened Index,NASDAQ,etf
HYXU,Fixed Income,High Yield,Global,2012-04-03,iShares International High Yield Bond ETF,55754111.33,55.754111,2021-02-04,464286210,1000000,"Feb 05, 2021",0.4,0.4,Markit iBoxx Global Developed Markets ex-US High Yield Index,Cboe BZX formerly known as BATS,etf
IAGG,Fixed Income,Multi Sectors,Global,2015-11-10,iShares Core International Aggregate Bond ETF,3412641064.17,55.535249,2021-02-05,46435G672,61450000,"Feb 05, 2021",0.08,0.08,Bloomberg Barclays Global Aggregate ex USD 10% Issuer Capped (Hedged) Index,Cboe BZX formerly known as BATS,etf
IAI,Equity,All Cap,North America,2006-05-01,iShares U.S. Broker-Dealers & Securities Exchanges ETF,207842203.82,84.833553,2021-02-04,464288794,2450000,"Feb 04, 2021",0.42,0.42,Dow Jones U.S. Select Investment Services Index,NYSE Arca,etf
IAK,Equity,All Cap,North America,2006-05-01,iShares U.S. Insurance ETF,65322237.91,68.76025,2021-02-04,464288786,950000,"Feb 05, 2021",0.42,0.42,Dow Jones U.S. Select Insurance Index,NYSE Arca,etf
IAT,Equity,All Cap,North America,2006-05-01,iShares U.S. Regional Banks ETF,331126954.11,50.170751,2021-02-04,464288778,6600000,"Feb 05, 2021",0.42,0.42,Dow Jones U.S. Select Regional Banks Index,NYSE Arca,etf
IAU,Commodity,Precious Metals,Global,2005-01-21,iShares Gold Trust,30455743934.71,17.18382,2021-02-05,464285105,1772350000,"Feb 05, 2021",,,,NYSE Arca,etf
IAUF,Commodity,Precious Metals,Global,2018-06-06,iShares Gold Strategy ETF,24812783.74,55.139519,2021-02-04,46431W614,450000,"Feb 05, 2021",0.25,0.32,Bloomberg Composite Gold Index,Cboe BZX formerly known as BATS,etf
IBB,Equity,All Cap,North America,2001-02-05,iShares Nasdaq Biotechnology ETF,11072180251.91,166.248953,2021-02-04,464287556,66650000,"Feb 05, 2021",0.46,0.46,Nasdaq Biotechnology Index(R),NASDAQ,etf
IBCE,Fixed Income,Credit,North America,2013-04-17,iShares® iBonds® Mar 2023 Term Corporate ex-Financials ETF,27434311.64,24.940283,2021-02-04,46432FAN7,1100000,"Feb 05, 2021",0.1,0.1,Bloomberg Barclays 2023 Maturity High Quality Corporate Index,NYSE Arca,etf
IBDD,Fixed Income,Credit,North America,2013-07-09,iShares® iBonds® Mar 2023 Term Corporate ETF,73470857.26,27.211429,2021-02-04,46432FAZ0,2700000,"Feb 05, 2021",0.1,0.1,Bloomberg Barclays 2023 Maturity Corporate Index,NYSE Arca,etf
IBDM,Fixed Income,Credit,North America,2015-03-10,iShares® iBonds® Dec 2021 Term Corporate ETF,1529195652.75,24.86497,2021-02-05,46434VBK5,61500000,"Feb 05, 2021",0.1,0.1,Bloomberg Barclays December 2021 Maturity Corporate Index,NYSE Arca,etf
IBDN,Fixed Income,Credit,North America,2015-03-10,iShares® iBonds® Dec 2022 Term Corporate ETF,1496578315.88,25.495372,2021-02-05,46434VBA7,58700000,"Feb 05, 2021",0.1,0.1,Bloomberg Barclays December 2022 Maturity Corporate Index,NYSE Arca,etf
IBDO,Fixed Income,Credit,North America,2015-03-11,iShares® iBonds® Dec 2023 Term Corporate ETF,1440499805.37,26.190906,2021-02-05,46434VAX8,55000000,"Feb 05, 2021",0.1,0.1,Bloomberg Barclays December 2023 Maturity Corporate Index,NYSE Arca,etf
IBDP,Fixed Income,Credit,North America,2015-03-11,iShares® iBonds® Dec 2024 Term Corporate ETF,1233442724.81,26.52565,2021-02-05,46434VBG4,46500000,"Feb 05, 2021",0.1,0.1,Bloomberg Barclays December 2024 Maturity Corporate Index,NYSE Arca,etf
IBDQ,Fixed Income,Credit,North America,2015-03-11,iShares® iBonds® Dec 2025 Term Corporate ETF,1018219914.51,27.188783,2021-02-05,46434VBD1,37450000,"Feb 05, 2021",0.1,0.1,Bloomberg Barclays December 2025 Maturity Corporate Index,NYSE Arca,etf
IBDR,Fixed Income,Credit,North America,2016-09-13,iShares® iBonds® Dec 2026 Term Corporate ETF,624148076.18,26.902934,2021-02-04,46435GAA0,23350000,"Feb 05, 2021",0.1,0.1,Bloomberg Barclays December 2026 Maturity Corporate Index,NYSE Arca,etf
IBDS,Fixed Income,Credit,North America,2017-09-12,iShares® iBonds® Dec 2027 Term Corporate ETF,426879608.33,27.452065,2021-02-04,46435UAA9,15550000,"Feb 05, 2021",0.1,0.1,Bloomberg Barclays December 2027 Maturity Corporate Index,NYSE Arca,etf
IBDT,Fixed Income,Credit,North America,2018-09-18,iShares® iBonds® Dec 2028 Term Corporate ETF,224529650.93,29.159695,2021-02-04,46435U515,7700000,"Feb 05, 2021",0.1,0.1,Bloomberg Barclays December 2028 Maturity Corporate Index,NYSE Arca,etf
IBDU,Fixed Income,Credit,North America,2019-09-17,iShares® iBonds® Dec 2029 Term Corporate ETF,92012258.1,27.062429,2021-02-04,46436E205,3400000,"Feb 05, 2021",0.1,0.1,Bloomberg Barclays December 2029 Maturity Corporate Index,NYSE Arca,etf
IBDV,Fixed Income,Credit,North America,2020-06-23,iShares® iBonds® Dec 2030 Term Corporate ETF,64369103.08,25.747641,2021-02-05,46436E726,2500000,"Feb 05, 2021",0.1,0.1,Bloomberg Barclays December 2030 Maturity Corporate Index,NYSE Arca,etf
IBHA,Fixed Income,High Yield,North America,2019-05-07,iShares® iBonds® 2021 Term High Yield and Income ETF,36290294.71,24.19353,2021-02-04,46435U226,1500000,"Feb 05, 2021",0.35,0.35,Bloomberg Barclays 2021 Term High Yield and Income Index,Cboe BZX formerly known as BATS,etf
IBHB,Fixed Income,High Yield,North America,2019-05-07,iShares® iBonds® 2022 Term High Yield and Income ETF,36267624.77,24.178417,2021-02-04,46435U176,1500000,"Feb 05, 2021",0.35,0.35,Bloomberg Barclays 2022 Term High Yield and Income Index,Cboe BZX formerly known as BATS,etf
IBHC,Fixed Income,High Yield,North America,2019-05-07,iShares® iBonds® 2023 Term High Yield and Income ETF,34158599.74,24.399,2021-02-04,46435U150,1400000,"Feb 05, 2021",0.35,0.35,Bloomberg Barclays 2023 Term High Yield and Income Index,Cboe BZX formerly known as BATS,etf
IBHD,Fixed Income,High Yield,North America,2019-05-07,iShares® iBonds® 2024 Term High Yield and Income ETF,26805011.5,24.368192,2021-02-04,46435U184,1100000,"Feb 05, 2021",0.35,0.35,Bloomberg Barclays 2024 Term High Yield and Income Index,Cboe BZX formerly known as BATS,etf
IBHE,Fixed Income,High Yield,North America,2019-05-07,iShares® iBonds® 2025 Term High Yield and Income ETF,19899282.92,24.874104,2021-02-04,46435U168,800000,"Feb 05, 2021",0.35,0.35,Bloomberg Barclays 2025 Term High Yield and Income Index,Cboe BZX formerly known as BATS,etf
IBHF,Fixed Income,High Yield,North America,2020-11-10,iShares® iBonds® 2026 Term High Yield and Income ETF,15247812.02,25.41302,2021-02-05,46436E528,600000,"Feb 05, 2021",0.35,0.35,Bloomberg Barclays 2026 Term High Yield and Income Index,Cboe BZX formerly known as BATS,etf
IBMJ,Fixed Income,Municipals,North America,2015-09-01,iShares® iBonds® Dec 2021 Term Muni Bond ETF,324326775.1,25.74022,2021-02-05,46435G789,12600000,"Feb 05, 2021",0.18,0.18,S&P AMT- Free Municipal Series Dec 2021 Index,NYSE Arca,etf
IBMK,Fixed Income,Municipals,North America,2015-09-01,iShares® iBonds® Dec 2022 Term Muni Bond ETF,376903950.28,26.35692,2021-02-05,46435G755,14300000,"Feb 05, 2021",0.18,0.18,S&P AMT-Free Municipal Series Dec 2022 Index,NYSE Arca,etf
IBML,Fixed Income,Municipals,North America,2017-04-11,iShares® iBonds® Dec 2023 Term Muni Bond ETF,298555805.97,26.189106,2021-02-04,46435G318,11450000,"Feb 05, 2021",0.18,0.18,S&P AMT-Free Municipal Series Dec 2023 Index,Cboe BZX formerly known as BATS,etf
IBMM,Fixed Income,Municipals,North America,2018-03-20,iShares® iBonds® Dec 2024 Term Muni Bond ETF,207324848.08,27.101287,2021-02-05,46435U697,7650000,"Feb 05, 2021",0.18,0.18,S&P AMT-Free Municipal Series Dec 2024 Index,Cboe BZX formerly known as BATS,etf
IBMN,Fixed Income,Municipals,North America,2018-11-13,iShares® iBonds® Dec 2025 Term Muni Bond ETF,136669773.66,28.179335,2021-02-04,46435U432,4900000,"Feb 05, 2021",0.18,0.18,S&P AMT-Free Municipal Series Dec 2025 Index,Cboe BZX formerly known as BATS,etf
IBMO,Fixed Income,Municipals,North America,2019-04-02,iShares® iBonds® Dec 2026 Term Muni Bond ETF,77305032.7,27.124573,2021-02-04,46435U259,2900000,"Feb 05, 2021",0.18,0.18,S&P AMT-Free Municipal Series Callable-Adjusted Dec 2026 Index,Cboe BZX formerly known as BATS,etf
IBMP,Fixed Income,Municipals,North America,2019-04-09,iShares® iBonds® Dec 2027 Term Muni Bond ETF,43735493.95,27.334684,2021-02-04,46435U283,1600000,"Feb 05, 2021",0.18,0.18,S&P AMT-Free Municipal Series Callable-Adjusted Dec 2027 Index,Cboe BZX formerly known as BATS,etf
IBMQ,Fixed Income,Municipals,North America,2019-04-16,iShares® iBonds® Dec 2028 Term Muni Bond ETF,60817364.62,27.644257,2021-02-04,46435U325,2200000,"Feb 05, 2021",0.18,0.18,S&P AMT-Free Municipal Series Callable-Adjusted Dec 2028 Index,Cboe BZX formerly known as BATS,etf
IBTA,Fixed Income,Government,North America,2020-02-25,iShares® iBonds® Dec 2021 Term Treasury ETF,11406798.44,25.348441,2021-02-05,46436E700,450000,"Feb 05, 2021",0.07,0.07,ICE 2021 Maturity US Treasury Index,NASDAQ,etf
IBTB,Fixed Income,Government,North America,2020-02-25,iShares® iBonds® Dec 2022 Term Treasury ETF,47030052.48,25.42165,2021-02-05,46436E809,1850000,"Feb 05, 2021",0.07,0.07,ICE 2022 Maturity US Treasury Index,NASDAQ,etf
IBTD,Fixed Income,Government,North America,2020-02-25,iShares® iBonds® Dec 2023 Term Treasury ETF,35976345.29,25.697389,2021-02-05,46436E882,1400000,"Feb 05, 2021",0.07,0.07,ICE 2023 Maturity US Treasury Index,NASDAQ,etf
IBTE,Fixed Income,Government,North America,2020-02-25,iShares® iBonds® Dec 2024 Term Treasury ETF,12937426.31,25.874853,2021-02-05,46436E874,500000,"Feb 05, 2021",0.07,0.07,ICE 2024 Maturity US Treasury Index,NASDAQ,etf
IBTF,Fixed Income,Government,North America,2020-02-25,iShares® iBonds® Dec 2025 Term Treasury ETF,22089951.9,25.988179,2021-02-05,46436E866,850000,"Feb 05, 2021",0.07,0.07,ICE 2025 Maturity US Treasury Index,NASDAQ,etf
IBTG,Fixed Income,Government,North America,2020-02-25,iShares® iBonds® Dec 2026 Term Treasury ETF,22119630.81,26.023095,2021-02-05,46436E858,850000,"Feb 05, 2021",0.07,0.07,ICE 2026 Maturity US Treasury Index,NASDAQ,etf
IBTH,Fixed Income,Government,North America,2020-02-25,iShares® iBonds® Dec 2027 Term Treasury ETF,10380475.71,25.951189,2021-02-05,46436E841,400000,"Feb 05, 2021",0.07,0.07,ICE 2027 Maturity US Treasury Index,NASDAQ,etf
IBTI,Fixed Income,Government,North America,2020-02-25,iShares® iBonds® Dec 2028 Term Treasury ETF,22057349.68,25.949823,2021-02-05,46436E833,850000,"Feb 05, 2021",0.07,0.07,ICE 2028 Maturity US Treasury Index,NASDAQ,etf
IBTJ,Fixed Income,Government,North America,2020-02-25,iShares® iBonds® Dec 2029 Term Treasury ETF,20621440.04,25.7768,2021-02-05,46436E825,800000,"Feb 05, 2021",0.07,0.07,ICE 2029 Maturity US Treasury Index,NASDAQ,etf
IBTK,Fixed Income,Government,North America,2020-07-14,iShares® iBonds® Dec 2030 Term Treasury ETF,2394957.42,23.949574,2021-02-05,46436E593,100000,"Feb 05, 2021",0.07,0.07,ICE 2030 Maturity US Treasury Index,NASDAQ,etf
ICF,Real Estate,Real Estate Securities,North America,2001-01-29,iShares Cohen & Steers REIT ETF,1980262360.82,55.160511,2021-02-04,464287564,35900000,"Feb 04, 2021",0.34,0.34,Cohen & Steers Realty Majors Index,Cboe BZX formerly known as BATS,etf
ICLN,Equity,All Cap,Global,2008-06-24,iShares Global Clean Energy ETF,6860967918.84,30.877443,2021-02-04,464288224,223900000,"Feb 05, 2021",0.46,0.46,S&P Global Clean Energy Index,NASDAQ,etf
ICOL,Equity,All Cap,Latin America,2013-06-18,iShares MSCI Colombia ETF,21625749.53,10.297976,2021-02-04,46434G202,2100000,"Feb 05, 2021",0.61,0.61,MSCI All Colombia Capped Index,NYSE Arca,etf
ICSH,Fixed Income,Multi Sectors,North America,2013-12-11,BlackRock Ultra Short-Term Bond ETF,5218073686.52,50.513782,2021-02-04,46434V878,103450000,"Feb 05, 2021",0.08,0.08,ICE BofA US 6-Month Treasury Bill Index,Cboe BZX formerly known as BATS,etf
ICVT,Fixed Income,Credit,North America,2015-06-02,iShares Convertible Bond ETF,1539497567.3,105.445039,2021-02-04,46435G102,14600000,"Feb 05, 2021",0.2,0.2,Bloomberg Barclays U.S. Convertible Cash Pay Bond > $250MM Index,Cboe BZX formerly known as BATS,etf
IDEV,Equity,Large/Mid Cap,Global,2017-03-21,iShares Core MSCI International Developed Markets ETF,4777103735.45,62.568484,2021-02-04,46435G326,76350000,"Feb 05, 2021",0.05,0.05,MSCI WORLD ex USA IMI Index,NYSE Arca,etf
IDNA,Equity,All Cap,Global,2019-06-11,iShares Genomics Immunology and Healthcare ETF,285985304.52,52.474368,2021-02-04,46435U192,5450000,"Feb 05, 2021",0.47,0.47,NYSE FactSet Global Genomics and Immuno Biopharma Index,NYSE Arca,etf
IDRV,Equity,All Cap,Global,2019-04-16,iShares Self-Driving EV and Tech ETF,254854383.18,46.337161,2021-02-04,46435U366,5700000,"Feb 05, 2021",0.47,0.47,NYSE® FactSet Global Autonomous Driving and Electric Vehicle Index,NYSE Arca,etf
IDU,Equity,All Cap,North America,2000-06-12,iShares U.S. Utilities ETF,797798593.04,78.215548,2021-02-04,464287697,10200000,"Feb 05, 2021",0.43,0.43,Dow Jones U.S. Utilities Index,NYSE Arca,etf
IDV,Equity,All Cap,Global,2007-06-11,iShares International Select Dividend ETF,3831029717.83,29.965035,2021-02-04,464288448,127850000,"Feb 04, 2021",0.49,0.49,Dow Jones EPAC Select Dividend Index,Cboe BZX formerly known as BATS,etf
IECS,Equity,All Cap,North America,2018-03-21,iShares Evolved U.S. Consumer Staples ETF,24115818.34,30.144773,2021-02-04,46431W671,800000,"Feb 05, 2021",0.18,0.18,,Cboe BZX formerly known as BATS,etf
IEDI,Equity,All Cap,North America,2018-03-21,iShares Evolved U.S. Discretionary Spending ETF,24674301.86,41.123836,2021-02-04,46431W663,600000,"Feb 05, 2021",0.18,0.18,,Cboe BZX formerly known as BATS,etf
IEF,Fixed Income,Government,North America,2002-07-22,iShares 7-10 Year Treasury Bond ETF,13956595907.41,118.076108,2021-02-04,464287440,118200000,"Feb 04, 2021",0.15,0.15,ICE U.S. Treasury 7-10 Year Bond Index,NASDAQ,etf
IEFA,Equity,All Cap,Global,2012-10-18,iShares Core MSCI EAFE ETF,84971176739.81,70.142956,2021-02-04,46432F842,1211400000,"Feb 05, 2021",0.07,0.07,MSCI EAFE IMI Index,Cboe BZX formerly known as BATS,etf
IEFN,Equity,All Cap,North America,2018-03-21,iShares Evolved U.S. Financials ETF,5307741.99,26.53871,2021-02-04,46431W655,200000,"Feb 05, 2021",0.18,0.18,,Cboe BZX formerly known as BATS,etf
IEHS,Equity,All Cap,North America,2018-03-21,iShares Evolved U.S. Healthcare Staples ETF,21129577.3,38.417413,2021-02-04,46431W689,550000,"Feb 05, 2021",0.18,0.18,,Cboe BZX formerly known as BATS,etf
IEI,Fixed Income,Government,North America,2007-01-05,iShares 3-7 Year Treasury Bond ETF,11475304937.75,132.356458,2021-02-04,464288661,86700000,"Feb 05, 2021",0.15,0.15,ICE U.S. Treasury 3-7 Year Bond Index,NASDAQ,etf
IEIH,Equity,All Cap,North America,2018-03-21,iShares Evolved U.S. Innovative Healthcare ETF,35922809.0,34.212199,2021-02-04,46431W622,1050000,"Feb 05, 2021",0.18,0.18,,Cboe BZX formerly known as BATS,etf
IEME,Equity,All Cap,North America,2018-03-21,iShares Evolved U.S. Media and Entertainment ETF,16359064.48,36.353477,2021-02-04,46431W630,450000,"Feb 05, 2021",0.18,0.18,,Cboe BZX formerly known as BATS,etf
IEMG,Equity,All Cap,Global,2012-10-18,iShares Core MSCI Emerging Markets ETF,77021705961.08,66.581696,2021-02-04,46434G103,1159200000,"Feb 05, 2021",0.11,0.11,MSCI Emerging Markets Investable Market Index,NYSE Arca,etf
IEO,Equity,All Cap,North America,2006-05-01,iShares U.S. Oil & Gas Exploration & Production ETF,190262931.16,40.916759,2021-02-04,464288851,4650000,"Feb 05, 2021",0.42,0.42,Dow Jones U.S. Select Oil Exploration & Production Index,Cboe BZX formerly known as BATS,etf
