ticker,asset_class,sub_class,region,inception,name,net_assets,nav,nav_as_of,cusip,shares_outstanding,shares_outstanding_as_of,mgmt_fee,expense_ratio,benchmark_index,exchange,type
IETC,Equity,All Cap,North America,2018-03-21,iShares Evolved U.S. Technology ETF,101584801.42,47.248745,2021-01-29,46431W648,2150000,"Feb 01, 2021",0.18,0.18,,Cboe BZX formerly known as BATS,etf
IEUR,Equity,All Cap,Europe,2014-06-10,iShares Core MSCI Europe ETF,3882833155.8,51.022775,2021-01-29,46434V738,76100000,"Feb 01, 2021",0.09,0.09,MSCI Europe Investable Market Index,NYSE Arca,etf
IEUS,Equity,Small Cap,Europe,2007-11-12,iShares MSCI Europe Small-Cap ETF,180488208.46,62.237313,2021-01-29,464288497,2950000,"Feb 01, 2021",0.4,0.4,MSCI Europe Small Cap Index,NASDAQ,etf
IEV,Equity,Large/Mid Cap,Europe,2000-07-25,iShares Europe ETF,1573642300.9,47.470356,2021-01-29,464287861,33150000,"Feb 01, 2021",0.59,0.59,S&P Europe 350 Index,NYSE Arca,etf
IEZ,Equity,All Cap,North America,2006-05-01,iShares U.S. Oil Equipment & Services ETF,143598163.33,11.627382,2021-01-29,464288844,12350000,"Feb 01, 2021",0.42,0.42,Dow Jones U.S. Select Oil Equipment & Services Index,NYSE Arca,etf
IFGL,Real Estate,Real Estate Securities,Global,2007-11-12,iShares International Developed Real Estate ETF,247557952.65,26.908473,2021-01-29,464288489,9200000,"Feb 01, 2021",0.48,0.48,FTSE EPRA Nareit Developed ex-U.S. Index,NASDAQ,etf
IFRA,Equity,All Cap,North America,2018-04-03,iShares U.S. Infrastructure ETF,176904284.74,30.240049,2021-02-01,46435U713,5850000,"Feb 01, 2021",0.4,0.4,NYSE FactSet U.S. Infrastructure Index,Cboe BZX formerly known as BATS,etf
IGBH,Fixed Income,Credit,North America,2015-07-22,iShares Interest Rate Hedged Long-Term Corporate Bond ETF,631822063.77,24.923947,2021-01-29,46431W812,25350000,"Feb 01, 2021",0.35,0.41,ICE Q70A Custom Index,NYSE Arca,etf
IGE,Equity,All Cap,North America,2001-10-22,iShares North American Natural Resources ETF,326869315.88,23.600673,2021-01-29,464287374,13850000,"Feb 01, 2021",0.46,0.46,S&P North American Natural Resources Sector Index(TM),Cboe BZX formerly known as BATS,etf
IGEB,Fixed Income,Credit,North America,2017-07-11,iShares Investment Grade Bond Factor ETF,161178071.21,54.636634,2021-01-29,46435G219,2950000,"Feb 01, 2021",0.18,0.18,BlackRock Investment Grade Enhanced Bond Index,Cboe BZX formerly known as BATS,etf
IGF,Equity,All Cap,Global,2007-12-10,iShares Global Infrastructure ETF,2965888099.09,42.859655,2021-01-29,464288372,69200000,"Feb 01, 2021",0.46,0.46,S&P Global Infrastructure Index,NASDAQ,etf
IGIB,Fixed Income,Credit,North America,2007-01-05,iShares 5-10 Year Investment Grade Corporate Bond ETF,11182405804.41,61.32386,2021-01-29,464288638,182500000,"Feb 01, 2021",0.06,0.06,ICE BofA 5-10 Year US Corporate Index,NASDAQ,etf
IGLB,Fixed Income,Credit,North America,2009-12-08,iShares 10+ Year Investment Grade Corporate Bond ETF,2489097177.2,71.117062,2021-01-29,464289511,35000000,"Feb 01, 2021",0.06,0.06,ICE BofA 10+ Year US Corporate Index,NYSE Arca,etf
IGM,Equity,All Cap,North America,2001-03-13,iShares Expanded Tech Sector ETF,3140497532.51,347.016302,2021-01-29,464287549,9050000,"Feb 01, 2021",0.46,0.46,S&P North American Expanded Technology Sector Index,NYSE Arca,etf
IGN,Equity,All Cap,North America,2001-07-10,iShares North American Tech-Multimedia Networking ETF,61378069.13,64.608494,2021-01-29,464287531,950000,"Feb 01, 2021",0.46,0.46,S&P North American Technology-Multimedia Networking Index(TM),NYSE Arca,etf
IGOV,Fixed Income,Government,Global,2009-01-21,iShares International Treasury Bond ETF,1168550989.91,54.733067,2021-01-29,464288117,21350000,"Feb 01, 2021",0.35,0.35,FTSE World Government Bond Index - Developed Markets Capped,NASDAQ,etf
IGRO,Equity,Large/Mid Cap,Global,2016-05-17,iShares International Dividend Growth ETF,186391895.25,62.130632,2021-01-29,46435G524,3000000,"Feb 01, 2021",0.15,0.15,Morningstar® Global ex-US Dividend Growth Index℠,Cboe BZX formerly known as BATS,etf
IGSB,Fixed Income,Credit,North America,2007-01-05,iShares 1-5 Year Investment Grade Corporate Bond ETF,22545669212.61,55.090212,2021-01-29,464288646,408750000,"Feb 01, 2021",0.06,0.06,ICE BofA 1-5 Year US Corporate Index,NASDAQ,etf
IGV,Equity,All Cap,North America,2001-07-10,iShares Expanded Tech-Software Sector ETF,5620345909.23,349.089808,2021-01-29,464287515,16200000,"Feb 01, 2021",0.46,0.46,S&P North American Expanded Technology Software Index,Cboe BZX formerly known as BATS,etf
IHAK,Equity,Large/Mid Cap,Global,2019-06-11,iShares Cybersecurity and Tech ETF,340096413.73,40.975472,2021-01-29,46435U135,8350000,"Feb 01, 2021",0.47,0.47,NYSE FactSet Global Cyber Security Index,NYSE Arca,etf
IHE,Equity,All Cap,North America,2006-05-01,iShares U.S. Pharmaceuticals ETF,359515662.59,179.757831,2021-01-29,464288836,2000000,"Feb 01, 2021",0.42,0.42,Dow Jones U.S. Select Pharmaceuticals Index,NYSE Arca,etf
IHF,Equity,All Cap,North America,2006-05-01,iShares U.S. Healthcare Providers ETF,1139000808.72,239.789644,2021-01-29,464288828,4750000,"Feb 01, 2021",0.42,0.42,Dow Jones U.S. Select Healthcare Providers Index,NYSE Arca,etf
IHI,Equity,All Cap,North America,2006-05-01,iShares U.S. Medical Devices ETF,8748640320.32,333.281536,2021-01-29,464288810,26100000,"Feb 01, 2021",0.42,0.42,Dow Jones U.S. Select Medical Equipment Index,NYSE Arca,etf
IJH,Equity,Mid Cap,North America,2000-05-22,iShares Core S&P Mid-Cap ETF,54231272326.43,233.353151,2021-01-29,464287507,232200000,"Feb 01, 2021",0.05,0.05,S&P MidCap 400 Index,NYSE Arca,etf
IJJ,Equity,Mid Cap,North America,2000-07-24,iShares S&P Mid-Cap 400 Value ETF,5964355653.32,87.325851,2021-01-29,464287705,68250000,"Feb 01, 2021",0.18,0.18,S&P MidCap 400(R) Value Index,NYSE Arca,etf
IJK,Equity,Mid Cap,North America,2000-07-24,iShares S&P Mid-Cap 400 Growth ETF,7659334128.3,73.576697,2021-01-29,464287606,103950000,"Feb 01, 2021",0.17,0.17,S&P MidCap 400(R) Growth Index,NYSE Arca,etf
IJR,Equity,Small Cap,North America,2000-05-22,iShares Core S&P Small-Cap ETF,60609723703.72,97.663106,2021-01-29,464287804,618750000,"Feb 01, 2021",0.06,0.06,S&P SmallCap 600 Index,NYSE Arca,etf
IJS,Equity,Small Cap,North America,2000-07-24,iShares S&P Small-Cap 600 Value ETF,7153954563.01,86.400417,2021-01-29,464287879,82800000,"Feb 01, 2021",0.18,0.18,S&P SmallCap 600(R) Value Index,NYSE Arca,etf
IJT,Equity,Small Cap,North America,2000-07-24,iShares S&P Small-Cap 600 Growth ETF,5961142275.03,121.284685,2021-01-29,464287887,49200000,"Feb 01, 2021",0.18,0.18,S&P SmallCap 600(R) Growth Index,NASDAQ,etf
ILF,Equity,Large Cap,Latin America,2001-10-25,iShares Latin America 40 ETF,1620355500.1,27.232866,2021-01-29,464287390,59500000,"Feb 01, 2021",0.48,0.48,S&P Latin America 40 Index,NYSE Arca,etf
ILTB,Fixed Income,Multi Sectors,North America,2009-12-08,iShares Core 10+ Year USD Bond ETF,452247673.85,74.138963,2021-01-29,464289479,6100000,"Feb 01, 2021",0.06,0.06,Bloomberg Barclays U.S. Universal 10+ Year Index,NYSE Arca,etf
IMTB,Fixed Income,Multi Sectors,North America,2016-11-01,iShares Core 5-10 Year USD Bond ETF,125266642.42,52.194434,2021-01-29,46435G417,2400000,"Feb 01, 2021",0.06,0.07,Bloomberg Barclays US Universal 5-10 Years Index,NYSE Arca,etf
IMTM,Equity,Large/Mid Cap,Global,2015-01-13,iShares MSCI Intl Momentum Factor ETF,715471625.28,37.855642,2021-02-01,46434V449,18900000,"Feb 01, 2021",0.3,0.3,MSCI World ex USA Momentum Index,NYSE Arca,etf
INDA,Equity,Large/Mid Cap,Asia Pacific,2012-02-02,iShares MSCI India ETF,4822467367.2,39.095804,2021-01-29,46429B598,123350000,"Feb 01, 2021",0.64,0.69,MSCI India Index,Cboe BZX formerly known as BATS,etf
INDY,Equity,Large Cap,Asia Pacific,2009-11-18,iShares India 50 ETF,652299155.92,41.680457,2021-01-29,464289529,15650000,"Feb 01, 2021",0.89,0.93,Nifty 50 Index,NASDAQ,etf
INTF,Equity,Large/Mid Cap,Global,2015-04-28,iShares MSCI Intl Multifactor ETF,912531249.96,27.078079,2021-01-29,46434V274,33700000,"Feb 01, 2021",0.3,0.3,MSCI World ex USA Diversified Multiple-Factor Index,NYSE Arca,etf
IOO,Equity,Large Cap,Global,2000-12-05,iShares Global 100 ETF,2818236387.47,62.907062,2021-01-29,464287572,44800000,"Feb 01, 2021",0.4,0.4,S&P Global 100 Index,NYSE Arca,etf
IPAC,Equity,All Cap,Asia Pacific,2014-06-10,iShares Core MSCI Pacific ETF,1097353054.91,64.172693,2021-01-29,46434V696,17100000,"Feb 01, 2021",0.09,0.09,MSCI Pacific Investable Market Index,NYSE Arca,etf
IPFF,Others,Others,Global,2011-11-15,iShares International Preferred Stock ETF,44712136.8,15.688469,2021-01-29,46429B135,2850000,"Feb 01, 2021",0.55,0.55,S&P International Preferred Stock Index,Cboe BZX formerly known as BATS,etf
IQLT,Equity,Large/Mid Cap,Global,2015-01-13,iShares MSCI Intl Quality Factor ETF,2798945953.91,35.519619,2021-02-01,46434V456,78800000,"Feb 01, 2021",0.3,0.3,MSCI World ex USA Sector Neutral Quality Index,NYSE Arca,etf
IRBO,Equity,All Cap,Global,2018-06-26,iShares Robotics and Artificial Intelligence Multisector ETF,339794859.03,43.563443,2021-01-29,46435U556,8000000,"Feb 01, 2021",0.47,0.47,NYSE FactSet Global Robotics and Artificial Intelligence Index,NYSE Arca,etf
ISCF,Equity,Small Cap,Global,2015-04-28,iShares MSCI Intl Small-Cap Multifactor ETF,156899849.4,33.382947,2021-01-29,46434V266,4700000,"Feb 01, 2021",0.4,0.4,MSCI World exUSA Small Cap Diversified Multiple-Factor Index,NYSE Arca,etf
ISHG,Fixed Income,Government,Global,2009-01-21,iShares 1-3 Year International Treasury Bond ETF,59081393.33,84.40199,2021-01-29,464288125,700000,"Feb 01, 2021",0.35,0.35,FTSE World Government Bond Index-Dev Markets 1-3 Years Capped Select Index,NASDAQ,etf
ISTB,Fixed Income,Multi Sectors,North America,2012-10-18,iShares Core 1-5 Year USD Bond ETF,4814228327.24,51.599446,2021-01-29,46432F859,93300000,"Feb 01, 2021",0.06,0.06,Bloomberg Barclays U.S. Universal 1-5 Year Index,NASDAQ,etf
ISZE,Equity,Large/Mid Cap,Global,2015-06-16,iShares MSCI Intl Size Factor ETF,29616604.07,29.616604,2021-02-01,46435G508,1000000,"Feb 01, 2021",0.3,0.3,MSCI World ex USA Low Size Index,NYSE Arca,etf
ITA,Equity,All Cap,North America,2006-05-01,iShares U.S. Aerospace & Defense ETF,2598482782.3,89.141776,2021-01-29,464288760,29000000,"Feb 01, 2021",0.42,0.42,Dow Jones U.S. Select Aerospace & Defense Index,Cboe BZX formerly known as BATS,etf
ITB,Equity,All Cap,North America,2006-05-01,iShares U.S. Home Construction ETF,2210457701.98,58.945539,2021-01-29,464288752,37500000,"Feb 01, 2021",0.42,0.42,Dow Jones U.S. Select Home Construction Index,Cboe BZX formerly known as BATS,etf
ITOT,Equity,All Cap,North America,2004-01-20,iShares Core S&P Total U.S. Stock Market ETF,32300479890.79,85.974128,2021-01-29,464287150,378200000,"Feb 01, 2021",0.03,0.03,S&P Total Market Index (TMI),NYSE Arca,etf
IUSB,Fixed Income,Multi Sectors,North America,2014-06-10,iShares Core Total USD Bond Market ETF,9639061719.35,54.152032,2021-01-29,46434V613,179000000,"Feb 01, 2021",0.06,0.07,Bloomberg Barclays U.S. Universal Index,NASDAQ,etf
IUSG,Equity,All Cap,North America,2000-07-24,iShares Core S&P U.S. Growth ETF,10143495474.21,88.357975,2021-01-29,464287671,114800000,"Feb 01, 2021",0.04,0.04,S&P 900 Growth Index,NASDAQ,etf
IUSV,Equity,All Cap,North America,2000-07-24,iShares Core S&P U.S. Value ETF,7486611960.28,61.315413,2021-01-29,464287663,123400000,"Feb 01, 2021",0.04,0.04,S&P 900 Value Index,NASDAQ,etf
IVE,Equity,Large Cap,North America,2000-05-22,iShares S&P 500 Value ETF,18314715874.64,126.047597,2021-01-29,464287408,145300000,"Feb 01, 2021",0.18,0.18,S&P 500(R) Value Index,NYSE Arca,etf
IVLU,Equity,Large/Mid Cap,Global,2015-06-16,iShares MSCI Intl Value Factor ETF,589012919.73,22.918791,2021-02-01,46435G409,25700000,"Feb 01, 2021",0.3,0.3,MSCI World ex USA Enhanced Value Index,NYSE Arca,etf
IVV,Equity,Large Cap,North America,2000-05-15,iShares Core S&P 500 ETF,234162868477.38,371.7461,2021-01-29,464287200,629800000,"Feb 01, 2021",0.03,0.03,S&P 500 Index,NYSE Arca,etf
IVW,Equity,Large Cap,North America,2000-05-22,iShares S&P 500 Growth ETF,31554012209.44,63.514517,2021-01-29,464287309,496350000,"Feb 01, 2021",0.18,0.18,S&P 500(R) Growth Index,NYSE Arca,etf
IWB,Equity,Large/Mid Cap,North America,2000-05-15,iShares Russell 1000 ETF,25435587265.09,210.211465,2021-01-29,464287622,120500000,"Feb 01, 2021",0.15,0.15,Russell 1000 Index,NYSE Arca,etf
IWC,Equity,Small Cap,North America,2005-08-12,iShares Micro-Cap ETF,1131180137.54,135.470675,2021-01-29,464288869,8350000,"Feb 01, 2021",0.6,0.6,Russell Microcap(R) Index,NYSE Arca,etf
IWD,Equity,Large/Mid Cap,North America,2000-05-22,iShares Russell 1000 Value ETF,42907079316.28,135.481779,2021-01-29,464287598,318200000,"Feb 01, 2021",0.19,0.19,Russell 1000 Value Index,NYSE Arca,etf
IWF,Equity,Large/Mid Cap,North America,2000-05-22,iShares Russell 1000 Growth ETF,62901899409.4,239.398285,2021-01-29,464287614,262300000,"Feb 01, 2021",0.19,0.19,Russell 1000 Growth Index,NYSE Arca,etf
IWFH,Equity,All Cap,Global,2020-09-29,iShares Virtual Work and Life Multisector ETF,6411464.52,32.057323,2021-02-01,46436E585,200000,"Feb 01, 2021",0.47,0.47,NYSE FactSet Global Virtual Work and Life Index,NYSE Arca,etf
IWL,Equity,Large Cap,North America,2009-09-22,iShares Russell Top 200 ETF,849471276.03,89.418029,2021-01-29,464289446,9400000,"Feb 01, 2021",0.15,0.15,Russell Top 200 Index,NYSE Arca,etf
IWM,Equity,Small Cap,North America,2000-05-22,iShares Russell 2000 ETF,61980303978.21,205.846244,2021-01-29,464287655,293150000,"Feb 01, 2021",0.19,0.19,Russell 2000 Index,NYSE Arca,etf
IWN,Equity,Small Cap,North America,2000-07-24,iShares Russell 2000 Value ETF,12990721576.23,138.641639,2021-01-29,464287630,93500000,"Feb 01, 2021",0.24,0.24,Russell 2000 Value Index,NYSE Arca,etf
IWO,Equity,Small Cap,North America,2000-07-24,iShares Russell 2000 Growth ETF,12208338922.26,300.328141,2021-01-29,464287648,40650000,"Feb 01, 2021",0.24,0.24,Russell 2000 Growth Index,NYSE Arca,etf
IWP,Equity,Mid Cap,North America,2001-07-17,iShares Russell Mid-Cap Growth ETF,15002178843.08,102.334099,2021-01-29,464287481,146150000,"Feb 01, 2021",0.24,0.24,Russell MidCap Growth Index,NYSE Arca,etf
IWR,Equity,Mid Cap,North America,2001-07-17,iShares Russell Mid-Cap ETF,24820460065.96,68.375923,2021-01-29,464287499,363000000,"Feb 01, 2021",0.19,0.19,Russell MidCap Index,NYSE Arca,etf
IWS,Equity,Mid Cap,North America,2001-07-17,iShares Russell Mid-Cap Value ETF,11677149191.69,96.705169,2021-01-29,464287473,120800000,"Feb 01, 2021",0.24,0.24,Russell MidCap Value Index,NYSE Arca,etf
IWV,Equity,All Cap,North America,2000-05-22,iShares Russell 3000 ETF,10447057008.13,222.751749,2021-01-29,464287689,46800000,"Feb 01, 2021",0.2,0.2,Russell 3000 Index,NYSE Arca,etf
IWX,Equity,Large Cap,North America,2009-09-22,iShares Russell Top 200 Value ETF,917942047.64,57.192651,2021-01-29,464289420,16050000,"Feb 01, 2021",0.2,0.2,Russell Top 200 Value Index,NYSE Arca,etf
IWY,Equity,Large Cap,North America,2009-09-22,iShares Russell Top 200 Growth ETF,3383431868.47,131.907675,2021-01-29,464289438,25650000,"Feb 01, 2021",0.2,0.2,Russell Top 200 Growth Index,NYSE Arca,etf
IXC,Equity,All Cap,Global,2001-11-12,iShares Global Energy ETF,1025917648.41,20.915752,2021-01-29,464287341,49050000,"Feb 01, 2021",0.46,0.46,S&P Global 1200 Energy Sector Index(TM),NYSE Arca,etf
IXG,Equity,All Cap,Global,2001-11-12,iShares Global Financials ETF,358198950.14,63.964098,2021-01-29,464287333,5600000,"Feb 01, 2021",0.46,0.46,S&P Global 1200 Financials Sector Index(TM),NYSE Arca,etf
IXJ,Equity,All Cap,Global,2001-11-13,iShares Global Healthcare ETF,2530094003.43,76.785857,2021-01-29,464287325,32950000,"Feb 01, 2021",0.46,0.46,S&P Global 1200 Healthcare Sector Index(TM),NYSE Arca,etf
IXN,Equity,All Cap,Global,2001-11-12,iShares Global Tech ETF,4949650245.19,299.978803,2021-01-29,464287291,16500000,"Feb 01, 2021",0.46,0.46,S&P Global 1200 Information Technology Sector Index(TM),NYSE Arca,etf
IXP,Equity,All Cap,Global,2001-11-12,iShares Global Comm Services ETF,296661255.18,75.104115,2021-01-29,464287275,3950000,"Feb 01, 2021",0.46,0.46,S&P Global 1200 Communication Services 4.5/22.5/45 Capped Index,NYSE Arca,etf
IXUS,Equity,All Cap,Global,2012-10-18,iShares Core MSCI Total International Stock ETF,25316781066.53,67.547441,2021-01-29,46432F834,374800000,"Feb 01, 2021",0.09,0.09,MSCI ACWI ex USA IMI Index,NASDAQ,etf
IYC,Equity,All Cap,North America,2000-06-12,iShares U.S. Consumer Services ETF,1245396161.96,68.997017,2021-01-29,464287580,18050000,"Feb 01, 2021",0.43,0.43,Dow Jones U.S. Consumer Services Capped Index,NYSE Arca,etf
IYE,Equity,All Cap,North America,2000-06-12,iShares U.S. Energy ETF,516254662.37,21.028703,2021-01-29,464287796,24550000,"Feb 01, 2021",0.42,0.42,Dow Jones U.S. Oil & Gas Index,NYSE Arca,etf
IYF,Equity,All Cap,North America,2000-05-22,iShares U.S. Financials ETF,1529865429.52,65.239464,2021-01-29,464287788,23350000,"Feb 01, 2021",0.42,0.42,Dow Jones U.S. Financials Capped Index,NYSE Arca,etf
IYG,Equity,All Cap,North America,2000-06-12,iShares U.S. Financial Services ETF,1200122560.54,145.469401,2021-01-29,464287770,8250000,"Feb 01, 2021",0.42,0.42,Dow Jones U.S. Financial Services Index,NYSE Arca,etf
IYH,Equity,All Cap,North America,2000-06-12,iShares U.S. Healthcare ETF,2561587588.09,251.136038,2021-01-29,464287762,10200000,"Feb 01, 2021",0.43,0.43,Dow Jones U.S. Health Care Index,NYSE Arca,etf
IYJ,Equity,All Cap,North America,2000-06-12,iShares U.S. Industrials ETF,1263295263.23,93.232123,2021-01-29,464287754,13550000,"Feb 01, 2021",0.42,0.42,Dow Jones U.S. Industrials Index,Cboe BZX formerly known as BATS,etf
IYK,Equity,All Cap,North America,2000-06-12,iShares U.S. Consumer Goods ETF,732068703.42,172.25146,2021-01-29,464287812,4300000,"Feb 01, 2021",0.43,0.43,Dow Jones U.S. Consumer Goods Index,NYSE Arca,etf
IYLD,Multi Asset,Static Allocation,Global,2012-04-03,iShares Morningstar Multi-Asset Income ETF,261352571.1,23.651816,2021-01-29,46432F875,11050000,"Feb 01, 2021",0.25,0.63,Morningstar Multi-Asset High Income Index,Cboe BZX formerly known as BATS,etf
IYM,Equity,All Cap,North America,2000-06-12,iShares U.S. Basic Materials ETF,561345780.24,111.15758,2021-01-29,464287838,5000000,"Feb 01, 2021",0.43,0.43,Dow Jones U.S. Basic Materials Index,NYSE Arca,etf
IYR,Real Estate,Real Estate Securities,North America,2000-06-12,iShares U.S. Real Estate ETF,3818835460.25,85.337105,2021-01-29,464287739,44350000,"Feb 01, 2021",0.42,0.42,Dow Jones U.S. Real Estate Capped Index,NYSE Arca,etf
IYT,Equity,All Cap,North America,2003-10-06,iShares Transportation Average ETF,1556396088.85,213.204944,2021-01-29,464287192,7300000,"Feb 01, 2021",0.42,0.42,Dow Jones Transportation Average Index,Cboe BZX formerly known as BATS,etf
IYW,Equity,All Cap,North America,2000-05-15,iShares U.S. Technology ETF,6834132384.76,85.855934,2021-01-29,464287721,79600000,"Feb 01, 2021",0.43,0.43,Dow Jones U.S. Technology Capped Index,NYSE Arca,etf
IYY,Equity,All Cap,North America,2000-06-12,iShares Dow Jones U.S. ETF,1447413109.01,93.683696,2021-01-29,464287846,15450000,"Feb 01, 2021",0.2,0.2,Dow Jones U.S. Index,NYSE Arca,etf
IYZ,Equity,All Cap,North America,2000-05-22,iShares U.S. Telecommunications ETF,406566473.72,30.80049,2021-01-29,464287713,13000000,"Feb 01, 2021",0.42,0.42,Dow Jones U.S. Select Telecommunications Index,Cboe BZX formerly known as BATS,etf
JKD,Equity,Large Cap,North America,2004-06-28,iShares Morningstar Large-Cap ETF,828300581.8,212.384765,2021-01-29,464287127,3900000,"Feb 01, 2021",0.2,0.2,Morningstar Large Core Index,NYSE Arca,etf
JKE,Equity,Large Cap,North America,2004-06-28,iShares Morningstar Large-Cap Growth ETF,1813744423.04,287.89594,2021-01-29,464287119,6300000,"Feb 01, 2021",0.25,0.25,Morningstar Large Growth Index,NYSE Arca,etf
JKF,Equity,Large Cap,North America,2004-06-28,iShares Morningstar Large-Cap Value ETF,541814224.29,110.574331,2021-01-29,464288109,4900000,"Feb 01, 2021",0.25,0.25,Morningstar Large Value Index,NYSE Arca,etf
JKG,Equity,Mid Cap,North America,2004-06-28,iShares Morningstar Mid-Cap ETF,797467489.24,231.149997,2021-01-29,464288208,3450000,"Feb 01, 2021",0.25,0.25,Morningstar Mid Core Index,NYSE Arca,etf
JKH,Equity,Mid Cap,North America,2004-06-28,iShares Morningstar Mid-Cap Growth ETF,1526575922.62,381.643981,2021-01-29,464288307,4000000,"Feb 01, 2021",0.3,0.3,Morningstar Mid Growth Index,NYSE Arca,etf
JKI,Equity,Mid Cap,North America,2004-06-28,iShares Morningstar Mid-Cap Value ETF,369770982.9,157.349354,2021-01-29,464288406,2350000,"Feb 01, 2021",0.3,0.3,Morningstar Mid Value Index,NASDAQ,etf
JKJ,Equity,Small Cap,North America,2004-06-28,iShares Morningstar Small-Cap ETF,222096711.08,201.906101,2021-01-29,464288505,1100000,"Feb 01, 2021",0.25,0.25,Morningstar Small Core Index,NYSE Arca,etf
JKK,Equity,Small Cap,North America,2004-06-28,iShares Morningstar Small-Cap Growth ETF,793037512.65,317.215005,2021-01-29,464288604,2500000,"Feb 01, 2021",0.3,0.3,Morningstar Small Growth Index,NYSE Arca,etf
JKL,Equity,Small Cap,North America,2004-06-28,iShares Morningstar Small-Cap Value ETF,329267723.3,143.15988,2021-01-29,464288703,2300000,"Feb 01, 2021",0.3,0.3,Morningstar Small Value Index,NYSE Arca,etf
JPXN,Equity,Large/Mid Cap,Asia Pacific,2001-10-23,iShares JPX-Nikkei 400 ETF,85822757.29,71.518964,2021-01-29,464287382,1200000,"Feb 01, 2021",0.48,0.48,JPX-Nikkei Index 400,NYSE Arca,etf
JXI,Equity,All Cap,Global,2006-09-12,iShares Global Utilities ETF,145435440.09,59.361404,2021-01-29,464288711,2450000,"Feb 01, 2021",0.46,0.46,S&P Global 1200 Utilities Sector Index(TM),NYSE Arca,etf
KSA,Equity,All Cap,Middle East and Africa,2015-09-16,iShares MSCI Saudi Arabia ETF,643776677.35,31.025382,2021-02-01,46434V423,20750000,"Feb 01, 2021",0.74,0.74,MSCI Saudi Arabia IMI 25/50 Index,NYSE Arca,etf
KWT,Equity,All Cap,-,2020-09-01,iShares MSCI Kuwait ETF,15537009.7,28.249109,2021-02-01,46436E817,550000,"Feb 01, 2021",0.74,0.74,MSCI All Kuwait Select Size Liquidity Capped Index,Cboe BZX formerly known as BATS,etf
KXI,Equity,All Cap,Global,2006-09-12,iShares Global Consumer Staples ETF,505628386.77,55.87054,2021-01-29,464288737,9050000,"Feb 01, 2021",0.46,0.46,S&P Global 1200 Consumer Staples Sector Capped Index,NYSE Arca,etf
LDEM,Equity,Large/Mid Cap,Global,2020-02-05,iShares ESG MSCI EM Leaders ETF,857472678.78,63.752616,2021-02-01,46436E601,13450000,"Feb 01, 2021",0.16,0.16,MSCI EM Extended ESG Leaders 5% Issuer Capped Net Index,NASDAQ,etf
LEMB,Fixed Income,Government,Global,2011-10-18,iShares J.P. Morgan EM Local Currency Bond ETF,528563760.9,44.793539,2021-01-29,464286517,11800000,"Feb 01, 2021",0.3,0.3,J.P. Morgan GBI-EM Global Diversified 15% Cap 4.5% Floor Index,NYSE Arca,etf
LQD,Fixed Income,Credit,North America,2002-07-22,iShares iBoxx $ Investment Grade Corporate Bond ETF,51975948476.19,135.636609,2021-01-29,464287242,375100000,"Feb 01, 2021",0.14,0.14,Markit iBoxx USD Liquid Investment Grade Index,NYSE Arca,etf
LQDH,Fixed Income,Credit,North America,2014-05-27,iShares Interest Rate Hedged Corporate Bond ETF,466622556.43,95.229093,2021-01-29,46431W705,4900000,"Feb 01, 2021",0.3,0.44,Markit iBoxx USD Liquid Investment Grade Interest Rate Hedged Swaps Index,NYSE Arca,etf
LQDI,Fixed Income,Credit,North America,2018-05-08,iShares Inflation Hedged Corporate Bond ETF,27614948.05,29.068366,2021-02-01,46431W580,950000,"Feb 01, 2021",0.2,0.34,iBoxx USD Liquid Investment Grade Inflation Hedged Index,Cboe BZX formerly known as BATS,etf
LRGF,Equity,Large/Mid Cap,North America,2015-04-28,iShares MSCI USA Multifactor ETF,884307459.25,37.790917,2021-01-29,46434V282,23550000,"Feb 01, 2021",0.2,0.2,MSCI USA Diversified Multiple-Factor Index,NYSE Arca,etf
MAIIX,Equity,All Cap,Global,1997-04-09,iShares MSCI EAFE International Index Fund,993909022.03,14.48,2021-01-29,09253F408,,,,,MSCI EAFE Index (Net Total Return),,mf
MASKX,Equity,Small Cap,North America,1997-04-09,iShares Russell 2000 Small-Cap Index Fund,356752781.68,25.41,2021-01-29,09253F804,,,,,Russell 2000 Index (Gross Total Return),,mf
MBB,Fixed Income,Mortgages,North America,2007-03-13,iShares MBS ETF,26353963438.64,110.267629,2021-01-29,464288588,239000000,"Feb 01, 2021",0.06,0.07,Bloomberg Barclays US Mortgage Backed Securities Index,NASDAQ,etf
MCHI,Equity,Large/Mid Cap,Asia Pacific,2011-03-29,iShares MSCI China ETF,7023953190.03,87.362602,2021-01-29,46429B671,80400000,"Feb 01, 2021",0.59,0.59,MSCI China Index,NASDAQ,etf
MDIIX,Equity,All Cap,Global,1997-04-09,iShares MSCI EAFE International Index Fund,339673374.97,14.38,2021-01-29,09253F309,,,,,MSCI EAFE Index (Net Total Return),,mf
MDSKX,Equity,Small Cap,North America,1997-04-09,iShares Russell 2000 Small-Cap Index Fund,269224142.37,25.43,2021-01-29,09253F705,,,,,Russell 2000 Index (Gross Total Return),,mf
MEAR,Fixed Income,Municipals,North America,2015-03-03,BlackRock Short Maturity Municipal Bond ETF,291307438.08,50.22542,2021-02-01,46431W838,5800000,"Feb 01, 2021",0.25,0.25,Bloomberg Barclays Municipal Bond: 1 Year (1-2) Index,Cboe BZX formerly known as BATS,etf
MIDF,Equity,Mid Cap,North America,2019-06-04,iShares MSCI USA Mid-Cap Multifactor ETF,3187684.54,31.876845,2021-01-29,46435U143,100000,"Feb 01, 2021",0.25,0.25,MSCI USA Mid Cap Diversified Multiple-Factor Index,NYSE Arca,etf
MTUM,Equity,Large/Mid Cap,North America,2013-04-16,iShares MSCI USA Momentum Factor ETF,14439679608.34,163.901017,2021-01-29,46432F396,87800000,"Feb 01, 2021",0.15,0.15,MSCI USA Momentum SR Variant Index,Cboe BZX formerly known as BATS,etf
MUB,Fixed Income,Municipals,North America,2007-09-07,iShares National Muni Bond ETF,21131975152.67,117.399862,2021-01-29,464288414,180000000,"Feb 01, 2021",0.07,0.07,S&P National AMT-Free Municipal Bond Index,NYSE Arca,etf
MXI,Equity,All Cap,Global,2006-09-12,iShares Global Materials ETF,607705708.04,80.490822,2021-01-29,464288695,7550000,"Feb 01, 2021",0.45,0.45,S&P Global 1200 Materials Sector Index(TM),NYSE Arca,etf
NEAR,Fixed Income,Multi Sectors,North America,2013-09-25,BlackRock Short Maturity Bond ETF,4564493387.4,50.242085,2021-01-29,46431W507,90850000,"Feb 01, 2021",0.25,0.26,,Cboe BZX formerly known as BATS,etf
