ticker,asset_class,sub_class,region,inception,name,net_assets,nav,nav_as_of,cusip,shares_outstanding,shares_outstanding_as_of,mgmt_fee,expense_ratio,benchmark_index,exchange,type
AAXJ,Equity,Large/Mid Cap,Asia Pacific,2008-08-13,iShares MSCI All Country Asia ex Japan ETF,6293166343.21,93.370421,2021-01-29,464288182,68000000,"Feb 01, 2021",0.7,0.7,MSCI AC Asia ex Japan Index,NASDAQ,etf
ACWF,Equity,Large/Mid Cap,Global,2015-04-28,iShares MSCI Global Multifactor ETF,89595698.55,33.809698,2021-01-29,46434V316,2650000,"Feb 01, 2021",0.35,0.35,MSCI ACWI Diversified Multiple-Factor Index,NYSE Arca,etf
ACWI,Equity,Large/Mid Cap,Global,2008-03-26,iShares MSCI ACWI ETF,14311766187.0,90.466284,2021-01-29,464288257,158200000,"Feb 01, 2021",0.32,0.33,MSCI ACWI Index,NASDAQ,etf
ACWV,Equity,Large/Mid Cap,Global,2011-10-18,iShares MSCI Global Min Vol Factor ETF,5562324109.29,95.408647,2021-01-29,464286525,58300000,"Feb 01, 2021",0.32,0.32,MSCI All Country World Minimum Volatility Index,Cboe BZX formerly known as BATS,etf
ACWX,Equity,Large/Mid Cap,Global,2008-03-26,iShares MSCI ACWI ex U.S. ETF,3753177017.99,53.312174,2021-01-29,464288240,70400000,"Feb 01, 2021",0.32,0.34,MSCI ACWI ex USA Index,NASDAQ,etf
AGG,Fixed Income,Multi Sectors,North America,2003-09-22,iShares Core U.S. Aggregate Bond ETF,86169720356.11,117.285586,2021-01-29,464287226,735500000,"Feb 01, 2021",0.04,0.04,Bloomberg Barclays US Aggregate Bond Index,NYSE Arca,etf
AGT,Equity,All Cap,Latin America,2017-04-25,iShares MSCI Argentina and Global Exposure ETF,7398432.71,24.661442,2021-01-29,46435G276,300000,"Feb 01, 2021",0.59,0.59,MSCI All Argentina 25/50 Index,Cboe BZX formerly known as BATS,etf
AGZ,Fixed Income,Government,North America,2008-11-05,iShares Agency Bond ETF,769944118.06,119.371181,2021-01-29,464288166,6450000,"Feb 01, 2021",0.2,0.2,Bloomberg Barclays U.S. Agency Bond Index,NYSE Arca,etf
AIA,Equity,Large Cap,Asia Pacific,2007-11-13,iShares Asia 50 ETF,2917155955.16,93.348991,2021-01-29,464288430,31250000,"Feb 01, 2021",0.5,0.5,S&P Asia 50 Index,NASDAQ,etf
AMCA,Equity,Large/Mid Cap,North America,2017-08-08,iShares Russell 1000 Pure U.S. Revenue ETF,3130030.14,31.300301,2021-01-29,46435G169,100000,"Feb 01, 2021",0.15,0.15,Russell 1000 Pure Domestic Exposure Index,NASDAQ,etf
AOA,Multi Asset,Static Allocation,Global,2008-11-04,iShares Core Aggressive Allocation ETF,1198766159.36,63.934195,2021-01-29,464289859,18750000,"Feb 01, 2021",0.25,0.31,S&P Target Risk Aggressive Index,NYSE Arca,etf
AOK,Multi Asset,Static Allocation,Global,2008-11-04,iShares Core Conservative Allocation ETF,846012471.17,38.542709,2021-01-29,464289883,21950000,"Feb 01, 2021",0.25,0.31,S&P Target Risk Conservative Index,NYSE Arca,etf
AOM,Multi Asset,Static Allocation,Global,2008-11-04,iShares Core Moderate Allocation ETF,1459623140.37,42.993318,2021-01-29,464289875,33350000,"Feb 01, 2021",0.25,0.3,S&P Target Risk Moderate Index,NYSE Arca,etf
AOR,Multi Asset,Static Allocation,Global,2008-11-04,iShares Core Growth Allocation ETF,1604310610.51,52.003585,2021-01-29,464289867,30850000,"Feb 01, 2021",0.25,0.31,S&P Target Risk Growth Index,NYSE Arca,etf
BAIPX,Fixed Income,Inflation,North America,2016-02-16,iShares Short-Term TIPS Bond Index Fund,1834348.88,10.39,2021-01-29,09258N877,,,,,BBG Barc US TIPS 0-5 Years Index,,mf
BARDX,Real Estate,Real Estate Securities,Global,2015-08-13,iShares Developed Real Estate Index Fund,1575244.71,9.76,2021-01-29,091936211,,,,,FTSE EPRA Nareit Developed Index (Net) in USD,,mf
BASMX,Equity,All Cap,North America,2015-08-13,iShares Total U.S. Stock Market Index Fund,124983058.93,17.89,2021-01-29,091936179,,,,,Russell 3000 Index,,mf
BDBKX,Equity,Small Cap,North America,2011-03-31,iShares Russell 2000 Small-Cap Index Fund,1949163505.41,25.48,2021-01-29,09253F887,,,,,Russell 2000 Index (Gross Total Return),,mf
BDBPX,Equity,Small Cap,North America,2018-08-06,iShares Russell 2000 Small-Cap Index Fund,344119761.28,25.35,2021-01-29,066923244,,,,,Russell 2000 Index (Gross Total Return),,mf
BDOAX,Equity,Large Cap,Global,2011-06-30,iShares MSCI Total International Index Fund,366473399.1,10.07,2021-01-29,066923624,,,,,MSCI All Country World ex US Index (Net TR),,mf
BDOIX,Equity,Large Cap,Global,2011-06-30,iShares MSCI Total International Index Fund,153891079.96,10.1,2021-01-29,066923616,,,,,MSCI All Country World ex US Index (Net TR),,mf
BDOKX,Equity,Large Cap,Global,2011-06-30,iShares MSCI Total International Index Fund,679179966.27,10.42,2021-01-29,066923590,,,,,MSCI All Country World ex US Index (Net TR),,mf
BFTR,Equity,Mid/Small Cap,North America,2020-09-29,BlackRock Future Innovators ETF,11595357.12,50.414596,2021-02-01,09290C202,230000,"Feb 01, 2021",0.8,0.8,Russell 2500 Growth Index,NYSE Arca,etf
BGRN,Fixed Income,Multi Sectors,Global,2018-11-13,iShares Global Green Bond ETF,191989017.99,55.648991,2021-01-29,46435U440,3450000,"Feb 01, 2021",0.25,0.25,Bloomberg Barclays MSCI Global Green Bond Select (USD Hedged) Index,NASDAQ,etf
BIDAX,Fixed Income,Municipals,North America,2018-11-16,iShares Municipal Bond Index Fund,23332808.43,12.35,2021-01-29,09258N356,,,,,ICE BofA US Municipal Securities Index,,mf
BIDIX,Fixed Income,Municipals,North America,2018-11-16,iShares Municipal Bond Index Fund,6395393.19,12.34,2021-01-29,09258N349,,,,,ICE BofA US Municipal Securities Index,,mf
BIDKX,Fixed Income,Municipals,North America,2018-11-16,iShares Municipal Bond Index Fund,107492.27,12.35,2021-01-29,09258N331,,,,,ICE BofA US Municipal Securities Index,,mf
BIDPX,Fixed Income,Municipals,North America,2018-11-16,iShares Municipal Bond Index Fund,316387768.98,12.34,2021-01-29,066923210,,,,,ICE BofA US Municipal Securities Index,,mf
BIEVX,Equity,Large Cap,Global,2016-07-13,iShares Edge MSCI Min Vol EAFE Index Fund,23997674.47,7.31,2021-01-29,09258N588,,,,,MSCI EAFE Minimum Volatility (USD Optimized) Index - USD Net,,mf
BIIPX,Fixed Income,Inflation,North America,2016-02-16,iShares Short-Term TIPS Bond Index Fund,16442190.73,10.36,2021-01-29,09258N885,,,,,BBG Barc US TIPS 0-5 Years Index,,mf
BIMVX,Equity,Large Cap,North America,2016-07-13,iShares Edge MSCI Min Vol USA Index Fund,34780393.32,8.73,2021-01-29,09258N638,,,,,MSCI USA Minimum Volatility (USD Optimized) Index - USD Gross,,mf
BIRDX,Real Estate,Real Estate Securities,Global,2015-08-13,iShares Developed Real Estate Index Fund,46943722.46,9.78,2021-01-29,091936195,,,,,FTSE EPRA Nareit Developed Index (Net) in USD,,mf
BITSX,Equity,All Cap,North America,2015-08-13,iShares Total U.S. Stock Market Index Fund,99871022.28,17.91,2021-01-29,091936161,,,,,Russell 3000 Index,,mf
BKEVX,Equity,Large Cap,Global,2016-07-13,iShares Edge MSCI Min Vol EAFE Index Fund,9469029.36,7.31,2021-01-29,09258N596,,,,,MSCI EAFE Minimum Volatility (USD Optimized) Index - USD Net,,mf
BKF,Equity,Large/Mid Cap,Global,2007-11-12,iShares MSCI BRIC ETF,185652702.62,54.603736,2021-01-29,464286657,3400000,"Feb 01, 2021",0.7,0.7,MSCI BRIC Index,NYSE Arca,etf
BKIPX,Fixed Income,Inflation,North America,2016-02-16,iShares Short-Term TIPS Bond Index Fund,42481313.49,10.39,2021-01-29,09258N869,,,,,BBG Barc US TIPS 0-5 Years Index,,mf
BKMVX,Equity,Large Cap,North America,2016-07-13,iShares Edge MSCI Min Vol USA Index Fund,15959396.0,8.73,2021-01-29,09258N646,,,,,MSCI USA Minimum Volatility (USD Optimized) Index - USD Gross,,mf
BKRDX,Real Estate,Real Estate Securities,Global,2015-08-13,iShares Developed Real Estate Index Fund,1954949488.94,9.76,2021-01-29,091936187,,,,,FTSE EPRA Nareit Developed Index (Net) in USD,,mf
BKTSX,Equity,All Cap,North America,2015-08-13,iShares Total U.S. Stock Market Index Fund,1269897153.87,17.91,2021-01-29,091936153,,,,,Russell 3000 Index,,mf
BMED,Equity,Mid/Small Cap,Global,2020-09-29,BlackRock Future Health ETF,7226515.06,30.110479,2021-02-01,09290C400,240000,"Feb 01, 2021",0.85,0.85,MSCI All Country World Index,NYSE Arca,etf
BMOAX,Fixed Income,Multi Sectors,North America,2011-03-31,iShares U.S. Aggregate Bond Index Fund,156536142.61,10.79,2021-01-29,066923400,,,,,BBG Barc U.S. Aggregate Index,,mf
BMOIX,Fixed Income,Multi Sectors,North America,2011-03-31,iShares U.S. Aggregate Bond Index Fund,376449988.86,10.79,2021-01-29,066923509,,,,,BBG Barc U.S. Aggregate Index,,mf
BMOPX,Fixed Income,Multi Sectors,North America,2018-08-06,iShares U.S. Aggregate Bond Index Fund,7362241.86,10.79,2021-01-29,066923228,,,,,BBG Barc U.S. Aggregate Index,,mf
BRGAX,Equity,Large Cap,North America,2011-03-31,iShares Russell 1000 Large-Cap Index Fund,82449928.64,24.71,2021-01-29,066923103,,,,,Russell 1000 Index (Gross Total Return),,mf
BRGKX,Equity,Large Cap,North America,2011-03-31,iShares Russell 1000 Large-Cap Index Fund,413282464.58,24.76,2021-01-29,066923301,,,,,Russell 1000 Index (Gross Total Return),,mf
BRGNX,Equity,Large Cap,North America,2011-03-31,iShares Russell 1000 Large-Cap Index Fund,124183848.53,24.87,2021-01-29,066923202,,,,,Russell 1000 Index (Gross Total Return),,mf
BRMAX,Equity,Mid Cap,North America,2015-11-30,iShares Russell Mid-Cap Index Fund,108731761.61,12.7,2021-01-29,09258N307,,,,,Russell MidCap Index,,mf
BRMIX,Equity,Mid Cap,North America,2015-05-13,iShares Russell Mid-Cap Index Fund,220146016.3,12.75,2021-01-29,091936294,,,,,Russell MidCap Index,,mf
BRMKX,Equity,Mid Cap,North America,2015-05-13,iShares Russell Mid-Cap Index Fund,1113653806.24,12.78,2021-01-29,091936286,,,,,Russell MidCap Index,,mf
BSMAX,Equity,Mid/Small Cap,North America,2015-08-13,iShares Russell Small/Mid-Cap Index Fund,84879507.02,15.49,2021-01-29,091936245,,,,,Russell 2500 Total Return Index,,mf
BSMIX,Equity,Mid/Small Cap,North America,2015-08-13,iShares Russell Small/Mid-Cap Index Fund,98148012.15,15.52,2021-01-29,091936237,,,,,Russell 2500 Total Return Index,,mf
BSMKX,Equity,Mid/Small Cap,North America,2015-08-13,iShares Russell Small/Mid-Cap Index Fund,189283137.49,15.52,2021-01-29,091936229,,,,,Russell 2500 Total Return Index,,mf
BSPAX,Equity,Large Cap,North America,2013-04-11,iShares S&P 500 Index Fund,2504238315.85,439.48,2021-01-29,066923566,,,,,S&P 500 Index,,mf
BSPGX,Equity,Large Cap,North America,2019-07-01,iShares S&P 500 Index Fund,7478293984.26,439.75,2021-01-29,066923194,,,,,S&P 500 Index,,mf
BSPIX,Equity,Large Cap,North America,2013-04-11,iShares S&P 500 Index Fund,3942240027.79,439.64,2021-01-29,066923558,,,,,S&P 500 Index,,mf
BSPPX,Equity,Large Cap,North America,2018-08-06,iShares S&P 500 Index Fund,1363429076.48,439.11,2021-01-29,066923236,,,,,S&P 500 Index,,mf
BSPSX,Equity,Large Cap,North America,2013-04-22,iShares S&P 500 Index Fund,585585430.44,439.55,2021-01-29,066923533,,,,,S&P 500 Index,,mf
BTEK,Equity,Mid/Small Cap,Global,2020-09-29,BlackRock Future Tech ETF,12051651.35,37.66141,2021-02-01,09290C301,320000,"Feb 01, 2021",0.88,0.88,MSCI All Country World Index,NYSE Arca,etf
BTMKX,Equity,All Cap,Global,2011-03-31,iShares MSCI EAFE International Index Fund,,14.69,2021-02-01,09253F879,,,,,MSCI EAFE Index (Net Total Return),,mf
BTMPX,Equity,All Cap,Global,2018-08-06,iShares MSCI EAFE International Index Fund,143707667.07,14.33,2021-01-29,066923251,,,,,MSCI EAFE Index (Net Total Return),,mf
BYLD,Fixed Income,Multi Sectors,North America,2014-04-22,iShares Yield Optimized Bond ETF,199996415.38,25.640566,2021-01-29,46434V787,7800000,"Feb 01, 2021",0.28,0.48,Morningstar U.S. Bond Market Yield-Optimized Index,NYSE Arca,etf
CCRV,Commodity,Multi Commodity,North America,2020-09-01,iShares Commodity Curve Carry Strategy ETF,32454930.45,21.63662,2021-01-29,46431W564,1500000,"Feb 01, 2021",0.4,0.4,ICE BofA Commodity Carry Total Return Index,NYSE Arca,etf
CEMB,Fixed Income,Credit,Global,2012-04-17,iShares J.P. Morgan EM Corporate Bond ETF,278638426.9,52.573288,2021-01-29,464286251,5300000,"Feb 01, 2021",0.5,0.5,J.P. Morgan CEMBI Broad Diversified Core Index,Cboe BZX formerly known as BATS,etf
CMBS,Fixed Income,Mortgages,North America,2012-02-14,iShares CMBS ETF,504765663.63,55.165646,2021-01-29,46429B366,9150000,"Feb 01, 2021",0.25,0.25,Bloomberg Barclays U.S. CMBS (ERISA Only) Index,NYSE Arca,etf
CMDY,Commodity,Multi Commodity,Global,2018-04-03,iShares Bloomberg Roll Select Commodity Strategy ETF,50917939.61,46.289036,2021-01-29,46431W598,1100000,"Feb 01, 2021",0.28,0.29,Bloomberg Roll Select Commodity Total Return Index,NYSE Arca,etf
CMF,Fixed Income,Municipals,North America,2007-10-04,iShares California Muni Bond ETF,1716159975.73,62.978348,2021-01-29,464288356,27250000,"Feb 01, 2021",0.25,0.25,S&P California AMT-Free Municipal bond Index,NYSE Arca,etf
CNYA,Equity,Large/Mid Cap,Asia Pacific,2016-06-13,iShares MSCI China A ETF,652148833.68,44.515279,2021-02-01,46434V514,14650000,"Feb 01, 2021",0.6,0.6,MSCI China A Inclusion Index,Cboe BZX formerly known as BATS,etf
COMT,Commodity,Multi Commodity,Global,2014-10-15,iShares Commodities Select Strategy ETF,228478175.97,27.527491,2021-01-29,46431W853,8300000,"Feb 01, 2021",0.48,0.48,,NASDAQ,etf
CRBN,Equity,Large/Mid Cap,Global,2014-12-08,iShares MSCI ACWI Low Carbon Target ETF,644597941.37,148.183435,2021-01-29,46434V464,4350000,"Feb 01, 2021",0.2,0.2,MSCI ACWI Low Carbon Target Index,NYSE Arca,etf
DEFA,Equity,Large/Mid Cap,Global,2016-01-05,iShares Adaptive Currency Hedged MSCI EAFE ETF,5984300.6,29.921503,2021-01-29,46435G656,200000,"Feb 01, 2021",0.38,0.7,MSCI EAFE Adaptive Hedge to USD Index,Cboe BZX formerly known as BATS,etf
DGRO,Equity,All Cap,North America,2014-06-10,iShares Core Dividend Growth ETF,14883992741.45,44.153049,2021-01-29,46434V621,335950000,"Feb 01, 2021",0.08,0.08,Morningstar US Dividend Growth Index,NYSE Arca,etf
DIVB,Equity,All Cap,North America,2017-11-07,iShares U.S. Dividend and Buyback ETF,44458995.95,32.93259,2021-01-29,46435U861,1350000,"Feb 01, 2021",0.25,0.25,Morningstar US Dividend and Buyback Index,Cboe BZX formerly known as BATS,etf
DMXF,Equity,Large Cap,Global,2020-06-16,iShares ESG Advanced MSCI EAFE ETF,63020693.77,63.020694,2021-02-01,46436E759,1000000,"Feb 01, 2021",0.12,0.12,MSCI EAFE Choice ESG Screened Net Index in USD,NASDAQ,etf
DSI,Equity,Large/Mid Cap,North America,2006-11-14,iShares MSCI KLD 400 Social ETF,2592840912.5,70.842648,2021-01-29,464288570,36450000,"Feb 01, 2021",0.25,0.25,MSCI KLD 400 Social Index,NYSE Arca,etf
DVY,Equity,All Cap,North America,2003-11-03,iShares Select Dividend ETF,14643045713.8,96.813525,2021-01-29,464287168,151150000,"Feb 01, 2021",0.39,0.39,Dow Jones U.S. Select Dividend IndexSM,NASDAQ,etf
DVYA,Equity,All Cap,Asia Pacific,2012-02-23,iShares Asia/Pacific Dividend ETF,34414244.05,38.238049,2021-01-29,464286293,900000,"Feb 01, 2021",0.49,0.49,Dow Jones Asia/Pacific Select Dividend 50 Index,NYSE Arca,etf
DVYE,Equity,All Cap,Global,2012-02-23,iShares Emerging Markets Dividend ETF,717430901.16,36.697233,2021-01-29,464286319,19550000,"Feb 01, 2021",0.49,0.49,Dow Jones Emerging Markets Select Dividend Index,NYSE Arca,etf
DYNF,Equity,Large/Mid Cap,North America,2019-03-19,BlackRock U.S. Equity Factor Rotation ETF,72709421.29,31.612792,2021-01-29,09290C103,2300000,"Feb 01, 2021",0.3,0.3,MSCI Developed - US Gross TR Index,NYSE Arca,etf
EAGG,Fixed Income,Multi Sectors,North America,2018-10-18,iShares ESG Aware U.S. Aggregate Bond ETF,1065370698.17,56.072142,2021-01-29,46435U549,19000000,"Feb 01, 2021",0.1,0.11,Bloomberg Barclays MSCI US Aggregate ESG Focus Index,NYSE Arca,etf
EAOA,Multi Asset,Multi Strategy,North America,2020-06-12,iShares ESG Aware Aggressive Allocation ETF,4631379.6,30.875864,2021-02-01,46436E668,150000,"Feb 01, 2021",0.18,0.33,BlackRock ESG Aware Aggressive Allocation Index,Cboe BZX formerly known as BATS,etf
EAOK,Multi Asset,Multi Strategy,North America,2020-06-12,iShares ESG Aware Conservative Allocation ETF,4068383.54,27.122557,2021-02-01,46436E692,150000,"Feb 01, 2021",0.18,0.3,BlackRock ESG Aware Conservative Allocation Index,Cboe BZX formerly known as BATS,etf
EAOM,Multi Asset,Multi Strategy,North America,2020-06-12,iShares ESG Aware Moderate Allocation ETF,4178044.96,27.853633,2021-02-01,46436E684,150000,"Feb 01, 2021",0.18,0.31,BlackRock ESG Aware Moderate Allocation Index,Cboe BZX formerly known as BATS,etf
EAOR,Multi Asset,Multi Strategy,North America,2020-06-12,iShares ESG Aware Growth Allocation ETF,4401841.8,29.345612,2021-02-01,46436E676,150000,"Feb 01, 2021",0.18,0.32,BlackRock ESG Aware Growth Allocation Index,Cboe BZX formerly known as BATS,etf
ECH,Equity,All Cap,Latin America,2007-11-12,iShares MSCI Chile ETF,467246995.09,30.048038,2021-01-29,464286640,15250000,"Feb 01, 2021",0.59,0.59,MSCI Chile IMI 25/50 Index,Cboe BZX formerly known as BATS,etf
ECNS,Equity,Small Cap,Asia Pacific,2010-09-28,iShares MSCI China Small-Cap ETF,72703630.4,53.854541,2021-01-29,46429B200,1350000,"Feb 01, 2021",0.59,0.59,MSCI China Small Cap Index,NYSE Arca,etf
EDEN,Equity,All Cap,Europe,2012-01-25,iShares MSCI Denmark ETF,169613023.14,94.229457,2021-01-29,46429B523,1800000,"Feb 01, 2021",0.53,0.53,MSCI Denmark IMI 25/50 Index,Cboe BZX formerly known as BATS,etf
EEM,Equity,Large/Mid Cap,Global,2003-04-07,iShares MSCI Emerging Markets ETF,29159661882.4,53.376646,2021-01-29,464287234,546300000,"Feb 01, 2021",0.7,0.7,MSCI Emerging Markets Index(SM),NYSE Arca,etf
EEMA,Equity,Large/Mid Cap,Asia Pacific,2012-02-08,iShares MSCI Emerging Markets Asia ETF,824814439.35,90.638949,2021-01-29,464286426,9100000,"Feb 01, 2021",0.49,0.5,MSCI EM Asia Custom Capped Index,NASDAQ,etf
EEMS,Equity,Small Cap,Global,2011-08-16,iShares MSCI Emerging Markets Small-Cap ETF,264676334.13,52.935267,2021-01-29,464286475,5000000,"Feb 01, 2021",0.7,0.71,MSCI Emerging Markets Small Cap Index,NYSE Arca,etf
EEMV,Equity,Large/Mid Cap,Global,2011-10-18,iShares MSCI Emerging Markets Min Vol Factor ETF,4090776008.38,61.887685,2021-01-29,464286533,66100000,"Feb 01, 2021",0.7,0.7,MSCI Emerging Markets Minimum Volatility Index,Cboe BZX formerly known as BATS,etf
EFA,Equity,Large/Mid Cap,Global,2001-08-14,iShares MSCI EAFE ETF,52136212989.02,72.4718,2021-01-29,464287465,719400000,"Feb 01, 2021",0.32,0.32,MSCI EAFE Index,NYSE Arca,etf
EFAV,Equity,Large/Mid Cap,Global,2011-10-18,iShares MSCI EAFE Min Vol Factor ETF,10104546542.64,72.799327,2021-01-29,46429B689,138300000,"Feb 01, 2021",0.32,0.32,MSCI EAFE Minimum Volatility (USD) Index,Cboe BZX formerly known as BATS,etf
EFG,Equity,Large/Mid Cap,Global,2005-08-01,iShares MSCI EAFE Growth ETF,9884750571.23,99.644663,2021-01-29,464288885,99600000,"Feb 01, 2021",0.39,0.39,MSCI EAFE Growth Index,Cboe BZX formerly known as BATS,etf
EFNL,Equity,All Cap,Europe,2012-01-25,iShares MSCI Finland ETF,29731172.96,45.740266,2021-01-29,46429B515,650000,"Feb 01, 2021",0.53,0.53,MSCI Finland IMI 25/50 Index,Cboe BZX formerly known as BATS,etf
EFV,Equity,Large/Mid Cap,Global,2005-08-01,iShares MSCI EAFE Value ETF,10300072449.58,46.989382,2021-01-29,464288877,219200000,"Feb 01, 2021",0.39,0.39,MSCI EAFE Value Index,Cboe BZX formerly known as BATS,etf
EIDO,Equity,All Cap,Asia Pacific,2010-05-05,iShares MSCI Indonesia ETF,349991849.32,22.580119,2021-01-29,46429B309,15500000,"Feb 01, 2021",0.59,0.59,MSCI Indonesia IMI 25/50 Index,NYSE Arca,etf
EIRL,Equity,All Cap,Europe,2010-05-05,iShares MSCI Ireland ETF,55861748.17,48.575433,2021-01-29,46429B507,1150000,"Feb 01, 2021",0.51,0.51,MSCI All Ireland Capped Index,NYSE Arca,etf
EIS,Equity,All Cap,Europe,2008-03-26,iShares MSCI Israel ETF,161128686.31,64.451475,2021-01-29,464286632,2500000,"Feb 01, 2021",0.59,0.59,MSCI Israel Capped Investable Market Index,NYSE Arca,etf
EMB,Fixed Income,Government,Global,2007-12-17,iShares J.P. Morgan USD Emerging Markets Bond ETF,18675653197.81,113.598864,2021-01-29,464288281,164400000,"Feb 01, 2021",0.39,0.39,J.P. Morgan EMBI Global Core Index,NASDAQ,etf
EMBH,Fixed Income,Government,Global,2015-07-22,iShares Interest Rate Hedged Emerging Markets Bond ETF,5957966.77,23.831867,2021-02-01,46431W820,250000,"Feb 01, 2021",0.75,1.13,JPM Swaps-Hedged EMBIG Core Index,NYSE Arca,etf
EMGF,Equity,Large/Mid Cap,Global,2015-12-08,iShares MSCI Emerging Markets Multifactor ETF,689133803.51,50.671603,2021-01-29,46434G889,13600000,"Feb 01, 2021",0.45,0.45,MSCI Emerging Market Diversified Multiple-Factor Index,Cboe BZX formerly known as BATS,etf
EMHY,Fixed Income,High Yield,Global,2012-04-03,iShares J.P. Morgan EM High Yield Bond ETF,346528016.46,45.595792,2021-01-29,464286285,7600000,"Feb 01, 2021",0.5,0.5,J.P. Morgan USD Emerging Markets High Yield Bond Index,Cboe BZX formerly known as BATS,etf
EMIF,Equity,All Cap,Global,2009-06-16,iShares Emerging Markets Infrastructure ETF,15154953.94,23.315314,2021-01-29,464288216,650000,"Feb 01, 2021",0.6,0.6,S&P Emerging Markets Infrastructure Index,NASDAQ,etf
EMXC,Equity,All Cap,Global,2017-07-18,iShares MSCI Emerging Markets ex China ETF,369415478.22,56.83315,2021-01-29,46434G764,6500000,"Feb 01, 2021",0.25,0.34,MSCI Emerging Markets ex China Index,NASDAQ,etf
EMXF,Equity,Large/Mid Cap,Global,2020-10-06,iShares ESG Advanced MSCI EM ETF,13284121.11,44.280404,2021-02-01,46436E742,300000,"Feb 01, 2021",0.16,0.16,MSCI Emerging Markets Choice ESG Screened 5% Issuer Capped Index,NASDAQ,etf
ENOR,Equity,All Cap,Europe,2012-01-23,iShares MSCI Norway ETF,29067562.61,25.276141,2021-01-29,46429B499,1150000,"Feb 01, 2021",0.53,0.53,MSCI Norway IMI 25/50 Index,Cboe BZX formerly known as BATS,etf
ENZL,Equity,All Cap,Asia Pacific,2010-09-01,iShares MSCI New Zealand ETF,191055346.7,68.234052,2021-01-29,464289123,2800000,"Feb 01, 2021",0.51,0.51,MSCI New Zealand IMI 25/50 Index,NASDAQ,etf
EPHE,Equity,All Cap,Asia Pacific,2010-09-28,iShares MSCI Philippines ETF,145606687.28,30.021997,2021-01-29,46429B408,4850000,"Feb 01, 2021",0.59,0.59,MSCI Philippines IMI 25-50 NET Index,NYSE Arca,etf
EPOL,Equity,All Cap,Europe,2010-05-25,iShares MSCI Poland ETF,282376179.01,19.079472,2021-01-29,46429B606,14800000,"Feb 01, 2021",0.59,0.59,MSCI Poland IMI 25/50 Index,NYSE Arca,etf
EPP,Equity,Large/Mid Cap,Asia Pacific,2001-10-25,iShares MSCI Pacific ex Japan ETF,2182760065.57,48.184549,2021-01-29,464286665,45300000,"Feb 01, 2021",0.48,0.48,MSCI Pacific ex-Japan Index,NYSE Arca,etf
EPU,Equity,All Cap,Latin America,2009-06-19,iShares MSCI Peru ETF,170303713.91,34.75586,2021-01-29,464289842,4900000,"Feb 01, 2021",0.59,0.59,MSCI All Peru Capped Index,NYSE Arca,etf
ERUS,Equity,Large/Mid Cap,Europe,2010-11-09,iShares MSCI Russia ETF,449686461.54,36.709099,2021-01-29,46434G798,12250000,"Feb 01, 2021",0.59,0.59,MSCI Russia 25 / 50 Index,NYSE Arca,etf
ESGD,Equity,Large/Mid Cap,Global,2016-06-28,iShares ESG Aware MSCI EAFE ETF,4224997441.74,72.345847,2021-01-29,46435G516,58400000,"Feb 01, 2021",0.2,0.2,MSCI EAFE Extended ESG Focus Index,NASDAQ,etf
ESGE,Equity,Large/Mid Cap,Global,2016-06-28,iShares ESG Aware MSCI EM ETF,6830524474.44,43.395962,2021-01-29,46434G863,157400000,"Feb 01, 2021",0.25,0.25,MSCI Emerging Markets Extended ESG Focus Index,NASDAQ,etf
ESGU,Equity,Large/Mid Cap,North America,2016-12-01,iShares ESG Aware MSCI USA ETF,13033201854.2,85.575849,2021-01-29,46435G425,152400000,"Feb 01, 2021",0.15,0.15,MSCI USA Extended ESG Focus Index,NASDAQ,etf
ESML,Equity,All Cap,North America,2018-04-10,iShares ESG Aware MSCI USA Small-Cap ETF,574076581.54,35.546538,2021-01-29,46435U663,15850000,"Feb 01, 2021",0.17,0.17,MSCI USA Small Cap Extended ESG Focus Index,Cboe BZX formerly known as BATS,etf
EUFN,Equity,All Cap,Europe,2010-01-20,iShares MSCI Europe Financials ETF,1017060209.77,16.936889,2021-01-29,464289180,59750000,"Feb 01, 2021",0.48,0.48,MSCI Europe Financials Index,NASDAQ,etf
EUSA,Equity,Large/Mid Cap,North America,2010-05-05,iShares MSCI USA Equal Weighted ETF,282450844.52,71.506543,2021-01-29,464286681,4000000,"Feb 01, 2021",0.15,0.15,MSCI USA Equal Weighted Index,NYSE Arca,etf
EUSB,Fixed Income,Multi Sectors,North America,2020-06-23,iShares ESG Advanced Total USD Bond Market ETF,166001293.68,50.303422,2021-02-01,46436E619,3300000,"Feb 01, 2021",0.12,0.13,Bloomberg Barclays MSCI US Universal Choice ESG Screened Index,NYSE Arca,etf
EWA,Equity,Large/Mid Cap,Asia Pacific,1996-03-12,iShares MSCI Australia ETF,1700179712.94,23.946193,2021-01-29,464286103,71000000,"Feb 01, 2021",0.51,0.51,MSCI Australia Index,NYSE Arca,etf
EWC,Equity,Large/Mid Cap,North America,1996-03-12,iShares MSCI Canada ETF,2875583911.53,30.623897,2021-01-29,464286509,93000000,"Feb 01, 2021",0.51,0.51,MSCI Canada Custom Capped Index,NYSE Arca,etf
EWD,Equity,Large/Mid Cap,Europe,1996-03-12,iShares MSCI Sweden ETF,427808042.4,41.036743,2021-01-29,464286756,10425000,"Feb 01, 2021",0.51,0.51,MSCI Sweden 25/50 Index,NYSE Arca,etf
EWG,Equity,Large/Mid Cap,Europe,1996-03-12,iShares MSCI Germany ETF,2526630846.23,31.543456,2021-01-29,464286806,80100000,"Feb 01, 2021",0.51,0.51,MSCI Germany Index,NYSE Arca,etf
EWGS,Equity,Small Cap,Europe,2012-01-25,iShares MSCI Germany Small-Cap ETF,42893968.27,77.989033,2021-01-29,46429B465,550000,"Feb 01, 2021",0.59,0.59,MSCI Germany Small Cap Index,Cboe BZX formerly known as BATS,etf
EWH,Equity,Large/Mid Cap,Asia Pacific,1996-03-12,iShares MSCI Hong Kong ETF,1478766529.63,25.18121,2021-01-29,464286871,58725000,"Feb 01, 2021",0.51,0.51,MSCI Hong Kong 25/50 Index,NYSE Arca,etf
EWI,Equity,Large/Mid Cap,Europe,1996-03-12,iShares MSCI Italy ETF,160086934.28,28.459899,2021-01-29,46434G830,5625000,"Feb 01, 2021",0.51,0.51,MSCI Italy 25/50 Index,NYSE Arca,etf
EWJ,Equity,Large/Mid Cap,Asia Pacific,1996-03-12,iShares MSCI Japan ETF,13262144834.94,66.627203,2021-01-29,46434G822,198450000,"Feb 01, 2021",0.51,0.51,MSCI Japan Index,NYSE Arca,etf
EWJE,Equity,Large/Mid Cap,Asia Pacific,2019-03-05,iShares MSCI Japan Equal Weighted ETF,7721578.3,38.607892,2021-01-29,46435U382,200000,"Feb 01, 2021",0.15,0.15,MSCI Japan Equal Weighted Index (USD),NASDAQ,etf
EWJV,Equity,Large/Mid Cap,Asia Pacific,2019-03-05,iShares MSCI Japan Value ETF,15490281.66,25.817136,2021-01-29,46435U374,600000,"Feb 01, 2021",0.15,0.15,MSCI Japan Value Index (USD),NASDAQ,etf
EWK,Equity,All Cap,Europe,1996-03-12,iShares MSCI Belgium ETF,37270869.53,19.411911,2021-01-29,464286301,1920000,"Feb 01, 2021",0.51,0.51,MSCI Belgium IMI 25/50 Index,NYSE Arca,etf
